"도민소통실장·여성가족정책관·국제협력관·동부지역본부장 브리핑 '전무'  농업·수산 업무 실국장들도 홍보 '소극적'  (무안=연합뉴스) 전승현 기자 = 이낙연 전남지사가 올해 1월 실·국장 등 간부들에게 도정홍보를 독려하면서 공식적인 대(對) 언론 접촉 현황을 집계하라고 지시했지만 일부 실·국장은 소극적인 자세로 일관한 것으로 나타났다.  4일 전남도에 따르면 올해 1-7월 실·국장의 언론 브리핑 및 간담회 현황을 분석한 결과, 자치행정국장이 10차례(브리핑 9차례·간담회 1차례)로 가장 많았고, 기획조정실장은 6차례(브리핑 3차례·간담회 3차례) 했다.  보건복지국장 5차례(브리핑 3차례·간담회 2차례), 건설도시국장 5차례(브리핑 4차례·간담회 1차례)로 대 언론 홍보 횟수가 많았다.  F1 지원담당관 4차례(브리핑 1차례·간담회 3차례), 경제과학국장 4차례(브리핑 3차례·간담회 1차례), 일자리정책실장 3차례(브리핑 2차례·간담회 1차례), 관광문화체육국장 3차례(브리핑 2차례·간담회 1차례), 도민안전실장 2차례(브리핑 1차례·간담회 1차례) 했다.  특히 전남도는 농도(農道)와 수산지역으로서 도민 입장에선 현안과 관심사가 많은데도 농림축산식품국장은 2차례(간담회), 해양수산국장은 단 1차례(간담회) 했다.  소방본부장도 1차례(간담회) 소관 업무를 알렸다.  도민소통실장, 여성가족정책관, 국제협력관, 동부지역본부장은 브리핑과 간담회를 단 한 차례도 하지 않았다.  이 지사는 지난 1월 ""'말하지 않아도 안다'라는 농경문화 의식에 젖어 도정홍보를 충분히 안 하고 있는 것은 아닌지 생각해봐야 한다""며 ""대변인실만 하는 게 아니라 실·국이 함께해야 한다""며 실·국장 등 간부들에게 도정홍보를 독려했다.  shchon@yna.co.kr"
"중앙정부가 전남에 승인해 준 지역특화 산업으로 에너지신산업에 비해 성격상 진전 속도가 느리지만 포기할 수 없는 미래산업이다. 전국에서 인정한 전략산업, 드론산업을 활성화하는데 지혜를 모아 나가자  이낙연 전남도지사는 4일 전남 고흥의 특화산업인 드론산업과 관련해 이 같이 말했다. 이날  고흥농업기술센터에서 열린 고흥군민과 대화에서 이 지사는 ""2019년까지 고흥 영남에서 여수 화양을 잇는 19.9㎞의 연도연륙교가 개통되면 고흥의 관광산업도 새 지평을 맞게 될 것""이라고 덧붙였다.  이날 고흥군이 건의한 '근 현대 생활문화 유물 전시를 위한 폐교 리모델링 사업 지원' 요구에 대해 이 지사는 ""폐교를 리모델링해 문화관과 연계한 볼거리와 체험거리 등을 제공하는 것은 관람객 유치에 좋을 것""이라며 ""지원을 적극 검토하겠다""고 답했다.  '국가종합비행성능시험장 부지매입비 지원'의 경우 ""규제프리존 특별법 반영건의 등 도 차원에서 다각적인 노력을 하고 있다""며 ""중앙정부와 상의해 도와 군의 부담이 적어지도록 하겠다""고 설명했다.  주민들이 건의한 '문어 어획량 감소에 따른 금어기 설정'과 관련해서는 ""올해 처음 낙지 금어기를 시행했는데 협조해줘 감사하다""며 ""문어는 평생 한 번 알을 낳는 어종으로 산란기 때 잘못하면 멸종될 수도 있는 어종이므로 내년 문어 금어기 설정을 적극 검토하겠다""고 밝혔다.  고흥=홍기철 기자 honam3333@mt.co.kr"
"[전남CBS 고영호 기자]이낙연 전남지사가 11일 포스코 광양제철소와 GS칼텍스 여수공장을 잇따라 방문했다.  이낙연 지사는 임·직원들과 지역 주력산업인 철강산업과 석유화학산업의 미래 신산업에 대한 의견을 교환했다.  안동일 광양제철소장은 ""앞으로 마그네슘과 니켈 같은 경량화 소재를 개발해 전기 자동차의 새로운 수요에 대비하고 탄산 리튬 등 신산업에서 활로를 찾을 것""이라고 말했다.  GS칼텍스 김병열 사장은 ""바이오 부탄올 등 신산업 모색을 통해 돌파구를 마련할 것""이라고 전했다.  이 지사는 ""전기 자동차와 친환경 에너지 생산 등 신사업 부문을 중앙정부 건의 등으로 적극 지원하겠다""고 강조했다.  newsman@cbs.co.kr  저작권자 © CBS 노컷뉴스(www.nocutnews.co.kr) 무단전재 및 재배포 금지"
"[아시아경제 노해섭 기자]제20회 무안연꽃축제가 12일 무안 회산백련지 주무대에서 열린 가운데 이낙연 전남지사(왼쪽 세번째), 김철주 무안군수(오른쪽), 박준영 국회의원(왼쪽 두번째), 이동진 무안군의장(왼쪽)이 타임캡슐 봉인 퍼포먼스를 하고 있다.  제20회 무안연꽃축제가 12일 무안 회산백련지 주무대에서 열린 가운데 이낙연 전남지사, 김철주 무안군수, 박준영 국회의원, 이동진 무안군의장 등이 타임캡슐 봉인 퍼포먼스를 하고 있다. 15일까지 4일간 열린다.  사진제공=전남도"
"[광주CBS 김형로 기자]이낙연 전라남도지사는 12일 전남도청에서 여수 경도 복합리조트 개발 우선협상대상자 1순위로 선정된 미래에셋의 박현주 회장을 만나 투자계획을 듣고 지원 방안을 논의했다.  이 자리에서 박 회장은 ""이 지사의 경도개발 요청이 그룹 차원에서 추진 중인 사업 다각화의 '신의 한 수'가 됐다""고 밝히고 ""경도는 접근성이 좋고 겨울철 온화한 날씨 덕에 리조트의 최적지""라고 투자 결정 배경을 설명했다.  박 회장은 또, ""경도개발은 호텔부터 최대한 빠르게 착수하고 나머지 레저시설 투자에도 속도를 낼 것이다""고 투자계획을 설명하고 ""세계적 디자이너에게 설계를 맡겨 명품 리조트를 만들겠다""는 포부도 밝혔다.  이에 대해 이 지사는 ""1조1천억 원을 투자해 경도를 아시아 최고의 복합리조트로 만들겠다는 박 회장의 통 큰 투자 결심에 대해 전남도민이 크게 환영하고 기대도 매우 크다""며 고마움을 표시하고 ""전남도는 여수시와 함께 행정적 지원을 다 하겠다""고 말했다.  박 회장은 이와 함께 ""그룹 차원에서 관광·레저뿐만 아니라 에너지 분야로 사업 다각화를 진행 중""이라며 ""바람이 센 서남해안 지역에 풍력발전 프로젝트를 검토하고 있다""고 밝혀 전남 서남해안 지역에 추가 투자 의향을 보이기도 했다.  미래에셋은 지난 9일 전남개발공사의 여수 경도 해양관광단지 제안입찰 결과 우선협상대상자 1순위로 선정됐다.  경도 골프앤리조트 시설을 3천423억 원에 일괄 매입하고 앞으로 5년간 7천500억 원을 추가로 투자해 호텔, 빌라, 요트 마리나, 워터파크, 해상케이블카 등을 갖춘 아시아 최고의 명품 복합리조트를 건설할 계획이다.  khn5029@hanmail.net  저작권자 © CBS 노컷뉴스(www.nocutnews.co.kr) 무단전재 및 재배포 금지"
"동영상 뉴스  전남산 천일염의 우수성을 알리기 위한 '2016 소금박람회'가 어제(10일) 서울 코엑스에서 나흘간의 일정으로 개막했습니다.  전남도와 해양수산부가 공동 개최하는 이번 행사에는 '신안 천일염' 등 전남지역 갯벌에서 생산된 수십 종의 고품질 소금들이 전시됩니다.  개막식에는 이낙연 전남도지사와 박준영·김학용 의원, 고길호 신안군수, 장태평 사단법인 천일염세계화포럼 공동대표 등 각계 인사 20여 명이 참석했습니다.  50여 개 기관과 기업이 참가한 이번 박람회에는 스마트 염전관과 천일염 건강관 등 총 8개관을 설치해 토종 천일염의 우수성을 알릴 예정입니다.  또 천일염 홍보관에서는 중국 등 해외시장 진출 현황과 주요 수출 제품을 전시하고, 다양한 이벤트를 진행해 관람객들에게 경품도 제공합니다.  ▶ 인터뷰 : 이낙연 / 전남도지사  - ""암연이나 정제염에 비해서 천일염은 나트륨이 적고, 미네랄이 많은 소금입니다. 이제 천일염이 대단히 과학적으로 스마트염전에서 생산되고 있고, 매우 친환경적으로 생산되고 있습니다. 소비자들이 안심하고 드셔도 됩니다.""  ▶ 인터뷰 : 고길호 / 신안군수  - ""신안에서 생산되는 천일염은 세계 3개 명품 소금 중에 하나입니다. 신안군에서 생산되는 총 연간 생산량이 23톤입니다. 23만 톤 중에 12만 톤을 이미 중국과 계약을 맺고 수출하기로 돼 있어서 소금 가격 문제, 소금에 대한 이미지가 대단히 혁신적으로 개선될 것이라고 봅니다."""
"1.1조 투자전략 수립 위해 여수 찾은 박현주 미래에셋 회장  ""호텔 사업부터 우선 추진…최고급 브랜드 가져오겠다""  [ 최성국 기자  ] 전남 여수 경도해양관광단지에 1조1000억원가량의 ‘통 큰’ 투자를 결정한 박현주 미래에셋 회장(사진)이 2박3일 일정으로 여수를 방문해 관심을 끌고 있다.  12일 여수시에 따르면 박 회장은 지난 10일부터 2박3일 일정으로 지인 등 측근과 함께 여수 경도와 인근 관광지 등을 둘러봤다. 박 회장은 여수지역 대표적 호텔인 히든베이호텔, 엠블호텔 등에서 투숙했으며 11일에는 경도에서 지인들과 골프를 쳤다. 이 때문에 이번 방문이 경도리조트와 여수 인근의 투자 여건을 둘러보고 구체적인 투자전략을 수립하기 위한 행보가 아니냐는 관측이 나오고 있다.  박 회장은 이날 골프 라운딩 직후 주철현 여수시장과의 환담에서 “우선협상대상자 지위를 확보하는 대로 먼저 호텔사업부터 시작할 계획”이라며 세계에 3700여개 호텔을 소유하고 있는 글로벌 기업의 최고급 브랜드를 여수에 가져오기 위해 협상에 나설 방침을 밝혔다.  그는 “이번 투자 결정 전에 디자이너들과 직접 방문해 현지에 살고 있는 주민과 접촉하며 세밀하게 조사 검토했다”며 “여수가 싱가포르보다 관광 개발 조건이 좋아 투자를 결정하게 됐다”고 소개했다. 미래에셋이 지난해부터 미국 샌프란시스코와 하와이, 싱가포르 등지에서 호텔 등 관광레저 분야에 투자하면서 제일 먼저 살펴보는 것이 자연환경 보존 상태인데 여수도 이 같은 요건에 부합하는 곳이라는 설명이다. 그는 또 “미래에셋에 투자하는 서울의 귀빈(VIP)들이 여수에 투자하는 것으로 생각하면 되는데, 명품으로 지어야 이들이 투자할 것이므로 최고로 만들 수밖에 없다”고 덧붙였다.  이에 대해 주 시장은 “미래에셋의 투자는 여수의 해양관광도시 비전을 인정받은 것”이라며 “미래에셋이 사업에 착수하면 지원팀을 구성해 최대한 지원에 나서겠다”고 화답했다. 박 회장은 이날 오전 전남도청을 방문해 광주일고 선배인 이낙연 지사를 만난 뒤 상경했다.  여수=최성국 기자 skchoi@hankyung.com  [, 무단전재 및 재배포 금지"
