"(무안=뉴스1) 김한식 기자 = 이낙연 전남도지사는 19일 흑산도를 방문, 에너지 자립섬 조성을 위한 태양광 및 풍력발전소 후보 부지를 살펴보고 주민들과 의견을 나눴다.  여객선이 유일한 교통수단인 도서민과 관광객의 교통불편을 해소할 흑산공항 개발 계획도 집중 점검했다.  흑산공항은 68만 3000㎡ 부지에 국비 1833억 원을 들여 활주로(1200m), 계류장(6대), 여객터미널 등을 건설할 계획으로 9월 공사입찰 공고를 거쳐 내년에 착공하게 되면 2020년 10월 준공, 하반기 개항을 목표로 하고 있다.  현재 수도권에서 흑산도를 방문하려면 KTX, 버스, 여객선을 타며 7시간 정도가 소요되지만 흑산공항이 개항되면 1시간 이내에 도착할 수 있다.  2020년 개항 첫 해 76만 6000명, 2050년 108만 명 이상이 흑산공항을 이용할 것으로 예측돼 섬 가꾸기, 다도해 관광 등 지역산업 전반에 걸쳐 광범위한 영향을 미칠 것으로 기대된다.  이 지사는 이날 현장방문에서 ""흑산공항이 개항되면 관광산업의 큰 변화가 예상되므로 흑산공항 개발사업과 함께 도로, 전기, 상하수도, 숙박시설 등 관광객 수용을 위한 기반시설 확충사업이 차질 없이 추진되도록 노력해 달라""며 ""특히 시간이 많이 소요되는 보상 문제해결을 위해 지금부터 주민들과 협의해서 철저히 준비해 줄 것""을 당부했다.  이 지사는 흑산공항에 이어 흑산도 탄소제로 에너지 자립섬 조성 사업 계획에 대해서도 꼼꼼히 살폈다.  흑산도 탄소제로 에너지 자립섬 조성 사업은 현재 5대의 디젤발전기를 이용해 전력을 공급하고 있는 흑산도·대둔도·다물도 등 3개 섬에 대해 전력공급원을 태양광, 풍력, 에너지저장장치(ESS) 등 친환경 신재생에너지로 바꾸는 사업이다.  한전KDN, 한전KPS, 지자체, 민간기업이 900억 원을 투입해 내년부터 점진적으로 신재생에너지로 대체하고 현재 화석연료 자동차로 운행 중인 1352대를 친환경 전기자동차로 전환해 나갈 계획이다.  도는 2025년까지 디젤발전소로 운영 중인 유인섬 74개 중 50개 섬을 한전과 민간사업자를 유치, 연차적으로 신재생에너지로 대체키로 했다.  이 지사는 에너지 자립섬 조성과 관련 ""주민들과 끊임없이 협의하고 군과 군의회와도 사전 설명을 통해 주민들의 불안을 해소하도록 접근해야 한다""며 ""특히 진도 가사도 성공사례 등 다른 지역 견학을 통해 주민들이 사업 추진에 따른 불안을 떨칠 수 있도록 끊임없이 소통하라""고 강조했다.  hskim@  ), 무단 전재 및 재배포 금지]"
"◇광주시  -우범기 경제부시장  16:00 달빛 통일한마음 대축제(대구 수성아트피아 용지홀)  ◇전남도  -이낙연 도지사  10:30 흑산도 방문(흑산도)  -김갑섭 행정부지사  09:00 당면현안 및 2017년 신규시책보고(서재필실)  13:30 당면현안 및 2017년 신규시책보고(서재필실)  15:50 당면현안 및 2017년 신규시책보고(서재필실)  ), 무단 전재 및 재배포 금지]"
"(서울=뉴스1) 추연화 기자 = 19일 서울 강남구 코엑스에서 열린 '제15회 친환경 유기농 무역박람회' 개막식에서 강원도 어재영 농정국장(왼쪽부터), 이진모 국립농원과학원 원장, 이낙연 전라남도 지사, 안희정 충청남도 지사, 이준원 농림축산식품부 차관, 윤경환 한국유기농업협회 회장, 정창진 농협중앙회 상무, 박성직 (사)전국친환경농업협의회 회장, 주형로 환경농업단체연합회 회장, 이등질 한국친환경농업협회 회장, 월간 친환경 이영자 발행인이 테이프 커팅을 하고 있다. (농협 제공) 2016.8.19/뉴스1  y2onhwa@news1.kr  ), 무단 전재 및 재배포 금지]"
"섬은 생물 다양성 상징이자 천연자원의 보고  제4차 도서종합계획에 실질 지원대책 포함 촉구  김성렬 행자부 차관 ""도서개발촉진법 개정"" 약속  【목포=뉴시스】박상수 기자 = 목포MBC(대표이사 이장석)가 창사 48주년을 맞아 '섬의 날' 제정을 제안하고 나서 눈길을 끌고 있다.  목포MBC는 오는 25일 오후 11시10분 부터 80분간 창사특집 '섬의 날을 제정하자' 토론회(연출 신광하)를 방송한다고 23일 밝혔다.  김윤 목포MBC 보도부장 사회로 진행되는 토론회에는 이낙연 전남도지사와 김성렬 행정자치부 차관,  박지원 국민의당 비상대책위원장, 고길호 신안군수, 강봉룡 목포대 도서문화연구원장 등 5명이 패널로 참석했다.  섬은 생물 다양성의 상징이자 천연자원의 보고이다. 동서고금을 막론하고 부국 강병을 꿈꾼 나라들은 모두 바다와 섬을 영토 개념으로 중요시 여겼고, 21세기 신해양시대를 맞는 대한민국 역시 섬과 바다를 개발해야 하는 의무를 갖고 있다.  연출을 맡은 신광하 기자는 ""한국의 섬은 3677개로 이 중 1967개가 전남에 밀집해 있다""면서 ""이 같은 여건에서 섬의 가치를 높이고 해양관광과 전통문화 수호의 거점으로써 섬의 중요성을 다시한번 강조하기 위해 특집 토론을 통해 '섬의 날' 제정을 제안했다""고 배경을 설명했다.  이른바 '렉처 디베이트(Lecture Debate)'를 표방한 토론회는 섬 정책에 대한 패널들의 강연에 이어 곧바로 토론하는  형식을 채택해 '섬의 날' 제정에 관한 이해를 높였다.  김성렬 행정자치부 차관은 23일 진행된 녹화토론에서 ""정부는 1988년 10년 단위 도서종합개발 계획을 수립한 이래 내년 3차계획까지 총 3조565억원을 투자했다""며 ""섬의 생활여건과 소득기반을 개선하고 문화복지 수준을 높이기 위해 제4차 도서종합계획을 수립하고, 도서개발촉진법 개정에 주력할 것""이라고 말했다.  이낙연 전남지사는 ""전국 섬의 65%가 전남에 있다""며 ""전남 관광객 5000만명 시대를 열기 위해 가고싶은 섬 정책을 확대 추진할 것""이라고 강조했다.  국민의당 비상대책위원장이자 국회 도서발전연구회 공동대표인 박지원(전남 목포) 원내대표는 ""진도 섬마을 출신으로, 섬이 얼마나 중요한지 잘 알고 있다""면서 ""정부 정책에서 소외되고 문화혜택은 꿈도 꿀 수 없는 취약지역인 섬의 가치를 높이기 위해서라도 '섬의 날'은 반드시 제정돼야 한다""고 말했다.  고길호 신안군수는 ""섬으로만 이뤄진 지방자치단체인 신안 섬 주민들에게 시급한 것은 접근성 확보""라며 ""새천년대교 등 연륙교 건설과 여객선 현대화·쾌속화가 서둘러 이뤄져야 한다고 주장했다.  전국 유일의 섬 전문 연구기관을 이끌고 있는 강봉룡 목포대 도서문화연구원장은 '섬과 바다 정책의 과거와 미래'라는 강연을 통해 ""섬의 가치와 가능성을 재발견하기위해 대학과 연계한 종합 싱크탱크가 필요하다""며 가칭 '한국섬발전진흥원' 설립을 주장했다.  이장석 목포MBC 사장은 ""섬은 국토 면적의 3.5%에 불과하지만, 섬이 만들어내는 경제수역은 우리 국토의 4배에 달한다""며 ""다도해를 가시청 권으로 둔 방송사로써 지역의 미래를 섬에서 찾고자 토론회를 개최하게 됐다""고 말했다.  parkss@newsis.com"
"윤장현 광주시장은 ""자동차 100만대 생산기지 기반조성과 투자진흥지구 지원시설 구축, 무등산 정상 군부대 이전, 자동차 애프터마켓 부품 시험인증센터 구축, 남구 도시첨단산단 진입도로 개설, 빛그린산업단지 진입도로 개설, 백운광장~주월교차로 혼잡도로 개선, 경전선(광주~순천간) 전철화, 미래형 자동차 부품 및 모듈패키징 산업기반 조성, AI기반 미래형 의료로봇 시장창출 지원, 월전동~무진로간 도로개설, 2019 세계수영선수권대회 개최, 정형외과용 생체이식 융합의료기기산업 지원센터 구축, 첨단실감콘텐츠 제작클러스터 조성, 아시아문화전당 콘텐츠 개발 및 운영 등의 국비 지원이 필요하다""고 밝혔다.  또 ""광주 군공항 이전, 에너지밸리 조성 특별법 제정, 전장 등 친환경자동차 부품산업기반 조성, (구)광주교도소 부지 무상양여, 광주형 일자리 성공을 위한 사회협약 법제화 등의 주요 현안사업이 실현될 수 있도록 새누리당이 힘써달라""고 건의했다.  이정현 대표는 ""전남·북과 광주시가 요구하고 있는 예산들은 지역에 국한된 것들이 아니라 대한민국의 미래가 걸린 사업들이다""면서 ""예전부터 알고 있는 사업들인 만큼 지원을 아끼지 않겠다""고 말했다.  kdg2066@  ), 무단 전재 및 재배포 금지]"
"호남포기 전략은 오늘로서 포기  (서울·전주=연합뉴스) 홍인철 안용수 기자 = 새누리당 이정현 대표는 23일 ""앞으로 호남의 사랑을 얻기 위한 무한대의 노력을 펼칠 것이며, 호남의 기존 정치 세력과도 모든 가능성을 열어두겠다""고 말했다.  이 대표는 전북도청에서 열린 '호남권 예산정책협의회'에 참석한 뒤 연합뉴스와의 통화에서 ""과거 새정치국민회의와 자유민주연합이 손잡을 것이라고 누가 생각했느냐. 뚜렷한 대권 주자가 없는 상황에 호남이 특정정당의 지역이라고 할 수 없다""면서 이같이 밝혔다.  이는 지난 1997년 이념 좌표가 달랐던 새정치국민회의 김대중(DJ) 대선 후보와 자민련 김종필 총재가 연대해 대선을 승리로 이끌었던 것처럼 내년 대선에서도 호남과 충청권을 아우르는 제2의 'DJP 연대'를 성사시키겠다는 것으로 풀이된다.  이 대표는 ""호남에서 새누리당이 2석, 더불어민주당 3석, 국민의당 23석으로서 새누리당은 엄연히 삼각 축의 한 축을 차지하고 있다""면서 ""호남은 합리적 보수세력이 엄연히 존재하고, 새누리당이 지향하는 대한민국의 가치를 가장 잘 이해하는 지역이기도 하다""라고 설명했다.  이 대표는 ""호남은 더이상 새누리당에서 소외된 지역이 아니다""라면서 ""호남을 배려, 동냥하듯이 하던 시절은 끝났고, 새누리당의 호남 포기 전략을 포기한다""고 강조했다.  앞서 이 대표는 정책협의회에서도 ""호남에서는 완전한 정치의 정립(鼎立·세 세력이 솥발과 같이 벌어져 서있음)이 이뤄졌고, 전국 어느 곳에서도 볼 수 없는 사실상의 정치 평준화가 이뤄지고 있다""면서 ""탕평인사를 포함한 지역 균형 발전에 더욱 관심을 갖고 호남의 사랑을 받아낼 것""이라고 약속했다.  이 대표는 ""이 대표는 ""지난 30여년 동안 호남에서 거의 독점했던 정당이 있었지만 이제는 정치 대변화가 일고 있다""면서 ""호남이 마음의 문을 여는 것을 놓치지 않고, 정서를 대변함으로써 새누리당도 변신과 변화를 꾀하겠다""고 말했다.  협의회에는 당에서 김광림 정책위의장, 주광덕 국회 예결위 새누리당 간사가, 지역에서 송하진 전북도지사, 윤장현 광주시장, 이낙연 전남도지사 등이 참석했다.  광역단체장들은 지역 현안 사업으로 ▲새만금 내부간선 도로 건설 ▲지리산 산악철도 시범사업 ▲태권도 명예의 전당 건립 ▲무안국제공항 활주로 연장 ▲광주∼완도 간 고속도로 건설 ▲백신 글로벌 산업화 기반구축 사업 등을 꼽았다.  한편, 이 대표는 다른 일정상 참석이 어려웠으나 호남에서 열리는 첫 정책협의회인 만큼 10분 정도의 발언을 마치고 곧바로 여의도 당사로 올라왔다.  ichong@yna.co.kr"
"[전남CBS 박형주 기자]광주와 전남북 광역단체장들이 23일 전북도청에서 새누리당 이정현 대표 등을 만나 내년도 지역 현안사업 지원을 위한 예산정책협의회를 열었다.  이낙연 전라남도지사는 이 자리에서  목포~보성 간 남해안 철도 건설과  광양항 석유화학 돌핀시설 건립, 기능성 화학소재 클러스터 구축 사업, 순천만 국가정원 운영관리 선도 모델 사업 등 지역 주요 현안 사업 17건에 대한 지원을 부탁했다.  이정현 대표는 이에 대해 ""호남의 쟁점 상당수는 지역 문제일 뿐 아니라 대한민국의 미래예산을 확보하기 위한 것이므로 새누리당은 소홀하거나 소극적으로 응하지 않을 것""이라고 약속했다.  저작권자 © CBS 노컷뉴스(www.nocutnews.co.kr) 무단전재 및 재배포 금지"
"전경련과 전라남도는 23일 전남 영암 F1 경기장에 위치한 프리미엄 자동차 연구센터에서 튜닝카 산업 발전과 협력을 위해 '대한민국 미래 동력, 자동차 튜닝 산업 발전방안 포럼'을 개최, 이승철 전경련 부회장을 비롯한 내빈들이 F1경기장에서 기념촬영을 하고 있다. 왼쪽부터 이용주 의원, 박준영 의원, 이승철 부회장, 김병수 자동차부품연구원 원장, 안병옥 전남기업도시 담당관  전경련과 전라남도는 23일 전남 영암 F1 경기장에 위치한 프리미엄 자동차 연구센터에서 튜닝카 산업 발전과 협력을 위해 '대한민국 미래 동력, 자동차 튜닝 산업 발전방안 포럼'을 개최, 이승철 전경련 부회장이 튜닝차량에 시승체험을 하고 있다.  전경련과 전라남도는 23일 전남 영암 F1 경기장에 위치한 프리미엄 자동차 연구센터에서 튜닝카 산업 발전과 협력을 위해 '대한민국 미래 동력, 자동차 튜닝 산업 발전방안 포럼'을 개최, 내빈들이 전시되어 있는 자동차 부품들을 살펴보고 있다. 왼쪽부터 이용주 의원, 박준영 의원, 이낙연 도지사, 이승철 전경련 부회장  전경련과 전라남도는 23일 전남 영암 F1 경기장에 위치한 프리미엄 자동차 연구센터에서 튜닝카 산업 발전과 협력을 위해 '대한민국 미래 동력, 자동차 튜닝 산업 발전방안 포럼'을 개최, 이승철 전경련 부회장이 기조강연을 하고 있다.  전경련과 전라남도는 23일 전남 영암 F1 경기장에 위치한 프리미엄 자동차 연구센터에서 튜닝카 산업 발전과 협력을 위해 '대한민국 미래 동력, 자동차 튜닝 산업 발전방안 포럼'을 개최, 이승철 전경련 부회장이 기조강연을 하고 있다.  sijeon@fnnews.com 전선익 기자  . 무단 전재-재배포 금지"
"새누리당 이정현 대표는 ""앞으로 호남의 사랑을 얻기 위한 무한대의 노력을 펼칠 것이며, 호남의 기존 정치 세력과도 모든 가능성을 열어두겠다""고 말했습니다.  이 대표는 오늘(23일) 오전 전북도청에서 열린 '호남권 예산정책협의회'에 참석한 뒤 ""과거 새정치국민회의와 자유민주연합이 손잡을 것이라고 누가 생각했느냐""면서 이렇게 밝혔습니다.  이 대표는 또 ""뚜렷한 대권주자가 없는 상황에서 호남이 특정 정당의 지역이라고 할 수 없다""며 ""호남에는 합리적 보수세력이 엄연히 존재하고, 새누리당이 지향하는 대한민국의 가치를 가장 잘 이해하는 지역""이라고 설명했습니다.  특히 ""호남은 더이상 새누리당에서 소외된 지역이 아니""라면서 ""새누리당의 호남 포기 전략을 포기한다""고 강조했습니다.  오늘 정책협의회에는 당에서 김광림 정책위의장을 비롯해 주광덕 국회 예결위 새누리당 간사가, 지역에서는 송하진 전북도지사, 윤장현 광주시장, 이낙연 전남도지사가 참석했습니다.  손석민 기자(hermes@sbs.co.kr)  ※ ⓒ SBS &amp; SBS콘텐츠허브 : 무단복제 및 재배포 금지"
"23일 연습장 찾아 떡 ·과일 등 전달하고 안보 동영상 시청  [아시아경제 노해섭 기자]전남도청 공직자 부인 모임인 전남도 목련회는 23일 을지연습장을 방문, 참가자를 위문 격려했다.  전남도 목련회 회원들은 이날 훈련장을 찾아 100여 명의 참가자들에게 떡, 과일, 치킨 등 위문품을 전달하고, 을지연습 상황 청취 및 국가안보 중요성에 대한 안보 동영상 시청 등을 통해 을지연습을 함께 공감하고 체험하는 시간을 가졌다.  전남도 목련회는 도청 간부급 이상 공무원들의 부인 모임으로 회장은 이낙연 도지사 부인인 김숙희 여사가 맡고 있다.  김숙희 회장은 “가상훈련이지만 최선을 다해 훈련에 참여해 국가비상사태에 대비해 달라”고 당부했다.  전남도 목련회는 정기적으로 사회복지시설을 방문해 위문활동을 펼치고 있으며, 추석, 설 등 명절에도 꾸준히 사회복지시설 및 어려운 가정을 방문해 온정을 나누고 있다.  노해섭  기자 nogary@"
"[아시아경제 노해섭 기자]새누리당-전라북도ㆍ전라남도ㆍ광주광역시 예산정책협의회가 23일 오전 전북도청 종합상황실에서 열린 가운데 (왼쪽부터) 성일종 예결위원, 김상훈 정책위부의장, 김광림 정책위의장, 정운천 전북도당위원장, 윤장현 광주시장, 송하진 전북지사, 이정현 대표, 주광덕 예결위간사, 이낙연 전남지사, 권석창 예결위원, 김중대 전남도당위원장 등이 기념촬영을 하고 있다.  새누리당-전라북도ㆍ전라남도ㆍ광주광역시 예산정책협의회가 23일 오전 전북도청 종합상황실에서 개최됐다. 이 협의회에는 이낙연 전남도지사, 송하진 전북도지사, 윤장현 광주광역시장, 새누리당 이정현 대표와 김광림 정책위의장, 주광덕 예결위 간사, 정운천 ·권석창 ·성일종 예결위원, 각 시 ·도당 위원장 등이 참석했다.  사진제공=전남도"
"특히 이 지사는 “지역 균형발전 차원에서 SOC 사업이 절실하다”고 말했다. 이어 “호남선과 전라선을 운행하는 열차는 신형으로 바뀌었지만 호남선의 광주~목포 구간과 전라선의 익산~여수 구간의 철로는 아직 구형이고, 경상도와 전라도를 연결하는 경전선 또한 부산~진주 구간은 복선전철, 진주~광양 구간은 복선 비전철이지만 순천~광주 송정 구간은 단선 비전철이며, 순천~부산 간 철도망과 연결 예정인 목포~보성 간 남해안철도는 아직까지도 예산 반영이 미진하다”며 “새누리당 차원에서 지역 불균형 해소에 앞장서달라”고 요청했다.  또한 “전남 제조업 생산액의 93.4%를 차지하는 주력산업인 조선 ·철강 ·석유화학산업 3대 산업이 어려움에 처해 있다”며 ""3대 산업 위기 극복을 위해 관련 사업 예산이 적극 반영되도록 해달라”고 건의했다.  이정현 대표는 “새누리당 호남 국회의원들은 호남 정치와 지역발전의 당당한 한 축으로서 책임감을 느낀다”며 “호남의 쟁점 상당수는 지역 문제일 뿐 아니라 대한민국의 미래예산을 확보하기 위한 것이므로 새누리당은 소홀하거나 소극적으로 응하지 않을 것”이라고 약속했다.  전라남도는 앞으로 2017년 지역 사업들이 차질 없이 추진되도록 국고 예산확보 활동을 지속적으로 추진하고, 향후 국회 심의에도 적극 대응할 계획이다. 이를 위해 중앙부처 관계자 및 여 ·야 의원들과 유기적 네트워크를 구축해 예산안 처리가 종료될 때까지 국고예산 확보에 최선을 다한다는 방침이다.  노해섭  기자 nogary@"
"【서울=뉴시스】조수정 기자 = 전경련과 전라남도는 23일 전남 영암 F1 경기장에 위치한 프리미엄 자동차 연구센터에서 튜닝카 산업 발전과 협력을 위해 '대한민국 미래 동력, 자동차 튜닝 산업 발전방안 포럼'을 개최했다. 내빈들이 전시되어 있는 자동차 부품들을 살펴보고 있다. 왼쪽부터 이용주 의원, 박준영 의원, 이낙연 도지사, 이승철 전경련 부회장. 2016.08.23. (사진=전국경제인연합회 제공)  photo@newsis.com  [사진 영상 제보받습니다] 공감언론 뉴시스가 독자 여러분의 소중한 제보를 기다립니다. 뉴스 가치나 화제성이 있다고 판단되는 사진 또는 영상을 뉴시스 사진영상부(n-photo@newsis.com, 02-721-7470)로 보내주시면 적극 반영하겠습니다."
"【전주=뉴시스】정경재 기자 = 23일 전북도청 4층 종합상황실에서 새누리당 호남권 예산정책협의회가 개최된 가운데 이낙연 전남도지사가 화기애애한 분위기 속에 미소를 짓고 있다. 2016.08.23.  jkj1122@newsis.com  [사진 영상 제보받습니다] 공감언론 뉴시스가 독자 여러분의 소중한 제보를 기다립니다. 뉴스 가치나 화제성이 있다고 판단되는 사진 또는 영상을 뉴시스 사진영상부(n-photo@newsis.com, 02-721-7470)로 보내주시면 적극 반영하겠습니다."
"“호남의 기존 정치 세력과  모든 가능성 열어둘 것” 강조  새누리당 이정현 대표가 23일 호남 정치세력과의 연대 가능성을 시사해 관심을 모으고 있다.  이 대표는 이날 전북도청에서 열린 ‘호남권 예산정책협의회’ 참석 후 언론 인터뷰에서 “과거 새정치국민회의와 자민련이 손잡을 것이라고 누가 생각했느냐. 뚜렷한 대권 주자가 없는 상황에 호남이 특정정당의 지역이라고 할 수 없다”며 “앞으로 호남의 사랑을 얻기 위한 무한대의 노력을 펼칠 것이며, 호남의 기존 정치세력과도 모든 가능성을 열어두겠다”고 말했다.  1997년 대선을 앞두고 새정치국민회의 김대중(DJ) 후보와 자유민주연합 김종필(JP) 총재가 손을 잡은 DJP 연대처럼 호남과 충청을 아우르는 ‘제2의 DJP연대’를 성사시켜 내년 대선을 돌파하겠다는 구상으로 풀이된다.  이 대표는 “호남에 합리적 보수세력이 엄연히 존재하고, 새누리당이 지향하는 대한민국의 가치를 가장 잘 이해하는 지역으로, 호남은 더는 새누리당에서 소외된 지역이 아니다”며 “호남을 배려, 동냥하듯이 하던 시절은 끝났고 새누리당의 호남 포기 전략을 포기한다”고 선언했다. 이어 “탕평인사를 포함한 지역 균형발전에 더욱 관심을 갖고 호남의 사랑을 받아낼 것”이라며 “호남이 마음의 문을 여는 것을 놓치지 않고 정서를 대변함으로써 새누리당도 변신과 변화를 꾀하겠다”고 강조했다.  이번 협의회에는 김광림 정책위의장, 주광덕 국회 예산결산특위 새누리당 간사, 송하진 전북도지사, 윤장현 광주시장, 이낙연 전남도지사 등이 참석했다.  이 대표는 오후 소상공인연합회 간담회에서 대기업의 골목상권 침해를 개선하겠다고 다짐했다. 그는 “도가 지나칠 정도로 골목상권을 침해하는 대기업이 있다면 신경을 쓰겠다”며 “대기업이 탐욕에 가깝게 소상공인에게 피해를 준다거나 가슴을 아프게 하는 일이 있다면 큰 경제정책의 하나로 많은 관심을 두겠다”고 약속했다. 아울러 소상공인을 위한 정책, 입법, 예산 등을 뒷받침할 전담 특위를 당내에 설치하기로 했다. 이 대표는 지난 19대 국회에서 당내 소상공인·중소기업특위원장을 맡았다.  박세준 기자 3jun@segye.com  ⓒ 세상을 보는 눈, 글로벌 미디어  세계일보"
"이정현 새누리당 대표는 23일(오늘) ""호남에서 정치의 대변화가 일어나고 있다""고 ""이제 더 이상 새누리당은 호남에서 소외세력이 아니다""라고 강조했다.  이 대표는 이날 전북도청에서 열린 '호남권 예산·정책협의회'에서 ""호남에서 정치 평균화가 이뤄졌다""며 이같이 말했다.  이 대표는 ""30여 년 동안 호남에서 독점해온 정당(더불어민주당)이 새누리당과 비슷하게 됐다""면서 ""새누리당 호남 국회의원들은 (야당 사이에) 어쩌다 끼어있는 것이 아니라, 당당한 한 축으로서 분명한 책임감을 느낀다""고 말했다.  이 대표는 이어 ""(새누리당은) 호남 사람이 마음의 문을 여는 것을, 정치의 변화를 놓치지 않을 것""이라며 ""지역을 가리지 않는 탕평인사와 호남 정서를 대변해 호남의 사랑을 받아 내겠으며 새누리당도 변신과 변화를 꾀하겠다""고 강조했다.  이 대표는 또 ""호남의 쟁점 상당수는 지역의 문제일 뿐 아니라 대한민국의 미래 예산을 확보하기 위한 것""이라며 ""(이에 대해) 새누리당은 소홀하거나 소극적으로 응하지 않을 것""이라고 약속했다.  이날 협의회에는 이정현 대표를 비롯해 김광림 정책위의장과 송하진 전북도지사, 윤장현 광주시장, 이낙연 전남도지사 등이 참석했다.  박민철기자 (mcpark@kbs.co.kr)  ▶ [저작권자ⓒ KBS 무단복제-재배포 금지]"
