"◇광주시  -윤장현 시장  08:30 KBS-R '출발 무등의 아침'(KBS 방송총국)  15:40 사회공헌 성금 전달식(접견실)  -문인 행정부시장  14:00 지방규제개혁 추진 검검회의(정부서울청사)  -우범기 경제부시장  11:00 광주디자인센터 이사회(광주디자인센터)  ◇전남도  -이낙연 도지사  14:30 동아일보·채널A 창농·귀농 박람회  -김갑섭 행정부지사  14:00 지방규제개혁 점검회의(정부서울청사)  -우기종 정무부지사  8.26~29 전남-일본 고치의 날 행사(일본)  being@  ), 무단 전재 및 재배포 금지]"
"동영상 뉴스  이낙연 전남 지사의 중국 방문 일정이  중국 측의 요청으로  무기한 연기됐습니다.  전라남도는 양국간의 현안을 둘러싼 입장차이가 지방정부 교류에도 영향을 끼친 것이 아닌가, 유감을 표명했습니다.  보도에 최혜진 기자입니다.  중국 쓰촨성 청두시입니다.  이번주 이곳을 방문해 성장과 면담하고 기업투자 설명회를 가지려던 이낙연 전남지사의 방중이 무기한 연기됐습니다.  방문을 사흘 앞둔 지난 26일, 중국 측이 '성장 일정'을 이유로, 부성장과 면담할 것을 요청한 겁니다.  또 방중 일정에 있었던 충칭시 시장과의 면담도 중국에서 연기를 요청해 와, 전라남도는 아예 이번 '지사 방중'을 취소했습니다.  조영식(전라남도 국제협력관실) : ""계속 협의를 해왔는데 방문하기 사흘 전에 (쓰촨성 측이) 당초 성장과의 회담이 부성장으로 격하가 됐다 이렇게 통보가 왔습니다.""  이밖에 자매결연을 준비해오던 중국 산시성 성장도  전남 방문을 취소했고, 다음달 장시성 정부가 전남에서 갖기로 한 주간 행사도 미뤄졌습니다.  중국 측은 인사이동에 따른 해외 출장 자제, 수해복구 등을 이유를 내세웠지만 전라남도는 최근 양국 간의 정치적 상황이 영향을 끼친 것으로 보인다며 일련의 과정에 매우 유감스럽다는 보도자료를 냈습니다.  양국 간의 긴장이 지방정부 교류에도 영향을  끼치는 것이 아닌가하는 우려 속에 전라남도는 지사 방문 연기와 상관없이 쓰촨성에서 열기로한 투자설명회와 관광설명회는 예정대로  추진하기로 했습니다.  KBS 뉴스 최혜진입니다.  최혜진기자 (join@kbs.co.kr)  ▶ [저작권자ⓒ KBS 무단복제-재배포 금지]"
"(무안=뉴스1) 김한식 기자 = 전남도는 30일 국무회의를 거쳐 발표된 2017년 정부예산안에 남해안철도 등 주요 사회간접자본(SOC)사업과 미래 성장산업을 비롯한 지역 현안사업 5조 4000억원이 반영된 것으로 파악됐다고 밝혔다.  이는 2016년 정부예산 반영액보다 1679억 원(3.2%) 늘어난 규모다.  이낙연 도지사를 필두로 연초부터 직접 부처 장·차관부터 실무자까지 만나 지역의 현안사업 반영을 요청하고 여·야 국회의원들과 간담회를 통해 강력히 건의했다. 특히 SOC사업의 경우 관련 공무원이 부처에 상주하면서 적극적인 국고예산 확보활동을 펼친 것이 주효했다는 분석이다.  현안사업인 목포∼보성 남해안철도 건설 1561억원, 광주∼완도 고속도로 건설 820억 원, 압해∼암태 새천년대교 건설 988억 원, 여수∼고흥 연륙·연도교 건설 550억원, 영광∼해제 칠산대교 건설 268억원, 지도∼임자 국도시설 개량 296억원이 반영됐다.  이에 따라 SOC 조기 확충은 물론 건설경기 활성화로 지역경제 일자리 창출에 큰 도움이 될 것으로 보인다.  또한 이산화탄소 고부가가치 사업화 플랫폼 구축 사업 15억원, 백신글로벌 산업화 기반 구축 15억원, 무인기 개발 성능시험 평가기반 구축 27억원, 농수산업 무인기 실증테스트베드 기반 구축 4억원, 소형선박 해상테스트 기반 구축 10억원, 레저선박 부품기자재 고급화기술 기반 구축 8억원도 반영됐다.  메가와트(㎿)급 태양광발전 실증단지 기반 구축 9억원, 조류 발전 실해역시험장 구축 7억원 등 미래 성장동력이 될 신규 사업도 포함됐다. 이는 석유화학, 조선, 철강산업 위기를 타개하려는 노력이 결실을 맺은 것으로 분석된다.  신안경찰서 신설 12억원, 응급의료 전용헬기 중형 전환 28억원이 확정됐다. 취약한 섬 지역 치안 문제와 응급의료 문제를 선제적으로 대처한 이낙연 도지사의 전방위적 노력이 성과를 발휘한 것으로 풀이된다.  지역 숙원사업인 증도 기독교 체험관 건립 9억원, 여수박람회 사후활용을 위한 청소년해양교육원 건립 19억6000만원 등도 포함됐다.  이밖에 반영된 주요 사업비는 흑산도 소형공항 건설 200억원, 호남고속철도(송정~목포) 건설 75억원, 청소년해양교육원 건립 19억6000만원, 국제농업박람회 개최 13억2000만원, 완도해조류박람회 개최 18억원, 기능성화학소재클러스터 구축 75억원, 산업용 고압 직류기기 성능시험 기반 구축 60억원, 국민해양안전관 건립 52억원 등이다.  도는 정부안에 미 반영된 무안국제공항 활주로 확장, 광주∼순천 간 경전선 철도, 광양항 석유화학부두 돌핀시설 건설 등과, 추가 증액이 필요한 남해안 철도 등 SOC사업에 대해서는 앞으로 국회 예산안 심의 과정에서 추가 반영되도록 최선을 다할 계획이다.  수송기기용 고기능성 플라스틱 소재부품 개발사업, 친환경 바이오 화학 복합소재부품 개발사업, 무인기 인증통합관제 인프라 구축사업, 무인기 개발 성능시험 평가 기반 구축사업 등도 추가 반영되도록 국고예산 확보활동에 총력을 기울인다는 방침이다.  hskim@  ), 무단 전재 및 재배포 금지]"
"[광주CBS 김형로 기자]이낙연 전라남도지사는 정부가 '부정청탁 및 금품 등 수수의 금지에 관한 법률(김영란법)' 시행령상의 음식물, 선물, 경조사비 가액 기준을 3만 원, 5만 원, 10만 원으로 확정한 데 따른 농어업의 피해와 대처 방안을 현장에서 점검했다.  이 지사는 30일 영광 법성포 굴비 상가와 영광읍 축협마트 등을 방문, 굴비와 한우의 판매 동향과 가공유통 현장의 대처상황을 살폈다.  법성포 굴비 상인들은 ""김영란법은 추석 이후에 시행되는데도 소비자들은 벌써 심리적으로 위축돼 주문을 포기 또는 취소하거나, 저가품을 구입해 판매가 크게 줄고 있다""고 전하며 ""김영란법 시행 이후인 내년 설에는 엄청난 피해가 현실화될 것""이라고 우려했다.  굴비 상인들은 ""벌써 4만 9천 원짜리 주문이 들어오고 있다""며 ""굴비 10마리 선물세트를 5만 원 이하로 만들면 볼품이 없고, 그렇다고 5마리 세트를 만들기도 어색하다""고 고충을 토로했다.  영광 축협 간부도 ""한우 선물세트를 5만 원 이하로 만들 수는 있겠지만, 그것을 선물로서 고맙게 주고받기는 어려울 것""이라고 말했다.  이 지사는 ""일단 법은 지켜야 한다""며 ""농어민이 힘들더라도 지혜를 발휘해 법에 맞추어 나가면서 대책을 함께 찾아보자""고 말했다.  이 지사는 ""김영란법으로 접대문화가 건전화되는 등의 효과는 기대할 수 있을 것""이라며 ""그러나 접대문화 개선의 그늘에서 농어민과 자영업자 등 서민이 빈곤의 수렁에 빠지는 것을 해결하지 못하면 김영란법 시행은 좋은 정책이라고 말할 수 없다""고 지적했다.  이 지사는 ""김영란법 시행으로 ▲외국의 값싼 농축수산물이 더 많이 들어와 우리의 식탁을 점령하고 ▲농어업과 국산농축수산물 가공유통업이 몰락하며 ▲식당 등 자영업이 붕괴하고 ▲서민의 가계부채가 폭증할 우려가 있다는 점을 정부와 정치권이 직시해야 한다""고 덧붙였다.  khn5029@hanmail.net  저작권자 © CBS 노컷뉴스(www.nocutnews.co.kr) 무단전재 및 재배포 금지"
"[서울신문]  尹광주시장 “친환경차 선도”  李전남지사 “에너지에 집중”  “창조와 혁신, 지역경제 활성화… 우리는 미래를 논의합니다.”  서울신문사와 광주시, 전라남도가 주최한 ‘지역경제 활성화를 위한 창조·혁신 포럼’이 29일 광주 서구 김대중컨벤션센터에서 열렸다. 정부, 산업계, 학계가 모여 함께 미래 산업 먹거리를 고민하는 전국 순회포럼의 첫 번째 장이다.  황교안 국무총리는 축사에서 “전국 곳곳에 창조와 혁신의 열기가 확산돼 지역 특성에 맞는 산업이 일어난다면 우리 경제가 재도약의 기회를 맞이할 것”이라고 말했다. 황 총리는 이어 “광주·전남은 찬란한 문화를 꽃피운 ‘예향’으로 창조와 혁신의 DNA를 지닌 고장”이라면서 “문화적 역량에 창의적 아이디어와 첨단 과학기술이 어우러져 신산업 진흥의 최적지가 될 것”이라고 격려했다.  윤장현 광주시장은 “세계 최초로 카셰어링 사업에 전기차와 수소차 15대씩을 시범 운영키로 하는 등 ‘친환경자동차 선도도시’로서 광주의 비전이 가시화되고 있다”고 소개했다.  이낙연 전남지사는 “지각판이 부딪칠 때 지진이 일어나듯 변화 역시 과거판과 미래판이 부딪칠 때 위기의 모습으로 나타난다”면서 “전남은 조선·철강·석유화학 산업에 닥친 지금까지의 위기를 극복하고 에너지 신산업에 집중해 번영하는 미래를 만들고 있다”고 강조했다.  서울신문 김영만 사장은 개회사에서 “지역경제가 살아야 나라가 산다”면서 “중앙정부와 지방자치단체, 기업들이 지역의 새로운 인프라를 적극 활용해 미래 먹거리를 창출해야 한다”고 말했다. 김 사장은 이어 “기술력은 있지만 자본이 뒷받침되지 않는 중소벤처기업들과 대기업이 상생할 수 있는 방안을 지속적으로 찾아야 한다”고 강조했다.  포럼은 중앙 대 지역, 대기업 대 중소기업, 전통기술 대 혁신기술, 기존 산업 대 미래 산업 등 대립 관계로 여겨지던 이항(二項)들 사이에서 협력, 상생, 창조의 계기를 찾아내는 데 집중했다. 포럼엔 친환경차 및 에너지 관련 산업인을 비롯해 400여명이 운집해 광주·전남의 창조경제혁신센터가 이뤄 낸 성과와 미래 산업의 활로에 대해 경청했다.  광주 최치봉 기자 cbchoi@seoul.co.kr  광주 홍희경 기자 saloo@seoul.co.kr  ▶ []  - Copyrights ⓒ서울신문사. 무단 전재 및 재배포 금지 -"
"전남 여수 경도와 돌산도를 잇는 연륙교 건설이 검토되고 있다. 섬 고유성을 흐트러뜨린다는 난개발 시비도 부를 것으로 보인다.  30일 전남도에 따르면 여수 경도와 돌산도를 연결하는 편도 2차선, 길이 1.9㎞(접속도로 구간 포함)의 교량을 건설하는 방안을 내부 검토중이다. 건설에는 모두 640억원 정도가 들 것으로 추산됐다.  연륙교 건설은 최근 경도에 1조1000억원을 투자키로 한 미래에셋 박현주 회장이 이낙연 전남지사에게 건의한 것으로 알려졌다.  전남도는 굴착공법을 이용하는 해저터널(400억~450억원)과 바닷속에 콘크리트 박스를 잇대는 침매터털(500억~550억원) 방식도 검토했으나 모두 수심이 얕아 불가능하다고 판단했다.  가장 큰 난제는 교량 건설이 섬을 육지로 만들어버린다는 정체성 훼손 논란을 잠재워야야 한다는 것이다.  현재 경도는 철부선 2대가 관광객을 실어나르고 있다. 2009년 경도 섬 전체를 관광단지로 꾸미는 사업이 시작될 때부터 교량건설 의견이 제시됐으나 반발여론이 높아 철부선을 운행하고 있다.  여수환경련 관계자는 “지역의 큰 관광자원인 경도에 거대한 인공물을 덧붙이려는 것은 정말 부자연스러운 발상이며 난개발 시비를 부르게 될 것”이라면서 “섬을 육지로 만들지 않고도 관광객을 모으는 방법은 없는지부터 먼저 연구해야 한다”고 말했다.  회사원 김모씨(51)는 “경도의 해발고도가 거의 해수면과 일치해 교량을 건설하려면 또 다른 부대시설을 높이 지어야 한다”면서 “지금처럼 철부선을 타고 드나들면서 섬과 바다의 묘미를 자연스럽게 만끽하도록 하는 그 자체가 관광자원이라 본다”고 말했다.  건설비용을 누가 대느냐도 풀어야할 숙제다.  검토되는 이 연륙교는 비법정도로로 국비를 지원받을 수 없다는 문제가 따른다. 그렇다고 재정자립도 최하위 광역지자체인 전남도가 예산을 내놓을 처지도 안된다. 경도 투자를 결정한 미래에셋컨소시엄이 맡아야 한다는 의견도 나오지만 이 경우 ‘민자도로’처럼 통행세 부과 가능성도 불거진다.  전남도 관계자는 “경도 연륙교 건설 시점이나 사업비 확보 등에 대한 구체적인 계획이 아직 마련되지 않은 단계”라고 말했다.  여수 경도는 전남개발공사가 2009~2014년 사이 3576억원을 들여 216만8894㎡의 면적에 골프장(25홀)과 콘도(100실), 기업연수부지, 상업용지 등을 조성하면서 관광객이 매년 증가하고 있다. 최근 미래에셋과 영국계 국제 투자회사 캐슬파인즈는 7대3으로 출자해 경도 골프장과 콘도 등을 3423억원에 일괄 매입, 앞으로 5년간 7500억원을 추가 투자해 명품 복합리조트를 건설할 방침이다.  ▶ 경향신문 SNS ), 무단전재 및 재배포 금지"
"대한민국을 대표할만한 관광 명소가 있다. 바로 전라남도다. 전남은 이른바 우리의 맛과 멋과 스타일을 한 곳에 모아둔 매력 있는 터전이다. 그 내력 있는 전통문화가, 맛깔스런 음식이, 그리고 사람들의 살가운 정서가 그러하다. 그래서 도시인들은 틈이 나면 남도의 넉넉한 품에 깃들어 추억을 회상하고 몸과 마음의 짐을 덜어낸다. 이게 바로 웅숭깊은 전라남도의 매력이다. 관광산업 차원에서 보자면 이만한 여건이 또 없다. 그래서 전문가들은 전라남도를 '대한민국 대표 관광지'라고 부르는데 주저하지 않는다.  이낙연 전남 지사는 이 같은 닉네임에 걸맞은 명품 전라남도를 일구기 위해 '관광'을 지역 경제 활로의 해법이자, 미래성장동력으로 내세웠다. 남도문예르네상스를 통해 전라남도의 역사와 전통 문화를 오늘에 되살리고, 천혜의 자연환경을 관광자원화 하는 한편, 글로벌 경쟁력을 갖춘 관광인프라를 토대로 전남을 복 받은 땅, 국내외 관광의 메카로 성장시켜 나가겠다는 포부다.  김형우  문화관광전문 기자 hwkim@sportschosun.com  -도정을 이끌며 가장 보람 있거나 힘든 점은 무엇입니까?  ▶보람도 고통도 변화지요. 변화가 생기고 있다는 것을 확인하는 것이 보람이고요. 욕심만큼 변화하지 않는다는 것을 확인하는 것이 고통입니다. 실제로 많은 변화가 있지요. 농도 전남이 일자리 종합 대상을 받았다든가, 국가적 과제인 출산율에서 좋은 결과를 가지고 있다든가, 노사평가 8년 연속 최우수상 또는 우수상을 받은 게 있거든요. 그런 거라든지 관광객이 전국에서 2번째로 많이 왔다든가 이런 것들은 큰 보람이지요.  과연 우리가 그만큼 부흥하고 있느냐? 내부적으로 하는 질문은 과제일 테고요.  -전라남도 관광, 어떻게 이끌 것입니까?  ▶모든 정책과 기획, 그리고 변화는 일정한 기반 위에서 이루어지는 것이지요. 그래서 우선 국내의 내방객들이 매력을 느끼고 찾을 만한 기반이 생기면, 그 다음에 외국관광객들이 쉽게 올 수 있는 여건들이 마련되는 것입니다. 어느 날 종이 위에서 기획한다고 다 이루어지는 것은 아니지요. 저는 늘 무슨 정책을 펴든지 현실의 변화 위에서 몇 발자국 더 보면서 정책을 세우는 그런 방식을 끊임없이 조언합니다.  우리가 무얼 갖고 있으니 거기서 더 뛰어 올라가자. 그래서 저희가 늘 미래 구상을 할 적에는 우리의 여건에서부터 출발 하는 것입니다. 전라남도 관광 역시 우리의 굳건한 현실적 기반위에서 열심히 추진해 나갈 것입니다,  △전남 영광 출신 △광주제일고등학교 △서울대학교 법학과  △동아일보 동경특파원, 논설위원, 국제부장  △4선 국회의원(16, 17, 18, 19대) △민주당 대변인, 원내대표, 사무총장 △한일의원연맹 간사장  △제37대 전남 도지사(현)  []  - Copyrightsⓒ 스포츠조선, 무단 전재 및 재배포 금지"
"영광군 천일염 우수성 홍보를 통한 인지도 향상  [아시아경제 김재길 기자]영광군(군수 김준성)은 10일부터 오는 13일까지 서울 코엑스에서 “My Life ! Healthy Salt ! ”주제로 열리고 있는 소금박람회에 참가했다.  이번 행사에는 이낙연 전라남도지사와 김학용, 박준영 국회의원, 김준성 영광군수, 강필구 영광군의회 의장을 비롯한 해양수산부 및 천일염 관계자 등 많은 인사들이 참여한 가운데, 주요 언론기관 및 관람객들의 큰 관심을 불러 일으켰다.  2016 소금 박람회는 단순한 형태의 전시에서 벗어난 천일염을 활용하여 다양한 형태의 식품, 생활용품 등을 체험할 수 있도록 생활 소금관, 천일염 건강관, 스마트 염전관 등으로 다양한 볼거리로 구성했다.  소금박람회는 50개 업체가 참여하고 100개의 부스를 운영하였으며, 관람객의 성황을 이룬 가운데 영광군에서는 천일염 4개 업체, 굴비 2개 업체가 참여하였으며, 군 홍보관을 개설하여 영광 갯벌 천일염의 우수성을 알리는 한편, 9월 16일부터 3일간 열리는 불갑산 상사화 축제를 병행 홍보했다.  군 관계자는“영광 갯벌 천일염은 염도가 낮고 칼륨 등 미네랄 함량이 높은 명품 천일염으로 소금박람회를 통해 영광 천일염의 저변을 확대하고, 수출 시장 확대 등 천일염산업 종사자의 소득 향상에 기여하는 계기가 되었으면 한다”고 말했다.  한편, 이번 소금박람회는 해양수산부, 전라남도, 영광군, 신안군이 공동 주체하고 대한급식 신문사가 주관하고 있다.  김재길 기자"
"[아시아경제 노해섭 기자]제15회 한국농업경영인 전국대회가 전국 한농연 회원과 가족 등 30,000여명이 참석해 10일 오후 여수세계박람회장에서 개막됐다. 환영리셉션에서 정세균 국회의장, 이낙연 전남도지사, 김진필 한농연중앙회장, 김승식 한농연전남도회장, 주철현 여수시장, 임명규 전남도의장 등 내빈들이 축하떡을 자르고 있다.  사진제공=전남도"
"[서울신문]  광주·전남지역 대학생들의 서울 기숙사인 ‘남도학숙’ 새 원장에 서재경(?사진?·68) 아름다운 서당 이사장이 내정됐다.  재단법인 남도장학회(이사장 윤장현 광주시장·이낙연 전남도지사)는 김완기 원장 후임에 서 이사장을 위촉하기로 했다고 10일 밝혔다. 26일부터 임기 3년이다. 남도학숙 원장은 시장과 도지사가 번갈아 가며 추천하게 돼 있으며, 이번 새 원장은 이낙연 도지사가 추천해 위촉 절차를 밟는다.  서울경제신문 출신인 서 신임 원장은 희망제작소 상임고문을 거쳐 박원순 서울시장후보 선거대책본부 총괄본부장, 서울신용보증재단 이사장 등을 지냈다. 서울 동작구 대방동에 있는 남도학숙은 이 지역 출신 대학생 850여명이 생활하고 있다. 600여명 규모의 제2 남도학숙은 서울 은평구 녹번동에 건립하고 있다.  무안 최치봉 기자 cbchoi@seoul.co.kr  ▶ []  - Copyrights ⓒ서울신문사. 무단 전재 및 재배포 금지 -"
"8회째를 맞은 이날 심포지엄에서는 김학렬(국립목포대학교 연구전임교수) (사)천일염세계화포럼 사무국장이 좌장을 맡았다. 1부(Session I)에서는 김준 광주전남연구원 책임연구위원이 인문학적 관점에서 소금의 역사 ·문화적인 의미를 심도 있게 강연했다. 이어 ㈜인포마스터의 김진성 박사(본부장)와 원지현 박사(과장)는 국내외 소금 시장에 대한 정보 제공, 대한민국 갯벌천일염에 대한 해외 수출시장 확대 및 전략에 대해 조사결과를 발표했다.  2부(Session II)에서는 한귀정 농촌진흥청 식품가공이용과장이 ‘한국 전통 발효식품에 천일염이 미치는 영향’이라는 주제로 식문화에 근간이 되는 갯벌천일염에 대한 학술적 우수성을 제시했다. 이세은 공주대학교 교수는 ‘고품질 천일염 생산을 위한 품질 관리 방향’이라는 주제로 고품질 천일염 생산을 위한 정보를 제공하는 학술적 연구 결과를 발표했다.  노해섭  기자 nogary@"
"전남도지사 추천 차례…곧 공식 발표  (무안=연합뉴스) 전승현 기자 = 제2남도학숙 건립으로 매머드급 기숙사가 될 남도학숙의 현 원장 임기가 이달 하순 끝남에 따라 후임 원장 인선 결과가 주목된다.  10일 전남도에 따르면 재단번인 남도장학회(이사장 윤장현 광주시장·이낙연 전남지사)는 이달 25일로 3년 임기가 마무리되는 김완기 원장 후임을 머지않아 위촉한다.  남도학숙 원장은 시장과 도지사가 번갈아 가며 추천하게 돼 있다.  이번 후임 원장은 이낙연 지사가 추천해 위촉 절차를 밟는다.  김완기 원장은 강운태 전 광주시장이 추천했었다.  남도학숙 원장은 판공비 등을 포함한 억대 연봉을 받으며, 명예직으로 여겨져 정치권 등에서 큰 관심을 보이는 자리다.  이와 관련, 전남도는 금명간 추천 인사를 발표할 예정이다.  1994년 설립된 남도학숙 역대 원장은 국회의원, 특허청장, 전남지사, 새마을지도자연수원장, 청와대 인사수석비서관 등을 역임한 '원로 정치인과 행정가들'이 맡아왔다.  교육 전문가(기숙사 사감)는 없었다.  도 관계자는 ""일부 인사에 대한 스크린 작업을 마무리 중""이라며 ""오늘, 내일 중으로 공식 발표가 있을 것""이라고 말했다.  서울에서 유학하는 광주·전남 출신 대학생들의 생활공간인 남도학숙은 현재 서울 동작구 대방동에 있다.  수용규모는 850명가량이다.  기숙사 시설이 양호하고 비용이 저렴해 학부모와 학생들로부터 인기가 있다.  광주시와 전남도는 2018년 개관 목표로 사업비 498억원을 들여 제2남도학숙을 건립하기로 했다.  서울 은평구 녹번동에 들어설 제2남도학숙 수용규모는 604명이다.  shchon@yna.co.kr"
"전남 여수 경도 해양관광단지가 5년 동안 1조 원이 넘는 돈이 투자돼 대규모 휴양 단지로 개발됩니다.  이낙연 전라남도지사는 여수 경도 개발 입찰에 참여한 3개 국제 컨소시엄 가운데 금융그룹 미래에셋과 영국계 투자회사가 합작한 미래에셋 컨소시엄이 우선협상 대상자로 선정됐다고 밝혔습니다.  미래에셋 컨소시엄은 기존에 있는 골프장과 콘도를 3천4백억 원에 인수하고, 5년에 걸쳐 7천5백억 원을 추가 투입하는 등 앞으로 5년 동안 1조 천억 원가량을 투자하겠다고 제안했습니다.  사업 계획서에는 6성급 리조트 호텔과 빌라, 물놀이 공원 새로 만들고 해상 케이블카를 건설하겠다는 구상이 담겼습니다.  이승배 [sbi@ytn.co.kr]  [저작권자(c) YTN(Yes! Top News) 무단전재 및 재배포 금지]"
