"광주R&amp;D특구 확대 등 건의  (광주=뉴스1) 김한식 기자 = 전남도는 29일 광주 김대중컨벤션센터에서 광주시 등과 공동으로 전국 첫 '창조·혁신 지역 순회 포럼'을 열어 각계 전문가로부터 지역경제 활성화와 미래 먹거리산업 육성을 위한 다양한 의견을 청취했다.  창조·혁신 지역 순회 포럼에는 황교안 국무총리, 이낙연 전남도지사, 윤장현 광주시장, 박주선 국회 부의장, 이개호 국회의원, 조봉환 민관합동창조경제추진단장, 정진행 현대차 사장, 황은연 포스코 사장, 김종웅 기아자동차 공장장 등 300여 명이 참석했다.  포럼에서 주제발표에 나선 문승일 서울대 교수는 나주빛가람혁신도시를 중심으로 한 에너지신산업 테스트베드, 스마트 에너지 도시, 글로벌 에너지 허브 조성 등의 로드맵을 제시하고 ""국가 주도의 전략적 에너지밸리 구축이 필요하다""고 주장했다.  이낙연 도지사는 환영사를 통해 ""위기에 처한 전남의 주력산업인 조선, 철강, 석유화학 산업의 새 활로를 모색하고 미래 성장동력인 에너지, 문화관광, 농수산식품, 생물의약 등 분야에서의 미래 신산업 육성이 절실하다""며 ""이 가운데 지역전략산업인 에너지신산업의 체계적인 추진이 무엇보다 중요하다""고 강조했다.  이어 행사에 참석한 총리에게 ""광주 R&amp;D특구를 나주 혁신도시까지 연결되도록 확대하고, 그 산업에 에너지신산업 분야를 추가해달라""며 ""에너지신산업이 광주·전남만의 문제가 아니라 국가경제의 미래라는 생각으로 도와주시길 바란다""고 건의했다.  나주 빛가람혁신도시에 조성하는 에너지밸리는 전남도가 한국전력, 광주시와 공동으로 추진하는 사업이다. 2020년까지 500개 에너지기업 유치를 목표로 하고 있으며, 현재까지 133개 기업이 투자를 결정했다.  한국전력과 SK텔레콤은 지난 4월 혁신도시 내 협업센터를 개소해 전기자동차 충전 인프라 구축사업을 추진하고 있다. 앞으로 5년 동안 5000억 원 규모의 전기자동차 충전 인프라를 구축할 계획이다.  이와 별도로 한전은 1000억 원 규모의 에너지밸리 연구개발(R&amp;D)센터 건립에 투자한다는 계획이다.  전국에서 처음 열리는 이번 창조·혁신 지역 순회포럼은 광주와 전남이 상생하는 차원을 넘어 '지역 발전의 창조·혁신모델'로서의 에너지신산업이 나아가야 할 방향을 제시하기 위해 열렸다.  도는 지역 전략산업으로 추진하는 에너지신산업과 드론산업 육성에 주력하고 빛가람혁신도시를 미래 핵심 신기술인 인공지능(AI) 기반 인공지능로봇, 지능형 자동차 등 에너지스마트 기술이 결합된 '최첨단 에너지밸리 중심축'으로 조성할 계획이다.  hskim@  ), 무단 전재 및 재배포 금지]"
"[광주CBS 김형로 기자]전남 남악 신도시 오룡지구 택지개발 사업과정에서 예산을 낭비한 혐의로 기소됐다가 1, 2심에서 무죄를 받았는데도 징계처분된 전남 여수시 간부가 징계 철회를 요구하는 소청 심사 청구를 했으나 기각돼 논란이 일고 있다.  전라남도에 따르면 29일 오후 2시 전남 도청에서 열린 제4차 소청심사위원회에서 여수시 국장인 A 씨가 전남도 인사위원회에서 중징계인 정직 3개월을 받은 데 대해 징계 철회를 요구한 소청 심사 청구에 대해 '기각' 결정했다.  도 기획조정실장과 위촉위원 10명 등 모두 11명으로 구성된 소청 심사위는 ""A 국장과 관련해 전남도가 감사를 거쳐 인사위원회에 회부돼 정직 3개월의 징계를 내리는 등 해당 절차를 밟아 징계가 이뤄진 만큼 징계 철회를 요구하는 소청 심사 청구가 이유 없다"" 라며 기각한 것으로 전해졌다.  A 국장은 전남도 출자기관인 전남개발 공사에서 본부장으로 재직 시 남악 신도시 오룡지구 개발과 관련해 배임 혐의로 기소됐으나 1, 2심 법원에서 ""책임감리를 외부 업체에 발주한 것은 경영상 판단에 의한 재량권 행사""라며 무죄가 선고된 뒤 검찰이 이에 불복해 상고함에 따라 현재 대법원에 계류 중이다.  그런데도 전남도는 지난 6월 27일 인사위원회를 열어 A 국장에 대해 ""전남개발공사 본부장으로 재직할 때 오룡지구 택지개발과 관련, 기술자평가위원회를 부적정하게 운영하고 예산편성 전 부당지출행위를 했다""며 정직 3개월의 중징계 처분한 데 이어 소청심사청구마저 기각했다.  징계 당시 주철현 여수시장이 A 국장에 대해 감봉, 견책 등 경징계를 인사위원회에 요청했으나 전남도 인사위원회는 중징계를 내려 오룡지구 개발사업에 대해 감사를 지시했던 이낙연 지사의 입김이 작용한 것 아니냐는 논란을 빚었다.  A 국장은 CBS와의 통화에서 ""아직 소청 심사 결과를 정식으로 받아보지 못했고 기각 사유도 정확히 알지 못해 뭐라고 코멘트(논평) 하기가 현시점에서 어렵다""고 밝혔는데 소청 심사 청구가 기각됨에 따라 이에 불복해 행정소송을 제기할지 주목된다.  khn5029@hanmail.net  저작권자 © CBS 노컷뉴스(www.nocutnews.co.kr) 무단전재 및 재배포 금지"
"이낙연 전남지사의 이번주 중국 방문 일정이 중국 측의 요청으로 무기한 연기됐다.  전라남도는 이 지사가 29일(오늘)부터 31일까지 중국 쓰촨성을 방문할 예정이었지만, 지난 26일 쓰촨성 측이 '성장의 일정'을 이유로 부성장과 회담할 것을 요청함에 따라 이번 일정을 취소했다고 밝혔다. 이 지사는 당초 방문 이틀째인 30일 쓰촨성 인리 성장과 회담하기로 실무협의를 통해 합의했었다.  이 지사는 이번 중국 방문 때 쓰촨성에 이어 충칭시도 방문해 황치판 시장과 회담을 준비해왔지만, 충칭시 측도 지난 8일 ""중앙 행사 일정과 겹친다""는 이유로 전남도 측에 이 지사의 방문 연기를 요청했다.  이에 앞서 지난달 26일에는, 8월에 전남을 방문할 예정이던 중국 산시성 리샤오펑 성장이 '인사이동에 따른 해외출장 제한'을 이유로 일정을 취소했고, 중국 장시성은 다음달 전남에서 열릴 예정인 '장시성 주간행사'를 무기한 연기할 것을 전남도에 통보했다.  이 지사는 이와 관련해 ""한국의 사드(고고도 미사일 방어체계·THAAD) 배치 같은 국가 차원의 현안이 영향을 준 것으로 보이지만, 그럼에도 전남도가 겪은 일련의 과정은 몹시 유감스럽다"" 면서 ""이런 상황에서 방문이 서로에게 의미 있는 성과를 내기는 어려울 것으로 판단해 방문 일정을 조정하기로 했다""고 밝혔다.  전남도는 30일부터 이틀 동안 중국 쓰촨성에서 열기로 한 에너지밸리 투자 설명회와 관광설명회는 실무단 차원에서 예정대로 추진할 예정이라고 설명했다.  최혜진기자 (join@kbs.co.kr)  ▶ [저작권자ⓒ KBS 무단복제-재배포 금지]"
"【광주=뉴시스】배상현 기자= 지역경제 활성화를 위한 창조·혁신 순회포럼이 29일 `지역경제가 살아야 나라가 산다'를 주제로 광주에서 열렸다.  광주시와 전남도, 서울신문사 공동주체로 이날 광주 김대중컨벤션센터에서 열린 포럼에는 황교안 국무총리와 윤장현 광주시장, 이낙연 전남지사, 박주선 국회부의장, 이개호 더불어민주당 전남도당위원장 등 정부와 지자체, 기업, 학계 관계자 300여명이 참석했다.  이날 황총리는 축사를 통해 ""정부는 지역경제 활성화를위해 창조경제와 지역경제 간 연계를 강화하는 데 배전의 노력을 기울이고 있다""면서 ""전국의 시·도별로 미래성장을 이끌어갈 수 있는 전략산업에 대해 재정·세제·금융·인력 등을 중점 지원하겠다""고 밝혔다.  이어 ""지역경제가 살아야 나라가 산다. 전국 곳곳에 창조와 혁신의 열기가 널리 확산돼야 한다""면서 ""17개 창조경제혁신센터의 산·학·연 거점 기능을 강화해 일자리 창출과 창업, 스타트업의 해외진출을 지원하겠다""고 말했다.  이날 조봉환 민관합동 창조경제추진단장이 `광주·전남지역 창조경제 추진현황과 활성화 전략'이란 주제로 특별강연을 시작으로 유기호 광주창조경제혁신센터장, 박성호 포항창조경제혁신센터장, 이종열 전남창조경제혁신센터장의 창조경제 성공사례 발표가 있었다.  이어 오일근 광주그린카진흥원장의 `자동차산업과 광주의 도전', 문승일 서울대 전기정보공학부 교수의 `창조경제의 핵심, 에너지 신산업 생태계 구축방안'이란 주제의 발표에 이어, 토론이 이뤄졌다.  광주시 관계자는 ""이번 포럼을 통해 지역별 산업특성에 맞게 중앙정부의 지원과 대기업의 투자를 이끌어낼 효과적인 방안을 마련해 지역 창조경제의 바람을 일으킬도록 노력하겠다""고 말했다.  이번 포럼은 광주·전남을 시작으로 부산, 전북, 대구, 경북, 충청, 강원, 경기, 제주 등에서 순차적으로 개최된다.  praxis@newsis.com"
"【무안=뉴시스】맹대환 기자 = 전남 여수 경도와 돌산을 잇는 연륙교 건설을 검토중이어서 결과에 관심이 모아진다.  29일 전남도에 따르면 도는 미래에셋 컨소시엄이 7500억원 가량을 투자할 예정인 경도해양관광단지에 연륙교를 건설하는 방안을 검토중이다.  연륙교는 돌산과 편도 2차선, 길이 1.9㎞ 규모로 예산은 620억원 가량이 들어갈 것으로 추정된다.  전남도는 굴착공법을 이용하는 해저터널(400~450억원)과 바닷속에 콘크리트 박스를 설치하는 침매터털(500~550억원) 방식도 검토했으나 수심이 얕아 불가능하다고 판단했다.  경도 연륙교는 박현주 미래에셋 회장이 이낙연 전남지사에게 건의한 것으로 알려졌다.  문제는 연륙교 건설 사업비 확보 방안이다. 경도 연륙교는 비법정도로로 국비를 지원받을 수 있는 법적 근거가 없다.  그렇다고 전남도가 지방비를 사용하기도 부담이 큰 상황이다.  전남도는 경도가 경제자유구역으로 편입되면 국비를 지원받을 수 있는 방안을 다각적으로 검토하겠다는 방침이다.  현재 경도는 도선 2대가 관광객과 차량을 실어나르고 있다.  미래에셋 컨소시엄은 골프장과 콘도 등 경도 골프앤리조트 시설과 부지를 3423억원에 일괄 매입했다.  향후 5년간 7500억원을 추가로 투자해 호텔, 빌라, 요트마리나, 워터파크, 해상케이블카 등을 갖춘 복합리조트를 건설할 계획이다.  mdhnews@newsis.com"
"이낙연 전남지사 지시, 총 연장 1.9㎞·사업비 620억원 추산  미래에셋 세계적 휴양지 조성 맞물려 교량 필요성 대두  (무안=연합뉴스) 전승현 기자 = 미래에셋 그룹의 투자를 계기로 세계적 해양관광단지로의 발돋움이 기대되는 전남 여수 경도에 연륙교 건설이 추진된다.  29일 전남도에 따르면 여수 경도와 돌산을 연결하는 편도 2차선, 총연장 1.9㎞(접속도로 구간 포함)의 교량 건설을 추진하기로 했다.  건설에는 총 620억원 투입될 것으로 추산됐다.  교량 건설은 최근 미래에셋의 경도 투자와 맞물려 교량 필요성이 대두한 데 따른 것으로 이낙연 전남지사는 연륙교 건설 등 교통수단을 검토하라고 관련 부서에 지시했다.  지난 10일부터 2박 3일 일정으로 경도골프장을 둘러본 미래에셋 박현주 회장도 경도를 연결하는 교량이 필요하다는 의견을 제시한 것으로 전해졌다.  전남도 관계자는 ""해저터널(굴착공법)과 침매터널(콘크리트 박스를 제작해 바닷속에 앉히는 공법)을 통해 경도를 육지와 연결하는 방안이 사업비(해저터널 530억원·침매터널 440억원)는 교량을 건설하는 것 보다 덜 들지만, 수심이 얕아 현실적으로 건설이 불가능해 교량 건설을 타당한 것으로 보고 있다""고 말했다.  이 관계자는 ""현재 경도를 오가는 도선이 도착하는 잠수기 수협 쪽 육지와 경도를 연결하는 교량도 검토했으나 항로여서 교량 높이가 높아져야 하는 문제가 있다""며 ""구체적인 교량 건설 시점과 사업비 확보는 정해지지 않았다""고 덧붙였다.  앞서 박준영 전남지사 당시 경도를 교량으로 연결하는 방안이 거론됐으나 섬 정체성을 훼손할 수 있고 섬 여행 정취를 느낄 수 있으려면 도선이 필요하다는 의견이 나와 현재까지 도선 2대로 경도를 오가고 있다.  전남개발공사는 2007년부터 현재까지 경도 일대 216만8천㎡ 3천600억원을 들여 골프장(25홀)과 콘도(100실), 기업연수부지, 상업용지 등을 조성했다.  개발공사는 2011년 10월 자회사인 전남관광㈜을 설립, 경도골프장·콘도를 위탁 경영하고 있다.  최근 미래에셋과 영국계 국제 투자회사 캐슬파인즈는 7대3으로 출자해 경도 골프장과 콘도 등을 3천423억원에 일괄 매입하고 앞으로 5년간 7천500억원을 추가 투자해 호텔, 빌라, 요트마리나, 워터파크, 해상케이블카 등을 갖춘 아시아 최고의 명품 복합리조트를 건설하겠다고 밝혔다.  shchon@yna.co.kr"
"[아시아경제 노해섭 기자]29일 광주 김대중컨벤션센터에서 열린 창조 ·혁신 지역순회 포럼에 참석한 황교안 국무총리, 윤장현 광주광역시장, 이낙연 전남도지사가 친환경에너지형 수소차를 살펴보고 있다.  29일 광주 김대중컨벤션센터에서 열린 창조 ·혁신 지역순회 포럼에 참석한 황교안 국무총리, 박주선 국회부의장, 조봉환 민관합동 창조경제추진단장, 이낙연 전남도지사, 윤장현 광주광역시장, 정징행 현대자동차 대표이사, 황은연 포스코 사장 등 내빈들이 기념촬영하고 있다.  사진제공=전남도"
"2년간 활기 ·매력 ·온정 넘치는 전남 홍보 앞장  [아시아경제 노해섭 기자]전라남도의 주요 정책을 홍보하고 지역 여론을 수렴해 도정에 반영토록 하는 도민명예기자 120명이 새롭게 위촉됐다.  전라남도는 9일 도청 왕인실에서 ‘전라남도 도민명예기자 위촉장 수여식’을 개최하고, 무보수 명예직으로 도정 메신저 역할을 수락해준 도민명예기자에게 감사의 뜻을 전했다.  이날 위촉된 도민명예기자는 전남의 22개 시군 주부 100명과 전국 시도 향우 20명이다. 인터넷 공모와 전국 시 ·도 향우회 추천을 통해 선정됐으며, 앞으로 2년간 지역 취재를 통해 ‘전남새뜸(전남 도정소식지)’에 다양한 소식을 전달하고 전남을 홍보하는 역할을 한다.  이낙연 전라남도지사는 위촉식에서 “우리 삶 주변에 있는 이야기들을 아무리 작은 것이라도 크게 봐달라”고 당부했다.  이어 이해인 수녀가 지은 ‘풀꽃의 노러라는 시의 ‘내게도 고운 이름이 있음을 사람들은 모르지만 서운하지 않아’라는 시구를 소개한 후 “우리 주변의 수많은 사람들에게도 고운 이름과 소중한 꿈, 누구에게도 양보하기 싫은 행복이 있다”며 “도민명예기자께서 그 이름을 불러주고, 꿈을 보듬어주고, 행복을 보장해주는 일에 앞장서 달라”고 말했다.  이 지사는 또 일자리 종합대상 및 4년 연속 노인일자리 대상 수상, 관광객 전국 2위, 8년 연속 합계출산율 전국 1위 등 도민과 함께 이룬 성과와, 전남에 생긴 긍정적 변화들을 소개하며 명예기자들의 도정 이해를 도왔다.  전라남도는 또 이날 명예기자들을 대상으로 기사 작성 방법 특강 시간을 마련하고 왕성한 활동을 위한 다양한 활동 요령 등을 설명했다.  도민명예기자는 2000년 주부명예기자로 시작해 도정 전파는 물론 도민들의 생생한 현장 목소리를 도에 전달하고, 지역의 온정 소식을 전남새뜸에 게재하는 등 도와 도민 간 소통 창구로서 가교 역할을 톡톡히 하고 있다는 평가를 받고 있다.  노해섭  기자 nogary@"
"[서울신문]  광주시와 전남도는 자동차와 에너지 분야를 각각 신성장 동력산업으로 선정하고 관련 인프라 구축에 총력을 기울이고 있다. 광주시는 ‘폭스바겐 사태’ 이후 자동차가 내연기관에서 전동 구동방식 또는 수소차 등의 친환경 자동차로 변화하는 세계적 추세에 주목하고 있다. 이를 토대로 친환경 자동차를 지역의 차세대 전략 산업으로 육성한다는 복안이다. 연 50만대 생산 규모의 기아차 광주 공장과 현대차의 창조경제혁신센터 등이 이를 선도해 나갈 것으로 보인다. 여기에 삼성전자도 최근 전기차의 전장 부문에 관심을 보이면서 자동차 관련 제조업의 부흥기를 맞고 있다. 전남도 역시 청정에너지 생산기지로 발돋움하고 있다. 조류와 풍력 등 천혜의 자연조건이 다른 지역과 비교 우위를 점하고 있다. 최근 광주전남 공동혁신도시로 이전한 한국전력과 에너지 밸리 조성사업에 나서는 등 발 빠른 움직임을 보이고 있다. 윤장현 광주시장과 이낙연 전남지사는 “서울신문이 주최하는 이번 제1회 지역경제 활성화 포럼은 각 지방정부가 역점으로 한 신산업을 널리 알리고 중앙정부의 지원과 대기업의 투자에 대한 관심을 이끌어 낼 수 있는 기회라고 생각한다”며 “전문가와 중앙·지방 정부, 정치권, 지역민이 머리를 맞대고 지역 전략산업의 발전 방안을 모색하는 자리가 됐으면 한다”고 말했다.  ■ 윤장현 광주시장 “친환경 자동차 공장 등 조성… 먹거리·청년실업 두토끼 해결”  “전기차·수소차 등 미래형 자동차 산업 육성에 박차를 가하고 있습니다.”  이낙연 전남도지사는 서울신문이 개최하는 ‘지역경제 활성화 포럼’ 제1회 광주전남 포럼을 앞두고 “전남의 발전 잠재력과 새로운 성장 동력을 자세히 알릴 좋은 기회라 무척 기대한다”며 8일 이렇게 말했다. 또 “앞으로 대한민국 경제발전을 책임질 가장 유력한 미래산업은 바로 에너지 신산업이라고 확신한다”고 덧붙였다.  이 도지사는 “지난 반세기 동안 우리나라를 먹여 살려 온 석유화학·철강·조선·해운·자동차 등의 중후장대형 산업들이 비슷한 시기에 연쇄적으로 어려움을 겪고 있다”고 현 상황을 압축적으로 설명하고서 “세계적으로 4차 산업혁명의 바람이 거세게 불고 있고, 한국 경제도 세계 변화의 소용돌이에 이미 들어가 있다”며 단언했다. 그는 “지금은 기존 주력산업의 활로를 찾는 동시에 그 뒤를 이을 새로운 산업을 서둘러 준비해야 할 중대한 시점이다”고 강조했다. 특히 “화석연료가 신재생에너지로 급속히 대체되고 파리 신기후 체제가 출범함에 따라 청정에너지 생산과 전력 절감, 저장기술 등을 요체로 하는 에너지 신산업이 미래 핵심 산업이 됐다”고 말했다.  그는 “전력분야 세계 최고 기업인 한국전력이 2015년 나주 빛가람혁신도시로 이전했고, 전남은 전국 최고 일사량과 전국 해상풍력 잠재량의 60%, 조류에너지의 97%를 차지할 만큼 신재생에너지 자원이 풍부하다”고 전남이 처한 좋은 입지조건과 산업환경을 설명했다. “전남은 국가 에너지산업을 견인할 전략적 요충지가 됐다”고 힘주어 말할 만한 근거이다.  현재 빠른 속도로 진행되고 있는 에너지 밸리를 중심으로 신재생 에너지를 포함한 에너지 신산업을 힘차게 육성해 전남을 대한민국 에너지 신산업 중심지로 만들어간다는 것이 이 도지사의 목표다.  에너지 밸리는 전남과 한전·광주시가 협력해 오는 2020년까지 빛가람 혁신도시 주변에 에너지저장장치(ESS)와 전기차 부품ㆍ소재기업 등 500개 에너지기업을 유치하겠다고 한다. 이는 전남을 넘어 국가 산업지도를 바꾸고 새로운 100년을 열어갈 중대 프로젝트라고 이 도지사는 강조했다. 실제로 2015년 에너지 밸리 조성에 착수한 지 1년 반 만에 133개 기업이 투자를 결정했고, 이 중 70개 기업은 투자를 완료해 목표보다 더 빠른 속도를 보이고 있다. 전남도는 에너지사업 연구개발 지원에도 총력을 기울이고 있다. 에너지밸리를 중심으로 100만평 규모의 ‘에너지기업 중심산단’을 조성하고, 광주연구개발특구를 나주 빛가람 혁신도시까지 확대할 예정이다. 나주 혁신산단으로 입지가 확정된 ‘한전 에너지밸리 R&amp;D센터’ 건립도 적극 지원한다는 계획이다.  농수산업 비중이 전국에서 가장 큰 전남이 올해 고용노동부로부터 ‘일자리종합대상’(대통령상)을 받아 전국 1위에 오를 수 있었던 것도 에너지밸리가 큰 도움이 됐다고 했다.  그는 “정부가 전남의 에너지 신산업에 2019년까지 2770억원을 투자하는 것을 비롯하여 2020년까지 에너지 신산업 분야에 42조원을 투자할 계획”이라며 “앞으로 에너지 밸리 투자실현 기업이 늘어나고 공장 가동이 본격화되면 좋은 일자리가 더 많이 생겨날 것”이라고 자신감을 보였다.  이 도지사는 “오는 2025년까지 흑산도 등 유인도 50개를 탄소 제로 에너지자립섬으로 조성하고, 에너지자립형 스마트팜 모델을 개발·보급할 계획”이라며 “전남이 생활 속에서 에너지 신산업을 널리 활용함으로써 신에너지 공급의 시장이 되겠다”고 포부를 밝혔다.  무안 최종필 기자 choijp@seoul.co.kr  ▶ []  - Copyrights ⓒ서울신문사. 무단 전재 및 재배포 금지 -"
"매각이 추진 중인 전남 여수 경도 해양관광단지의 우선협상대상자 1순위로 금융그룹 ‘미래에셋 컨소시엄’이 선정됐다.  이낙연 전남도지사는 9일 전남도청에서 기자회견을 열고 “전남 서남해안권에 새로운 투자가 이어지게 하는 기폭제가 될 것으로 기대한다”면서 이같은 사실을 공개했다.  미래에셋 컨소시엄은 최근 대우증권을 인수해 국내 금융그룹으로 부상한 미래에셋과 영국계 투자회사 캐슬파인즈(Castlepines)가 7대3으로 출자했다.  이번 입찰에는 3개 국제 컨소시엄이 참여했으나 미래에셋 컨소시엄이 투자신뢰도와 지역경제 활성화 등에서 높은 점수를 받았다.  미래에셋 컨소시엄은 이달 중 외국인투자기업을 설립, 연말까지 전남개발공사와 투자규모, 시설, 대금납부조건 등에 대한 협상을 마무리하고 본계약을 체결할 예정이다.  이번 입찰에서 미래에셋 컨소시엄은 골프장과 콘도 등 경도 골프앤리조트 시설과 부지를 3423억원에 일괄 매입했다.  또 앞으로 5년간 7500억원을 추가로 투자해 호텔, 빌라, 요트마리나, 워터파크, 해상케이블카 등을 갖춘 명품복합리조트를 건설한다는 계획을 세워놓고 있다.  미래에셋 컨소시엄의 1조1000억원 규모의 투자는 그동안 전남에 이뤄진 관광레저 분야에서는 사상 최대라고 전남도는 밝혔다.  전남개발공사가 추진한 경도 해양관광단지는 부지 212만7000㎡에 1단계 사업으로 27홀 골프장, 100실 규모의 콘도와 오토캠핑장 등이 마련돼 있다.  양지문 전남개발공사 사장은 “입찰에 참여한 컨소시엄 중 미래에셋이 난개발과 개발 지연 등의 우려를 불식시키는데 가장 적합한 평가를 받았다”면서 “지난해 정부의 복합리조트 공모 실패 때처럼 자본투자 지연 등의 사태는 염려하지 않아도 된다”고 말했다.  ▶ 경향신문 SNS ), 무단전재 및 재배포 금지"
