"- 문재인정부 두번째 당정청 회동  - G20 성과 소개하는 자리 만들기로  지난달 5일 오전 서울 삼청동 총리공관에서 열린 고위 당정청 회의에서 참석자들과 함께 기념촬영을 하고 있다. 왼쪽부터 더불어민주당 김태년 정책위의장, 우원식 원내대표, 이 총리, 더불어민주당 추미애 대표, 청와대 장하성 정책실장, 전병헌 정무수석(사진=연합뉴스)[이데일리 조진영 기자] 더불어민주당과 정부, 청와대가 추가경정예산과 정부조직개편안의 조속한 처리를 위해 긴밀히 협력하기로 했다. 또한 G20에 참석 중인 문재인 대통령이 돌아오면 G20성과에 대해 야당과 국민에게 설명하는 자리를 만들기로 했다.  당정청은 7일 저녁 서울 종로구 삼청동 총리공관에서 비공개로 만찬 간담회를 열고 이 같은 내용을 논의했다. 간담회에서는 최근 야당의 반대로 국회 문턱을 넘지 못하고 있는 추경안에 대한 논의가 이뤄졌다. 백혜련 민주당 대변인은 간담회 후 서면브리핑을 통해 “야당과 소통하면서 조속한 처리를 위해 최선을 다하기로 했다”고 전했다.  이어 “정부와 청와대는 G20 정상회의로 대통령이 부재인 상황에서 국정에 더욱 집중해야한다고 했다”며 “대통령 귀국 이후 G20 성과에 대해 야당과 국민에게 설명하는 자리를 만들기로 했다”고 알렸다.  이에 대해 추미애 민주당 대표는 “대통령께서 평화통일 원칙을 견지하면서 유연하게 대응한 것을 보며 매우 안심이 됐다”며 “한미 정상회담과 G20정상회의 후속조치가 잘 추진될 수 있도록 정부와 청와대가 노력해달라”고 당부했다.  당정청은 지난 4일 북한의 미사일 발사에 대해 문 대통령이 즉시 한미 미사일 연합훈련을 지시한 것은 매우 시의적절하다고 평가했다. 백 대변인은 “북한의 위험한 도발에 대해 향후 상황을 면밀히 주시해서 필요한 조치를 건의하기로 했다”고 말했다.  김태년 민주당 정책위의장은 “국정기획자문위원회에서 만든 국정과제를 정부와 청와대가 잘 이행할 수 있도록 노력해달라”고 당부했다.  문재인정부 들어 두번째로 열린 당정청 회동은 오후 6시 40분부터 3시간 가량 진행됐다. 더불어민주당에서는 추미애 대표·우원식 원내대표·이춘석 사무총장·김태년 정책위의장·백혜련 대변인이 참석했다. 정부에선 이낙연 국무총리·홍남기 국무조정실장이, 청와대에선 임종석 대통령비서실장·장하성 정책실장·전병헌 정무수석비서관이 참석했다.  조진영 (listen@edaily.co.kr)  ＜ⓒ종합 경제정보 미디어 이데일리 - 무단전재 &amp; 재배포 금지＞"
"정국 상황 공유하고 해법 논의, ""뾰족한 수는 못찾아""  [CBS노컷뉴스 조은정 기자]이낙연 국무총리와 추미애 더불어민주당 대표, 임종석 대통령 비서실장 등 당정청 수장들이 7일 비공개 만찬을 갖고 현안을 논의하고 국회 파행과 관련해 해법을 찾기 위해 토론을 벌였다.  추 대표의 '머리자르기' 발언으로 국민의당이 국회를 전면 보이콧하면서 추경안 통과에도 빨간불이 켜진 가운데, 이날 꽉 막힌 정국을 풀기 위해 심도있는 대화가 오간 것으로 알려졌다.  서울 삼청동 총리실 공관에서 진행된 고위 당정청 만찬은 이날 오후 6시40분에 시작해 9시30분이 돼서야 끝났다.  문재인 대통령이 해외 순방중인 가운데 청와대에서는 임종석 비서실장과 장하성 정책실장, 전병헌 정무수석이 참석했고, 정부에서는 이 총리와 홍남기 국무조정 실장, 배재정 비서실장이 배석했다. 민주당에서는 추 대표와 우원식 원내대표, 김태년 정책위의장, 이춘석 사무총장, 백혜련 대변인이 참석했다.  약 3시간에 걸친 만찬 회동에서 참석자들은 정국 상황을 냉정하게 분석하며 해법을 진지하게 논의한 것으로 알려졌다.  백혜련 당 대변인은 통화에서 ""국민의당이 강경하게 보이콧을 하는 상황과 함께, 국민의당을 포함해 자유한국당, 바른정당의 상황에 대해서 서로 공유했다""며 ""추경과 정부조직법 통과에 대해 어떻게 풀어가야 하는지 포괄적으로 얘기가 나왔다""고 설명했다.  특히 우원식 원내대표는 한국당, 국민의당, 바른정당이 각각 다른 입장으로 국회를 보이콧하고 있다는 점을 설명하며 당별로 사정에 맞게 전략을 달리해 접근해야 한다고 강조한 것으로 알려졌다.  각 당의 상황에 맞는 '명분'을 제공해 야당이 국회에 협조하도록 이끌어야 한다는 것이다.  특히, 추 대표의 '머리자르기' 발언에 대한 직접적인 언급이나 지적은 없었지만, 국민의당을 물밑에서 적극 설득해 추경에 협조하게 해야 한다는 데에는 대다수 참석자들이 공감한 것으로 전해졌다.  하지만 긴 토론에서도 국회 정상화를 위한 뾰족한 대책은 나오지 않았으며, 서로 인식을 공유하는데 그친 것으로 알려졌다.  한 참석자는 ""토론을 한들 뾰족한 수가 없는 것이 현실""이라며 ""여소야대 국면에서 국회의 어려운 상황을 얘기하고 대화를 주고받는 자리였다""고 설명했다.  백 대변인은 공식 논평을 통해서 ""추경 및 정부조직개편안 등 주요 현안 관련 당정청의 긴밀한 협력과 더불어 야당과 소통하면서 조속 처리를 위해 최선을 다하기로 했다""고 강조했다.  또한 당정청은 대통령 귀국 후 한미정상회담과 G20정상회담의 성과를 국민에게 설명하는 자리를 만들고, 후속조치를 적극 추진하기로 했다.  백 대변인은 ""추미애 대표는 '대통령께서 평화통일 원칙을 견지하면서 유연하게 대응한 것을 보며 매우 안심이 됐으며, 한미정상회담과 G20정상회의의 후속조치가 잘 추진될 수 있도록 정부와 청와대가 노력해달라’고 당부했다""고 전했다.  아울러 ""참석자 모두 북한의 미사일 도발에 대통령이 즉시 한미 미사일 연합 훈련을 지시한 것은 매우 시의적절했다고 평가했으며, 북한의 위험한 도발에 대해 향후 상황을 면밀히 주시해서 필요한 조치를 건의하기로 했다""고 밝혔다.  aori@cbs.co.kr  저작권자 © CBS 노컷뉴스(www.nocutnews.co.kr) 무단전재 및 재배포 금지"
"한편 추 대표 발언으로 국회 보이콧을 선언하긴 했지만, 벌써부터 국민의당 내부에선 정부여당과 정면으로 각을 세우는 상황에 대한 부담감도 느껴진다.  당장 추 대표가 사퇴와 사과를 거부할 경우 언제까지 보수야당과 발을 맞추며 국회를 보이콧할지, 보이콧 정국을 마무리 지을 만한 마땅한 출구전략이 무엇인지에 대한 우려가 나온다.  일각에선 민주당이 일정선의 유감표명을 한 뒤 송영무·조대엽 후보자 중 한 명 정도는 양보하는 수준에서 국회 정상화 합의가 이뤄질 거라는 분석도 나오는 상황이다.  김 원내대표는 그러나 ""국정운영은 여야에게 똑같이 책임이 있지만, 여당은 무한책임이 있는 데 반해 야당은 약간의 책임이 있을 뿐""이라고 일단은 보이콧 기조를 이어간다는 방침을 확인했다."
"[아시아경제 오현길 기자] 이낙연 국무총리는 7일 ""남성이 가사를 훨씬 더많이 분담해야 한다. 남성의 육아휴직을 활성화하도록 정부 각 부처와 지자체는 물론 민간기업도 함께 노력해달라""고 당부했다.  이 총리는 이날 서울 용산구 백범김구기념관에서 열린 양성평등주간 기념식에서 축사하면서 이같이 밝혔다.  이 총리는 ""문재인 정부는 성평등을 국정의 핵심에 두고 있다. 그래서 성평등위원회를 대통령 직속으로 설치하기로 했다""며 ""정부는 경제사회활동에서 실재하는 성차별을 없애고 취업과 임금, 승진에서 부당한 차별이 없어지도록 노력하겠다""고 약속했다.  그는 ""민간기업의 여성임원 비율이 늘도록 유도하고, 공공부문에서 유리천장을 깨기 시작해 사회 모든 분야로 확산해 나가겠다""고 덧붙였다.  남성의 가사분담 확대가 절실하고 여성들이 사회경험을 더 많이 쌓아야 한다고 주문했다.  이 총리는 ""여성이 학교 교육을 남성보다 더 많이 받는다고 하더라도 사회적 경험이 부족한 것은 사실""이라며 ""여성들께 다양한 사회적 경험의 기회를 드리도록 정부와 지자체와 민간이 함께 노력하겠다""고 말했다.  이 총리는 ""2009년 한국 여학생의 대학진학률이 남학생을 앞지르더니 계속 격차가 벌어져 세계사에 특기할만한 사건이 됐다""고 말했다.  또 학교 반장과 전교회장을 여학생이 휩쓸고 일반대학과 사관학교에 이르기까지 여학생이 수석으로 졸업하는 일이 흔해졌다면서 '여성의 눈부신 도약'을 전했다.  여성합격률이 사법고시 ·행정고시는 절반, 외부고시는 70% 안팎이고, 신규 공무원의 거의 절반이 여성이라는 점도 덧붙였다. 문재인 정부는 역대 정부 가운데 여성장관을 가장 많이 발탁했다.  그러나 이 총리는 아직도 과제가 많다고 봤다. 그는 ""우수한 성적으로 대학을 졸업해도 여성들은 대기업 입사에서 보이지 않는 성차별을 느꼈다고 호소하고, 결혼과 출산 등으로 불이익과 경력단절의 손해를 감당해야 한다""고 지적했다.  이 총리는 ""세상은 매우 빠르게 변하고 있고 앞으로는 더 그럴 것이다. 할머니와 어머니 세대의 좌절이 딸과 손녀의 세대에게는 이어지지 않을 것""이라며 ""여성이라는 이유로 손해를 보는 일은 우리 세대로 끝나야 한다""고 힘줘 말했다.  오현길 기자 ohk0414@asiae.co.kr"
"【서울=뉴시스】이현주 기자 = 당정청은 7일 ""추경 및 정부조직개편안 등 주요 현안 관련 당정청의 긴밀한 협력과 더불어 야당과 소통하면서 조속 처리를 위해 최선을 다하기로 했다""고 밝혔다.  백혜련 더불어민주당 대변인은 이날 서면 브리핑을 통해 ""오늘 당정청 만찬 간담회에서 향후 당정청이 수시로 현안을 논의하면서 긴밀한 협력을 하기로 했다""며 이같이 말했다.  백 대변인은 ""정부와 청와대는 G20 정상회의로 대통령이 부재인 상황에서 국정에 더욱 집중해야 하며, 대통령 귀국 후 G20의 성과에 대해 야당과 국민에게 설명하는 자리를 만들기로 했다""고 밝혔다.  그는 ""추미애 대표는 '대통령께서 평화통일 원칙을 견지하면서 유연하게 대응한 것을 보며 매우 안심이 됐으며 한미정상회담과 G20정상회의의 후속조치가 잘 추진될 수 있도록 정부와 청와대가 노력해달라'고 당부했다""고 전했다.  백 대변인은 ""참석자 모두 북한의 미사일 도발에 대통령이 즉시 한미 미사일 연합 훈련을 지시한 것은 매우 시의적절했다고 평가했으며, 북한의 위험한 도발에 대해 향후 상황을 면밀히 주시해서 필요한 조치를 건의하기로 했다""고 강조했다.  그는 ""김태년 정책위의장은 국정기획자문위원에서 만든 국정과제를 정부와 청와대가 잘 이행할 수 있도록 노력해달라고 당부했다""며 ""오늘 참석자 모두 앞으로 자주 보고 소통하기로 했으며 현 시국의 엄중함을 인식하고 다방면의 노력을 기울이기로 했다""고 덧붙였다.  이날 당정청 만찬 간담회에는 당에서는 추미애 대표, 우원식 원내대표, 김태년 정책위의장, 이춘석 사무총장, 백혜련 대변인이 참석했다. 정부에서는 이낙연 국무총리, 홍남기 국무조정실장, 배재정 비서실장, 청와대에서는 임종석 비서실장, 장하성 정책실장, 전병헌 정무수석이 참석했다.  lovelypsyche@newsis.com"
"더불어민주당 추미애 대표가 지난 3일 국회에서 열린 최고위원회의에서 발언하고 있다. 사진=연합뉴스 제공[이데일리 이준기 조진영 기자] 추미애 더불어민주당 대표와 이낙연 국무총리, 임종석 대통령비서실장 등 당정청 수장들이 7일 만찬 회동을 하고 추 대표의 이른바 ‘머리 자르기’ 발언으로 꽉 얼어붙은 대치 정국을 깨트릴 해법 찾기에 나선다. 추가경정예산안(추경안) 처리 등 주요 정국현안 모두 야권의 도움 없이는 한 발짝도 앞으로 나아갈 수 없는 탓이다.  민주당과 총리실, 청와대는 이날 저녁 서울 삼청동 총리공관에서 고위 당·정·청 만찬을 한다고 전했다. 이 자리에는 당에서 추 대표와 우원식 원내대표, 이춘석 사무총장, 김태년 정책위의장이, 정부에서 이 총리와 홍남기 국무조정실장, 배재정 총리비서실장이, 청와대에선 임 비서실장과 장하성 정책실장, 전병헌 정무수석이 각각 참석한다.  지난달 5일 총리공관에서 열린 첫 고위 당·정·청 회의가 일종의 ‘상견례’ 자리였다면 이날 만찬은 주요 정국현안을 놓고 실질적인 협력방안을 모색하는 자리가 될 것이라는 게 여권과 정부 관계자들의 전언이다. 당시 이 총리는 “문재인정부는 촛불 민심으로 만들어진 정부로, 국민을 위한 정치를 하자”고 제안했고, 참석자들은 “당·정·청이 잘 협력해 문재인정부의 정책 어젠다를 성공시키고 국민을 행복하게 만드는 정치를 하자”고 화답한 것으로 알려졌다.  그러나 지금은 추경안 및 정부조직법 개정안 처리와 송영무 국방부·조대엽 고용노동부 장관 후보자 임명, 북한의 대륙간탄도미사일(ICMB) 발사 도발 등 당면과제가 수두룩하다. 이 와중에 추 대표의 ‘머리자르기’ 발언으로 전날(6일) 예정됐던 이 총리와 국민의당 지도부 간 만찬이 불발돼는 등 경색된 정국은 악화 일로를 걷고 있다. 야권의 한 관계자는 “국민의당은 그간 다른 야당들과 달리 여당에 비교적 협조하는 스탠스를 취해왔다는 점에서 더 격앙된 분위기”라며 “이날 만찬에서 올바른 정국 해법이 마련되길 기대한다”고 말했다.  한편 이 총리는 지난달 29일 민주당 원내지도부를 시작으로 여야 정치권과의 ‘만찬 정치’를 이어가고 있다. 이튿날인 30일에는 야당 중 처음으로 이혜훈 대표 등 바른정당 지도부와 만찬 회동을 하고 ‘협치’(協治)를 다짐했다. 홍준표 대표 체제로 전환된 자유한국당 지도부에게도 저녁을 대접하기로 하고 이달 말쯤으로 날짜를 잡았다고 한다. 이 총리 부인 김숙희 여사도 지난달 29일 국민의당 의원 부인들과 오찬을 함께한 바 있다.  이준기 (jeke1@edaily.co.kr)  ＜ⓒ종합 경제정보 미디어 이데일리 - 무단전재 &amp; 재배포 금지＞"
"이낙연 국무총리는 ""우리 사회는 양성평등을 지체하게 하는 여러 문제를 최대한 빨리 해결해 가야 한다""며 ""문재인 정부는 성평등을 국정의 핵심에 두고 있다""고 밝혔다.  이 총리는 7일 오후 서울 용산구 백범김구기념관에서 열린 '2017년 양성평등주간 기념행사'에서 ""그래서 성평등위원회를 대통령 직속으로 설치하기로 했다""며 이같이 말했다.  이어 ""이미 우리 사회 곳곳에서 여성들의 도약은 눈부시다""며 ""신규 공무원 가운데 거의 절반이 여성이고 문재인정부에서는 역대정부 가운데 여성 장관을 가장 많이 발탁했다""고 설명했다.  그는 ""분명히 여성의 지위는 크게 올랐고 활동 무대도 넓어졌지만, 아직도 과제는 많다""며 ""여성들은 대기업 입사에서 보이지 않는 성차별을 느꼈다고 호소하고 이후에도 결혼과 출산 등으로 불이익을 받고 경력단절의 손해를 감당한다""고 했다.  이 총리는 또 ""취업과 임금과 승진에서 부당한 차별이 없어지도록 노력하겠다""며 ""민간기업의 여성임원 비율도 늘어나도록 유도하고 공공부문에서 유리천장을 깨기 시작해 사회의 전 분야로 확산하겠다""고 강조했다.  그는 아울러 ""할머니와 어머니 세대의 좌절이 딸과 손녀의 세대에게는 이어지지 않을 것""이라며 ""여성이라는 이유로 손해를 보는 일은 우리 세대로 끝나야 한다. 그렇게 되도록 함께 노력하자""고 덧붙였다.  [디지털뉴스국 길나영 인턴기자]  [ⓒ 매일경제 &amp; mk.co.kr, 무단전재 및 재배포 금지]"
"이낙연 국무총리가 7일 서울 용산구 백범김구기념관에서 열린 ‘2017 양성평등주간 기념식’에 참석해 인사말을 하고 있다.  ‘함께하는 성평등, 모두가 행복한 대한민국!’을 주제로 열린 이날 행사에서 성평등 문화 확산에 기여해 온 유공자 63명에게 훈·포장 등 표창이 수여됐다.  이정실 여성신문 사진기자 (atgetjr@womennews.co.kr)"
"【서울=뉴시스】박진희 기자 = 이낙연 국무총리는 7일 오후 서울 용산구 효창동 작은도서관(효창동 주민센터)을 방문하여 주민들과 기념 사진을 찍고 있다. 2017.07.07.  pak7130@newsis.com  [사진 영상 제보받습니다] 공감언론 뉴시스가 독자 여러분의 소중한 제보를 기다립니다. 뉴스 가치나 화제성이 있다고 판단되는 사진 또는 영상을 뉴시스 사진영상부(n-photo@newsis.com, 02-721-7470)로 보내주시면 적극 반영하겠습니다."
"北미사일 도발 면밀 주시…필요한 조치 건의 방침  (서울=뉴스1) 성도현 기자 = 더불어민주당과 정부, 청와대는 7일 추가경정예산안(추경)과 정부조직개편안 등과 관련해 긴밀히 협력하면서 야당과도 소통해 조속히 추경 등을 처리하는데 최선을 다하기로 했다.  백혜련 민주당 대변인에 따르면 당정청은 앞으로 수시로 현안을 논의한다. 또 정부·청와대는 문재인 대통령 귀국후 주요 20개국(G20) 성과를 야당과 국민에게 설명하는 자리를 갖기로 합의했다.  추미애 대표는 ""대통령이 평화통일 원칙을 견지하며 유연하게 대응한 것을 보며 매우 안심됐다, 한미정상회담과 G20 정상회의 후속조치가 잘 추진될 수 있도록 정부와 청와대가 노력해 달라""고 말했다.  김태년 정책위의장은 국정기획자문위에서 만든 국정과제를 정부와 청와대가 잘 이행할 수 있도록 노력해 달라고 당부했다.  참석자들은 북한의 미사일 도발에 대통령이 즉시 한미 미사일 연합 훈련을 지시한 것에 대해 매우 시의적절했다고 평가했다.  또 북한의 위험한 도발에 대해 향후 상황을 면밀히 주시해 필요한 조치를 건의하기로 의견을 모았다.  당정청 회동은 문재 인정부 들어 이번이 두 번째다. 민주당 측은 추 대표와 우원식 원내대표, 김 정책위의장, 이춘석 사무총장, 백 대변인이 참석했다.  정부에서는 이낙연 국무총리와 홍남기 국무조정실장, 배재정 비서실장이 자리했고 청와대에서는 임종석 비서실장과 장하성 정책실장, 전병헌 정무수석이 참석했다.  당정청은 지난달 5일 열린 첫 고위 당정청 회의에서는 정부조직개편안과 추경 처리를 위해 야당과 협치가 필수적이라는 데 공감하고 서로간 유기적인 소통과 대화를 다짐했다.  이날 만찬에서는 국민의당이 추 대표의 '머리 자르기' 발언에 거세게 반발해 국회 의사일정을 보이콧한 것과 관련한 대책 등도 논의된 것으로 전해졌다.  dhspeople@news1.kr  ), 무단 전재 및 재배포 금지]"
"문재인 정부, 성평등 국정 핵심 두고 노력…성평등위 설치  양성평등주간 기념 성평등 진흥 유공자 63명 표창 수여  경단녀(경력단절여성)·육아휴직 등 성차별 문제가 여전한 가운데, 정부가 성평등위원회를 설치해 경제사회활동에서의 성차별 문제를 적극 해결해나가겠다고 밝혔다.  이낙연 국무총리는 7일 백범김구기념관에서 열린 '2017 양성평등주간 기념행사'에서 축사를 통해 ""문재인 정부는 성평등을 국정의 핵심에 두고 있다""며 ""대통령 직속 성평등위원회를 설치해 경제사회활동에서 실재하는 성차별을 없애가겠다""고 밝혔다.  총리는 ""취업과 임금, 승진에서 부당한 차별이 없어지도록 노력할 것이고, 민간기업의 여성임원 비율이 늘어나도록 유도해 갈 것""이라며 ""공공부문에서 유리천장을 깨기 시작해 그것을 사회의 모든 분야로 확산해 가겠다""고 공언했다.  이어 이를 위해서는 △남성 육아휴직 장려 △여성 사회경력 확대 등이 우선돼야 한다고 강조했다.  총리는 ""남성의 육아휴직을 활성화하도록 정부 각 부처와 지방자치단체는 물론 민간기업도 함께 노력해야 한다""며 ""이와 함께 정부는 국공립 어린이집을 확대하고, 보육의 질을 높여가도록 계속해서 노력할 것""이라고 밝혔다.  또한 ""여성들이 학교 교육을 남성보다 더 많이 받는다고 하더라도 사회적 경험이 부족한 것이 사실""이라며 ""여성들께 다양한 사회적 경험의 기회를 드리도록 정부와 지자체, 민간이 함께 노력해야 한다""고 당부했다.  한편, 여성가족부는 양성평등주간을 맞아 성평등 진흥 유공자 63명에 표창을 수여했다. 여기에는 '여성폭력 원스톱(one-stop) 대응시스템'을 구축한 양수옥 여성전화 1366 경북센터장과 여성일자리 창출에 기여해 온 김영남 종로여성인력개발센터 관장, 지역사회 성평등 문화 확산에 기여해온 원경숙 경남 통영시 여성회관 관장 등이 선정됐다.  데일리안 박진여 기자  ⓒ (주)데일리안 - 무단전재, 변형, 무단배포 금지"
