"[헤럴드경제(무안)=박대성기자] 전라남도(지사 이낙연)는 ‘서민 빚 탕감프로젝트’의 일환으로 시장상인과 기초생활수급자, 주부 등 생계형 채무자 413명에 짖눌려 진 대출금 50억 원을 소각했다고 7일 밝혔다.  전남도와 금융복지상담센터에 따르면 이번 소각행사는 전라남도가 서민시책 일환으로 지난해 하반기부터 역점적으로 추진하고 있는 ‘서민 빚 100억 탕감 프로젝트’의 첫 결실이다.  이번에 소각된 50억 원의 채권은 전남지역 신협과 새마을금고에서 기부한 채권으로 1인당 평균 채무 원금은 560만 원, 이자는 653만 원으로 담보능력이 없어 신용대출을 받은 채무금이다.  소각 대상 채권들은 원금 1000만 원 이하의 생계형 소액채무로 파산.실직.질병 등의 사유로 더 이상 갚을 능력이 없다고 판단되는 재산이 없는 서민들의 채무가 대상이다.  이날 소각으로 그동안 빚을 갚지 못해 채무불이행자로 분류돼 금융 거래 등 경제활동에 많은 제약을 받았던 413명의 도민들이 새 희망을 갖고 새롭게 출발하는 기회를 갖게 됐다.  이낙연 전남도지사의 공약으로 지난해 5월 개소한 전남금융복지상담센터는 지금까지 3166명에 달하는 서민들의 대출문제를 상담해 왔다.  상담자 대부분은 자녀 학비, 병원비, 최저 생계유지를 위해 빚을 지게 되고, 이를 감당하지 못해 채무불이행자가 된 것으로 분석됐다.  앞서 전라남도는 지난해 2월 ‘주빌리은행’과 업무협약을 체결해 서민 생계형 빚 탕감시책을 추진하고, 연말 쯤에는 참여를 희망한 신협, 상인회, 여성벤처협회, 도자기협회 등과 성금 모금 및 부실채권 기부를 위한 협약을 맺어 이 운동을 추진해 왔다.  이낙연 도지사는 인사말을 통해 “우리나라 가계의 60%가 빚을 지고 있고, 더욱이 경제력이 있는 사람은 좋은 조건의 대출을 받고 가난할수록 조건이 나쁜 대출을 받는 부조리한 일이 벌어지고 있다”며 “OECD 국가 중에서 자살률이 가장 높은 우리나라는 6명 중 1명이 빚 때문에 자살하고 있고, 이는 채무자 스스로 돈을 벌어 빚을 갚는 것이 쉽지 않기 때문”이라고 지적했다.  이 지사는 이어 “도덕적 해이가 없는 범위 내에서 1년에 2회 정도 빚 소각을 지속적으로 확대, 추진할 계획이므로 각급 사회단체, 종교단체 등에서도 적극 동참해주길 바란다”고 당부했다.  parkds@heraldcorp.com  - Copyrights ⓒ 헤럴드경제 &amp; heraldbiz.com, 무단 전재 및 재배포 금지 -"
"【진도=뉴시스】박상수 기자 = 세월호 참사 3주기를 맞아 전남 진도 팽목항에서 희생자들의 넋을 기리는 추모행사가 열린다.  진도군은 오는 16일 오전 9시30분부터 임회면 팽목항 일원에서 '세월호 사고 3주기 추모행사'를 개최한다고 7일 밝혔다.  추모행사는 참석자들의 분향소 헌화와 희생자 가족들과의 티타임 등의 식전행사와 추모식, 부대행사 등으로 구분해 펼쳐진다.  추모식은 개식선언과 국민의례, 추모영상, 추모사, 추모인사, 희생자 가족의 추모답사, 편지나 시 낭송, 추모 풍선 날리기 등의 순으로 진행된다.  부대행사로는 희생자들의 넋을 달래는 금비예술단의 '진혼무'와 씻김굿보존회의 '씻김굿' 등이 펼쳐진다.  또 방파제와 팽목항 무대에서는 진도불교사업연합회와 원불교광주전남교구, 천주교광주대교구가 주관하는 추모법회와 미사가 이어진다.  한편 이 날 추모행사에는 이낙연 전남도지사와 이동진 진도군수, 윤영일 국회의원, 유가족, 주민, 자원봉사자 등 1500여명이 참석할 예정이다.  parkss@newsis.com"
"6일부터 4일간 다채로운 컨텐츠와 볼거리 제공  [김대원 기자(=영암)]  전라남도와 영암군이 공동 주최하는 ‘제6회 대한민국 한옥건축박람회’가 6일 전남 영암군 군서면 목재문화체험장 일원에서 열렸다.  특히 주체측이 손꼽는 행사로는 전통혼례공연극“가례”, KBS합창단“오쏭즈”와 조정래 작가가 협연하는 명사초청 토크콘서트, 개그맨 강성범과 함께하는“한·통·속”, 그 밖에 전통놀이마당 ‘한마당’과 캐리커쳐 드로잉쇼 등이 선보일 예정이다.  김대원 기자(=영암) ( 무단전재 및 재배포금지  기사제보 jebo.pressian.com"
"[아시아경제 노해섭 기자]전라남도와 영암군이 공동 주최하는 제6회 대한민국 한옥건축박람회가  6일 전남 영암군 군서면 목재문화체험장 일원에서 성대하게 열렸다.  영암 왕인문화축제와 같은 시기에 개최하는 박람회는 주말쯤 만개할 것으로 보이는 봄의 전령사 벚꽃과 함께 한옥의 운치와 미래를 선보이는 무대가 될 것이다.  이 날 개막식에서 “아퀴타다”퓨전타악 공연이 흥겨운 분위기를 고조시키고, 천득염 조직위원장의 개막선언과 함께 이낙연 전라남도지사와 전동평 영암군수를 비롯한 여러 귀빈들의 환영사가 있었다.  금년 박람회는 ‘미래 건강주거, 한옥4.0’이라는 주제 아래 미래지향적인 소통형 주거문화를 제시하는 주제관과 한옥건축관, 한옥자재관, 한옥인테리어관으로 구성된 참여업체 부스, 관람객 모두가 즐길 수 있는 전통 체험 및 오락 프로그램을 신설하는 등 다양한 볼거리를 제공하고 흥미를 유발하는 콘텐츠를 전시하고 있다.  특히, 눈 여겨 보실 행사로는 전통혼례공연극“가례”, KBS합창단“오쏭즈”와 조정래 작가가 협연하는 명사초청 토크콘서트, 개그맨 강성범과 함께하는“한 ·통 ·속”, 그 밖에 전통놀이마당 ‘한마당’과 캐리커쳐 드로잉쇼 등이 신명나게 펼쳐질 예정이다.  노해섭  기자 nogary@"
이낙연 도지사는 △투자유치를 통한 일자리 창출 △17년 만에 제조업 종사자 10만 명 회복 △나주 빛가람혁신도시 ‘에너지밸리’조성 등 지역 특성을 살린 경제 활성화 성과를 높이 평가받았다.  또한 전방위적인 국고 확보 노력으로 △호남선 KTX 2단계 추진 △남해안철도 공사 재개 등 지역의 장기 현안사업 해결과 △100원 택시 △전국 최초 공공산후조리원 운영 등 차별화된 전남형 복지시책이 좋은 평가를 받았다.  이 지사는 최근 여론조사 전문기관(리얼미터)에서 실시한 ‘전국 시 ·도지사 직무수행 평갗에서도 전국 2위를 차지하는 등 도정 수행능력과 리더십 평가에서 줄곧 상위권을 유지하고 있다.  이 지사는 “이토록 영광스런 상을 주신 것은 앞으로 잘 하라는 뜻이라고 알고 더욱 좋은 행정을 펴겠다”고 말했다.  노해섭  기자 nogary@
"6~8일 수도권 향우 대상 시군과 함께 집중 홍보  [아시아경제 노해섭 기자]전라남도가 8일까지 3일간 서울 광화문광장에서 열리는 '2017광주 ·전남 귀농귀촌 박람회’에서 유치 ·홍보 활동을 펼친다.  이번 박람회는 수도권 향우회 등 500만 향우가 참여할 것으로 보인다. 은퇴하는 도시민과, 특히 최근 급증하는 귀농귀촌 희망자에게 광주 ·전남의 귀농귀촌 정보를 안내해 한분이라도 더 유치하기 위해 재경광주전남향우회 등이 공동으로 주최했다.  특히 전라남도와 22개 시군 전체가 함께 참가하는 박람회로 시군별로 귀농귀촌 지원정책, 영농 여건 등을 소개하고, 귀농인이 직접 재배한 농산물과 지역의 대표 농특산물을 전시 ·홍보하는 등 도와 시군이 한마음 한뜻으로 귀농귀촌인 유치 ·홍보에 총력을 기울이고 있다.  김대화 재경광주전남향우회장은 “내고향 전남이 ‘귀농귀촌 최적지’임을 적극 홍보해 인구 감소와 고령화로 침체된 고향의 활력 증진에 앞장서기 위해 박람회를 준비했다”며 “귀농귀촌을 희망하는 향우회원의 참여와 도시민이 함께 참여하기 운동으로 수도권 도시민의 참여를 향우회 차원에서 적극 유도하고, 이 행사를 계기로 광주 ·전남이 살기 좋은 우리의 고향으로 거듭 나기를 기대한다”고 말했다.  이낙연 도지사는 “전남은 친환경농업 인증 면적이 전국의 50%를 넘고 최근 농가 소득 증가율이 전국 평균의 2배 가량 높은 편이며, 수산물 생산량도 전국의 52%를 차지하고 있다”며 “이 때문에 지난해 8천여 명이 전남에 귀농 ·귀촌해왔고, 특히 30대 이하 귀농 ·귀촌자는 전국에서 제일 많은 편”이라고 소개했다.  이어 “한국인 가운데 딱 1명만 세계적 위업을 달성한 사람은 유엔사무총장을 지낸 반기문 씨, 노벨상평화상을 수상한 김대중 대통령, 우주 비행을 한 이소연 박사, 바둑에서 알파고에 한 판이라도 이겨본 이세돌 국수, 세계 메이저 골프대회 최소타 기록을 가진 전인지 선수 등을 꼽을 수 있다”며 “이들 중 반기문 전 총장을 빼고는 모두가 전남의 농축수산물을 섭취하고 성장했다는 점을 감안해 공기 맑고 살기 좋은 광주전남으로 옮겨 사는 길을 생각해보길 바란다”고 말했다.  노해섭  기자 nogary@"
"[이데일리 이순용 기자]  화순전남대병원(김형준 원장)과 전라남도문화관광재단(이사장 이낙연 전남도지사)은 최근 의료·웰니스 사업 활성화를 위한 업무협약(MOU)를 맺었다.  이날 협약식에는 전남문화관광재단 오영상 사무처장, 강미정 전남도 보건의료과 의료관리팀장 등이 참석, 상호협력을 다짐했다. 전남 의료관광클러스터 조성사업의 일환으로 추진된 이번 협약을 계기로 양기관은 의료·웰니스관광객 유치 공동마케팅과 관련상품 개발, 전문인력 양성 등에 힘을 모으기로 했다.  전남문화관광재단은 지난해 8월 전남도로부터 의료관광클러스터 조성사업을 위탁받아 추진중이다. 중국·몽골 등지에서 현지설명회 개최, 의료기관·여행사 대상 팸투어 진행, 의료통역 인력 양성교육 등 다양한 사업을 펼치고 있다.  ‘아시아를 대표하는 암특화병원’으로 평가받고 있는 화순전남대병원은 수년전부터 해외 네트워크를 확대하고 외국인 환자를 유치하는 데 앞장서왔다. 지난 2010년과 2013년 국제 인증으로 입증된 글로벌 수준의 환자안전과 뛰어난 암치료역량, 쾌적한 전원도시 속의 치유환경 등으로 주목받고 있다.  김형준 병원장은 “광주·전남의 경우 수도권과 영남권에 비해 아직 의료관광 불모지나 다름없다”며 “유기적인 협력을 통해 그동안 타지역으로 향했던  해외환자와 관광객들의 발길을 끌어오는 계기가 되길 기대한다”고 밝혔다.  오영상 사무처장은 “글로벌 경쟁력을 갖춘 지역의 대표적인 의료기관과 손을 맞잡게 돼 든든하다”며 “천혜의 자연환경과 우수한 의료진이 풍부한 전남이 의료·웰니스 메카로 거듭날 수 있도록 더욱 노력하겠다”고 화답했다.  한편 웰니스는 웰빙·행복·건강의 합성어이며, 의료관광은 환자와 가족들이 자신들의 부담으로 해당국가를 방문해 치료받고 관광도 하는 것을 말한다. 제품 수출에 비해 파생되는 외화수입이 훨씬 커 태국,싱가포르,인도,대만,일본 등 아시아 각국마다 관련시장 개척에 적극 나서고 있다.  화순전남대병원과 전남도문화관광재단이 의료·웰니스관광 활성화를 위해 상호협력을 다짐하는 MOU를 체결했다.  이순용 (sylee@edaily.co.kr)  ＜ⓒ종합 경제정보 미디어 이데일리 - 무단전재 &amp; 재배포 금지＞"
"리얼미터 3월 조사서 긍정평가 60.1%  [아시아경제 노해섭 기자]이낙연 전남지사가 3월중 리얼미터 월간 정례 광역자치단체장 평가에서 전달에 이어 2개월 연속 2위를 차지했다.  여론조사기관인 리얼미터에 따르면 이 지사에 대한 긍정평가는 60.1%로 전월(59.1%)에 비해 1.0%p 상승, 안희정 충남지사(82.0%)에 이어 광역단체장 2위를 기록했다.  이어 김기현 울산시장(56.6%), 김관용 경북지사(56.5%), 최문순 강원지사(55.5%) 등이 상위권에 올랐다.  긍정평가가 가장 낮은 시도지사 최하위 3인은 서병수 부산시장(32.2%), 윤장현 광주시장(35.6%), 유정복 인천시장(36.0%)순으로 각각 집계됐다.  권역별로 보면 수도권에서 박원순 서울시장(51.2%)이 1위를 기록했고 남경필 경기지사와 유정복 인천시장이 그 뒤를 이었다.  충청권에서는 안희정 충남지사(82.0%)가 1위를 차지했고 다음으로 이춘희 세종시장과 이시종 충북지사, 권선택 대전시장 순으로 나타났다.  영남권의 경우 김기현 울산시장(56.6%)이 1위에 이어 그 뒤를 김관용 경북지사, 홍준표 경남지사, 권영진 대구시장, 서병수 부산시장이 차지했다.  호남권에서는 이낙연 전남지사가 60.1%로 가장 높아 1위를 줄곧 고수하고 있으며 그 뒤로 송하진 전북지사와 윤장현 광주시장 순으로 집계됐다.  한편 3월중 시도교육감 직무수행지지도 부문에서는 광주시 장휘국 교육감이 56.8%의 잘한다는 긍정평가로 1위를 기록했다. 전남 장만채 교육감은 56.2%로 2위를 유지했고, 전북 김승환 교육감이 53.6%로 3위를 차지했다.  이번 광역자치단체 평가 조사는 리얼미터가 유선 임의전화걸기(RDD) 자동응답(IVR) 방식으로 지난 3월31일부터 4월2일까지 3일간 전국 19세 이상 시도 주민 8500명(시도별 500명)을 대상으로 실시했다. 시도별 표집오차는 95% 신뢰수준에서 ±.1%p, 응답률은 5.5%다.  노해섭  기자 nogary@"
"[광주CBS 박준일 기자]이낙연 전남도지사는 ""인구 감소 원인 분석을 다각도로 해보고 귀농귀촌 확대와 출산율 제고, 청년이 돌아오는 전남, 관광 등 각 부서별로 할 수 있는 모든 대비책 마련에 몸부림을 쳐야 할 때""라고 강조했다.  이 지사는 11일 오후 도청 서재필실에서 열린 실국장 토론회에서 ""전남 인구 200만이 붕괴된 지 7년 만에 190만이 붕괴됐다""며 이같이 밝혔다.  이 지사는 ""그동안 출산율을 높이려고 노력했지만 산모가 적어 출생아 수가 줄고, 고령화로 고령자 사망은 늘고, 교육 또는 기업 여건의 불비로 청년층이 유출되는 등 인구 감소를 막기 어려운 추세""라고 말했다.  이어 ""원인 분석을 다각도로 해보고, 해볼 만한 대책이 무엇인지, 인구문제 대처 시스템에 보강할 요소는 없는지, 기존 정책 중 보완할 것은 없는지, 새로 도입할 것은 없는지 등을 포함한 모든 대비책을 강구해주길 바란다""고 당부했다.  이 지사는 또 ""일본 역시 지방의 인구감소 문제에 부단히 노력하고 있지만 좀처럼 효과가 나타나지 않은 상태""라며 ""그럼에도 불구하고 효과가 있든 없든 도시민들을 돌아오게 하는 정책, 출산율 제고정책 등을 포기하지 않고 추진하고 있는 점 등을 눈여겨볼 필요가 있다""고 덧붙였다.  전기자동차 보급 노력도 독려했다. 이 지사는 ""지난 3월 제주에서 열린 국제전기자동차엑스포에 참가하면서 전기버스 도입 얘기가 나왔다""며 ""시군에서 교체가 임박한 군내버스가 몇 대나 있는지 등을 파악해 빨리 대처하라""고 말했다.  park@cbs.co.kr  저작권자 © CBS 노컷뉴스(www.nocutnews.co.kr) 무단전재 및 재배포 금지"
"본문 이미지 영역세월호 3주기 추모행사. /자료사진=뉴스1  세월호 3주기 추모행사가 오늘(11일) 정부세종청사 15동 대강당에서 진행된다. 교육부는 이날 오후 3시 정부세종청사 15동 대강당에서 전직원이 참여한 가운데 세월호 사고 3주기 추모 행사를 갖는다고 밝혔다.  교육부는 세월호 3주기 추모행사에 대해 오는 16일 세월호 사고 3주기를 맞아 희생자들의 명복을 빌고 미수습자 9명도 조속히 돌아오길 바라는 취지로 마련했다고 설명했다.  세월호 3주기 추모행사는 추모 묵념, 이준식 부총리 겸 교육부장관 추모사, 조원철 연세대 명예교수(방재안전관리 전공)의 안전 주제 강의 순으로 진행된다.  행사 후에는 안전문화 의식 제고를 위해 장차관 등 주요 간부 등이 심폐소생술을 실습한다. 교육부는 직원대상 심폐소생술 실습교육도 다음달 2일까지 진행할 계획이다.  교육부는 이날부터 16일까지를 세월호 추모주간으로 지정해 운영한다. 추모주간 시행을 앞두고 전국 시·도교육청에 각급 학교에서도 세월호 3주기와 관련해 희생자 애도 시간을 갖고 안전문화 확산을 위한 계기교육을 시행하도록 전달한 상태다. 교육부 홈페이지도 해당 주간에는 추모 모드로 바뀐다.  이준식 부총리는 ""다시는 세월호와 같은 일이 발생하지 않도록 모든 교육 분야에서 생명 존중과 안전을 최우선으로 생각해주길 바란다""고 당부했다.  한편 이날 오전 9시30분부터 임회면 팽목항 일원에서도 희생자들의 넋을 기리는 '세월호 3주기 추모행사'가 열린다. 추모행사는 참석자들의 분향소 헌화와 희생자 가족들과의 티타임 등의 식전행사와 추모식, 부대행사 등으로 구분해 펼쳐진다.  추모행사에는 이낙연 전남도지사와 이동진 진도군수, 윤영일 국회의원, 유가족, 주민, 자원봉사자 등 1500여명이 참석할 예정이다.  김유림 기자 cocory0989@mt.co.kr"
"[광주CBS 박준일 기자]이낙연 전라남도지사는 10일 일본 매실산업의 중심지인 와카야마현에서 니사카 요시노부 지사와 회담하고 매실산업 선진 현장을 시찰했다.  이 지사는 이날 회담에서 ""와카야마현의 우수한 남고매실 품종은 순천으로 전래돼 전남에서 매실 산업이 본격화하는 계기가 됐다""며 ""양 지역은 농업 구조가 유사하므로 농업인을 비롯한 인적 교류를 확대해나가자""고 제안했다.  이에 대해 니사카 지사는 ""와카야마현은 과실 재배 분야, 특히 매실농업에서 6차 산업화를 통해 경쟁력을 확보하고 있고, 일본에서 최상품을 생산하는 곳으로 인정받고 있다""며 ""양 지역 간 매실산업 교류에 적극 협조하겠다""고 화답했다.  회담에 앞서 이 지사는 전남지역 기업 4곳, 광양 하이텍고 바이오 농업교사 등과 함께 매실농업 6차 산업화의 선진 기업인 나카다(中田)식품을 방문해매실가공공장과 부지 내에 설치된 판매점을 둘러봤다.  나카다식품은 120년의 역사를 가진 와카야마현의 대표 매실업체다. 매실주 40종을 비롯한 매실 가공품 총 110여 종을 제조해 판매하고 있으며 동남아 등 전 세계 32개 나라에 수출하고 있다.  최근에는 공장 견학을 하는 관광객을 대상으로 각종 매실상품을 판매하는 등 매실농업의 6차 산업화를 통해 새로운 고용 창출과 지역경제 활성화에 기여하고 있다.  방문단은 이어 일본 매실의 최고 품종 '남고매실'의 산실인 와카야마현립 미나베 고등학교를 방문해 개교 이래 110여 년간 이어져온 매실 특화 교육과정 설명을 들었다.  이 학교에서 학생들이 직접 재배한 매실은 우메보시, 잼, 음료수 등 다양하게 가공, 판매되고 있다. 미나베고가 소재한 미나베쵸에서는 지역 특산물인 매실에 대한 관심도를 높이고 산업 인재를 양성하기 위해 매년 고교생 매실 요리 콘테스트를 개최하고 있다.  이번 방문에 동행한 전남지역 매실 기업 등은 일본 매실산업 경쟁력의 원천인 6차 산업화 우수 기업, 매실 특화고, 파머스마켓 등을 시찰하고 얻은 정보와 아이디어를 신상품 개발과 유통체계 개선, 수출시장 개척 등에 참고할 예정이다.  park@cbs.co.kr  저작권자 © CBS 노컷뉴스(www.nocutnews.co.kr) 무단전재 및 재배포 금지"
"[아시아경제 노해섭 기자]이낙연 전남지사와 주동식 전남도 도민안전실장이 11일 오전 목포신항을 방문, 해수부 김철홍 세월호수습반장(왼쪽) 안내로 세월호 육상 거치 현장을 둘러보고 있다. 세월호가 오늘 받침대에 고정되면 내일부터 세척을 위한 사전 작업이 진행될 예정이다. 해수부는 다음 주 초까지 구체적인 수색 계획을 마련할 예정이다.  11일 전남 폭포신항 철재부두에서 관계자들이 세월호를 받치고 있던 모듈트랜스포터(MT)를 빼내는 작업을 위해 분주하게 움직이고 있다. 세월호가 오늘 받침대에 고정되면 내일부터 세척을 위한 사전 작업이 진행될 예정이다. 해수부는 다음 주 초까지 구체적인 수색 계획을 마련할 예정이다.  사진제공=전남도"
"시책과 연계해 전기차 보급 확대…2025년까지 7만 대  (무안=연합뉴스) 손상원 기자 = 전남도가 '탄소 제로 섬' 조성, '100원 택시' 등 친환경·복지 정책과 연계해 전기자동차 보급을 확대하기로 했다.  11일 전남도에 따르면 지난해까지 도에는 전기자동차 924대, 급속충전기 52대가 보급됐다.  지난해 말 현재 전기차 보급량은 전국 3위, 급속충전기는 4위 수준인 것으로 알려졌다.  전남도는 올해 민간 477대, 공공 76대 등 553대를 확대 보급하는 등 2025년까지 전기차 7만 대, 충전기 800대 보급을 목표로 추진하기로 했다.  특히 섬 전체에서 탄소 에너지를 사용하지 않는 탄소 제로섬에서 보급량을 늘릴 예정이다.  교통 약자를 위해 지원되는 100원 택시와 산간 오·벽지를 운행하는 공영 버스에도 전기차를 투입한다는 방침이다.  전남도는 이밖에 사회적 약자 지원 차량을 전기차로 운용하고, 스마트 에너지시티 조성계획이 시행되는 나주시 등에도 전기차를 확대 보급하는 방안을 검토하고 있다.  이낙연 전남지사는 이날 실국장 토론회에서 시군에서 교체가 임박한 시·군내 버스가 몇 대나 되는지 등을 파악하도록 지시했다.  이 지사는 ""도의 에너지산업 발전 10개년 계획의 핵심은 2025년까지 50개 섬을 탄소 제로·에너지 자립 섬으로 만들겠다는 것이고, 전기 버스는 탄소 제로섬 조성의 시작이 될 수 있다""며 ""특히 전남의 섬은 크지 않고 직선도로도 많지 않아 전기버스 도입에 용이하다""고 적극적인 대처를 주문했다.  도와 시·군은 오는 13일 회의를 열어 전기차 보급 방안을 논의하고 다음 달까지 확대 보급계획을 마련할 예정이다.  sangwon700@yna.co.kr"
