"본문 이미지 영역전남 강진군 강진읍이 최근 전남도에서 실시한 '2016 시군읍면 현장행정 평가'에서 1위를 차지했다.  23일 군에 따르면 이낙연 도지사 특별지시로 전남지역 내 행정사각지대 해소를 위해 처음 실시 한 '2016년 읍면동 현장행정 평가'는 지난해 3월부터 12월까지 10개 분야,32개 추진실적을 기준으로 평가됐다.  평가는 군에서 자체적으로 1차 평가를 실시해 3개 우수 읍면을 선정 한 후 도에 보고 하면 도에서 2차 현장점검과 서류검토를 통해 순위를 결정했다.  그 결과 강진읍이 1위로 선정돼 1000만원의 인센티브 상 사업비를 보조금으로 받았다. 강진읍은 기존의 팀장자리를 민원인과 가깝게 재배치하는 등 현장을 직접 발로 뛰고 주민과 소통 분위기를 조성한 것이 좋은 평가로 이어졌다.  윤영갑 강진읍장은 ""직원 모두가 혼연일체가 되어 열심히 일한 결과""라며 ""우리가 열심을 다해 땀 흘리면 군민은 그 몇 배로 행복해진다는 긍지와 자부심으로 올 한해도 더욱 열심히 하겠다""고 말했다.  강진읍은 지난해 군정홍보실적 1위와 상반기 읍면시책평수행평가, 조기집행, 체납세징수율 등에서 예년보다 크게 향상된 성적을 거뒀다.  강진=홍기철 기자 honam3333@mt.co.kr"
"주철현 전남 여수시장이 23일 다섯번이나 고개를 숙였다. 전 국민이 여수수산시장 화재피해 복구에 힘을 모아준데 대한 감사의 인사였다.  주 시장은 이날 교동 여객선터미널 2층 여수수산시장 화재현장 상황실에서 열린 기자회견을 통해 “22일까지 전국 각지에서 보내온 서금이 18억원이나 됐다”면서 “이 성금과 앞으로 지급될 시장건물 화재보험금을 시장시설 복구와 활성화에 사용하겠다”고 밝혔다.  주 시장은 “이낙연 전남지사, 김성렬 행정자치부 차관, 주영섭 중소기업청장, 이개호 민주당 도당위원장, 문재인 민주당 전 대표, 국민의당 안철수 전 대표 등이 여수를 찾아 상인들과 시민들에게 힘을 주신데 대해 감사한다”고 덧붙였다.  주 시장은 “특히 김성렬 차관이 수산시장 주변에 3층 규모로 100대 주차가 가능한 공영주차장 건설을 적극 검토하겠다는 약속을 해주셨다”면서 “큰 위기 속에서도 또 다른 기회를 얻게 돼 다행스럽다”고 말했다.  주 시장은 또 “출향객으로 부산에서 사업을 하시는 박수관 회장, 여수산단 입주기업들이 성금을 들고 달려와 도와주신데 대해 직접 찾아 감사의 인사를 전하겠다”는 뜻도 표시했다.  주 시장은 “이러한 성원에 힘입어 20일부터 임시판매장을 열게 됐다”면서 “현장 철거작업과 건물안전진단에 이어 그 후속조치를 빈틈없이 하도록 하겠다”고 약속했다.  주 시장은 “늦어도 3월 중에는 125명 피해상인들이 예전처럼 관광객들과 시민들을 웃는 얼굴로 맞이할 수 있도록 하겠다”면서 “재개장때는 그동안 보내주신 사랑에 보답하는 기회를 마련해 국민들과 시민들을 초대하겠다”고 말했다.  주 시장은 “전통시장에 이런 피해가 다시는 반복되지 않도록 지자체와 정부가 할 일을 구분해 서로 최선을 다할 수 있도록 제도개선에 힘을 쏟겠다”고 말했다.  ▶ 경향신문 SNS ), 무단전재 및 재배포 금지"
"23일 업무보고 …미래 산업수요 대응한 신산업 육성 ·서민 지원 확대  [아시아경제 노해섭 기자]전라남도는 23일 이낙연 도지사와 외부 전문가가 참석한 가운데 출연기관 업무계획 보고와 토론회를 갖고 올 한 해 미래에 대비한 지역산업 경쟁력 강화, 중소기업과 소상공인 지원 강화, 서민복지 확대에 주력하기로 했다.  분야별로 미래 신성장산업 육성으로 새 일자리 700여 개를 만들기 위해 ▲전남테크노파크는 전남대표산업 조정 및 발전 전략을 마련하고, 에너지신산업 ·드론 ·공작기계 ·차세대 2차 전지산업 생태계를 조성하며 ▲생물산업진흥원은 바이오식품?생물의약?수산물 가공산업 발전을 지원한다.  신 기후변화체제에 대응해 ▲녹색에너지연구원은 신재생에너지사업을 태양광 중심에서 풍력 ·조류까지 확대, 열-전기 복합에너지 기술 개발, 대불국가산단 마이크로그리드 조성을 추진하며 ▲환경산업진흥원은 수질 위주의 환경기술 연구를 대기 ·기후변화 분야로 확대, 축산분뇨 악취저감기술 개발, 환경산업 창업보육과 기업 지원 등을 통해 280여 개의 일자리를 창출한다.  중소기업과 소상공인 지원을 강화하기 위해 ▲중소기업지원센터는 중소기업 육성자금을 지난해보다 400억 원 늘어난 2천900억 원을 조성해 1천여 기업을 지원하고, 청년 700여 명 등 총 1천 300명에게 취업을 알선하며 ▲신용보증재단은 신용보증규모를 500억 원 늘린 5천억 원으로 확대해 노점상 ·어업인 ·소상공인 대상 특별보증을 시행하고, 현재 2개소인 금융복지상담센터도 5개소로 확대해 금융취약계층의 경제적 안정을 지원한다.  역사문화자원을 활용한 관광 활성화 및 소외계층 문화복지 증진을 위해 ▲정보문화산업진흥원은 웹툰, 실감미디어기술을 활용한 콘텐츠 개발을 추진하고 ▲문화관광재단은 관광객 유치활동을 중국을 포함한 동남아 국가로 확대하며, 저소득층 아동 ·청소년 270여 명을 대상으로 ‘꿈사다리 예술학교’와 ‘찾아가는 예술캠프’를 운영한다.  따뜻한 지역공동체 실현을 위해 ▲전남복지재단은 민관 협력 지역복지 네트워크 구축사업을 진행하고, 저소득층 아동의 교육기회 확대를 위해 ‘우리 아이들 꿈 키움’사업을 시행하며 ▲여성플라자와 청소년미래재단은 여성 2천 700여 명의 취업 알선 및 민간부문까지 일 ·가정 양립 직장문화를 확산하고, 청소년 진로 탐색을 지원하는 ‘성장통 휴먼북 콘서트’를 확대 개최한다.  도민에게 양질의 의료서비스를 제공하기 위해 ▲순천 ·강진의료원은 상근의사를 증원하고, 감염병 격리 병상을 확충하며, 특히 강진의료원은 24시간 분만 산부인과를 운영하고, 공공산후조리원도 신설해 10월부터 운영한다.  도민 주거 안정을 위해 ▲전남개발공사는 읍 ·면지역 소규모 주거 용지 개발사업을 추진하고 ▲전남교통연수원은 운수 종사자와 도민의 안전운전 교육을 강화해 지난해 교통문화지수 도단위 3위의 성과 달성을 이어간다.  광주 ·전남의 싱크탱크 역할을 담당하는 ▲광주전남연구원은 전라도 천년 기념사업 및 대선공약 발굴을 지원하고, 4차 산업혁명 등에 대비한 미래 지역발전전략 수립, 광주와의 상생협력 사업 발굴을 적극 추진한다.  이낙연 도지사는 이날 보고회에서 관련 기관 및 민간, 정책 수혜자들 간 끊임없는 ‘소통과 협업’을 강조하면서 ?차 산업혁명 등 미래 변화에 대비해 출연기관의 연구개발 역량을 강화하고, 청렴한 조직문화를 만드는데 최선을 다해달라”고 당부했다.  노해섭  기자 nogary@"
"【나주=뉴시스】류형근 기자 = 더불어민주당 문재인 전 대표가 23일 오후 전남 나주시 광주전남(빛가람)혁신도시 한국전력공사 31층에서 이낙연 전남지사 등과 이야기를 하고 있다. 2017.01.23.  hgryu77@newsis.com  [사진 영상 제보받습니다] 공감언론 뉴시스가 독자 여러분의 소중한 제보를 기다립니다. 뉴스 가치나 화제성이 있다고 판단되는 사진 또는 영상을 뉴시스 사진영상부(n-photo@newsis.com, 02-721-7470)로 보내주시면 적극 반영하겠습니다."
"인센티브 상 사업비 1천만 원  [김동언 기자]  전남 강진군 강진읍은 지난 19일 전라남도에서 실시한 2016년 시·군·읍·면 현장행정 평가에서 1위에 선정됐다.  이낙연 도지사 특별지시로 전라남도 지역 내 행정사각지대 해소를 위해 처음 실시 한‘2016년 읍면동 현장행정 평가’는 지난 2016년 3월부터 12월까지 10개 분야, 32개 추진실적을 기준으로 평가가 실시됐다.  평가방법에 있어 군에서 자체적으로 1차 평가를 실시해 3개 우수 읍면을 선정하고, 도에 보고 후 도에서 2차 현장점검, 서류검토를 통해 순위를 결정한다.  그 결과 강진읍이 1위로 선정돼 1000만원의 인센티브 상 사업비를 보조금으로 받았으며, 상 사업비 1천만 원은 강진읍 관내 문화재 및 관광시설물의 보수 사업비로 사용될 계획이다.  강진읍은 2017년 새해 강진 방문의 해를 맞아 ‘강진읍이 그 중심에 서겠습니다’라는 슬로건을 걸고 더욱 열심히 할 것을 다짐하며, 기존의 팀장자리를 민원인과 가깝게 재배치하는 등 현장을 직접 발로 뛰고 주민들과 소통하는 분위기를 조성해 주민들로부터 좋은 평가를 받고 있다.  윤영갑 강진읍장은 “직원 모두가 혼연일체가 되어 열심히 일한 결과”라며 “우리가 열심을 다해 땀 흘리면 군민은 그 몇 배로 행복해진다는 긍지와 자부심으로 올 한해도 더욱 열심히 하겠다”고 말했다.  한편 상 사업비 1천만 원은 강진읍 관내 문화재 및 관광시설물의 보수 사업비로 사용될 계획이다.  김동언 기자 ( 무단전재 및 재배포금지"
[전남CBS 고영호 기자]  여수 수산시장 일부 상인들이 20일부터 임시 판매장에서 판매를 시작했으나 기존 시장과 달리 천막 등으로 기반시설이 미비한데다 한파에 강풍까지 불면서 큰 불편을 겪고 있다.  전라남도와 여수시는 철거비 3억 3천만 원을 들여 최대 2주 일정으로 20일부터 철거작업에 들어갔으며 화재 잔해물은 550톤 정도로 추산했다.  다음달 17일 이전까지는 안전진단도 마칠 방침이다.  휴일인 22일에는 이낙연 전남지사가 다시 화재 현장을 찾아 임시 판매장의 상인들을 위문하고 전라남도 소속 공직자 등이 23일부터 3일간 수산시장을 방문해 설 장보기 행사에 참여하기로 했다.  (사진=전남CBS 고영호 기자)  newsman@cbs.co.kr  저작권자 © CBS 노컷뉴스(www.nocutnews.co.kr) 무단전재 및 재배포 금지
" 23일 목포서 신년인사회 개최  [아시아경제 노해섭 기자]전남사회복지협의회(회장 노진영)는 23일 목포 신안비치호텔에서 사회복지관계자들이 한자리에 모여 올 한 해 화합과 온정있는 도민복지 구현을 다짐하는 ‘신년인사회’를 가졌다.  이날 행사에는 이낙연 전라남도지사와 권욱 도의회 부의장, 배종범 보건복지환경위원장을 비롯한 도의원, 노진영 전남사회복지협의회장, 허정 전남사회복지공동모금회장, 김양희 여성단체협의회장, 정시채 전남사회복지협의회 고문, 사회복지 직능단체 대표 등 150여명이 참석했다.  신년인사회는 전남사회복지협의회장의 신년인사와 도지사 축사, 축하떡 절단, 축하공연 순으로 진행됐다.  노진영 협의회장은 이날 신년사에서 “사회복지 각계 직능단체와 유기적 네트워크를 강화하고 사회복지 인식의 저변 확대 및 사회공헌을 통한 푸드뱅크 활성화 등의 활동을 펼쳐나갈 것”이라고 말했다.  이낙연 도지사는 축사를 통해 “사회복지시설 종사자들이 생활에 큰 불편이 없고, 숭고한 일을 지속할 수 있게 할 정도의 처우를 보장해나가겠다”고 격려했다.  이어 “전남도는 고령화가 전국에서 가장 먼저 진척되고, 독거노인 및 장애인 비율도 가장 높아 복지 수요가 굉장히 많은데 소득은 낮다”며 “이 때문에 전남도가 어떤 복지모델을 만드느냐에 전국이 주목하고 있다는 마음가짐으로 복지행정을 펴고 있고, 앞으로도 더욱 노력하겠다”고 말했다.  노해섭  기자 nogary@"
"초고령화시대 노인 권익 증진 앞장   [아시아경제 노해섭 기자]대한노인회 전남연합회(회장 강갑구)는 4일 오전 목포 신안비치호텔에서 도 및 시군 노인지도층 인사들이 참석한 가운데 초고령화시대 노인 권익 증진과, 노인회의 화합 및 새로운 도약을 다짐하는 신년인사회를 가졌다.  신년인사회에는 이낙연 전라남도지사를 비롯해 대한노인회 시군지회장, 노인대학장, 노인회 관계자, 전남복지재단 대표이사 등 160여 명이 참석했다.  행사는 강갑구 회장과 이낙연 도지사의 신년 인사와 시루떡 절단, 축배 등 친교의 장으로 치러졌다.  강 회장은 신년사에서 “노인들이 격변하는 사회를 이해하고, 이에 적응할 수 있도록 교육에 힘쓰고, 노인회 업무 수행능력을 한층 높여나가겠다”며 “어떻게 살아가야 존경받는 어르신이 되는지를 항상 되새기자”고 말했다.  이 지사는 인사말을 통해 “지난해 전남노인회가 도내 경로당에서 2천 700여만 원을 모금해 기부하신 일에 경의를 표한다”며 “지난해 노인일자리사업 4년 연속 대상 및 보건복지 분야 6개의 상을 받도록 노인회 등이 도와준 것에 감사드린다”고 말했다.  이어 “올해는 ‘어르신 결핵검진 시범사업’, ‘폐지 줍는 어르신 교통안전용품 지원’, ‘한궁대회 지원’등의 사업을 새로 시작하겠다”며 “어르신 일자리 창출과 알선, 건강과 고독의 관리, 경로당 생활 지원 등 기존 사업들도 더 확대하고 내실화 하겠다”고 밝혔다.  전라남도는 올 한 해 어르신들이 노후생활을  건강하고 안정된 환경에서 지낼 수 있도록 하기 위해 7천787억 원의 예산을 들여 기초연금 지급과 노인일자리 사업 확대, 경로당 등 여가 복지 시설 운영, 독거노인 사회안전망 구축 등 사업을 추진할 계획이다.  노해섭  기자 nogary@"
"(광주=연합뉴스) 형민우 기자 = 조선대학교는 10일 오후 3시 해오름관 대강당에서 'CU Again 7만2천 비전 페스티벌'을 연다고 4일 밝혔다.  'CU Again 7만2천 프로젝트'는 지난해 9월 취임한 강동완 총장의 공약으로 대학 설립동지회원 7만2천여 명을 상징화해 대학발전기금을 조성하고 인적 네트워크를 구축해 건학 100년의 기틀을 마련하는 사업이다.  이날 행사는 교직원, 시·도민, 사회적 배려자, CU Again 7만2천위원회 공동위원장 등 1천0여 명이 참석한 가운데 열린다.  학교 홍보 동영상 상영에 이어 세계적인 미디어아트 작가인 이이남 동문(조소과 44회)의 작품 'Great Chosun'이 상영된다.  강 총장은 프레젠테이션을 통해 'CU Again 7만2천 프로젝트'의 취지를 설명하고 '아시아 최고 대학 르네상스' 비전을 선언한다.  이어 고은 시인과 박원순 서울시장, 박인구 동원그룹 부회장, 올림픽 금메달리스트 기보배 선수 등 다양한 인물들의 축하 영상 메시지가 소개된다.  프로젝트를 추진할 'CU Again 7만2천위원회'는 강 총장이 추진위원장을 맡고 이낙연 전남지사, 윤장현 광주시장, 임명규 전남도의장, 이은방 광주시의장, 김상열 광주상공회의소 회장, 최상준 광주경영자총협회장, 이주현 조선대학교총동창회장이 공동위원장을 맡는다.  minu21@yna.co.kr"
"대선공약 개발 등 협의, 16일 영암 영산재에서  [아시아경제 노해섭 기자]더불어민주당 전남도당(위원장 이개호)은 16일 오전 11시 영암군 삼호읍 영산재에서 '2017전남도당-전남도청 민생현안 당정회의’를 개최한다.  이날 회의는 2017대선을 앞두고 AI 피해현황 및 지원대책, 조선산업 등 지역 주요산업의 활력 회복방안 등의 주요 민생현안을 파악하고 당의 대선공약을 마련하기 위해 실시된다.  회의에는 도당에서 이개호 위원장, 김영록(해남 ·완도 ·진도), 신정훈(나주 ·화순), 박병종(고흥 ·보성 ·장흥 ·강진) 지역위원장을 비롯한 전남 10개 지역위 위원장과 도당 사무처장, 정책실장, 대변인 등이 참석한다. 또 전남도에서는 이낙연 지사와 문금주 기획조정실장, 서은수 농림축식품국장, 임채영 경제과학국장 등 민생관련 실 ·국장 등 10명이 참석한다.  회의에서 전남도 안상현 정책기획관은 2016 도정 주요 성과 및 2017 도정 운영방향에 대해, 서은수 농림축산식품국장과 임채영 경제과학국장이 조선산업 활력 회복 방안 및 SOC 국고확보 현황 과 건설계획에 대해 각각 브리핑을 할 예정이다. 이어 질의응답, 기타 현안 토론 등이 실시된다.  이개호 도당 위원장은 “이번 회의는 2017 대선을 앞두고 전남의 민생현안을 파악해 대선공약에 반영하기 위해 마련했다”며 “반드시 정권교체를 이뤄 낙후와 소외를 딛고 전남을 희망의 땅으로 만들겠다”고 밝혔다.노해섭  기자 nogary@"
"전남도 새해 업무보고 '전시성'많고 청렴대책도 '부실' 지적  [광주CBS 박준일 기자]전남도 각 국·실이 이낙연 지사에게 새해 업무보고를 하는 과정에서 올해 역점사업으로 '개천에서 용 나게 하는 사업'을 추진하겠다고 밝혔으나 지나치게 과장되거나 전시성 사업이라는 지적을 받고 있다.  또 지난해 청렴도 전국 꼴찌를 기록한 감사관실의 청렴도 대책도 너무 부실하다는 비판이 나오고 있다.  전남도는 12일 이낙연 지사와 정책자문위원 등 외부 전문가가 참석한 가운데 일반행정, 보건복지여성 분야 새해 업무계획 보고를 실시했다.  이 자리에서 기조실은 ""개천에서 용이 나게 하는 사업""을 본격 시행하겠다고 밝혔다. 기조실은 ""취약계층 아동들에게 학습능력 향상기회를 제공하는 '꿈 사다리 공부방'을 운영하는 등 가난의 대물림 극복을 위한 계층 이동 지원체계를 구축하겠다""고 밝혔다.  그러나 이 사업을 좀 더 들여다보면 ""올해 예산 13억 5천만 원을 들여 비정규직 인턴 70명을 고용, 지역 아동센터에 1명씩 배치해 저소득계층 취학 전 아동들의 공부를 돕겠다""는 내용이 전부다.  특히 연간 6조 3735억 원의 예산을 집행하는 전남도가 13억 5천만 원으로 개천에서 용 나는 사업을 추진하겠다는 것은 거창한 취지에 비해 실효성이 떨어진다는 지적이다.  이에 대해 '광주·전남교육을생각하는학부모연합회' 정미경(53) 대표는 ""소외계층 자녀들이 차별받지 않고 공부해 속칭 좋은 대학에 진학하고 취업해서 가난의 고리를 끊을 수 있는 환경까지 만들어 줄 수 있는 프로그램 정도 돼야 개천에서 용 나는 사업이라고 말 할 수 있지 않는냐""고 반문했다.  이어 ""사업명만 그럴듯하게 개천에서 용 나는 사업이라고 포장해 놓고는 정작 내용면에서 부실하기 짝이 없는 완전히 부풀리기 식 사업의 표본""이라고 비판했다.  또 지난해 12월 국가권익위의 청렴도 종합평가에서 전국 17개 광역시도 가운데 꼴찌를 차지한 감사관실의 '청렴도 높이기 대책'도 부실하다는 비판을 받고 있다.  감사관실은 ""청렴도 하위권의 주요 원인인 공사·용역 분야 민원 만족도를 높이는데 주력하고 비리 적발 시 공직자는 원스트라이크 아웃제를 실시하고 관련 업체도 엄격히 처벌할 방침이다""고 밝혔다.  그러나 도청 하위직 직원들이 노조 사이트 등을 통해서 지속적으로 제기해온 각종 부조리와 부패 요인에 대한 대안 제시도 지나치게 미흡한데다 매년 되풀이 해온 업무보고 수준의 '판박이'라는 지적을 받고 있다.  한편 지난 1995년 첫 민선 전남지사로 취임했던 당시 허경만 지사는 부패관행과 복지부동을 뿌리 뽑겠다며 시장·군수 3명을 총무과에 대기발령 시키는 파격으로 인사기강을 바로 세웠다.  또 광주시교육청도 지난 2010년 장휘국 교육감 취임이후 외부에서 김용철 감사관을 영입해 2011∼2012년도에 무려 1천여 명이 넘는 교육공무원들에 대해 수사의뢰와 파면, 해임 등 각종 징계처분을 강행, 촌지 문화를 근절시켰다.  그러나 이 지사가 청렴도 최하위라는 불명예에도 불구하고 차기 선거가 불과 1년 5개월여 앞으로 다가오면서 부패청산을 위한 골든타임을 놓쳤다는 지적도 나온다.  park@cbs.co.kr  저작권자 © CBS 노컷뉴스(www.nocutnews.co.kr) 무단전재 및 재배포 금지"
"동영상 뉴스  [앵커]  지난 2012년 세계박람회 이후 가고 싶은 관광지로 자리매김한 전남 여수에 1조 원이 투자됩니다.  전남지역 관광단지 개발에 민간 자본 1조 원이 투자되는 것은 처음인데요.  전라남도는 여수의 섬 '경도'를 '아시아의 모나코'로 만들겠다는 포부를 밝혔습니다.  이승배 기자입니다.  [기자]  바다를 낀 환상적인 코스의 골프장과 글램핑장이 이미 들어선 여수 경도.  글로벌 투자 그룹 미래에셋 컨소시엄이 여수 경도 일대 개발에 1조 원을 투자하기로 했습니다.  [박현주 / 미래에셋 회장 : 여수 경도 하나가 아니라 전라남도가 어떻게 하면 격이 높아지는 전체 관광 리조트 비즈니스 축을 만드느냐 이게 관심이 있어요.]  경도 개발은 먼저 땅의 소유권 이전을 시작으로 빠르면 2년 뒤쯤 첫 삽을 뜹니다.  6성급 리조트 호텔과 빌라 그리고 물놀이 공원을 새로 만들고, 섬을 오가는 해상 케이블카도 건설됩니다.  해양 스포츠의 꽃인 요트를 정박할 수 있는 시설도 생깁니다.  [이낙연 / 전라남도 지사 : 아시아 최고 수준의 복합 리조트, 6성급 호텔을 포함한 아시아의 모나코로 우리 경도를 만들어주시길 바라고, 저희가 할 수 있는 모든 지원을 아끼지 않겠습니다.]  여수 돌산과 경도를 연결하는 다리는 미래에셋과 전라남도 등이 함께 놓기로 했습니다.  여수 경도 개발이 마무리되는 때는 오는 2029년.  미래에셋은 그때까지 투자액이 1조 원이 되지 않으면 지연 배상금으로 3%를 내겠다고 밝혀, 사업을 차질없이 추진하겠다는 강한 의지를 보였습니다.  YTN 이승배[sbi@ytn.co.kr]입니다.  [저작권자(c) YTN(Yes! Top News) 무단전재 및 재배포 금지]"
"(무안=연합뉴스) 손상원 기자 = 더불어민주당 전남도당과 전남도가 올해 첫 당정회의를 연다.  12일 민주당 전남도당에 따르면 도당과 전남도는 오는 16일 오전 11시 영암군 삼호읍 한옥 호텔 영산재에서 민생현안 당정회의를 연다.  조류인플루엔자(AI) 피해현황과 지원책을 공유하고 주요 민생현안을 파악해 대선공약을 마련하기 위한 행사다.  이개호 도당 위원장을 비롯해 김영록(해남·완도·진도), 신정훈(나주·화순), 박병종(고흥·보성·장흥·강진) 등 전남 10개 지역 위원장이 이낙연 지사 등 전남도 주요 간부들과 만난다.  sangwon700@yna.co.kr"
