"성충동 약물치료 일부개정안 등 17건 안건 심의  (서울=뉴스1) 박승주 기자 = 정부는 18일 이낙연 국무총리 주재로 국무회의를 열고 성충동 약물치료 대상범죄에 카메라 등을 이용한 촬영죄를 추가하는 내용을 담은 법률안 등을 심의·의결한다.  이 총리는 이날 오전 정부 서울-세종청사간 영상으로 진행되는 제31회 국무회의를 주재하고 법률안 4건, 대통령령안 12건, 일반안건 1건 등 총 17건의 안건을 다룬다.  이 총리는 이날 7월 임시국회 마지막 본회의가 열리는 것과 관련, 추가경정예산안(추경)의 조속한 처리를 위한 국회의 결단을 촉구할 예정이다.  이 총리는 앞선 여러차례 국무회의에서 일자리 창출을 위한 추경 편성은 새 정부 구성과 시급한 현안 해결이라는 목표를 이루는 데 꼭 필요하다며 국회의 협조를 주문했다.  이날에도 추경과 함께 정부조직법 개편안의 국회 통과를 당부할 예정이다.  이 총리는 또 휴가철이 다가온 만큼 '하절기 국민안전대책'에 대해서도 언급할 것으로 보인다.  앞서 정부는 풍수해나 폭염 같은 자연재해, 교통안전, 식중독·감염병, 독거노인·노숙인 등 혹서기 취약계층과 관련한 대책 마련을 적극 추진하기로 했다.  취약계층의 눈높이에 맞는 맞춤형 안전대책으로 차별없는 안전복지를 실현하겠다는 문재인정부의 방침에 따라 취약지역 현장점검 등 재난 발생 전 사전예방을 강조할 것으로 예상된다.  최근 충북 지역을 중심으로 폭우 피해가 컸던 점을 고려해 이와 관련한 추가 대책 지시 등을 내릴 가능성도 있다.  아울러 정부는 이날 국무회의에서 '성폭력범죄자의 성충동 약물치료에 관한 법률 일부개정법률안', '창조경제 민관협의회 등의 설치 및 운영에 관한 규정 일부개정령안' 등 안건 17건을 일괄 심의한다.  '성폭력범죄자의 성충동 약물치료에 관한 법률 일부개정법률안'은 약물치료 대상범죄에 Δ아동·청소년 강간 등 상해·치상죄 Δ아동·청소년 강간 등 살인·치사죄 Δ카메라 등을 이용한 촬영죄 Δ강도강간미수죄·해상강도강간미수죄를 추가하는 내용을 담았다.  또 현행 성충동 약물치료 판결조항은 치료명령 선고를 피고사건 선고와 동시에 해 장기형 선고의 경우 치료명령 선고시점과 집행시점 사이에 상당한 시간적 격차가 있다는 점을 고려, 치료명령의 집행 면제 신청 절차를 마련하는 내용도 함께 담고 있다.  휴직 중인 군인이 공무 목적이 아닌 휴직 목적에 맞는 국외여행을 하려는 경우 지휘관이 승인할 수 있도록 하는 '군인의 지위 및 복무에 관한 기본법 시행령 일부개정령안'도 이날 심의 대상이다.  영화상영관을 설치·경영하기 위해 등록한 사람이 재해대처계획을 신고 또는 보완하지 않은 경우 최대 400만원의 과태료를 부과하는 내용의 '영화 및 비디오물의 진흥에 관한 법률 시행령 일부개정령안'도 심의·의결될 예정이다.  parksj@  ), 무단 전재 및 재배포 금지]"
"【서울=뉴시스】김선웅 기자 = 18일 오전 서울 종로구 정부서울청사에서 열린 국무회의에서 이낙연 국무총리를 비롯한 김동연, 김상곤 부총리 등 국무위원들이 국민의례를 하고 있다. 2017.07.18.  mangusta@newsis.com  [사진 영상 제보받습니다] 공감언론 뉴시스가 독자 여러분의 소중한 제보를 기다립니다. 뉴스 가치나 화제성이 있다고 판단되는 사진 또는 영상을 뉴시스 사진영상부(n-photo@newsis.com, 02-721-7470)로 보내주시면 적극 반영하겠습니다."
"【서울=뉴시스】김선웅 기자 = 18일 오전 서울 강남구 코엑스에서 열린 2017 세계한국어교육자대회에서 이낙연 국무총리가 축사를 하고 있다.  교육부, 외교부, 문화체육관광부 주최로 열린 '세계한국어교육자대회'는 국내외 한국어 교육자들이 참석, 한국어 교수법, 한국어 발음 강의, 한국 문화 체험 등을 통해 한국어 교수 역량을 강화하고 긍정적인 한국관을 배양하기 위해 마련됐다. 2017.07.18.  mangusta@newsis.com  [사진 영상 제보받습니다] 공감언론 뉴시스가 독자 여러분의 소중한 제보를 기다립니다. 뉴스 가치나 화제성이 있다고 판단되는 사진 또는 영상을 뉴시스 사진영상부(n-photo@newsis.com, 02-721-7470)로 보내주시면 적극 반영하겠습니다."
이낙연 국무총리는 추가경정 예산안이 통과돼 정부로 넘어오면 오늘 밤에라도 임시 국무회의를 열어 안건을 의결하겠다고 밝혔습니다.  이 총리는 정부서울청사에서 열린 국무회의에서 7월 임시국회 마지막 날인 오늘 국회 본회의에서 추경안이 꼭 통과되길 부탁한다며 이같이 말했습니다.  이 총리는 추경안이 애초 예정보다 늦어진 만큼 집행을 서두를 수 있도록 예산 배정 등 후속 조치 준비에 만전을 기해달라고 당부했습니다.  [저작권자(c) YTN(Yes! Top News) 무단전재 및 재배포 금지]
"동영상 뉴스  '화학적 거세' 대상에 몰카범·강도강간 미수범 포함  이낙연 주재 국무회의… 성충동약물치료법 개정안 의결  몰카범도 '화학적 거세' 대상 포함… 실효성은?  ""약물 중단 시 성욕 회복·재범 가능성""… 견해는?  횡단보도에서 '슬쩍'… 대학생, 여성 29명에 몰카  ""휴지로 막는 것도 지쳐""… 여자 화장실 몰카 구멍  몰카 장비는 초소형화… 공유 사이트도 매년 증가  ※자세한 내용은 뉴스TOP10에서 확인하실 수 있습니다  꿈을 담는 캔버스 채널A  ⓒCHANNEL A(www.ichannela.com), 무단 전재 및 재배포 금지"
"【서울=뉴시스】김지훈 기자 = 이낙연 국무총리는 18일 ""오늘 국회에서 추가경정예산안이 통과돼 정부로 이송돼 오면, 오늘 밤에라도 임시국무회의를 열어 관련 안건을 의결할 계획""이라고 밝혔다.  이 총리는 이날 오전 제31회 국무회의 모두발언에서 ""오늘 국회 본회의에 추경안 등이 상정될 예정, 본회의에서 추경안이 꼭 통과되도록 해 달라""며 이같이 말했다.  이 총리는 이어 ""각 부처는 추경안이 당초 예상보다 늦어진 만큼 집행을 더 빨리 서두를 수 있도록 예산배정 등 후속조치 준비에 만전을 기해주길 바란다""고 당부했다.  이 총리는 또한 ""국정운영 5개년 계획과 100대 국정과제를 내일(19일) 국민께 보고 드리게 됐다""며 ""각 부처가 국정과제 의미를 정확히 공유하고, 이를 실천하기 위한 정교한 계획으로 뒷받침해줄 차례다. 신속하게 세부추진계획을 마련해 과제 실천에 만전을 기해 달라""고 강조했다.  이 총리는 아울러 학교 여름방학 기간에 취약계층 학생 돌봄지원이 차질 없도록 유념해 달라고 당부했으며, 경로당 에어컨 확충과 무더위쉼터 오지·벽지 확충 등을 지시했다.  jikime@newsis.com"
"관련 업무 부서에는 폭우 피해 학생을 지원·관리하는 매뉴얼도 없는 것으로 확인됐다.  뉴시스가 이런 문제를 짚어보려 취재에 착수하자 도교육청 일부 부서는 그제야 부랴부랴 피해학생 현황을 파악하기 시작했다.  도교육청 관계자는 ""시설물 말고는 학생 피해는 집계하지 않았다""며 ""학생 피해 현황 파악과 지원책은 없는지 논의하겠다""고 말했다.  전날 이낙연 총리는 ""사람 중심의 사고가 필요해요. 그래야 신뢰를 얻죠""라는 말을 남겼다.  pjw@newsis.com"
"동영상 뉴스  '물폭탄' 수해 충북지역, '특별재난지역' 선포 추진  [앵커]  정부가 최대 300mm의 물폭탄으로 수해를 당한 청주 등 충북지역 4곳을 '특별재난지역'으로 선포하는 방안을 추진합니다.  피해액이 눈덩이처럼 불어나 지방자치단체의 재정 여건만으로는 감당하기 어렵다는 판단에서입니다.  최지숙 기자입니다.  [기자]  지난 16일, 300㎜ 규모의 집중 호우로 도심 절반이 물에 잠긴 충북 청주.  충북 지역에 집중된 기록적인 폭우로 5명이 사망하고 500명이 넘는 이재민이 발생했습니다.  주택 686채와 농경지 4천962ha가 침수되고 하천 둑이 유실되는 등 피해 규모가 걷잡을 수 없이 커지자 정부가 특별재난지역 선포 검토에 들어갔습니다.  지난 17일 청주 호우 피해현장을 방문한 이낙연 국무총리는 피해 현황을 보고받고 이같이 밝혔습니다.  ""청주나 증평, 진천, 괴산…거의 그(특별재난지역 선포) 요건에 육박하지 않는가…청주는 이미 초과돼있지 않나 싶습니다.""  특별재난지역으로 선포되면 피해 지역은 응급대책과 재난구호, 복구에 필요한 각종 특별지원을 받습니다.  하지만 이를 위해선 일정 요건을 갖춰야 합니다.  재난 및 안전관리 기본법에 따르면 피해액이 청주시의 경우 90억원, 증평과 진천군은 75억원, 괴산군은 60억원 이상일 경우 가능합니다.  아울러 특별재난지역 선포까지 시일이 걸리는 만큼 이 총리는 우선 국민안전처나 행정자치부의 재난안전특별교부세 지급 등이 필요하다고 말했습니다.  정부는 피해 복구를 서두르는 한편 관련 예산도 긴급 지원할 방침입니다.  연합뉴스TV 최지숙입니다.  연합뉴스TV : 02-398-4441(기사문의·제보) 카톡/라인 jebo23"
"이낙연 국무총리는 ""7월 임시국회 마지막 날인 오늘 국회 본회의에 추가경정 예산안이 상정된다. 오늘 추경안이 꼭 통과되도록 해 주시길 부탁한다""고 밝혔다.  이 총리는 18일 오전 정부서울청사에서 주재한 국무회의에서 ""추경안이 통과돼 정부로 이송되면 오늘 밤에라도 임시국무회의를 열어 관련 안건을 의결할 계획""이라며 이같이 말했다.  그는 ""각 부처는 추경안이 당초 예정보다 늦어진 만큼, 집행을 더 빨리 서두를 수 있도록 예산배정 등 후속조치 준비에 만전을 기해달라""고 당부했다.  또 ""국정기획자문위원회가 밤낮없이 애써준 결과, 국정운영의 나침반이 될 국정운영 5개년 계획과 100대 국정과제를 내일 국민께 보고드린다""며 ""각 부처가 국정과제의 의미를 정확히 파악·공유하고 이를 실천하기 위한 정교한 계획으로 뒷받침할 차례""라고 설명했다.  이 총리는 아울러 ""정부는 신속하게 세부 추진계획을 마련해 과제 추진상황 실시간 모니터링 시스템을 갖추는 등 과제실천에 최선을 다해 달라""고 지시했다.  [디지털뉴스국 길나영 인턴기자]  [ⓒ 매일경제 &amp; mk.co.kr, 무단전재 및 재배포 금지]"
"【서울=뉴시스】김지훈 기자 = 이낙연 국무총리는 18일 ""한국인의 자랑스러운 글자 한글을 세계에 더 널리 전파하고, 우리 후대에 더 멀리 전수하기 위해 정부는 더 많은 노력을 하겠다""고 밝혔다.  이 총리는 이날 서울 코엑스에서 열린 세계한국어교육자대회 개회식에 참석, 환영사에서 ""한국어에는 반만년 동안 쌓인 한국인의 생활, 정서, 문화, 역사, 영혼, 한국인의 존재 그 자체가 녹아 있다""며 이같이 말했다.  이 총리는 ""외국인을 위한 한국어 교육을 더욱 지원하겠다""며 ""특히 세종학당이 언어와 문화의 교류에서 더 많은 역할을 하도록 돕겠다""고 약속했다.  이 총리는 또한 ""미래의 해외동포를 위한 한국어 교육을 더욱 체계화하겠다""며 ""이 과업은 한국의 미래상에도 직결된다고 인식하고 있다""고 강조했다.  이 총리는 아울러 ""해외 한국어 교육에 과학기술을 접목해 교육 환경과 방식을 발전시키겠다""며 ""해외 한국어 교육이 더 큰 효과를 내도록 유도하겠다""고 덧붙였다.  jikime@newsis.com"
"【청주=뉴시스】천영준 기자 = 집중 폭우로 침수돼 가동이 중단됐던 충북 청주산업단지 폐수종말처리장이 18일 임시 가동됐다.  이 처리장이 지난 16일 인근 석남천이 범람하면서 폐수처리시설이 물에 잠겨 가동이 중단된 지 사흘 만이다.  청주산업단지 관리공단에 따르면 폐수종말처리장은 시험운전 등의 절차를 거친 뒤 이날 임시 가동에 들어갔다.  이곳을 관리하는 금강유역환경청은 침수로 가동이 중단되자 산단 입주 업체들이 내보내는 폐수 유입을 중단했다.  폐수처리장을 갖춘 청주 산단 내 대기업에는 발생 폐수를 자체 처리해 달라고 했고 중소 업체들에는 폐수 방류 자제를 요청했다. 이후 침수된 장비 등을 수리하고 배수 작업을 마무리했다.  관리공단은 임시 가동이지만 평소 폐수 유입량인 2만~2만3000t 정도를 처리할 수 있을 것으로 보고 있다. 폐수종말처리장의 하루 오·폐수 처리 용량은 3만1000t이다.  이에 따라 산단에 입주한 51개 업체의 폐수 처리가 가능해 공장도 정상 가동될 것으로 보인다.  관리공단 관계자는 ""폐수종말처리장이 임시 가동됐지만 평소처럼 폐수 처리가 가능할 것""이라며 ""완전히 정상화하는 데는 조금 시간이 걸린다""고 말했다.  이낙연 국무총리는 지난 17일 폐수종말처리장을 방문, 피해 복구 상황을 보고받은 뒤 조속한 시설 복구를 지시했다.  yjc@newsis.com"
"ㆍ정부, 약물치료 대상 확대  성폭력범죄자에 대한 성충동 약물치료, 이른바 ‘화학적 거세’ 대상 범죄에 몰래카메라 촬영죄와 강도강간미수죄 등이 포함됐다.  정부는 18일 정부서울청사에서 이낙연 국무총리 주재로 열린 국무회의에서 이런 내용을 골자로 하는 성충동 약물치료에 관한 법률 일부 개정안을 심의·의결했다.  성충동 약물치료 대상 범죄에는 아동·청소년 강간 등 살인·치사죄와 상해·치사죄도 포함됐다.  또 실제 치료명령의 집행 시점에 피치료자가 이의를 제기할 경우 치료 필요성을 다시 판단하도록 하는 절차도 추가됐다. 징역형과 함께 약물치료명령을 선고받은 이가 형 집행 종료 전 9개월부터 6개월 사이에 법원에 치료명령의 집행 면제를 신청할 기회를 주도록 하는 조항을 신설한 것이다.  신청이 들어오면 법원은 정신건강의학과 전문의의 진단과 감정, 보호관찰소장의 재범 위험성 등의 조사 결과를 토대로 면제 여부를 판단한다.  회의에선 이 내용을 포함해 총 4건의 법률안과 12건의 대통령령안, 1건의 일반안건을 심의·의결됐다. 박근혜 정부 핵심 국정과제였던 ‘창조경제’ 정책의 추진을 맡았던 ‘민관합동 창조경제추진단’을 폐지하는 안건도 의결됐다.  ▶ 경향신문 SNS ), 무단전재 및 재배포 금지"
"文대통령이 정한 '5대 비리' 그랜드슬램  (서울=뉴스1) 구교운 기자,이형진 기자 = 정우택 자유한국당 원내대표는 18일 이효성 방송통신위원장 후보자를 '부적격의 끝판왕'이라며 지칭하며 자진사퇴를 촉구했다.  정 원내대표는 이날 국회에서 열린 원내대책회의에서 ""이 후보자에 대한 인사청문회가 열리기 전에 수많은 의혹이 터져나오고 있다""며 이렇게 말했다.  그는 ""대통령과 여야가 균형감 있게 인원을 추천하는 기구가 방통위""라며 ""방송통신위원장 직무 성격상 최고 수준의 정치적 중립성이 담보돼야 한다""고 강조했다.  이어 ""그러나 이 후보자는 그동안 제기된 편향된 정치성만 보더라도 방통위의 중립성을 지킬 수 없는 후보""라며 ""한국당 소속 미래창조과학통신위원회 위원 전원의 의견""이라고 밝혔다.  정 원내대표는 ""문재인정부는 지난 대선부터 온갖 꼼수와 억지수단을 동원해 공영방송을 장악하려고 시도했다""며 ""그런 만큼 정치적 편향성을 가진 분이 방송통신위원장에 임명된다는 것은 대단히 부적절하다""고 지적했다.  이어 ""이 후보자는 위장전입, 부동산투기, 병역법 위반, 자녀 미국국적 보유, 논문표절, 전관예우 등 총 10가지나 되는 각종 비리 의혹이 있다""며 ""이낙연, 강경화, 김상곤, 김상조, 송영무 등 명백한 부적격 후보자들이 있었지만 이 후보자야말로 절대 부적격의 '끝판왕'이라 부를 만하다""고 힘주어 말했다.  또 ""문 대통령이 스스로 정한 5대 비리 요건에 모두 해당하는, 영광스러운 그랜드슬램을 달성한 5대비리 전관왕""이라고 비꼬면서 ""임명되면 안 된다는 것을 분명히 밝힌다""고 목소리를 높였다.  kukoo@  ), 무단 전재 및 재배포 금지]"
"[헤럴드경제=박병국 기자] 문재인 정부의 ‘고위공직자 5대 인사 배제 원칙’(병역 면탈, 부동산 투기, 세금 탈루, 위장 전입, 논문 표절)이 문 정부가 지명한 후보자로 무너지는 모습이다. 이낙연 총리, 김상조 공정거래위원장, 강경화 외교부장관 등이 인사원칙에 위배되는 사실이 하나둘씩 드러나며 고전한 데 이어 막바지 인사청문회 절차를 밟고 있는 박능후 보건복지부 장관 후보자에 대해서도 위장 전입, 세금탈루, 논문표절 등의 의혹이 쏟아져 나왔다.  우선 박능후 후보자 본인도 인정한 위장전입 문제. 박 후보자는 인사청문회 위원들의 추궁이 이어지자 인사청문회 전 보도자료를 내고 “총선에 출마한 지인을 돕기 위해 위장전입을 했다”고 시인했다. 자신의 결혼식 주례를 섰던 이상희 전 과학기술부 장관이 1988년 총선에 출마하자, 이를 돕기 위해 주소를 이전했다는 것이다. 박 후보자의 배우자에 대해서는 위장전입과 농지법 위반 의혹을 제기되기도 했다.  다음은 논문표절 의혹. 김광수 국민의당 의원은 박 후보자가 2009년 11월 보건사회연구 학술지에 박사과정에 있던 자신의 제자 A 씨와 함께 ‘근로빈곤층 노동이동 결정요인 분석’이라는 논문을 발표했는데, 한 달 뒤인 2009년 12월 A씨가 박사학위 논문으로 낸 ‘생애주기와 빈곤이 노동에 미치는 영향’과 표절률이 21%로 나왔다고 주장했다. 김 의원은 “논문 지도교수였던 박 후보자가 제자의 박사 논문 심사과정에서 표절을 묵인 또는 방조하고 심사를 최종 통과시켜주는 것을 대가로, 제자의 논문을 가로채기 한 것이 아니냐는 의혹이 나온다”고 했다.  발표한 논문이 과거에 이미 발표된 논문과 유사한. 이른바 ‘자기표절’ 의혹도 제기됐다. 송석준 자유한국당 의원은 박 후보자가 2002년 4월에 발표한 논문 ‘사회복지재정의 적정성에 관한 연구’의 총 177문장(요약문 제외) 중 163개 문장이 2001년 논문 ‘한국 사회 복지재정의 현황과 과제’의 문장과 완벽히 일치한다고 주장했다.  세금탈루 의혹도 피해가지 못했다. 김승희 자유한국당 의원에 따르면 후보자의 배우자는 2012~2014년, 2016년 동안 두 대학에서 강의를 하며 소득이 발생했지만, 최근까지 신고하지 않았다. 후보자의 배우자는 청와대의 사전검증이 있었던 지난 6월 19일 2012년, 2013년 분 세금 107만원을, 후보자 지명 발표 하루 전인 7월 6일에 는 2014년, 2016년도 분 세금 158만원을 납부냈다.  한편 이낙연 총리는 인청과정에서 군면제 의혹, 위장전입, 세금탈루, 부동산 투기 의혹이 불거졌지만 결국 국회 인준을 받았고, 강경화 외교부 장관의 경우 부동산투기, 세금탈루, 위장전입 의혹으로 야당이 강하게 반대했지만 임명이 강행됐다. 김상조 공정거래위원장는 부동산투기, 세금탈루, 위장전입, 논문표절 등 5대 원칙중 4개에 해당하는 의혹이 불거졌지만 후보자 딱지를 떼는데 성공했다.  cook@heraldcorp.com  - Copyrights ⓒ 헤럴드경제 &amp; heraldbiz.com, 무단 전재 및 재배포 금지 -"
"동영상 뉴스  11조원 추경안 통과…與 '공무원 증원' 관철  [앵커]  추가경정예산안이 진통 끝에 국회 문턱을 넘었습니다.  정부 여당은 난제였던 공무원 증원 등 일자리 공약을 관철하면서 국정개혁의 추동력도 확보했다는 평가가 나옵니다.  홍제성 기자가 보도합니다.  [기자]  ""재석 179인중 찬성 140인, 반대 31인, 기권 8인으로서 2017년도 제1회 추가경정예산안은 예산결산특별위원회의 수정안대로 가결되었음을 선포합니다.""  새 정부가 제출한 일자리 추경안이 오랜 줄다리기 끝에 어렵게 국회 문턱을 넘었습니다.  추경안이 제출된지 45일만입니다.  총액은 당초 정부안보다 약 1천500억원 줄어든 11조300억원입니다.  핵심쟁점이던 중앙직 공무원 증원 비용은 추경안 예산 80억원을 삭감하는 대신 예비비에서 지출하기로 했습니다.  증원 규모도 정부안 4천500명보다 적은 2천575명으로 확정됐습니다.  정부 여당은 이로써 공무원 증원 등 일자리 공약을 관철하는데 성공했습니다.  정부는 곧바로 이낙연 총리 주재로 임시국무회의를 열어 추경안을 심의·의결했습니다.  ""이번 추경은 일자리 창출과 서민생활보호에 중점을 두고 편성됐고 그렇게 국회를 통과했습니다. 추경이 제때 집행이 되고 본래 취지에 맞게 일자리 창출과 서민생활 보호에 효과를 나타낼 수 있도록 계속 집행하고 점검해주시기 바랍니다.""  정부조직법에 이은 추경안이 통과됨으로써 문재인 정부는 뒤늦게나마 국정운영의 추동력을 확보하며 각종 개혁과제 이행에 힘찬 시동을 걸게 됐습니다.  연합뉴스TV 홍제성입니다.  연합뉴스TV : 02-398-4441(기사문의·제보) 카톡/라인 jebo23"
"국회서 추경 통과 후 임시국무회의 열어  매월 재정관리점검회의 열어 추경 점검  (서울=뉴스1) 조소영 기자 = 이낙연 국무총리는 22일 국회에서 추가경정예산안(추경)이 통과된 것과 관련, 기획재정부를 비롯한 관계부처와 지방자치단체를 향해 추경의 편성 및 집행, 점검에 적극 협력해 줄 것을 당부했다.  이 총리는 이날 오전 국회에서 추경안이 통과된 뒤 오후 2시 서울청사 국무회의실에서 임시국무회의를 열고 모두발언을 통해 이렇게 말했다.  이 총리는 ""국회 심의과정에서 지적된 사항이나 정부가 약속한 사항은 집행과정에서 최대한 반영해나가야할 것""이라며 ""이번 추경은 일자리 창출과 서민생활보호에 중점을 둬 편성됐고, 그렇게 국회를 통과했다""고 말했다.  그는 ""기획재정부 등 관계부처는 조기 배정계획에 따라 추경이 제때 집행이 되고 본래의 취지에 맞게 일자리 창출과 서민생활보호에 효과를 나타낼 수 있도록 계속 집행하고 점검해주시길 바란다""고 말했다.  또 ""예산이 집행되는 과정에서는 지방자치단체가 함께 하는 경우가 많으므로, 지방자치단체도 추경이 신속히 편성되고 집행될 수 있도록 적극 협력해주시길 바란다""고 강조했다.  이 총리는 ""상당수 지방자치단체가 이미 중앙정부보다 먼저 추경을 편성해 매칭을 기다리고 있다""며 ""그러한 지방자치단체에 대해 감사를 드린다""고도 했다.  아울러 이 총리는 ""이번 국회 심의과정에서 새롭게 예산이 반영된 평창동계올림픽 지원, 항구적 가뭄대책, AI(조류인플루엔자) 대책 같은 사업도 차질없이 집행되도록 노력해주시길 바란다""고 요청했다.  한편, 이날 임시국무회의에서는 기획재정부를 비롯한 관계부처들을 중심으로 추경안이 일자리 창출의 마중물 역할을 할 수 있도록 행정절차를 최대한 단축하고 집행 관리에 만전을 기하는데 노력하기로 했다.  이에 따라 회의에서는 추경예산 공고안 및 배정계획안이 상정, 의결됐으며, 매월 기획재정부 2차관이 주재하는 재정관리점검회의를 통해 추경예산 집행상황을 점검해나가기로 했다.  아울러 기획재정부가 이번 추경과 관련해 밝힌 주요 감액사업으로는 Δ중소기업 모태조합 출자 및 정책자금 융자(8000억원) Δ관광산업 융자지원(400억원) 등이 꼽혔다.  반면 주요 증액사업으로는 Δ항구적 가뭄대책 추진(1077억원) Δ평창동계올림픽 지원(450억원) Δ일자리 창출 및 서민생활안정 지원 등(977억원)이었다.  cho11757@  ), 무단 전재 및 재배포 금지]"
