"이낙연 국무총리가 3일 “청와대를 포함한 정부와 송하진 지사를 비롯한 전라북도 지역사회가 노력했는데도 불구하고 군산조선소 가동이 중단돼 참으로 안타깝다”며 지원 대책을 조속히 마련하라고 지시했다.  이 총리는 이날 오전 총리실 간부회의에서 “군산조선소 가동 중단에 따른 전북·군산 지역 충격을 완화하고 지역주민이 공감할 수 있는 지원 대책이 필요하다”며 이 같이 밝혔다.  이 총리는 “현대중공업 측으로서는 조선업 불황과 일감 부족에 따른 불가피한 조치였다고는 하지만 조선소가 지역경제나 주민들 생활에 가졌던 의미를 생각할 때 매우 가슴 아픈 조업중단”이라며 “조선소 가동중단으로 인한 조선 협력업체 폐업과 근로자 실직사태 등에 대해 노심초사하고 있다”고 덧붙였다.  이 총리는 “지원 대책은 현장과 긴밀한 소통을 바탕으로 전북·군산지역에 특화된 지원 내용으로 구성됐으면 한다”며 “우선 시급한 중소 협력업체와 근로자 지원대책과 함께 지역주민 생활여건 개선을 위한 방안 등도 추가돼야 한다”고 주문했다. 또 “이번 위기가 전라북도 경제의 근본적인 산업구조 혁신 기회로 전환될 수 있도록 농업이나 건설기계, 친환경자동차 부품 등 대안 산업 육성에도 만전을 다해 달라”고 덧붙였다.  이날 지시에 따라 총리실과 산업부 등 관계부처는 지역 의견수렴을 거쳐 이달 중으로 지원 대책을 확정 발표할 예정이다.  양종석 산업정책(세종) 전문기자 jsyang@etnews.com  [Copyright ⓒ 전자신문 &amp; 전자신문인터넷, 무단전재 및 재배포 금지]"
"전교조, 대정부 투쟁 강도 높이기로  김한주 기자  전국교직원노동조합(전교조) 간부들이 3일 광화문 광장에서 전교조 법외노조 철회를 요구하며 3천 배에 돌입했다.  전교조 중앙집행위원 약 20여 명은 광화문 광장에서 3천 배 돌입 기자회견을 열고 △전교조 법외노조 통보 철회 △교사 노동3권 보장 △교원노조법 개정 △노조 할 권리 보장 △ILO 핵심협약 비준 등을 요구했다.  출처: 김한주 기자  3천 배는 3일부터 오는 14일까지 평일 열흘간 진행된다. 중앙집행위원이 각각 하루에 300배씩 총 3,000배를 채운다. 전교조는 3천 배를 비롯해 청와대 연좌 농성, 광화문 농성 확대 등 강도 높은 투쟁에 나설 계획이다.  전교조는 “새 정부 출범 55일째, 전교조 농성 36일째 전교조 탄압은 멈춰지지 않고 있다”며 “정부 측과의 어떤 만남에서도, 총리와 장관 인사청문회에서도 법외노조를 즉각 철회하겠다는 답변이 들리지 않는다. 청와대에 읍소하는 게 아닌 광장에 호출하려는 것이다. 3천 배가 끝나기 전 광장에서 정부와 만나 이정표를 세울 수 있길 바란다”고 3천 배 취지를 밝혔다.  앞서 전교조와 국정기획자문위원회 사회분과 등 정부 측과 몇 차례 비공식 면담이 있었지만, 전교조는 정부의 법외노조 철회 의지와 계획을 확인할 수 없었다고 주장했다. 따라서 전교조는 지난 29일 중앙집행위원회를 열어, 보다 강도 높은 투쟁을 전개하자는 뜻을 모았다.  이와 관련해 송재혁 전교조 대변인은 3일 과 인터뷰에서 “정부는 비공식 면담에서 지금의 높은 국정 지지율을 훼손당할까 우려하는 것처럼 보였다”며 “또 이낙연 총리의 ‘대법원 판단을 기다려야 한다’는 발언 등 행정부는 기다리란 말만 하는데,  5만 4천 조합원들은 더 기다릴 수 없는 입장”이라고 전했다.  송 대변인은 “또 김상곤 교육부 장관 후보자의 청문회 답변서를 검토해도 원론적인 답변, 듣기 좋은 말만 할 뿐 구체적 계획은 없다”며 “정부는 전교조 문제를 법적 갈등 사항으로만 보는데 정부는 교사의 사용자이며, 문제의 당사자다. 정부는 법적 다툼 없이 노조 통보 한 장으로 해결할 수 있다”고 강조했다.  출처: 김한주 기자  전교조 조창익 위원장은 기자회견에서 “정부 집권 2달이 됐는데, 전교조 문제는 가시권에서 벗어나 불안정한 상태가 계속되고 있다”며 “적폐 청산을 요구하며 타올랐던 촛불 민주주의 광장의 염원을 담아 전교조가 교육 적폐 1호인 전교조 탄압을 직접 해결하고자 한다”고 말했다.  이어 김종선 충남지부장은 “경기도교육청은 오늘(3일) 오전에도 전교조 전임자를 신청한 교사에 대한 징계위원회를 개최했다”며 “지난해 해고된 교사 33명이 거리에서 투쟁하고 있고, 올해 교사 16명의 징계가 본격적으로 시작되고 있다. 새 정부는 박근혜 국정농단 세력이 저지른 적폐를 끌고 가고 있는 꼴”이라고 지적했다.  경기도교육청뿐 아니라 지난 19일엔 세종시교육청도 전교조 조합원을 대상으로 징계위원회를 개최했다. 지난 27일엔 인천시교육청이 전교조 조합원 2명을 두고 징계위원회를 열었지만, 법외노조 취소 소송 대법 판결 이후로 연기했다.  출처: 김한주 기자  이 기사는 정보공유라이선스 2.0 : 영리금지'를 따릅니다."
"- 이낙연 총리부터 고위 공직 후보자 줄줄이 논란  - 靑 “선거캠페인과 현실, 같은 수 없다” 공약 파기 공식화  - 청문 대상 공직 후보자 21명 중 13명이 5대 원칙 위반 의혹  [이데일리 유태환 기자] “병역면탈, 부동산투기, 세금탈루, 그리고 위장전입, 논문표절과 같은 5대 비리 관련자는 결코 고위공직에 오를 수 없게 하겠다. 국민의 의무를 회피하고 면탈하는 것은 자유일지 몰라도 그가 권력과 명예까지 가지게 해서는 안 된다고 믿는다.”  문재인 대통령이 지난 19대 대선 과정에서 줄기차게 강조한 인사 원칙이다. 소위 ‘5대 인사 원칙’으로 불리는 기준으로 지금은 오히려 문 대통령의 발목을 잡는 자충수가 됐다는 평가다.  지난 2일 이데일리 조사결과 문재인 정부 출범 뒤 첫 고위 공직 후보 지명자였던 이낙연 국무총리부터 지난 27일 지명한 박명기 법무부 장관 후보자까지 21명가운데 62%에 달하는 13명의 후보자가 5대 원칙 위반 의혹을 받고 있는 것으로 확인됐다. 21명 가운데 13명이 5대원칙과 관련해 논란이 일고 있는 점을 고려하면 사실상 공약이 파기된 셈이다.  전병헌 정무수석은 이에 대해 국회를 방문해 야3당에 “투기나 이익 목적의 위장전입은 원천적으로 배제하겠다”며 “인사청문회 제도가 도입된 2007년 5월 이후의 위장전입은 원칙적으로 배제하겠다고 약속을 드린다”며 양해를 구했다. 하지만 문 대통령은 후보 시절 5대원칙 기준만 강조했을 뿐 기준점이나 제반 사정 등 세부사항을 언급하지 않았다.  야권은 이를 근거로 김상조 공정거래 위원장과 강경화 외교부 장관이 5대 원칙 중 위장전입과 세금탈루, 부동산투기, 논문표절 등 4개 사항을 위반했다며 청문보고서 채택 자체를 거부했다. 문 대통령은 보고서 채택 기한이 만료되자 절차대로 임명을 강행했고 야당이 이에 강력 반발하면서 ‘상임위 보이콧’에 나서는 등 대치가 이어졌다.  ‘신 부적격 3종 세트’라 불리며 집중공세를 받는 김상곤 사회부총리 겸 교육부 장관·송영무 국방부 장관·조대엽 고용노동부 장관 후보자에 대한 의혹 중 상당 부분도 5대 원칙에 해당된다. 김상곤 후보자는 박사·석사·학술논문을 모두 포함해 250여 곳의 표절 의혹을 받고 있고 송 후보자는 4차례의 위장전입이 도마에 올라 있다.  세 후보자에 비해 야당과 언론의 관심도가 떨어지긴 하지만 김영록 농림식품부 장관, 김은경 환경부 장관, 유영민 미래창조과학부 장관 후보자 역시 각각 2008년 총선 직전 자신이 출마한 지역구로 자녀들을 위장전입시켰다는 의혹과 자신의 저서를 연구용역보고서에 그대로 사용했다는 자기표절 의혹, 위장전입 의혹 등이 제기되고 있다.  청와대는 임종석 비서실장이 지난달 26일 “선거캠페인과 국정운영이라는 현실의 무게가 기계적으로 같을 수 없다”며 사실상 5대 비리 배제 공약을 제대로 지킬 수 없음을 시인했다.  하지만 야권은 인사원칙 위반에 대해 “문재인 대통령이 산적한 국정 현안에 대한 돌파구가 열릴 수 있도록 진솔하고 책임 있는 정치를 펼치길 요청드린다”며 유감표명 등을 요구하고 있고 청와대는 그 가능성을 일축하고 있다. 이에 따라 향후 남아있는 청문 과정에서도 여야의 대립 속에 정국경색이 불가피해 보인다.  유태환 (pok2032@edaily.co.kr)  ＜ⓒ종합 경제정보 미디어 이데일리 - 무단전재 &amp; 재배포 금지＞"
"[한겨레]  주민 1311명, 국무총리에 탄원  인천시장·옹진군수가 조례 개정  공무원에 수당 20만원 지급  섬 주민엔 달랑 5만원 지원  최북단 서해5도 주민들이 2010년 북한의 연평도 포격 사태 이후 섬 주민들의 안정적 정주생활 지원을 위해 ‘서해 5도서 지원특별법’까지 만들었지만 실상은 공무원들에게 잔칫상을 차려준 꼴이 됐다며 시정을 요구하고 나섰다. 김필우씨 등 백령도와 연평도 등 서해5도 주민 1311명은 3일 이낙연 국무총리에게 이런 내용의 탄원서를 보냈다.  서해5도서 주민들은 탄원서에서 “6.25 전쟁 이후 사실상 고립된 상태에서 안보를 위해 희생만 당하며 살아왔고, 2010년 3월 천안함 폭침과 2010년 11월 연평도 포격을 당해 주민들의 정주생활 환경이 더 열악해지자 주민들의 안정적 정주생활 지원을 위해 정부가 ‘서해5도 지원특별법' 제정했다”고 밝혔다. 그러나 인천시장과 옹진군수는 특별법을 근거로 조례까지 개정하여 서해 5도서 근무 공무원들에게 월 20만원의 특지 근무수당을 지급하는 반면 서해 5도를 생활 본거지로 삼고 있는 주민들에게는 공무원 수당의 1/4 수준인 5만원을 지급하고 있다는 것이다.  섬 주민들은 “평균 연봉이 5800만원이 넘는 공무원에게는 ‘5도서가 위험지역이라며 무서워서 근무 못 하겠다’는 말 한마디에 월 20만원의 특수지 수당을 주고, 가구당 연평균 소득이 2천만원도 안 되는 섬 주민들에게 월 5만원의 정주생활지원금을 지급해 위화감을 조성하고 자괴감을 주고 있다”고 주장했다.  주민들은 또 “나라를 지키겠다며 지원 입대하여 목숨을 걸고 5도섬을 지키고 있는 일반 병사에게는 월 5만5천원의 수당을 지급하고, 중령 이하 준사관에게도 월 12만원을, 국가공무원 역시 9만원을 지급하고 있어 5도섬에 거주하거나 근무하고 있는 주민, 군인, 국가공무원, 지방공무원 사이에 형평성 문제도 대두하고 있다”고 지적했다.  주민들은 “이런 행위가 ‘모든 국민은 법 앞에 평등하다. 누구든지 성별·종교 또는 사회적 신분에 의해 정치적·경제적·사회적·문화적 생활의 모든 영역에 있어 차별을 받지 아니한다'는 헌법 정신에 맞지 않는다”며 “차별받지 않는 평등이 실현될 수 있도록 잘못된 정책을 바로잡아 달라”고 호소했다.  한편 정부는 2010년 11월 북한의 연평도 포격 사태 이후 이듬해 2월부터 서해5도에 주소를 두고 6개월 이상 실제로 거주한 주민 1인당 매월 5만원씩 정주생활지원금을 지급하고 있다. 이는 당시 신설된 '서해5도 지원특별법'에 따른 것으로 백령도, 연평도(소연평도 포함), 대청도(소청도 포함) 등 안보 불안을 겪는 서해5도 주민에게 경제적인 지원을 하기 위해 마련됐다. 최초 6개월 거주 조건을 채운 뒤에도 매달 15일 이상 서해5도에 머무른 사실이 확인돼야 지원금을 줄 정도로 자격 조건이 까다롭다. 올해 5월 기준 서해5도에 주소를 둔 전체 주민 9468명 가운데 매월 정주생활지원금을 받는 대상자는 5천명 안팎인 것으로 전해졌다. 김영환 기자 ywkim@hani.co.kr  ▶ 한겨레 절친이 되어 주세요!  [ⓒ한겨레신문 : 무단전재 및 재배포 금지]"
"[헤럴드경제(울산)=이경길 기자]  지역 현안의 국정 정책화와 국가예산 확보를 위한 김기현 울산시장의 광폭행보가 연일 이어지고 있다.  김기현 울산시장은 3일 7월 첫째 주부터 국회를 찾아 김태년 더불어민주당 정책위의장, 이혜훈 바른정당 대표, 기획재정위원회 정병국(바른정당) 의원, 예산결산특별위원회 김기선(자유한국당) 의원 등을 만나는 등 지역 현안챙기기에 숨가쁜 일정을 보내고 있다.  김 시장은 이날 만남에서 문재인 대통령이 제안한 지역공약, 2017년 정부추경, 그리고 울산발전 주요 현안 등을 설명하고 적극적인 지원을 요청했다.  특히, 김태년 의장과의 면담에서 원자력시설 해체종합연구센터 설립, 공공 산재모병원 건립, 지능형 미래자동차 산업육성과 울산외곽순환고속도로 조기 착공의 필요성을 설명하고 집권당의 협조를 강력하게 요청했다.  아울러 ’17년 정부추경 관련 울산시 주요 일자리 사업인 △3D프린팅 전문인력 양성사업 △조선업 퇴직자 전문기술·기능 활용 청년취업 지원사업 △4차산업혁명 맞춤형 전문 기능인력 양성사업 등 조선업 위기 극복을 위한 일자리 창출 지원의 필요성을 강조했고,  새정부의 주요 정책인 △치매안심센터 및 치매안심요양병원 설치 △전기자동차 공용충전인프라 구축 사업이 울산에 대폭 반영될 수 있도록 협의했다.  김 시장은 지난 6월에도 김진표 국정기획자문위원장, 백재현 국회 예산결산특별위원장 및 여야 예결위원, 이낙연 국무총리, 김용진 기획재정부 제2차관 등 주요 정관계 인사들을 만나 울산의 주요 현안사업들이 새 정부에 최대한 반영하기 위해 동분서주했다.  한편 울산시는 ""7월은 국정기획자문위원회의 국정 5개년 계획 발표 및 임시국회의 정부추경 심사를 앞둔 중요한 시기인 만큼, 관계 중앙부처는 물론 정치권 등과 다양한 소통 채널을 지속적으로 구축해 지역 현안사업이 누락되지 않도록 총력을 기울일 예정""이라고 덧붙였다.  hmdlee@heraldcorp.com  - Copyrights ⓒ 헤럴드경제 &amp; heraldbiz.com, 무단 전재 및 재배포 금지 -"
"이낙연 국무총리, 대통령 해외 순방기간 군사대비태세 확립 강조  - 합동참모본부 방문, 군사대비태세 점검 및 군 관계자·장병 격려 -  □ 이낙연 국무총리는 7월 1일(토) 오전, 합동참모본부(서울 용산구)를 방문하여 대통령 해외 순방에 따른 군사대비태세를 점검했다.  * 참석 : 한민구 국방부 장관, 이순진 합참의장, 서주석 국방부 차관 등  ㅇ 이번 점검은 문재인 대통령이 미국 방문에 이어 독일 방문 및 G20 정상회의 참석을 위한 해외 일정을 소화할 예정인 가운데,  ㅇ 우리 군이 북한의 특이동향을 예의주시하면서 경계를 강화하는 등 확고한 군사대비태세를 갖춰줄 것을 당부하기 위해 마련됐다.  □ 이 총리는 연중 24시간 빈틈없는 작전태세를 유지하고 있는 합동참모본부 전투통제실에서 작전부장으로부터 군사대비태세 보고를 받고,  ㅇ 국군장병 모두가 밤낮없이 국가안보를 위해 헌신하고 있는 점에 마음이 든든하다고 하면서 노고를 치하했다.  ㅇ 또한, 대통령께서 현재 미국 방문 중이며 내주에는 G20 정상회의 참석을 위해 다시 출국하시는 만큼, 안심하고 외교활동을 하시는 한편, 국민들도 생업에 전념할 수 있도록 군이 만만의 대비태세를 갖춰줄 것을 당부했다.  □ 한편, 이 총리는 지난 6월 22일(목), 경기도 파주 소재의 육군 1사단 GOP를 방문하여 대비태세 점검과 함께 경계작전 중인 장병들을 격려한 바 있다."
"고시 출신 3명에 그쳐···외시·사시 한명도 없어  【서울=뉴시스】장윤희 기자 = 문재인 정부가 출범 55일만인 3일 1기 내각 구성을 완료했다. 청와대가 이날 공석이었던산업통상자원부와 보건복지부 장관 후보자를 지명한 가운데 이낙연 국무총리와 17개 부처 장관 입각자들의 면면을 살펴보았다.  총 18명 국무위원의 출신 지역을 보면 영남권이 7명으로 38.8%를 차지했다. 이어 호남 출신이 5명, 충청권 3명, 서울·수도권 3명 순이었다. 세부적으로는 ▲영남권 김부겸·김영춘·박능후·백운규·유영민·조대엽·정현백 장관 ▲호남권 이낙연 총리·김영록·김상곤·김현미·박상기 장관 ▲충청권 김동연·도종환·송영무 장관 ▲서울수도권 강경화·김은경·조명균 장관 등이다.  출신 학교는 다양해졌다. 비수도권 대학교를 나온 인사는 22.2%인 4명이었고, 서울권 대학 출신은 14명이었다. 서울대학교가 5명(김부겸·김상곤·박능후·정현백·이낙연)으로 가장 많았고 고려대(김은경·김영춘·조대엽)·연세대(강경화·김현미·박상기) 각각 3명, 국제대(김동연)·건국대(김영록)·부산대(유영민)·성균관대(조명균)·충북대(도종환)·한양대(백운규)·해군사관학교(송영무) 각각 1명이었다.  고위공직자 등용문 중 하나인 고시 출신은 문재인 정부 들어 확연히 줄었다. 고시 출신은 김동연 경제부총리 겸 기획재정부 장관, 조명균 통일부 장관, 김영록 농림축산식품부 장관 등 3명으로 모두 행정고시를 치렀다. 문재인 정부 내각 1기에서 사법시험 출신이 한명도 없다는 점도 눈에 띈다. 박근혜 정부 1기 내각은 18명 중 10명이 고시 출신이었다.  더욱이 강경화 외교부 장관은 비외무고시 출신, 박상기 법무부 장관 후보자는 비사법시험 출신, 송영무 국방부 장관 후보자는 장관 배출이 많았던 육군사관학교가 아닌 해군사관학교를 나와 문재인 정부의 내각 스타일을 보여준다.  여성 인사는 강경화 외교부 장관, 김현미 국토교통부 장관, 김은경 환경부 장관 후보자, 정현백 여성가족부 장관 후보자 등 총 4명이다. 강경화 장관과 김현미 장관은 현 부처의 최초 여성 장관이란 기록을 세웠다. 문재인 대통령은 대선 후보 시절 여성 인물을 30% 이상 내각에 반영하겠다고 밝혔지만 비율을 못 달성하며 정부를 꾸리게 됐다. 문 대통령이 중소기업벤처부 신설을 추진하고 있는만큼 정부조직법 개편안이 국회를 통과하면 여성 장관이 임명될 가능성을 기대해볼 수 있다.  ego@newsis.com"
"【서울=뉴시스】홍세희 기자 = 바른정당은 3일 문재인 대통령이 4명의 장관급 인사를 발표한데 대해 ""4명 중 3명의 후보는 보은인사이자 코드인사""라고 비판했다.  오신환 대변인은 이날 구두논평을 통해 이같이 밝혔다. 오 대변인은 ""백운규 산업통상부 장관 후보자와 박능후 보건복지부 장관 후보자, 이효성 방송통신위원장 후보자는 대선 당시 문재인 캠프에 합류했던 분들로 보은인사""라며 ""특히 이효성 후보자는 노무현 정부 시절 방송위원회 부위원장 출신으로 언론과 방송을 염두한 코드인사""라고 지적했다.  그는 이어 ""이낙연 총리(전남 영광), 김상곤 교육부장관 후보자(광주), 김영록 농림축산식품부 장관(전남 완도), 김현미 국토교통부 장관(전북 정읍), 박상기 법무부 장관 후보자(전남 무안), 김이수 헌법재판소장 내정자(전북 고창), 이효성 방통위원장 후보자(전북 익산) 등 호남일색의 인사""라며 ""국민대통합을 기대하는 국민들의 눈높이에 얼마나 부합하는지도 의문""이라고 거듭 비판했다.  오 대변인은 ""비리종합세트, 자격미달 후보자인 김상곤, 송영무, 조대엽 후보들에 대해서 아무런 입장표명 없이 새로운 장관급 인사를 발표하는 것도 일방통행식 인사""라며 ""바른정당은 국민의 눈높이에 맞춰 도덕적으로나 자질면에서 얼마나 준비된 인사들인지 철저하게 검증할 것""이라고 강조했다.  한편 문 대통령은 이날 산업통상부 장관 후보자에 백운규 한양대 교수를, 보건복지부 장관 후보자에 박능후 경기대 교수를 각각 지명했다. 방송통신위원장 후보로는 이효성 성균관대 명예교수를, 금융위원장 후보에는 최종구 한국수출입은행장을 지명했다.  hong1987@newsis.com"
