"이낙연 도지사는 협약식에서 “전남지역은 최근 투자가 많이 늘고 있고, 오늘 협약한 5개 기업 모두 수요가 있는 분야에 투자하게 돼 기대가 크다”며 ""1차 상품 생산만으로 끝내지 말고 가공, 유통, 기자재 등 연관 산업까지 키워간다면 전남도가 좋은 구매처가 될 수 있도록 노력하겠다”고 말했다.  이어 “전남은 수산물 생산량이 전국에서 가장 많은 52%를 차지하고 있어 수산업은 가장 기대할 만한 분야로 도 예산 중 수산업 분야 예산 증가율이 일자리 창출에 이어 두 번째를 차지하고 있다”며 “도에서는 수산식품 수출단지, 수산기자재 산업 클러스터 조성 등 각종 인프라 구축에 최선을 다하겠다”고 덧붙였다.  신우철 완도군수는 “해조류의 우수성과 가치를 널리 알리고 해조류 산업이 한층 더 성장하는 계기를 마련하기 위해 완도에서 '2017완도국제해조류박람회’를 개최하고 있다”며 “앞으로 해조류, 전복 등 지역 특산물을 통한 적극적 투자유치로 활기찬 지역경제를 만들어가겠다”고 밝혔다.  안병호 함평군수는 “오늘 협약한 업체는 전세계적으로 생산제품을 납품하는 업체로, 세계적으로 최고의 기업이 되도록 함평 군민 모두와 함께 행정 ·재정적 지원을 아끼지 않겠다""고 말했다.  이번 협약은 2017완도국제해조류박람회 성공 개최를 위해 완도에서 이뤄졌으며, 협약식 종료 후 기업 임직원과 시군 관계 공무원 등이 박람회장을 관람했다.  노해섭  기자 nogary@"
"[아시아경제 노해섭 기자]이낙연 전남지사가 21일 오후 강진군 병영면 전라병성에서 열린 강진 전라병영성 축성 600주년기념 제20회 전라병영성축제에 참석, 축사를 하고 있다. 전라병영성은 조선 태종 17년인 1417년에 광주 광산구 옛터에서 강진군 병영면으로 이전했다.  이낙연 전남지사가 21일 오후 강진군 병영면 전라병성에서 열린 강진 전라병영성 축성 600주년기념 제20회 전라병영성축제에서 600주년 화합 줄다리기의 시작을 알리는 징을 치고 있다.  강진 전라병영성 축성 600주년을 기념하는 제20회 전라병영성축제가 21일 오후 강진군 병영면 전라병성에서 열린 가운데 이낙연 전남지사, 강진원 강진군수, 나선화 문화재청장. 박병주 축제추진위원장, 권삼 육군제31사단장 등 참석자들이 풍선날리기를 하고 있다.  강진 전라병영성 축성 600주년을 기념하는 제20회 전라병영성축제가 21일 오후 강진군 병영면 전라병성에서 열린 가운데 나선화 문화재청장, 맨드 브뤼사 네덜란드 호르큼시 관계자 등 참석자들이 600주년 화합 줄다리기를 하고 있다.  사진제공=전남도"
"목포신항서 미수습자 가족 면담…""진상조사도 철저히""  희생자 유가족 ""黃대행 면담 회피했다"" 항의도  (서울=뉴스1) 김수완 기자 = 황교안 대통령 권한대행 국무총리가 1일 전남 목포신항 세월호 인양 현장에서 세월호 참사 미수습자 가족들을 만나 미수습자 수습과 철저한 진상조사를 재차 약속하면서 잠시 눈시울을 붉혔다.  세월호 참사 미수습자 유가족들은 이날 세월호 인양 현장을 점검하기 위해 목포신항을 방문한 황 권한대행을 만난 자리에서 ""배 안에 들어가 열손가락으로 파서 (미수습자를) 찾고 싶은 심정""이라며 ""5일까지는 꼭 육상 거치를 해주셨으면 좋겠다""고 호소했다.  또 다른 유가족은 ""배는 보이는데 저희가 할 수 있는 게 없다""며 ""저 안에 있는 9명의 가족을 찾아달라""고 말했다.  날씨가 하루하루 더워지고 있는 점을 걱정하면서 ""신속하게 미수습자를 찾아달라""고 요청하는 유가족도 있었다.  이에 대해 황 권한대행은 ""정말 안타까운 마음을 갖고 미수습자를 하루라도 빨리 찾으려고 애를 쓰고 있다""며 ""여러번 말씀드렸다시피 미수습자 수습이 정부의 최우선과제이며 선체 조사는 물론이고 세월호 역추적을 해서 혹시라도 있을 부분에 대해 꼼꼼히 챙기겠다""고 말했다.  또 ""빠른 시간 안에 미수습자 수습이 되고 그것이 되고 나면 진상조사 남아 있는 부분들을 선체조사를 통해 철저히 밝히겠다""며 ""어머니, 아버지의 한이 남지 않도록 최선을 다하겠다""고 강조했다.  황 권한대행은 미수습자 가족과의 면담 도중 ""다행히 선박이 인양됐으니 최선을 다하겠다. 얼굴을 뵈니 말이 안 나온다""며 눈시울을 붉히기도 했다.  미수습자 유가족들은 이날 면담에서 식사할 곳이나 씻을 장소가 마땅치 않다는 점, 선체 접안 지역이 군사보호지역인 만큼 외부 출입이 통제돼 있어 사람을 만나기가 어렵다는 점 등의 고충을 황 권한대행에게 얘기했다.  이날 면담 자리에 함께 한 이낙연 전남도지사는 ""식당과 만남의 장소를 만들고 있지만 조리 도구 등을 옮겨오는 데에 시간이 좀 걸린다""고 답했다.  한편 이날 목포 현장에서는 세월호 희생자 가족들이 면담을 회피했다며 황 권한대행을 향해 거세게 항의하는 일이 벌어지기도 했다.  희생자 유가족들은 황 권한대행이 목포신항을 떠난 직후 기자회견을 열고 ""황 대행이 (면담) 약속을 한 건지 아닌지는 모르겠지만 경비담당자라는 분들에게 황 대행이 곧 나올 것이라는 약속을 기다리고 있었다. (우린) 가족 대표를 선정해 정숙하게 기다리고 있었고 구호를 외치지도 않았다""며 ""그런데 저희에게 온 것은 황 대행이 아니라 경찰병력이었다""고 주장했다.  또 ""경호 담당자라는 분은 (황 대행이) 일정상 바빠서 이동했다는 해명을 내놨다. 우리와의 약속을 애초에 없었던 것""이라고 지적했다.  이에 대해 황 권한대행 측은 당초 세월호 희생자 가족들과의 만남도 예정돼 있었지만 면담을 약속한 희생자 가족이 현장에 오지 않아 성사되지 못했다고 해명했다.  또 미수습자 가족과의 면담 중 희생자 가족 일부가 밖에 와 있었으나 정식 면담 요구는 없는 상황이었으며 황 권한대행이 현장을 떠난 이후 집행위원장 등 가족 몇 명이 정문에 와 있다는 연락을 들었다고 덧붙였다.  abilitykl@  ), 무단 전재 및 재배포 금지]"
"[머니투데이 세종=정혁수 기자] [1일 오전 전남 목포신항 세월호 선체 인양 현장 방문]  황교안 대통령 권한대행이 1일 오전 세월호 선체가 접안된 전남 목포신항 세월호 선체 인양 현장을 방문했다.  황 권한대행은 현장수습본부에서 김영석 해수부장관으로부터 인양 진행상황에 대해 보고를 받고 미수습자 가족, 인양업체, 해경 등 현장 관계자들을 격려했다. 현장에는 이낙연 전남지사, 박흥률 목포시장, 이철조 세월호인양추진단장, 고명석 서해해양경비안전본부장, 지희진 대통령비서실 해양수산비서관 등이 배석했다.  황 권한대행은 ""세월호 선체를 목포신항에 육상 거치하는 작업을 빈틈없이 진행해 선체가 안전하게 육상으로 옮겨질 수 있도록 최선을 다해달라""며 ""후속조치가 신속하게 진행될 수 있도록 선체 안전진단, 진입로 확보 등 준비작업을 철저히 하고, 인양작업이 안전사고 없이 마무리될 수 있도록 만전을 기해달라""고 말했다.  황 권한대행은 ""앞으로의 최우선 과제는 미수습자 수습""이라고 강조한 뒤 ""9명의 미수습자가 모두 가족의 품으로 돌아갈 수 있도록 세월호 선체는 물론 사고해역과 그 주변에서도 신속하고 철저한 수색이 이루어져야 한다""고 지시했다.  또 ""정부는 미수습자 수색, 신원확인 및 장례지원 등 수습과정에 예우와 품격을 갖춰 진행하고 가족들에 대한 지원에도 만전을 기해달라""고 당부했다.  황 권한대행은  ""해수부는 세월호 선체조사위원회가 신속한 선체조사를 수행할 수 있도록 노력해 달라""며 ""세월호 인양이 '안전한 대한민국 정착'의 계기가 되고, 세월호 사고 희생자 가족의 치유와 화합으로 나아가는 디딤돌이 되기 바란다""고 밝혔다.  황 권한대행은 현장수습본부에서 인양 진행상황을 보고받은 뒤, 가족거주동을 방문해 미수습자 가족을 만나 위로하고, 미수습자 수습을 우선적으로 추진하겠다고 말했다.  이어 세월호 선체가 접안된 철재부두로 이동해 세월호 인양추진단장으로부터 향후 진행될 하역 및 육상거치 과정에 대해 보고를 받고 세월호 선체를 둘러봤다.  세종=정혁수 기자 hyeoksooj@."
"[아시아경제 노해섭 기자]해남군 박동인, 최병남, 최옥림, 한안자씨가 전남도가 선정한 ‘전남농업을 빛낸 사람들’ 70인에 선정됐다.  전남농업을 빛낸 사람들은 1945년 이후 전남농업사 70년 동안 농정분야, 영농농업전문기술분야, 농산물 가공유통분야 등 10개 분야에 걸쳐 혁신적인 성과를 이룬 70명의 전남도민이 선정됐다.  박동인씨(해남읍 ·64)는 바닷가 자생식물인 함초를 연구, 국내 최초로 함초 식품화 및 육상재배에 성공해 함초에 대한 인식확산과 산업화의 활로를 열었다. 2004년 신지식인상, 2011년 농림부장관상을 수상했으며, 현재 해남군의회 의원으로 활동 중이다.  최병남씨(해남읍 ·68)는 2009~2012년 해남미맥연구회장으로 우리밀과 유색보리 등의 재배 확산과 우량종자 증식에 선도적인 역할을 해왔다. 현재 농촌진흥청 식량과학원 현장명예연구관으로도 활동 중이다.  최옥림씨(계곡면 ·77)는 전남 무형문화재 제25호로 지정된 해남 진양주 전수자이다. 조선시대 궁중에서 어주로 빚던 전통 민속주인 진양주는 지난 2009년 프랑스에서 개최된 OECD 각료회의에서 만찬 건배주로 채택된 바 있으며, 2012년 여수엑스포 공식만찬주 지정 등 세계적으로 인정받고 있다.  한안자씨(황산면 ·77)는 이론과 실제를 겸비한 전통장류의 명인으로 우리나라 전통장을 개량한 동국장을 개발, 표준화 하는 등 종가음식 전통을 문화의 수준으로 끌어올렸다는 평가를 받고 있다. 2011년 농림식품부 전통식품 명인에 지정됐으며, 전통 장류 제조업체인 귀빈식품을 운영하고 있다.  한편 전라남도는 선정된 농업인들에 대해 3월 31일 도청 왕인실에서 인물선 책자 및 공로패를 전달했다.  노해섭  기자 nogary@"
"[아시아경제 노해섭 기자]이낙연 전남지사가 31일 오후 목포신항을 방문, 주동식 도청 도민안전실장 안내로 세월호가 정박된 현장을 둘러보고 있다. 이날 오후 세월호는 반잠수식 선박 화이트마린호에 선적돼 목포신항에 도착했다.  이낙연 전남지사가 31일 오후 목포신항 세월호 수습 대책본부에서 윤학배 해양수산부 차관과 이야기를 나누고 있다.  이낙연 전남지사가 31일 오후 목포신항을 방문, 주동식 도청 도민안전실장 안내로 세월호가 정박된 현장을 둘러보고 있다.  사진제공=전남도"
"황교안 대통령 권한대행은 1일 세월호 선체 인양 현장을 방문해 “최우선 과제는 미수습자 수습”이라고 밝혔다.  황 권한대행은 이날 오전 9시 쯤 세월호 선체가 접안된 전남 목포신항의 현장수습본부를 방문해 “9명의 미수습자가 모두 가족의 품으로 돌아갈 수 있도록 세월호 선체는 물론 사고해역과 그 주변에서도 신속하고 철저한 수색이 이루어져야 한다”며 이 같이 말했다.  이어 황 권한대행은 “미수습자 수색, 신원 확인 및 장례 지원 등 수습 과정이 예우와 품격을 갖춰 진행되도록 해야 하고 가족들에 대한 지원에도 만전을 기해야 한다”고 했다.  황 권한대행이 2015년 6월 국무총리가 된 뒤 세월호 현장을 찾은 것은 이번이 처음이다. 황 권한대행은 법무부 장관 재직 당시 세월호 사건을 수사하는 광주지검에 외압을 행사했다는 의혹이 제기된 바 있다. 황 권한대행은 지난 해 12월21일 국회 대정부질문에서 이러한 의혹에 대해 “전혀 사실이 아니다”고 부인했다.  황 권한대행은 이날 방문에서 신속하고 철저한 선체 조사를 당부하며 “세월호 인양이 ‘안전한 대한민국 정착’의 계기가 되고, 세월호 사고 희생자 가족의 치유와 화합으로 나아가는 디딤돌이 되기를 바란다”고 말했다.  황 권한대행은 현장수습본부에서 인양 진행 상황을 보고받은 뒤 컨테이너로 만들어진 가족거주동을 방문해 허다윤양의 어머니 박은미씨 등 미수습자 가족 8명과 만났다. 미수습자 가족들은 “배는 보이는데 저희가 할 수 있는 것이 없다”, “지금이라도 손으로라도 배를 파서 가족을 찾고 싶다”는 안타까운 심정을 쏟아냈다. 일부 가족들은 “국민의 안전과 생명, 재산에 대해 (정부가) 조금 더 빨랐으면 어땠을까 소망을 갖고 있다”며 세월호를 침몰 3년만에야 끌어올린 것에 서운함을 드러내기도 했다.  황 권한대행은 “정말 안타까운 마음을 가지고 미수습자를 하루라도 빨리 찾으려고 애쓰고 있다. 다행이 선박이 인양이 돼서, 최선을 다하겠다. (여러분) 얼굴을 뵈니까 말이 안 나온다”며 울컥하는 표정을 지었다.  하지만 이날 사망이 확인된 세월호 희생자 유가족들은 황 권한대행을 만나지 못했다. 황 권한대행과 미수습자 가족들의 만남이 이뤄지는 동안 일부 희생자 유가족들이 컨테이너 밖에서 황 권한대행을 향해 “어딜 들어와, 여길 어딜 들어와”라고 항의하기도 했다.  황 권한대행이 세월호 선체 시찰까지 한 시간 가량의 방문 일정을 마치고 오전 10시 쯤 버스에 올라 떠나려 할 때 더불어민주당 박주민 의원과 세월호 희생자 유가족 30여명 출구를 막고 시위를 했다. 황 권한대행 일행이 탑승한 버스는 다른 출구를 통해 목포신항을 떠났다.  국무총리실 관계자는 “오늘 원래 미수습자 가족 뿐 아니라 희생자 가족도 만날 예정이었고, 희생자 가족 세 명에게 이를 위해 (출입)비표를 발급했다”며 “하지만 그 세 분이 오늘 현장에 안 오셔서서 만나지 못했다”고 밝혔다. 이어 “(목포신항을) 나갈 때 차를 막던 유가족들은 너무 격앙되어 있어서 대화를 하기 어렵다고 판단해 만나 인사드리지 못하고 돌아갔다”고 했다.  황 권한대행이 미수습자 가족들과 면담할 때 컨테이너 밖에서 항의했던 희생자 유가족들을 만나주지 않은 것에 대해 총리실 측은 “그 때는 정식 면담요구는 없는 상태였다. 권한대행이 출발할 때쯤 유가족 측에서 집행위원장 등 몇 명이 면담을 위해 정문에 와 있다고 연락해왔다. 그러나 그 때는 이미 권한대행이 탄 버스는 출발한 상황이었다”고 설명했다.  ▶ 경향신문 SNS ), 무단전재 및 재배포 금지"
"17일 2017국제농업박람회 사무국과 홍보 ·입장권 예매 등 업무협약  [아시아경제 노해섭 기자]공무원노동조합 전남연맹(위원장 문삼재 ·보성군)이 2017국제농업박람회 성공 개최를 위해 적극 협력키로 했다.  2017국제농업박람회사무국은 17일 오전 전남도청에서 이사장인 이낙연 전라남도지사와 문삼재 위원장, 전남연맹 소속 시군 위원장들이 참석한 가운데 업무협약을 체결했다.  협약에 따라 공무원노조 전남연맹은 전국연맹 산하기관을 대상으로 박람회 홍보활동, 조합원 복지 증진 및 온정사업 추진 시 박람회와 연계, 관람객 45만 목표 달성을 위한 입장권 사전 예매에 적극 협력할 계획이다.  또 국제농업박람회사무국은 공무원노조의 각종 회의 시 농업 ·농촌의 어려운 현실을 타개하고 농업인의 소득 증대 기회가 될 2017국제농업박람회의 성공 개최 필요성을 홍보하고, 노조활동에도 적극 협조키로 했다.  이낙연 도지사는 “반년쯤 뒤에 열릴 국제농업박람회를 공무원노조 전남연맹이 도와주겠다고 하니 천군만마를 얻은 것처럼 든든하다”며 “큰 결심을 해준 문삼재 위원장과 전남도청노조의 장승규 위원장을 비롯한 각 시군 노조위원장께 감사드린다”고 밝혔다.  올해로 국제행사 3회째인 2017국제농업박람회는 ‘농업이 세상을 바꾼다’라는 주제로 오는 10월 26일부터 11월 5일까지 11일간 나주 소재 전남농업기술원과 빛가람혁신도시 일원에서 열린다. 민간단체와 함께 하는 차별화된 행사로서 국제행사의 입지를 견고히 하는 계기가 될 전망이다.  노해섭  기자 nogary@"
"국가 수행사업으로 추진할 지자체 성공정책 지속적 제공돼야…  [김대원 기자(=전남)]  이낙연 전라남도지사는 17일 “100원 택시 등 복지정책을 비롯해 일자리, 출산율 제고, 저소득층 아이 학력 보강, 서민 가계부채 부담 완화 등 지방이 중앙정부보다 잘 할 수 있는 분야의 정책을 전남이 전국에 발신해나가자”고 강조했다.  이 지사는 이날 오전 도청 서재필실에서 열린 실국장 토론회에서 “전라남도가 성공적으로 시행하고 있는 100원 택시에 대해 최근 한 유력 대선 후보가 국가 사업으로 수행하겠다고 발표했다”며 “이것이 바로 정책의 발신”이라고 밝혔다.  100원 택시 사업은 이 지사의 복지 분야 대표 공약 가운데 하나로 오지벽지 도민들의 이동권을 보장, 농어촌 사회에 활기를 넣고 작은 지역 경제에 활력을 넣는데 도움이 되는 정책으로 전국 시도지사들 사이에서 평가받은 바 있다.  이 지사는 “지방에서 작아 보이는 정책을 시행하지만 그 정책이 좋아 중앙 또는 전국에 발신돼 국가 정책에 변화를 가져오는 것은 대단히 자랑스러운 일이고, 이런 사례들이 더 나오길 바란다”며 “중앙정부보다 지방이 더 잘 할 수 있는 사업이나, 지자체가 해야 더 어울리는 사업, 지자체가 시작하기에 더 용이한 사업들을 찾아 전남이 발신해나가자”고 당부했다.  이 지사는 이어 “출산율 제고정책의 경우 어려운 일이지만, 가임기에 있는 귀농·귀촌·귀어 여성들은 농어촌에서 아이 낳는 것에 더 긍정적일 가능성이 높다”며 “아이들이 어려서부터 학원 다니고 경쟁에 내몰리기보다는 흙밭에서 뛰어노는 것도 좋다고 생각할 수 있기 때문에 이들과 서로 소통해 아이를 낳고 싶다는 생각을 확고히 해주거나 작은 인센티브를 주거나 하면 출산율 제고 효과가 높을 수 있다”고 말했다.  이 지사는 “정부가 올해 선정한 수산업경영인 1206명 가운데 전남 수산인이 46%나 되고, 특히 30대는 전남이 무려 52%, 20대 미만은 45%를 차지했다”며 “전남 수산업에 젊은피가 대거 들어온 것은 굉장히 반가운 소식으로, 이들이 지금 꿈꾸는 그대로를 이루고, 수산업에 전념하길 잘 했다고 생각할 수 있도록 정책적으로 배려해주길 바란다”고 밝혔다.  또한 이 지사는 “이번 신규 수산경영인들을 비롯해 수산업을 공부하는 전남지역 대학생들이나 관심 있는 학생들, 가능하면 초·중고생까지 완도국제해조류박람회를 둘러보도록 하면 좋겠다”며 “해조류 관람은 여느 박람회보다 재밌기도 할 것이고, 특히 시대가 발전하고 오래 살수록 식생활에서 해조류 비중이 점점 커질 것이므로 본인의 진로를 생각하는 데 의미가 있을 것”이라고 덧붙였다.  이 지사는 또 “수산업 가운데서도 김 산업의 경우 1970년대 이후 다시 부흥기가 오면서 지난주 목포 대양산단에 4개 관련 기업이 투자협약을 하고, 최근 수도권에서 신안으로 이전해온 김 가공회사가 전남에서 수출탑을 받기도 했다”며 “이는 전남해양수산과학원이 ‘슈퍼김’을 개발 보급한 결과로, 미국, 유럽, 중국 등 국내외적으로 김 소비가 늘고 있기 때문에 먼 미래를 봤을 때 수산업경영인이나 학생들이 해조류박람회를 다녀봤으면 좋겠다”고 다시 한 번 강조했다.  김대원 기자(=전남) ( 무단전재 및 재배포금지  기사제보 jebo.pressian.com"
주민들과 소통하는 자리에서는 화전놀이터 진입로 토사 유출 방지 시설과 김 양식어장 어업면허 확대 등 지역민의 다양한 의견과 애로사항을 귀담아 들었다.  이 지사는 이 자리에서 “주민들께서 한 집 한 집 꿈에서 본 듯한 꽃밭을 가꾸고 있어 놀랐다”며 “손죽도는 먼바다 한복판에 있는 섬이어서 정말로 섬을 사랑하는 분들이 찾게 될 것이므로 더 아름답게 가꾸고 따뜻한 마음으로 맞아야 한다”고 말했다.  노해섭  기자 nogary@
"팽목항·안산 등 추모제…목포신항선 온전한 수습 기원  희생자 위한 부활절 예배도…정부 ""안전체감도 높일 것""  정부는 정부서울청사 별관 대강당에서 '제3회 국민안전의 날 국민안전 다짐대회'를 열고 안전한 나라 만들기를 약속했다.  황교안 대통령 권한대행 국무총리는 대회사를 통해 ""정부는 앞으로 사고 우려가 있는 안전 사각지대를 선제적으로 발굴해 철저히 대비함으로써 국민의 안전체감도를 높이는 데 주력하고 국민의 삶과 직결된 생활안전, 시설안전, 산업안전 등 분야별 안전대책을 차질 없이 추진해 나가겠다""고 밝혔다.  (박성우 이태수 장아름 이우성 강영훈 윤태훈 김기훈 강병철 고동욱 최종호 기자)  zorba@yna.co.kr"
