"농축산 ·관광 ·건설 업무보고 …남도문예 르네상스?안전 전남 집중  [아시아경제 노해섭 기자]전라남도는 10일 이낙연 지사와 정책자문위원 등 외부 전문가가 참석한 가운데 농축산, 관광, 안전?건설 분야 새해 업무계획 보고를 실시했다.  보고회에서 농림축산식품국은 농업이 미래산업으로 발돋움할 기반 마련을 위해 ▲유기농 중심의 친환경농산업 육성 ▲저비용 ·고소득 농업 생산 기반 구축 ▲활력과 온정이 넘치는 농업 ·농촌공동체 실현 등을 핵심 과제로 추진키로 하고 이를 위해 1조 659억 원을 투자한다고 밝혔다.  전국 최초로 기초자치단체(구례군) 전체를 ‘친환경농업지구’로 선포하고 유기농 생태마을 육성 등 차별화된 친환경농업 육성정책을 추진해 친환경 인증면적을 지난해 3만 7천ha에서 4만 2천ha(유기농 7 ·무농약 35)로 늘릴 계획이다.  농식품산업 육성 및 수출 기반 강화를 위해서는 비교우위 농산물을 적극 발굴해 지역전략식품산업으로 육성하고 인구 ·가구 형태 변화에 따른 가공 농식품 개발과 새로운 부가가치를 창출하는 6차산업을 계속 확대할 계획이다. 여성농업인의 문화 ·복지활동 기회 확대를 위한 ‘행복바우처’시책과 농번기 일손 부족 문제를 돕기 위한 ‘농촌인력지원센터’를 올해 처음 운영하고, ‘마을공동급식’과 ‘소형비닐하우스 지원’은 지난해보다 확대한다.  브랜드시책인 ‘숲 속의 전남’만들기는 기후변화에 대비 난대숲과 경제숲 조성을 확대하고, 축산 분야는 육지부 유일의 구제역 청정지역을 유지하면서 현재 피해가 늘어나는 고병원성 AI를 철저한 방역으로 조기 종식시킨다는 방침이다.  농업기술원은 주작목별 생산비 8% 절감 기술 개발 보급, 손쉬운 유기재배 기술 실용화, 생산성 향상을 위한 신품종 육성 보급, 경영 역량을 갖춘 전문 농업인력 양성을 위한 추진전략을 제시했다.  이를 위해 ▲농축산물 생산비 절감 기술 개발 ·보급 ▲저비용 유기농업 실천기술 개발 ·확산 ▲현장 체감형 농업정보 수집 ·이용 기능 강화 ▲신품종 육성 ▲고소득 틈새작물과 1시군 1특화작목 육성 ▲부가가치 향상을 위한 가공기술 개발 ▲기후변화 대응 기술개발 등을 추진한다. 한국전력과 공동으로 에너지 자립형 스마트팜 모델도 개발, 보급할 계획이다. 10월 말에는 ‘농업이 세상을 바꾼다’라는 주제로 국제농업박람회를 개최한다.  관광문화체육국은 수서발고속철 등 개선된 접근성을 활용, 남도명품길과 테마여행길 등 관광콘텐츠를 보강하고 목포?신안 등 서남권 관광 활성화에 나선다.  예향 남도의 위상 제고를 위한 ‘남도문예 르네상스’프로젝트도 본격 추진한다. 2018년 국제수묵화 비엔날레 국제행사 승인 등 개최를 준비하고 호남 3대 전통정원을 중심으로 새로운 정원문화를 창출하는 한편 종가문화 자원 전승 및 활성화, 바둑박물관 건립 등 선도사업을 추진한다.  전국체전 10위 달성을 위해 체육 꿈나무 관리 ·육성 시스템을 구축하고, 우수 선수 영입 및 전략종목 확대 ·고득점을 위한 지원에 나선다. 목포권 전국체육대회 유치를 위해 2만 명 규모의 종합경기장 건설비 국고 확보에도 나선다.  모터스포츠담당관실은 국내외 모터스포츠 대회 개최를 포함해 경주장 신규 콘텐츠 개발과 시설 확충을 통해 가동 일수 285일을 달성한다는 목표다. 카트장 주변 캠핑장, 야구장 이외에 족구장, 농구장을 신설해 다목적 여가공간을 제공하며, 녹지공간을 확대해 자연친화적 휴식공원으로 활용키로 했다.  도민안전실은 안전하고 행복한 전남 만들기 안전시책을 다양하게 추진한다. 선진 안전문화가 뿌리내린 전남을 만들기 위해 모든 재난사고에 초동단계부터 상황관리 및 자동지원시스템을 가동하고, 대외창구역할을 담당한다. 재난취약계층인 어르신을 대상으로는 찾아가는 ‘안전학당’도 운영한다.  재난사고 예방관리 역량 강화를 위해 재난관리시설 5천942개소를 정기 점검하고, D등급 시설 33개소 중 16개소를 올해 해소한다는 방침이다. 자연재해에 강한 전남을 만들기 위해 연중 재난재해 예방관리시스템을 가동하고, 재해예방사업 154지구와 지방하천정비사업 35지구를 정비할 계획이다.  건설도시국은 철도, 공항, 도로 건설 등 광역교통망 확충에 집중할 계획이다. 호남고속철도 2단계 중 광주 송정∼고막원 구간은 2018년 완공할 목표로 추진하고, 무안국제공항 경유 노선이 조속히 확정되도록 최선을 다할 계획이다.  남해안철도(보성∼목포)는 2020년 준공을 목표로 하고, 경전선(광주∼순천 ·광양∼진주)과 함께 전철화사업이 동시에 이뤄지도록 하며, 전라선(익산∼여수) 고속철도, 서울~제주 간 해저고속철도, 서해안(목포~군산)철도와 무안국제공항을 서남권 공항으로 육성하는 정책은 2017 대선공약에 반영토록 할 방침이다.  흑산공항은 2020년 개항토록 관련 절차를 마무리하고, 광주~완도 간 고속도로 중 광주~강진 성전 구간은 상반기에 착공하면서 잔여 구간인 강진 성전∼해남 남창 구간도 국가기간교통망계획에 반영되도록 정부와 협의할 계획이다. 연륙 ·연도교 사업은 압해∼암태 새천년대교 등 10개 교량에 2천206억 원을, 국도 ·국가지원지방도 ·지방도 정비사업은 63개 지구에 3천938억 원을 투입한다.  소방본부는 화재 안전지수 지속 개선, 119구조대 인명구조 집중, 소방서 및 119구조대가 설치되지 않은 군지역에 안전수혜 균등 제공을 위한 소방 인프라 확충 등을 통해 안전 여건을 높여나갈 방침이다.  주요 시책사업으로 ▲농 ·어촌  ·홍보마을’시범 운영 ▲비응급환자 이송 ‘전담구급대’발대 ▲안전전남 환경조성을 위한 ‘숙박시설 안전인증제’▲도정 시책추진 파트너 ‘소방 서포터즈’운영 등 선제적 예방안전 정책 추진에 대응역량을 집중할 계획이다.  노해섭  기자 nogary@"
"‘CU Again 7만2천’ 축제 개최  “조선대학교 건학 100년의 기틀을 다지는 계기를 만들겠습니다.”  조선대는 10일 교내 해오름관 대강당에서 ‘CU Again 7만2천 비전 페스티벌’을 개최했다. ‘CU Again 7만2천 프로젝트’는 조선대의 영문 약자로 1946년 조선대 설립 당시 도움을 준 7만2000명을 상징화한 것이다. 지난해 9월 취임한 강동완 총장의 공약사업으로, 이 프로젝트로 대학발전기금을 조성하고 인적 네트워크를 구축하는 게 취지다. 강 총장은 ‘CU Again 7만2천 프로젝트’의 취지를 설명하고 ‘아시아 최고 대학 르네상스’ 비전을 선언했다.  이어 고은 시인과 박원순 서울시장, 박인구 동원그룹 부회장, 올림픽 금메달리스트 기보배 선수 등 다양한 인물들의 축하 영상 메시지가 소개됐다.  프로젝트를 추진할 ‘CU Again 7만2천위원회’는 강 총장이 추진위원장을 맡고 이낙연 전남지사, 윤장현 광주시장, 임명규 전남도의장, 이은방 광주시의장, 김상열 광주상공회의소 회장, 최상준 광주경영자총협회장, 이주현 조선대학교총동창회장이 공동위원장을 맡았다.  ‘CU Again 7만2천 프로젝트’가 가동되면서 고액 기탁자가 줄을 잇고 있다. 이기상 대호전기 대표이사는 1억5000만원을 현물로 기탁했다. 이 기부금으로 교내 서석홀 4층 대강당을 리모델링한다. 오는 2월25일 공사가 끝나면 서석홀 대강당을 ‘대호전기홀’로 부르기로 했다.염홍섭 ㈜서산 회장과 이민수 ㈜동양건설 대표이사, 조성희 싸이버테크㈜ 대표이사가 각각 1억원을 기탁했다. 조선대치과병원의 김수관 치과병원장과 직원이 6880만원을 기부했다.  광주=한현묵 기자 hanshim@segye.com  ⓒ 세상을 보는 눈, 글로벌 미디어  세계일보"
"이 지사 지지도 상위권 불구 청렴도는 왜? ""지사님 무서워서 말도 못해요""  [광주CBS 박준일 기자]전남도정이 이낙연 지사 취임이후 직무수행 지지도는 줄곧 상위권을 유지한 반면 청렴도는 전국 16개 광역시도 가운데 꼴찌라는 불명예를 안 은지 한달이 지났으나 그 원인과 처방에 대해서는 서로 다른 목소리가 나오고 있다.  물론 직무수행지지도 평가는 전 도민을 대상으로 한 것이고 청렴도 조사는 외부 민원인과 내부 공무원, 전문가 집단이 대상이어서 조사기법에서 크게 다르기 때문에 결과도 다를 수 있음에도 도민들에게는 충격이다.  ◇ 이 지사 개인 지지도는 상위권  이 지사는 2년 반 동안 각종 여론조사 결과 전국 17개 시도지사 가운데 직무수행평가에서 3∼5위를 차지하며 비교적 상위권을 유지하고 있다.  이 지사는 여론조사전문기관인 리얼미터의 월간 정례 광역자치단체장 평가에서 지난해 내내 잘하고 있다가 50∼60%를, 잘못하고 있다가 16∼20%로 긍정평가가 부정평가보다 2배 이상 높았다.  특히 지난해 2월∼4월 조사까지 3개월 연속 최상위권인 3위에 오르는 등 취임이후 개인 지지도는 50%를 웃돌면서 전남도민들로부터 직무수행 평가가 합격점을 받았다.  한국갤럽이 지난해 세종시를 제외한 16개 시도지사 직무 수행지지도 조사에서도 상하반기 모두 잘하고 있다 55%, 잘못하고 있다 17%로 5위를 차지했다.  조금 다른 평가도 나온 여론조사도 있다. 문화일보와 한국지방자치학회가 지난 7월부터 연말까지 약 6개월간 국내 최초로 실시한 16개 광역자치단체장에 대한 종합평가에서 전남은 B로 10위를 차지했다.  이처럼 여론조사 기관의 조사기법에 따라 차이가 있지만 이 지사의 직무수행 평가는 비교적 성공적 도정수행이다.  ◇ 왜 청렴도가 전국 꼴찌?  그러나 이 지사에 대한 평가가 아닌 전남도정의 청렴도에서는 얘기가 달라진다.  지난해 12월 국민권익위원회가 발표한 전국 공공기관 청렴도 종합평가에서 전남도는 세종시를 포함한 17개 시·도 가운데 17위라는 혹독한 평가를 받았다.  세부적으로 들여다보면 공사와 용역, 보조금 지원, 인하가 관련 민원인 599명을 대상으로 한 외부 청렴도는 10점 만점에 6.97로 17개 시·도 중 최하위로 공사용역 관리감독 분야에서 금품과 향응, 편의 제공 등 부패가 심각한 것으로 나타났다. 특히 농축산과 도로건설, 환경 분야에서 5점대로 매우 낮았다.  도 산하 공무원 200명을 대상으로 한 내부청렴도도 조직 내 인사와 예산집행, 업무지시의 공정성 등 업무청렴 평가에서 7.60으로 14위에 그쳤으며 그나마 출입기자와 퇴직 공무원, 자문교수 등 450명을 대상으로 한 정책고객 평가에서 6.41로 7위를 차지했다.  전남도는 이 지사 취임이후 2013년 13위, 2014년 13위, 지난해 16위에 이어 최하위라는 오명까지 쓰게 된 것이다.  이 같은 청렴도 꼴찌는 직설적으로 아직도 전남도정 곳곳에서 비리가 많다는 얘기다, 그 진실을 드러내진 않지만 각종 인허가 관련 금품이 제공되고 인사가 투명하지 않다고 생각하는 공무원이 많다는 얘기다.  전남도는 2016년 청렴도 전국 최하위 평가에 대한 첫 반응에서 ""이낙연 지사는 실천과 전개를 통해 잘 해오고 있으나 결과가 참담하다. 부패요인을 발본색원 하겠다""고 밝혔다.  그러나 직원들의 거센 반발이 이어지자 이 지사가 직접 나서 ""지사는 잘 하려 했는데 직원들이 잘못해 이런 결과가 나왔다는 인식은 옳지 않다""고 말했다.  이 지사는 ""직원들께서 각자의 위치에서 최선을 다했다는 것을 잘 안다""며 ""잘못도, 책임도 저에게 있다. 도민 여러분과 도청 직원 여러분께 죄송스럽다""고 밝혔다.  또 ""공정한 인사평정과 합리적 범위의 순환근무 제도도입, 실·국장들의 권한과 책임강화, 주말근무 최소화 등 직원들의 마음을 더 세심하게 헤아리겠다""고 밝혔다.  ◇ 직원들 자성 불구, 이 지사의 '불통' 비판  청렴도 전국 꼴찌 발표이후 도청 직원들이 한번쯤 읽었을 법 한 노조게시판 글은 깊은 자성과 자괴감이 묻어난다. 그리고 이 지사와 보직 간부들을 향한 원성으로 이어졌다.  ""부패요인을 발본색원 하신다구요. 인사를 직원이 합니까. 계약을 직원이 합니까. 도 간부공무원들의 근평 문제는 누구나 다 아는 사실이다""며 청렴도 추락의 1차적 책임에서 이 지사와 보직간부들이 결코 자유로울 수 없다는 얘기다.  ""백약이 무효라는 비아냥을 듣고 있다. 심지어 팀원들끼리 소통을 위한 식사도 못하게 하는 등 거의 팀 해체 수준이다. 우리에게 부정부패의 DNA가 있는 것일까. 그건 아니라고 믿고 싶다.  우리 주위에 부패요인이 잔존하고 있는 것은 아닌지 둘러보자. 평소 형님 동생처럼 지내서 정으로 대접하는 거라고 해서, 업체들의 애로사항을 들어야 한다면서 향응을 받은 직원들이 있을 것이다. 3만원 미만이라고 아무 문제가 없는 것처럼 말하는 직원도 있다고 들었다.  하지만 이런 사람들이 청렴도 평가할 때 좋게 평가할까. 절대 아니다. 아직도 도청직원들 변하게 없다고 생각할 것이다.""  특히 이 지사에 대한 직언이 많았다. ""우리 지사님도 좀 달라졌으면 한다. 아직도 직원의 역량을 믿지 못하고 질책하고 힐난하고. 이런 조직에 누가 애정과 충성심을 갖겠는가""  또 다른 글이다. ""청렴도 이제 더 이상 내려갈 곳이 없다. 다시 시작하자. 공사, 용역 등 외부평가와 인사, 투명한 행정, 근무평정 등 내부 평가가 왜 낮게 나왔는지에 대한 현실적인 대책이 필요하다.  형식적인 대책과 강압적인 방식은 이제 머릿속에서 지워야 할 시점이다. 전남도청 전 직원들이 소통할 수 있는 시스템 보완이 필요할 것으로 생각된다.  그러나 현재 시스템으로는 누구 하나 속마음을 시원하게 이야기 할 공간과 장치가 없다. 현재 도청은 상하 계급간의 불만만 쌓이고 또 쌓이고 하여 동맥경화에 걸릴 지경이다.  이번 청렴도 사건을 계기로 지사부터 모든 직원이 형식적인 소통이 아닌 속마음 툭 터놓고 소통할 수 있는 시스템을 보완하기를 바란다.  지사님과의 점심식사가 그냥 국밥 한 끼 먹는 형식적인 소통의 자리가 아닌 시원한 사이다 한 잔 할 수 있는 자리를 만들어 보는 것도 좋겠다는 생각이 든다.  그러나 현재 상황으로는 지사님께 무서워서 말도 못하겠다. 모든 직원들이 형식적인 대답밖에는 할 말이 없을 것이라 생각한다.  차라리 김제동을 초대하여 지사님이라 생각하고 툭 터놓고 비공개로 톡투유 한 번 하는 것이 좋을 듯싶다. 대책이나 아이디어가 필요하면 지사님 말씀하시는 무게감부터 조금 내려놓으라고 부탁드리고 싶다.  지금 말씀하시는 톤으로는 절대 직원들과 소통할 수 없다. 과연 누구하나 이런 말을 할 수 있을까. 애로사항 말해봤자 입만 아프다. 팀원들끼리도 함께 식사를 못하게 하면서 이게 뭔가""  ◇ 이 지사는 '지시'를 좋아한다?  이 지사는 10일 실·국장 회의에서 ""중앙정부나 시군, 또는 도민들께 보내는 문서나 알리는 것들은 오류가 있어선 안 되고 무례해서도 안 되며 부적절한 내용이 포함 되서도 안 된다""고 밝혔다.  이어 ""규칙이나 규정, 정관처럼 오래도록 사용해야 할 내부 문서들 역시 철저히 정확해야 하고 중복이 있어서는 안 되며 누락이나 앞뒤 모순이 있어서도 안 된다""고 했다.  이 같은 발언 배경은 지난해 내·외부에 보내진 문서나 배포된 보도자료 등에 대해 지사가 한 달이 멀다 하게 자신의 코멘트와 문장, 오탈자 수정까지 꼼꼼하게 챙겼는데도 좀처럼 고쳐지지 않고 있는데 대한 소회를 반영한 것으로 보인다.  또 도청 안팎에서는 오랜 기자생활에서 벤 철저함과 섬세함 때문이라고 보고 있다. 그러나 이런 것은 적어도 공문을 발생시키는 주무관과 결재라인의 팀장, 과장까지 2∼3차 여과과정을 거치면서 책임져야 할 일이다, 하물며 오탈자까지 지사가 지적하다 보면 시시콜콜해진다.  이 지사는 가장 초보적인 오탈자도 못 챙기는 도청 업무체계를 한탄하며 자주 질타하다보니 직원들은 자연 주눅이 들고 사기저하로 이어지면서 결국은 청렴도 최하위로 곤두박질치는 한 요인으로 작용하는 역설적인 상황을 맞게 됐다.  ◇ 직언극간(直言極諫)하는 참모도 없고 분위기도 아니다  조선왕조 신하 중 왕에게 직언을 서슴지 않았던 인물 중 한명으로 율곡 '이이'를 꼽는다. 그가 너무 직언을 많이 하자 동료신하들이 심히 염려했다. 이 소리를 들은 이이는 ""내가 물러나면 이런 말도 없을 것이니 나로 인해 그런 근심을 하지 않아도 될 것이다""고 했다는 일화가 있다.  직언극간(直言極諫)은 ""옳다고 생각하는 바를 거리낌 없이 말하고 끝까지 버티어 간언""함 이다. 전남도청 실국장급 간부 가운데 과연 지사에게 직언을 하는 간부들이 몇이나 될까.  또 지사는 그런 쓴 소리를 귀담아 들을 준비가 되어 있을까. 몇 몇 간부는 지사에게 현안과 관련해 ""직언을 한번은 해도 두 번은 못하겠더라""고 했다. ""지사의 표정이 달라져 받아들이지 않는다""는 얘기였다.  공무원은 사기를 먹고 산다. 지사의 말 한마디가 공무원들의 사기를 살리기도 하고 해바라기 성향의 복지부동 상태를 만들기도 한다. 물은 배를 띄우기도 하고 뒤집기도 한다는 사자성어 군주민수(君舟民水)는 대통령에게만 적용되는 말이 아니다.  태생적인 것 외에는 금수저인 지사가 만약 ""네가 뭘 안다고"", ""버릇없이""라고 생각한다면 그것은 일방통행인 말에 불과하고 반면 진심으로 들어주는 대화를 하면 그것은 곧 양방통행이다.  전남도가 실·국장 회의가 아닌 토론회라고 공표하려면 적어도 짝퉁 토론회가 아닌 직언이 쏟아져 나오는 진짜 토론회가 되어야 한다.  park@cbs.co.kr  저작권자 © CBS 노컷뉴스(www.nocutnews.co.kr) 무단전재 및 재배포 금지"
"1946년 설립동지회원 7만2천명 뜻 이어 재도약 기틀 마련  지구촌 시민대학 설립, 지역 청년에 국제화 장학금 지원  (광주=연합뉴스) 형민우 기자 = 조선대학교가 건학 100주년(2045년)의 기틀을 마련하기 위한 'CU Again 7만2천 프로젝트'를 선포했다.  조선대는 10일 오후 3시 해오름관 대강당에서 강동완 총장과 박주선 국회부의장, 양향자 더불어민주당 최고위원, 이은방 광주시의회장, 임영규 전남도의회 의장 등 1천여명이 참석한 가운데 'CU Again 7만2천 비전 페스티벌'을 열었다.  광주무형문화재인 김용철의 설장구 공연을 시작으로 개회 선언, 국민의례에 이어 미디어 아티스트 이이남의 'Great Chosun, Human University'가 상영됐다.  'CU Again 7만2천 프로젝트'는 지난해 9월 취임한 강동완 총장의 공약으로 대학 설립동지회원 7만2천여 명을 상징화해 대학발전기금을 조성하고 지역 사회 공헌 확대와 인적 네트워크 구축으로 건학 100년의 기틀을 마련하는 사업이다.  강 총장은 비전 선포문에서 ""1946년 설립을 지원하기 위해 전국 방방곡곡에서 7만2천375명이 모금에 참여했던 위대한 역사에 비해 시·도민과 지역사회에 대한 공헌은 부족했다""며 ""시대적 요청에 부응하고 1946년 설립 당시의 위대한 역사를 새롭게 조명하고자 조선대가 다시 한 번 시·도민과 함께 CU Again 7만2천 프로젝트를 추진하게 됐다""고 밝혔다.  강 총장은 이어 ""시·도민에 의한 시·도민을 위한 지구촌 시민대학을 설립해 시·도민에게 다양한 사회인문학 콘텐츠를 제공할 계획""이라며 ""지역 청년을 제4차 산업시대의 차세대 통일·경제·과학·문화·스포츠 리더로 키우기 위한 국제화 장학금을 지원하겠다""고 말했다.  비전 선포에 이어 고은 시인과 박원순 서울시장, 박인구 동원그룹 부회장, 올림픽 금메달리스트 기보배 선수 등이 영상 메시지를 통해 축하했다.  프로젝트를 추진할 'CU Again 7만2천위원회'는 강 총장이 추진위원장을 맡고 이낙연 전남지사, 윤장현 광주시장, 임명규 전남도의장, 이은방 광주시의장, 김상열 광주상공회의소 회장, 최상준 광주경영자총협회장, 이주현 조선대학교총동창회장이 공동위원장을 맡는다.  조선대는 1946년 호남지방에 종합대학을 세워 민족 지도자를 길러내자는 목소리에 힘입어 1년여 만에 7만2천명이 설립동지회원으로 참여해 민립대학으로 문을 열었다.  조선대는 당시 설립동지회원들의 숭고한 이념을 계승하고 명문 사학으로 발돋움하기 위해 발전기금 모금을 통해 인재 육성과 사회 봉사활동을 펼칠 계획이다.  1계좌당 월 1만원의 소액으로도 참여할 수 있으며 발전기금은 민주·인권·평화 글로벌 인재육성과 창의 인재 양성 등에 쓰일 예정이다.  이기상 대호전기 회장이 1억5천만원을 현물로 기탁하기로 했고 염홍섭 서산 회장이 1억원, 이민수 동양건설 대표이사가 1억원, 조성희 싸이버테크 대표이사가 1억원을 각각 기탁하는 등 고액 기탁도 잇따르고 있다.  minu21@yna.co.kr"
"‘막는 것 산이거든 무느곤 못가랴...’  조선대가 10일 ‘건학 100년’과 제2의 도약을 향한 웅비의 나래를 펼쳤다. 개교 70년의 발자취를 돌아보고 향후 30년의 청사진을 설계한 ‘CU Again 7만2천 비전 페스티벌’을 통해서다.  조선대는 이날 오후 3시 해오름관 대강당에서 시·도민과 학생, 각급 기관장 등 1000여명이 참석한 가운데 페스티벌 행사를 가졌다. ‘CU Again 7만2천 비전 페스티벌’은 1946년 조선대가 전국 유일의 민립대학으로 개교할 때 십시일반으로 도움을 준 전국 각지의 대학 설립 동지회원 7만2000여명의 염원을 상징한다.  지난해 취임한 강동원 조선대총장이 추진위원장을 맡고 윤장현 광주시장과 이낙연 전남지사, 이은방 광주시의회의장, 임명규 전남도의회 의장 등 지역 정·관계 유력인사가 공동위원장을 맡은 ‘CU Again 7만2000 위원회’가 구성됐다.  조선대는 개교 이후 전국 사립대에서 가장 많은 사법고시 합격자를 배출하는 등 그동안 호남을 대표하는 명문 사학으로 명성을 떨쳤다.  이 대학은 4차 산업혁명이 도래한 21세기를 맞아 7만2000여명의 인적 네트워크 구축을 토대로 미래를 이끌어갈 인재양성의 동력과 경쟁력을 높여간다는 계획이다. 또 역대 졸업생 25만 여명이 소속된 각 동문회와 해외 진출 동문 등을 규합해 대학발전에 이바지하도록 유도하기로 했다.  이번 행사를 앞두고 동문들의 고액기부도 잇따랐다. 염홍섭 ㈜서산 회장이 3억원, 이민수 ㈜동양건설 대표이사, 조성희 싸이버테크 ㈜대표이사가 각각 1억원의 발전기금을 기탁했다. 이기상 대호전기 대표이사도 1억5000만원의 현물을 기증해 서석홀 4층 대강당을 리모델링하기로 했다. 조선대치과병원 김수관 병원장 등은 6088만원의 발전기금을 냈다.  광주=장선욱 기자 swjang@kmib.co.kr  , 무단전재 및 재배포금지  [뉴스 미란다 원칙] 취재원과 독자에게는 국민일보에 자유로이 접근할 권리와 반론·정정·추후 보도를 청구할 권리가 있습니다. 고충처리인(gochung@kmib.co.kr)/전화:02-781-9711"
