"[아시아경제 노해섭 기자]제19회 함평나비축제 환영연이 28일 오후 함평엑스포공원에서 열린 가운데 이낙연 전남지사, 안병호 함평군수, 이개호 국회의원, 김준성 영광군수, 유근기 곡성군수, 남성우 함평군축제추진위원장, 이윤행 함평군 의장 등 참석자들이 축하 떡을 자르고 있다.  제19회 함평나비축제 개막식이  28일 오후 함평엑스포공원에서 열린 가운데 이낙연 전남지사, 안병호 함평군수, 이개호 국회의원, 김준성 영광군수, 유근기 곡성군수, 남성우 함평군축제추진위원장, 이윤행 함평군 의장 등 참석자들이 나라의식을 하고 있다.  노해섭  기자 nogary@"
"[아시아경제 노해섭 기자]식중독 예방 다짐대회 및 2017년 음식문화개선 워크숍이 28일 오후 완도 군민회관에서 열린 가운데 이낙연 전남지사, 신우철 완도군수, 송기현 한국외식업중앙회 전남지회장, 소비자식품위생감시원, 모범음식점 대표, 음식문화개선 모니터요원 등 참석자들이 ‘식중독 예방! 가족건강 OK!’ 손 펼침막을 들고 구호를 외치고 있다.  이낙연 전남지사(왼쪽 세 번째)와 송기현 한국외식업중앙회 전남지회장(왼쪽 두 번째)이 28일 오후 완도 군민회관에서 열린 식중독 예방 다짐대회 및 2017년 음식문화개선 워크숍에서 식중독 예방 실천 결의문을 채택한 뒤 기념촬영을 하고 있다.  사진제공=전남도"
"[아시아경제 노해섭 기자]남악복합주민센터 개청식이 13일 오후 무안군 삼향읍 남악복합주민센터에서 열린 가운데 이낙연 전남지사, 박준수 무안부군수, 정경채 무안경찰서장 등 참석자들이 개청을 알리는 테이프를 자르고 있다. 센터는 9900㎡ 부지에 건축연면적 8482㎡ 규모로 건립됐으며, 1층에는 남악신도시개발사업소와 남악출장소, 장난감 도서관, 2층에 건강생활지원센터, 3층에 주민자치센터와 공연장, 4층에 다목적 강당과 공연장 등이 각각 들어섰다.  남악복합주민센터 개청식이 13일 오후 무안군 삼향읍 남악복합주민센터에서 열린 가운데 이낙연 전남지사, 박준수 무안부군수 등 참석자들이 기념식수를 하고 있다.  사진제공=전남도"
"김 가공·로프 제조기계 제작공장 등…분양률도 33% 상향  【목포=뉴시스】박상수 기자 = 전남도와 목포시가 대양산단에 김 가공공장 등 7개 기업을 유치해 산단 활성화에 청신호가 켜졌다.  13일 목포시에 따르면 이날 시청 상황실에서 김선미 선진레이버 대표 등 7개 기업 대표와 이낙연 전남도지사, 박홍률 목포시장, 조성오 목포시의장 등이 참석한 가운데 416억원 규모의 투자협약을 체결했다.  이들 기업 유치로 일자리 창출 규모는 215명에 달할 것으로 예상되고 있다.  협약에 따라 선진레이버는 대양산단 6656㎡ 부지에 150억원을 투자해 2019년 말까지 수출용 마른 김 제조공장을 건립한다.  김선미 대표의 남편이 운영하는 선진수산도 지난 2015년 투자협약을 맺어 부부 기업이 모두 대양산단으로 이전하게 됐다.  어업회사법인 아라(대표 정동훈)도 대양산단 8199㎡ 부지에 105억원을 투자해 2018년 말까지 마른 김 제조공장을 건립한다.  또 (유)와이디(대표 이영동)는 대양산단 8672㎡ 부지에 50억원을 투자해 2019년 말까지 로프 제조기계 제작공장을 건립한다.  경기도 여주에 본사를 둔 계량기 등 제조 전문기업인 ㈜위지트에너지(대표 윤호권)는 대양산단 4997㎡ 부지에 41억원을 투자해 연말까지 전력량계 제조공장을 건립한다.  (유)청해에스앤에프(대표 정길환)는 대양산단 2657㎡ 부지에 30억원을 투자해 연말까지 조미 김 가공공장을 건립한다.  ㈜대신푸드시스템(대표 위성범)은 대양산단 2392㎡ 부지에 20억원을 투자해 2018년 말까지 닭, 오리 등 육류 가공공장을 건립한다.  (유)민성(대표 윤민자)은 대양산단 4036㎡ 부지에 20억원을 투자해 연말까지 건조 어류 가공공장을 건립한다.  박홍률 목포시장은 ""새 비전과 전략을 갖고 사통팔달의 교통망과 정주여건이 우수한 대양산단에 투자를 결심한 것에 감사드린다""며 ""지역과 기업이 상생하는 성공적 투자가 되도록 각종 행정적 지원과 애로사항 해결에 최선을 다하겠다""고 말했다.  한편 목포대양산단에 7개기업이 투자협약을 체결하면서 전체 분양대상 107만4000㎡ 중 35만8000㎡가 분양돼 33%의 분양률을 보이고 있다.  parkss@newsis.com"
"416억 원 규모, 215명 일자리 창출 효과  [김대원 기자(=목포)]  전남도와 목포시는 목포대양산단에 7개 기업을 유치하는 성과를 이뤘다.  목포시는 13일 이낙연 전남도지사와 박홍률 목포시장을 비롯해, 목포에 지역구를 두고 있는 전남도의원들과 시의원들이 참석한 가운데 김선미 레이버 대표 등 7개 기업 대표와 투자협약을 체결했다.  이번 7개 기업유치는 215명의 새로운 일자리 창출 효과와 함께 416억 원 규모로 3만 7609㎡를 분양해, 시는 전체 분양대상 107만 4000㎡중 35만 8000㎡으로 총 33%의 분양률을 달성했다.  이낙연 도지사는 협약식에서 “대양산단은 앞으로 수산식품 수출단지, 수산기자재산업 육성 클러스터, 국가 수산연구기관 유치 등 4가지 인프라가 갖춰질 것”이라고 말하고 “에너지 분야도 빠르게 변화되고 있다”며 “도에서는 대한민국의 에너지산업을 어떻게 키울 것인가에 대한 구체적 방안을 마련해 새 정부 출범 시 국가적인 어젠다로 채택되도록 준비하고 있다”고 덧붙였다.  한편 박홍률 목포시장은 “새 비전과 전략을 갖고 사통팔달의 교통망과 정주 여건이 우수한 대양산단에 투자를 결심한 것에 감사드린다”며 “지역과 기업이 상생하는 성공적 투자가 되도록 각종 행정적 지원과 애로사항 해결에 최선을 다하겠다”고 말했다.  김대원 기자(=목포) ( 무단전재 및 재배포금지  기사제보 jebo.pressian.com"
"전남체육회 98회 전국체전 성적향상 발판 마련  [아시아경제 노해섭 기자]전라남도체육회(회장 이낙연 전라남도지사)는 세한대학교 여자축구팀 창단으로 인하여 여자축구 연계육성 및 제98회 전국체육대회 축구 여대부에 참가하여 전국체전 성적 향상에 이바지 할 수 있게 됐다.  세한대학교는 14일 오전 11시 세한대학교 영암캠퍼스 학생복지회관 2층 세미나실에서 이승훈총장, 한국여자축구연맹 오규상 회장, 전남체육회 김상민 사무처장, 대한축구협회 황보관 기술교육실장, 전남축구협회 신정식 회장 등 주요 내빈이 참석한 가운데 창단식을 갖는다.  세한대학교 여자축구팀은 김영주 담당교수를 비롯해 김주영 감독과 이미애 코치, 김 현 의무, 선수 16명으로 활약할 예정이다.  현재 전남에는 여자축구팀이 초, 중, 고등부 각 종별 1팀씩으로 총 66명의 선수가 각종 전국대회에 출전 최고의 기량을 펼쳐 선전중이나, 전남에 대학팀이 없어 고교 선수들이 부득이하게 타 지역으로 갈 수 밖에 없는 안타까운 상황이 이어졌다.  세한대학교 여자축구팀 창단으로 도내 우수한 선수들이 타 지역으로 유출되는 문제점을 해소 할 수 있게 됐다.  새롭게 팀을 이끌게 된 김주영 감독은 “축구인으로서 새로운 팀이 창단 된 것이 기쁘고, 새로운 길을 가게 되서 걱정도 앞서지만, 앞으로 우리팀을 거쳐 프로팀이나 사회진출에 새로운 통로가 되고, 연결고리 역할을 할 수 있는 팀이 될 수 있도록 하고 싶다”며 각오를 밝혔다.  전라남도체육회 관계자는 “팀 창단으로 우수선수 유출문제를 해결하게 됐고, 어렵게 창단된 만큼 전남체육회에서도 많은 관심을 두고 뒷받침하겠다”며 “우리 도에 여자축구 저변확대 및 활성화를 위해서 앞장서 달라”고도 주문했다.  노해섭  기자 nogary@"
"숲속의 전남 ‘돈이 되는 소득숲’선도 역할  [위종선 기자]  보성군에 소재하고 있는 솔향옻(주)(대표 황길봉)이 옻나무에서 천연 옻칠 도료의 대량생산 및 가공이 가능한 공장을 설립하고 준공식을 가졌다.  군은 지난 12일 솔향옻 가공공장에서 이용부 군수를 비롯해 이낙연 도지사, 임명규 도의회 의장, 전남지역 임업단체장과 지역주민 등 400여명이 참석해 준공식을 축하하고 옻나무 6차 산업화의 성공적 발전을 기원했다.  솔향옻(주)은 10여년간의 오랜 연구 끝에 고품질 친환경 옻칠 천연도료의 신기술을 개발하여 진주, 고성, 산청, 공주, 전남동부권 등 한옥마을에 천연 도료를 시공하고 있다.  특히 우리나라 전통가옥인 한옥의 아름다움을 오랫동안 보전하고 누구나 쉽고 편리하게 옻칠을 할 수 있는 다양한 제품을 대량 생산하고자 공장을 설립했으며, 시범 운영기간을 걸쳐 10월부터 본격적인 생산에 들어갈 계획이다.  황길봉 대표는 “천연도료와 함께 사람들의 입맛을 사로잡을 옻 가공식품 연구개발에도 힘써 친환경 임산물 먹거리 전문 기업으로 성장해 지역발전과 일자리 창출에 노력하겠다”고 말했다.  이용부 군수는“옻나무 6차 가공공장 설립으로 새로운 부가가치가 창출되기를 기대한다”며 “우리군에서는 경관숲, 소득숲, 힐링숲 조성을 위한 보성숲세상 만들기를 중점 추진하고 있다”고 밝혔다.  이 군수는 또 “앞으로 숲속의 전남 ‘돈이 되는 소득숲’분야의 선도적 거점이 되어주기를 바란다”고 덧붙였다.  한편 보성군은 지난해 헛개나무 생산단지 5ha, 호두나무 생산단지 5ha를 조성하고, 올해 밀원수림 5ha, 산약초 생산단지 2ha 등을 조성해 돈이 되는 소득숲 만들기에 총력을 다 할 방침이다.  위종선 기자 ( 무단전재 및 재배포금지  기사제보 jebo.pressian.com"
"전남일보주최, 광주시·전남도·20개 시군 참여  재경광주전남향우회 총출동 홍보 동참  【무안=뉴시스】배상현 기자 =재경광주전남향우회와 전남일보사가 공동주최하는 ‘2017광주·전남귀농귀촌박람회’가 오는 7~8일 이틀간 서울 광화문광장 중앙광장(세종문화회관 앞)에서 열린다.  지난해에 이어 올해 2회째를 맞는 이번 박람회는 전라남도와 광주광역시, 전남 20개 시·군 등 광주·전남지역 자치단체와 산림조합중앙회 등 유관단체 등이 참가해 귀농귀촌 지원정책을 원스톱으로 설명한다.  각 자치단체는 지역 귀농귀촌단체들과 함께 참여해 귀농귀촌의 경험담을 들려주고 지역특성에 맞는 차별화된 귀농귀촌 지원정책을 소개한다.  이와함께 각 자치단체는 귀농인들의 생산물과 지역특산물 등을 전시·홍보·판매하고 지역 관광자원 홍보활동도 병행한다.  특히 이번 행사에는 재경광주전남향우회 소속 23개 재경 광주·전남 시·군향우회가 ‘수도권 500만 광주·전남 향우와 함께 청정고향으로 모십니다’라는 슬로건을 내걸고 참여한다.  재경 각 향우회는 수도권 광주·전남 출신 향우 뿐만 아니라 서울·경기도민들에게 청정지역 광주·전남에서 새로운 인생 2막을 설계할 것을 호소한다.  개막식은 7일 오전 10시 이낙연 전남지사를 비롯한 각계 인사 300여 명이 참석한 가운데 열린다.  이어 7일 오후 12시40분부터 8일 오후 6시까지 20개 참가 시·군과 향우회가 각 자치단체의 귀농귀촌 지원정책을 설명한다.  부대행사는 향우들로 구성된 아리랑풍물패와 진실풍물단의 농악공연, 재경진도군강강술래단과 재경해남군강강술래단의 강강술래 공연 등이 이어진다.  2017 광주·전남 귀농귀촌박람회에 대한 자세한 내용은 박람회 홈페이지나 전남일보 홈페이지를 참조하면 된다.  praxis@newsis.com"
백정자 님은 지난 50년 동안 최씨 종가의 전통장을 만들어왔다. 2015년 대한민국 식품명인으로 지정됐다. 도시 사람들에게 “음식 손맛과 정성은 인공지능으로는 안된다”며 “먼 미래 세대들도 맛있고 멋진 음식을 맛볼 수 있도록 해야 한다”고 전통된장의 우수성을 알리고 있다. 1천개의 장독으로 강진이 콩 농사 1번지로 변신하는데 기여하고 있다.  이낙연 도지사는 현장에서 운영현황을 듣고 “각 분야의 명인들은 지역 발전을 위한 후계자 육성에 심혈을 기울여야 한다”며 “또한 진양주 등 문화재급 전통식품의 전승?발전을 위해서도 노력해달라”고 당부했다.  노해섭  기자 nogary@
"[아시아경제 노해섭 기자]이낙연 전남지사가 4일 오후 목포신항만 세월호 유가족 회의실에서 4ㆍ16세월호 참사 가족협의회 어머니들과 이야기를 나누고 있다.  이낙연 전남지사가 4일 오후 목포신항만 세월호 유가족 회의실에서 4ㆍ16세월호 참사 가족협의회 유경근 집행위원장, 홍영미 심리생계분과장, 오병환 추모분과 팀장, 장동원 진상규명분과 팀장 등과 면담을 갖고 있다.  사진제공=전남도"
[아시아경제 노해섭 기자]이낙연 전남지사는 25일 귀농 ·귀촌자 6가구 20명이 살고 있는 담양군 봉산면 신평마을을 방문했다. 마을주민들과 대화하고 딸기 재배농장(대표 귀농인 신재길)을 둘러봤다.  이낙연 전남지사는 25일 귀농 ·귀촌자 6가구 20명이 살고 있는 담양군 봉산면 신평마을을 방문했다. 마을주민들과 대화하고 딸기 재배농장(대표 귀농인 신재길)을 둘러봤다.  사진제공=전남도
"25일 담양 죽화경 방문해 생활 속 정원문화 구상  [아시아경제 노해섭 기자]이낙연 전라남도지사는 민간이 주도하는 생활 속 정원문화 구상을 위해 25일 전남 제2호 민간정원인 담양 ‘죽화경’을 방문했다.  이 지사는 이날 죽화경에서 동양을 상징하는 대나무와 서양을 상징하는 장미를 가꿔 전통과 현대미를 살린 풍경정원을 감상하고, 나무 한 그루 한 그루마다 정성과 땀으로 가꿔온 유영길(51) 씨의 노고를 격려했다.  죽화경은 유 씨가 대나무의 고장 담양을 상징하는 1만여 대나무로 엮어진 울타리 안에 꽃과 나무를 심고, 대나무의 기운찬 기를 표현한 ‘氣의 정원’이다. ‘자연은 직선을 싫어한다’는 철학을 담아 담양 봉산면 유산리 고창~담양 고속도로 교각 옆 골짜기의 지형을 그대로 살려 자연과 조화를 이룬 전원 풍경식 정원으로 조성했다.  이 때문에 민간 주도 정원문화를 실천한 모델로 평가받아 지난 3월 전남 제2호 민간정원으로 등록됐다.  유 씨는 “아름다운 정원에서 차 한 잔 마시며 스트레스를 날려버리고 쉬어가는 정원으로 가꿔나가겠다”고 말했다.  이 지사는 정원을 관람한 후 “정원 옆을 지나는 고속도로 소음을 제거할 수 있는 방안을 찾아 쉼과 휴식의 공간으로 재탄생시키고, 정원 전체에 색채감을 줘 디자인하면 좋겠다”고 제안했다.  죽화경은 5월 13일부터 6월 10일까지 29일간 제8회 데이지 ·장미 축제를 개최한다. 관람 시간은 오전 10시부터 오후 6시까지며 정원 관리를 위해 입장료 3천 원을 받는다. 체험행사 참여와 정원에 대한 이야기를 듣기 위해서는 사전 예약을 해야 한다.  한편 유 씨는 2013순천만국제정원박람회에 대나무를 주제로 한국정원을 디자인한 ‘The Castle and Line’작품으로 많은 호평을 받은 정원디자이너다. 다른 업종의 일을 하다 산림계통에서 일하던 아버지의 영향을 받아 30년간 독학으로 정원을 공부했다. 정원박람회 이후 출품 작품을 온전히 보전하고 많은 사람들과 정원에 대한 교감을 할 방법을 찾던 중 대나무의 이미지에 맞는 이곳 봉산면에 터를 잡고 수년간의 노력 끝에 지금의 죽화경을 조성했다.  노해섭  기자 nogary@"
"◇광주시  -윤장현 시장  09:00 화요 간부회의(중회의실)  14:00 광주 아시아재해긴급구호협의회 정기총회(1층 행복회의실)  15:00 친환경자동차 부품단지 현장 방문(빛그린산단)  -박병호 행정부시장  15:00 (재)광주정보문화산업진흥원 임시회(광주CGI센터)  -김종식 경제부시장  09:00 화요 간부회의(중회의실)  ◇전남도  -이낙연 도지사  10:00 어린이직업체험관 드림하이센터 개관식(곡성)  13:00 담양 봉산면 귀촌자 마을 방문(담양)  13:40 민간정원 2호 담양 죽화경 방문(담양 봉산면)  -김갑섭 행정부지사  4월24~28 제19회 한중포럼 참가 및 장시성 교류확대 협의(중국 저장성·장시성)  -우기종 정무부지사  11:00 남북교류협력위원회(정약용실)  14:00 나주 융합본부협의회(실감미디어센터)  yr2003@  ), 무단 전재 및 재배포 금지]"
"[아시아경제 노해섭 기자]이낙연 전남지사는 25일 담양군 봉산면 유산리에 있는 전남 제2호 민간정원 ‘죽화경(대표 유영길)’을 관람했다. 죽화경은 2012년 개원해 장미정원, 잔디광장, 체험시설 등을 갖췄으며, 장미 데이지 제충국 꽃창포 등 341종의 식물이 서식하고 있다. 이날  최형식 담양군수, 박철홍 도의원이 동행했다.  사진제공=전남도"
"[아시아경제 노해섭 기자]25일 곡성읍에 문을 연 곡성어린이직업체험관 개관식에 참석한 이낙연 전남지사, 유근기 곡성군수, 서병재 전남부교육감, 김규태 전북부교육감, 조상래 도의원,박찬주 곡성교육장 등 내빈들이  테이프커팅 하고 있다.  곡성어린이직업체험관이 25일 곡성읍에 문을 열었다. 이낙연 전남지사와 유근기 곡성군수 등 내빈들이 체험관을 관람하고 있다.  사진제공=전남도"
"유근기 곡성군수는 기념사를 통해 “4차 산업혁명의 시대에, 우리 어린이들이 이곳에서 체험을 통해 미래의 꿈을 키우고 실현하여 올바른 직업관을 갖게 되고, 미래의 희망이자 꽃처럼 아름다운 우리 어린이들에게 건전한 직업관 형성과 진로 결정 능력을 배양시켜 주고 싶다는 우리 어른들의 바람이 이제 이곳 ‘곡성 직업 체험관 드림하이센터’에서 실현될 것이다”고 밝혔다.  노해섭  기자 nogary@"
"[서울신문]  세월호 육상 거치를 시도하는 목포신항에 주요 정치인의 방문이 잦다. 특히 5월 대선을 앞두고 이달 초부터 대선 주자 등 유력 정치인들의 발길이 이어지고 있다. 바쁜 정치일정에 광주·전남 지역 3~4군데를 한꺼번에 묶어서 방문하는 터라, 일부에서는 추모의 순수성을 의심하는 눈초리도 있다. 다른 한편에서는 더 많은 정치인이 목포신항을 방문해 세월호 참사의 아픔을 서로 공감하는 장소가 돼야 한다는 주장도 제기된다.  7일 박지원 국민의당 대표는 4·12 재보선 전남도의회 해남지역 당 후보자를 지원하는 길에 목포신항에 들렀다. 해양수산부 직원의 상황보고를 받고 세월호 미수습자 가족 면담 등 1시간 30분 동안 머물렀다. 전날에는 더불어민주당 문재인 대선 후보가 광양제철소와 광주 5·18 민주묘지를 거쳐 오후 2시 목포신항을 방문해 미수습자 가족들을 위로했다. 지난달 31일에는 심상정 정의당 대선 후보가, 1일에는 황교안 대통령 권한대행과 이낙연 전남도지사, 유승민 바른정당 대선 후보가 다녀갔다. 지난 5일엔 세월호가 관할인 국회 농림축산식품해양수산위원회 상임위원 12명이 방문했다.  문제는 이들 유력 정치인들이 등장할 때마다 목포신항에 있는 해수부 등 관계자 10여명이 하던 업무를 중단하고 1시간여 이상 수행을 하고 다니는 등 의전에 바쁘다는 것이다. 이철조 세월호 현장수습본부장도 정치인들이 방문하면 또 일일이 상황 보고를 해야 한다.  일부 유가족들은 ‘정치인의 생색내기용 방문은 곤란하다’는 반응이다. 정치인에 대한 의전 때문에 육상 거치 등 수습에 차질이 빚어질 수 있다는 우려 탓이다. 반면 미수습자 가족들은 “정치인들이 언론을 의식해서라도, 한 분이라도 더 많이 목포신항을 방문해 주길 바란다”고 말했다.  목포 최종필 기자 choijp@seoul.co.kr  ▶  재미있는 세상[), 무단전재 및 재배포금지"
"광주전남행사위 출범… 지역 항쟁사 정리·6월민주교육 상설화  [광주CBS 조시영 기자]'6월 민주항쟁' 30주년을 맞이해 광주에서 1987년 '민주대행진'이 재현된다.  6월민주항쟁 30년 광주전남행사위원회는 24일 오전 광주 5·18민주광장에서 출범식을 개최하고 올해 기념식 내용과 기념사업 추진 방향 등을 발표했다.  행사위는 오는 6월 10일 오후 6시 광주 금남로 특설무대에서 6월민주항쟁30년 기념식을 열고 '민주대행진'과 '시민합창제' 등을 진행한다.  특히 30년만에 광주에서 '민주대행진'을 통해 1987년 당시 박종철 고문치사 사건 은폐와 전두환 정권의 간선제 호헌 조치에 반대하며 길거리에 나섰던 국민 대행진을 재현할 예정이다.  행사위는 시민들과 함께 민주열사 영정을 들고 광주역부터 옛 전남도청 분수대 앞까지 행진을 이어갈 계획이다.  행사위는 30주년을 맞아 1987명의 시도민추진위원회를 구성, 구술 기록 등을 확보해 지역의 6월 항쟁사를 정리하는 사업도 진행한다.  행사위는 또 미래세대를 위한 6월민주교육도 상설화에 나선다.  행사위 상임위원장으로는 지선 스님, 배종렬 광주민주화운동동지회 고문, 이홍길 광주민주화운동기념사업회 이사장, 남재희 전 노동부 장관 등이 참여하며 윤장현 광주시장과 이낙연 전남도지사는 명예 상임위원장을 맡았다.  행사위는 출범선언문을 통해 ""1987년 6월 민주항쟁은 1980년 5·18광주민주화운동의 승리였다""면서 ""역사의 고비에 영감과 실천을 통해 새로운 시대를 열어 나간 호남 지역민들과 함께 민주항쟁 30주년을 맞아 또 다른 새로운 나라를 만들기 위해 이제 희망으로 힘차게 나아가자""고 밝혔다  cla80@naver.com  저작권자 © CBS 노컷뉴스(www.nocutnews.co.kr) 무단전재 및 재배포 금지"
