"이낙연 국무총리는 5일 임시국무회의에서 3조9,000억원 규모의 추가경정예산(추경)안을 확정하고 국회 통과 협조를 호소했다. 반면 야당은 추경 편성에 반발하고 있어 진통이 불가피할 전망이다.  이낙연 총리는 이날 정부서울청사에서 주재한 임시국무회의에서 “일자리를 찾지 못해 좌절한 청년들과 구조조정의 고통을 겪는 몇개 지역 주민 및 기업들에게 희망을 드릴 수 있도록 국회가 추경을 차질 없이 처리해 주시기를 간곡히 부탁드린다”고 말했다.  이어 “정부가 지난 10년 동안 20여 차례에 걸쳐 청년고용대책을 시행했으나 사정은 개선되지 않았다”며 청년고용 확대가 어려운 이유로 ▦고용 없는 성장 ▦대기업ㆍ중소기업 임금 격차 ▦인구 구조 문제를 꼽았다.  조선ㆍ자동차 산업의 구조조정도 또 다른 추경 요인이라고 이 총리는 지목했다. 그는 “군산과 거제ㆍ통영 등 조선과 자동차를 중심으로 큰 규모의 구조조정이 이루어지는 지역에서는 실업자가 많이 늘고 협력업체들이 연쇄적으로 경영난에 빠져 지역경제가 크게 위축되고 있다”며 “이런 상황을 방치할 수 없다”고 강조했다.  이 총리는 “추경안 재원은 국채 발행 없이 작년 결산잉여금과 기금 여유분을 활용함으로써 국가재정에 부담이 되지 않도록 했다”며 “기획재정부와 고용노동부, 중소벤처기업부 등 관계부처는 추경의 필요성과 시급성, 그리고 기대효과 등을 국회와 국민들께 잘 설명해 이해와 협조를 얻도록 해주시기 바란다”고 당부했다.  추경안이 국무회의를 통과했지만 국회 처리는 난항이 예상된다. 특히 자유한국당을 중심으로 야권은 국민 세금을 이용해 매번 임시처방만 내놓고 있다며 추경에 반대하는 입장이다. 추경안 국회 통과를 위해서는 국회의원 과반 출석, 과반 찬성이 필요해 더불어민주당 단독 처리는 불가능하다.  정지용 기자cdragon25@hankookilbo.com  ▶한국일보 ), 무단 전재 및 재배포 금지]"
"“16일로 세월호 만 4년, 그날 생각하며 회의진행”  이낙연 국무총리가 5일 오전 정부서울청사에서 제33회 국정현안점검조정회의를 주재하고 모두발언을 통해 정부의 안전정책 또는 안전행정에 관한 평소 생각을 밝혔다.  이 총리는 “모든 정책이 그렇지만, 특히 안전정책은 꼼꼼해야 한다”며 “인간도, 행정체계도, 시설도, 장비도 완전하지 못하다는 것, 인간을 포함한 모든 요소가 선의로 작동하는 것만은 아니라는 것을 전제로 정책을 짜야 한다”고 강조했다.  그러면서 “중앙정부의 정책이 현장에서 그대로 이행되면 좋지만, 그렇지 못한 경우가 많다. 현장에서 모르는 경우, 잘못 아는 경우, 알더라도 이행하지 않거나 못하는 경우, 심지어 시책을 악용하는 경우도 생긴다”며 “그런 여러 경우들을 상정하면서, 그런 일이 최소화되도록 정책을 만들어야 한다”고 말했다.  이어 “그런데 중앙정부의 정책부터 빈틈을 남기는 일이 있다”며 “중앙정부의 정책이 제대로 실행되려면 지방자치단체와 함께 이행해야 한다. 지방자치단체가 분권을 지향한다면, 책임의 분담도 당연히 수용해야 옳을 것이다. 그러나 지방자치단체들이 권한을 주장하는 만큼 책임을 다하고 있느냐에 대해 저는 충분히 확신하지 못한다”고 우려를 표했다.  이 총리는 “지방자치단체가 협력하도록 하는 법적, 행정적 또는 정치적 장치가 정책 입안단계부터 마련돼 있어야 한다”며 “정책의 생명은 실행력의 확보에 있다. 실행될 수 있어야 정책입니다. 실행력이 없거나 미약한 정책안은 수필 같은 것이지 정책이 아니다”고 지적했다.  이에 따라 “장차관님들이 챙겨 주셔야겠다”며 “직원들보다 경험이 더 많고 현장과 지자체를 더 잘 아시는 분들이 장차관이다. 장차관님들께서 정책의 입안과 수립의 과정에 지금보다 훨씬 더 꼼꼼히 관여해 주시기 바한다”고 당부했다.  한편 이날 이 총리는 “세월호가 바다에 가라앉아서 안산 단원고등학교 학생 등 304명을 잃은 지 16일로 만 4년이 된다. 그 날을 생각하면서 오늘 회의를 진행하겠다”며 낚싯배와 여객선 등 연안선박 안전, 지진방재에 관한 개선대책을 심의 했다.  데일리안 이선민 기자 (yeatsmin@dailian.co.kr)  ⓒ (주)데일리안 - 무단전재, 변형, 무단배포 금지"
"3.9조 규모 2018년 추가경정예산안 심의 임시국무회의  청년 고용 어려움, '고용없는 성장·임금격차·인구구조' 탓이낙연 국무총리가 5일 청년 일자리 확대 등을 위한 3조9000억원의 추가경정예산안을 심의·의결하기 위해 서울 세종로 정부서울청사에서 열린 임시 국무회의에서 안건을 상정하고 있다. 연합뉴스 제공[세종=이데일리 이진철 기자] 이낙연 국무총리는 5일 “일자리를 찾지 못해 좌절한 청년들과 구조조정의 고통을 겪는 몇 개 지역의 주민 및 기업들에게 희망을 드릴 수 있도록 국회가 추경을 차질없이 처리해 주시기를 간곡히 부탁드린다”고 말했다.  이 총리는 이날 정부서울청사에서 열린 임시국무회의에서 “청년 취업을 늘리고 구조조정 지역을 지원하기 위한 3조9000억원 규모의 2018년도 제1차 추가경정예산안을 심의하려고 임시국무회의를 열었다”면서 이같이 밝혔다.  이 총리는 “정부가 지난 10년 동안 20여 차례에 걸쳐 청년고용 대책을 시행했으나 사정은 개선되지 않았다”면서 청년고용 확대가 어려운 3가지 이유를 꼽았다 .  그는 “첫째는 고용 없는 성장”이라며 “지난해 자산 5조원 이상 대기업의 영업이익이 전년보다 55% 증가했으나, 고용은 1.8% 증가하는데 그쳤다”고 지적했다. 이어 “둘째는 임금격차”라면서 “대기업과 중소기업, 정규직과 비정규직의 임금이 대체로 2대 1 수준이다. 이런 상태에서 청년층은 중소기업 취업을 기피하고, 그 결과 미스매치의 문제가 악화된다”고 말했다.  이 총리는 셋째로 인구구조를 지적햇다. 그는 “베이비붐 세대의 은퇴가 완전히 이루어지지 않은 시기에 그 자녀들인 에코세대가 취업연령을 맞았다”면서 “이대로 두면 2021년까지 에코세대 중 14만명 가량이 직장을 구하기 힘들게 된다. 이러한 인구구조는 앞으로 3~4년이 고비가 될 전망”이라고 설명했다.  이 총리는 또 하나의 추경요인은 ‘구조조정’이라고 밝혔다. 이어 “군산과 거제·통영 등 조선과 자동차를 중심으로 큰 규모의 구조조정이 이루어지는 지역에서는 실업자가 많이 늘고, 협력업체들이 연쇄적으로 경영난에 빠져 지역경제가 크게 위축되고 있다”면서 “이런 상황을 방치할 수 없다”고 강조했다.  이 총리는 “추경안의 재원은 국채발행 없이 작년 결산잉여금과 기금 여유분을 활용함으로써 국가재정에 부담이 되지 않도록 했다”면서 “기획재정부와 고용노동부, 중소벤처기업부 등 관계부처는 추경의 필요성과 시급성, 그리고 기대효과 등을 국회와 국민들께 잘 설명해 이해와 협조를 얻도록 해주시기 바란다”고 당부했다.  이진철 (cheol@edaily.co.kr)  ＜ⓒ종합 경제정보 미디어 이데일리 - 무단전재 &amp; 재배포 금지＞"
"한국신문협회·한국신문방송편집인협회·한국기자협회가 공동으로 주최하는 제62회 신문의 날 기념 축하연이 5일 서울 한국프레스센터 20층 국제회의장에서 열렸다. 이낙연 국무총리와 내빈들이 축하 떡을 자르기 전 기념촬영을 하고 있다. 왼쪽부터 성낙인 서울대 총장, 박원순 서울시장, 김부겸 행정안전부 장관, 유성엽 국회 교육문화체육관광위원장, 조배숙 민주평화당 대표, 이 총리, 이병규 한국신문협회장, 우원식 더불어민주당 원내대표, 김동철 바른미래당 원내대표, 이정미 정의당 대표, 김상곤 부총리 겸 교육부 장관, 도종환 문화체육관광부 장관.  연합뉴스  [, 무단전재 및 재배포 금지"
"-고용없는 성장ㆍ임금격차ㆍ인구구조 등 어려움 토로  -“군산ㆍ거제ㆍ통영 등 지역경제 위축 방치할 수 없다”  [헤럴드경제=신대원 기자] 이낙연 국무총리는 5일 3조9000억원 규모의 추가경정 예산안 편성과 관련, “추경안 재원은 국채발행 없이 작년 결산잉여금과 기금 여유분을 활용함으로써 국가재정에 부담이 되지 않도록 했다”고 밝혔다.  이 총리는 이날 오후 정부서울청사에서 주재한 임시국무회의에서 이같이 말한 뒤 “일자리를 찾지 못해 좌절한 청년들과 구조조정 고통을 겪으시는 몇 개 지역 주민 및 기업들에게 희망을 드릴 수 있도록 국회가 추경을 차질 없이 처리해 주시기를 간곡히 부탁드린다”고 당부했다.  이 총리는 이번 추경 편성이 청년 일자리 창출과 구조조정 지원이라고 밝혔다.  먼저 “정부는 지난 10년 동안 20여차례에 걸쳐 청년고용 대책을 시행했으나 사정은 개선되지 않았다”며 “지난해에도 우리 정부가 청년 일자리 중심의 추경예산을 편성해 집행했고, 올해 본예산에도 청년일자리 사업이 많이 포함됐다. 그래도 문제의 해결에는 역부족”이라고 토로했다.  이어 청년고용 확대가 어려운 이유로 고용 없는 성장ㆍ임금격차ㆍ인구구조 등을 꼽았다.  이 총리는 “이런 상황을 인식하고 정부는 지난달 15일 의욕적인 청년일자리 대책을 발표했다”며 “오늘 심의할 추경안은 그 대책을 실행하기 위한 예산을 반영하고 있다”고 설명했다.  이 총리는 아울러 “또 하나의 추경요인은 구조조정”이라며 “군산과 거제ㆍ통영 등 조선과 자동차를 중심으로 큰 규모의 구조조정이 이루어지는 지역에서는 실업자가 많이 늘고 협력업체들이 연쇄적으로 경영난에 빠져 지역경제가 크게 위축되고 있다. 이런 상황을 방치할 수 없다”고 강조했다.  또 “이들 지역에 대한 지원방안을 오늘 정부가 발표했다”면서 “오늘 심의할 추경안은 그 지원방안을 실행할 예산도 포함하고 있다”고 덧붙였다.  이 총리는 끝으로 “기획재정부와 고용노동부, 중소벤처기업부 등 관계부처는 추경의 필요성과 시급성, 그리고 기대효과 등을 국회와 국민들게 잘 설명해 이해와 협조를 얻도록 해주시기 바란다”고 당부했다.  신대원 기자 /  - Copyrights ⓒ 헤럴드경제 &amp; heraldbiz.com, 무단 전재 및 재배포 금지 -"
"국정현안점검조정회의  ""중앙정부 공무원, 지자체 협력 중요성 충분히 알지 못해""이낙연 국무총리가 5일 오전 서울 종로구 세종대로 정부서울청사에서 열린 국정현안점검조정회의에서 모두발언을 하고 있다. 뉴시스 제공[세종=이데일리 이진철 기자] 이낙연 국무총리는 5일 “중앙정부의 정책이 제대로 실행되려면 지방자치단체와 함께 이행해야 한다”고 말했다.  이 총리는 이날 정부서울청사에서 열린 국정현안점검조정회의에서 “정부의 안전정책 또는 안전행정에 관한 평소 생각을 말씀드리고자 한다”면서 이같이 밝혔다.  이 총리는 “중앙정부의 정책이 현장에서 그대로 이행되면 좋지만, 그렇지 못한 경우가 많다. 현장에서 모르는 경우, 잘못 아는 경우, 알더라도 이행하지 않거나 못하는 경우, 심지어 시책을 악용하는 경우도 생긴다”고 말했다. 그러면서 “그런 여러 경우들을 상정하면서, 그런 일이 최소화되도록 정책을 만들어야 한다. 그런데 중앙정부의 정책부터 빈틈을 남기는 일이 있다”고 지적했다.  그는 “지방자치단체가 분권을 지향한다면, 책임의 분담도 당연히 수용해야 옳을 것”이라며 “자치단체의 고유업무 이거나 자치단체에 위임된 업무일 경우에는 더 말 할 나위도 없다”고 말했다. 이 총리는 그러나 “지방자치단체들이 권한을 주장하는 만큼 책임을 다하고 있느냐에 대해 저는 충분히 확신하지 못한다”고 덧붙였다.  이 총리는 “지방자치단체가 협력하도록 하는 법적, 행정적 또는 정치적 장치가 정책 입안단계부터 마련돼 있어야 한다”면서 “그런데 지방자치단체와 함께 하려는 고려가 정책에 빠져있는 경우 또한 적지 않다”고 말했다. 이어 “정책의 생명은 실행력의 확보에 있다. 실행될 수 있어야 정책”이라며 “실행력이 없거나 미약한 정책안은 수필 같은 것이지 정책이 아니다”라고 강조했다.  이 총리는 “정책의 실행력은 현장을 알아야 확보된다. 현장은 지방자치단체가 잘 안다. 정책은 지방자치단체와 함께 현장에서 정확히 이행돼야 비로소 완성된다”면서 “중앙정부의 많은 공무원들은 현장을 충분히 알지 못하고, 지방자치단체와의 협력의 중요성이나 그 방법에 대해서도 충분히 알지 못한다”고 지적했다.  이 총리는 “직원들보다 경험이 더 많고 현장과 지자체를 더 잘 아시는 분들이 장차관”이라며 “장차관님들께서 정책의 입안과 수립의 과정에 지금보다 훨씬 더 꼼꼼히 관여해 주시기 바란다”고 당부했다.  이진철 (cheol@edaily.co.kr)  ＜ⓒ종합 경제정보 미디어 이데일리 - 무단전재 &amp; 재배포 금지＞"
"이낙연 국무총리는 모든 정책이 그렇지만, 특히 안전정책은 꼼꼼해야 한다며 인간을 포함한 모든 요소가 선의로 작동하는 것만은 아니라는 것을 전제로 정책을 짜야 한다고 밝혔습니다.  이 총리는 오늘 정부서울청사에서 주재한 국정현안점검조정회의에서 연안선박 안전관리 강화방안과 관련해 ""인간도, 행정체계도, 시설도, 장비도 완전하지 못하다""며 이같이 말했습니다.  이 총리는 또 중앙정부의 정책이 제대로 실행되려면 지자체와 함께 이행해야 하지만 지자체들이 권한을 주장하는 만큼 책임을 다하고 있느냐에 대해 확신하지 못한다며 지자체가 협력하도록 하는 법적·행정적·정치적 장치가 입안단계부터 마련돼야 한다고 강조했습니다.  이어 중앙정부의 많은 공무원이 현장을 충분히 알지 못하고, 지자체와 협력의 중요성이나 그 방법에 대해서도 충분히 알지 못한다고 쓴소리를 한 뒤 장·차관들이 잘 챙겨주기를 바란다고 당부했습니다.  한편 애초 오늘 회의 안건에 포함됐던 '수도권 재활용 쓰레기 문제 대응방안'은 어제 사전보고를 받은 이 총리가 현장점검부터 더 하라고 지시해 빠졌습니다.  이 총리는 사전보고를 받는 자리에서 재활용쓰레기 문제가 불거지도록 제때 대응하지 못하고, 수습책도 부실한 점에 대해 안병옥 차관을 비롯한 환경부 당국자들을 강하게 질타한 것으로 전해졌습니다.  [저작권자(c) YTN &amp; YTN PLUS 무단전재 및 재배포 금지]"
"[ 김희경 기자  ] ‘제62회 신문의 날’ 기념대회가 한국신문협회(회장 이병규·사진)와 한국신문방송편집인협회(회장 이하경) 한국기자협회(회장 정규성) 주최로 5일 서울 태평로 한국프레스센터에서 열렸다. 이낙연 국무총리와 이병규 신문협회장(문화일보 회장) 등 정·재계 및 언론계 인사 200여 명이 참석, 신문협회상과 신문의날 표어 공모전 당선작을 시상했다.  이 회장은 “신문은 민주사회를 지탱하는 대표적인 공공재이며 신문의 공익성은 어느 매체로도 대신할 수 없다”며 “신문은 더 소중히 지켜야 할 사회의 공적(公的) 자산이라는 인식의 대전환이 이뤄지길 바란다”고 환영사를 했다.  그는 신문 본연의 역할을 강조하며 재정비도 촉구했다. 이 회장은 “뉴스가 곧 신문이던 시절 신문은 한국 사회의 중심으로서 환대받았다”며 “권력에 대한 감시, 의제 설정 및 여론 형성과 같은 공적 역할이 오롯이 신문의 몫이었기 때문”이라고 말했다. 그는 “하지만 최근에는 상황이 크게 달라졌다”며 “온라인 생태계에 출처와 근본을 알 수 없는 정보가 저널리즘의 탈을 쓰고 넘쳐나면서 전체 언론에 대한 신뢰가 크게 하락했다”고 지적했다. 끝으로 “국민이 신문에 엄중히 요구하는 것은 정확하고 공정한 정보”라며 “우리 사회가 필요로 하는 정제되고 신뢰할 수 있는 유익한 정보를 제공해 나갈 것”이라고 다짐했다.  김희경 기자 hkkim@hankyung.com  [, 무단전재 및 재배포 금지"
"【서울=뉴시스】고승민 기자 = 이낙연 국무총리와 김동연 경제부총리 겸 기획재정부 장관 등 국무위원들이 5일 오후 정부서울청사에서 청년 일자리 확대 등을 위한 4조원 내외의 추가경정예산안을 심의·의결하기 위해 열린 임시국무회의에 참석하고 있다. 2018.04.05.  photo@newsis.com  [사진 영상 제보받습니다] 공감언론 뉴시스가 독자 여러분의 소중한 제보를 기다립니다. 뉴스 가치나 화제성이 있다고 판단되는 사진 또는 영상을 뉴시스 사진영상부(n-photo@newsis.com, 02-721-7470)로 보내주시면 적극 반영하겠습니다."
"세월호 참사 4주기 앞두고 강조/ 중앙·지방정부 책임 일일이 거론/“정책 입안 단계부터 협력해야” 주문  이낙연 국무총리가 세월호 참사 4주년을 맞아 5일 정부 관계자들에게 안전정책·행정의 중요성을 재차 강조했다. 문재인정부 국정과제에 포함된 ‘안전한 대한민국 만들기’의 일환이다.  이 총리는 이날 정부서울청사에서 국정현안점검조정회의를 시작하며 “세월호가 바다에 가라앉아서 안산 단원고등학교 학생 등 304명을 잃은 지 16일로 만 4년이 된다”며 “그날을 생각하며 오늘 회의를 진행하겠다”고 말했다. 이날 회의에는 낚싯배와 여객선 등 연안선박 안전, 지진방재 개선대책 등 안전 관련 안건 두 개가 상정됐다.  이 총리는 먼저 “모든 정책이 그렇지만 특히 안전정책은 꼼꼼해야 한다. 인간을 포함한 모든 요소가 선의로 작동하는 것만은 아니라는 것을 전제로 정책을 짜야 한다”고 강조했다. 이어 안전정책의 책임주체로서 중앙·지방정부의 책임을 하나하나 거론했다. 그는 “중앙정부의 정책이 제대로 실행되려면 지자체와 함께 이행해야 한다”며 “지자체들이 권한을 주장하는 만큼 책임을 다하고 있느냐에 대해 저는 충분히 확신하지 못한다”고 꼬집었다.  이 총리는 그러면서 정책의 입안단계부터 중앙과 지자체가 협력하도록 하는 법적·행정적·정치적 장치가 마련돼야 한다는 점을 강조했다.  홍주형 기자 jhh@segye.com  ⓒ 세상을 보는 눈, 글로벌 미디어  세계일보"
"이낙연 국무총리는 안전정책이 꼼꼼해야 한다며 모든 요소가 선의로 작동하는 것만은 아니라는 것을 전제로 정책을 짜야 한다고 당부했습니다.  이 총리는 오늘(5일) 정부서울청사에서 주재한 제33회 국정현안점검조정회의에서 연안선박 안전관리 강화방안과 관련해 ""인간도, 행정체계도, 시설도, 장비도 완전하지 못하다""며 이같이 밝혔습니다.  이 총리는 세월호가 바다에 가라앉아서 안산 단원고등학교 학생 등 304명을 잃은 지 16일로 만 4년이 되는데, 그 날을 생각하면서 오늘 회의를 진행하겠다고 말했습니다.  이 총리는 이어 중앙정부의 정책이 현장에서 그대로 이행되면 좋지만 그렇지 못한 경우가 많다면서 ""현장에서 모르는 경우, 잘못 아는 경우, 알더라도 이행하지 않거나 못하는 경우, 심지어 시책을 악용하는 경우도 있다""고 지적했습니다.  정책의 생명은 실행력 확보에 있고, 실행될 수 있어야 정책이라며, 지자체와 함께 현장에서 정확히 이행돼야 비로소 완성된다고 이 총리는 밝혔습니다.  (사진=연합뉴스)  김수영 기자(swim@sbs.co.kr)  ※ ⓒ SBS &amp; SBS Digital News Lab. : 무단복제 및 재배포 금지"
"송곳 질문에 답 못하면 불호령  저출산·최저임금·미세먼지 등  주요 현안 발생한 부처 장·차관, 정보 숙지 못했을때 강한 질타  ""나한테도 제대로 답 못하는데 기자 질문에 어떻게 답할거냐""  장관들 '국무회의 노이로제'  ""작년부터 예고된 폐비닐 대란  당장 급한 수거처리도 못하면서 무슨 방안 내놓겠다는 거냐""  환경부 장관, 이 총리 질책 듣고 대책발표 취소하고 현장으로…  [ 고경봉 기자  ]  국무총리는 엄부(嚴父)  이 총리의 질책은 정책 대응이 늦거나 관리가 제대로 안 됐을 때도 있지만 주로 장·차관이 정책 현장에 관한 정보를 숙지하지 못했다고 판단할 때 쏟아진다. 경제부처 한 장관은 “대면 보고하다가 묵묵히 듣던 이 총리가 송곳 질문을 시작하면 ‘올 것이 왔다’는 생각에 식은땀이 흐른다”고 했다. 장관 보고에 배석한 적이 있는 국장급 관료는 “정책 발표를 앞둔 대면 보고나 회의에서 총리가 질문을 던졌는데 장·차관이 대답을 머뭇거리면 곧바로 불호령이 떨어진다”며 “‘나한테도 제대로 답을 못 하는데 기자들 질문에는 어떻게 답할 것이냐’며 ‘제대로 준비될 때까지 브리핑하지 말라’고 해 브리핑이 취소된 사례도 많다”고 전했다.  기자 출신인 이 총리는 사석에서 “국무회의에서 내가 기자라고 가정하고 장관들한테 질문을 던진다. 그 질문에 답을 제대로 해야 언론을 통해 정책이 정확히 전달될 것 아니냐”고 얘기한 적이 있다. 지난해 하반기 차관급 공직자 임명장 수여식에서는 “어떤 질문이 나올 것인지, 이렇게 말하면 어떤 반문이 들어올 것인지를 본능적으로 알아야 한다. 그런 준비가 갖춰져야 기자들한테 나설 수 있다. 덤벙덤벙 나섰다가는 완전히 망하는 것”이라고 강조했다.  보고서류 산더미처럼 쌓아놓은 장관들  사회부처 한 차관은 “이 총리의 정책 관련 질문들은 상당히 구체적이어서 제대로 준비하지 못하면 당황하기 일쑤”라고 했다. 지난달 29일 국정현안점검조정회의에서도 환경부 장관은 “중국 교육부의 미세먼지 대응 방식이 어떤가”라고 묻는 총리 질문에 답하지 못해 교육부 장관과 함께 질책을 들었다. 지난해 하반기 ‘살충제 계란’ 파동이 터졌을 때는 류영진 식품의약품안전처장이 총리의 맹폭을 맞았다. 한 장관은 “첫 번째 보고하는 장관이 깨지는 날이면 회의 시작부터 끝까지 초긴장이 흐른다”며 “사소한 실수라도 생기면 특유의 중저음으로 ‘지금 이걸 보고라고 하는 겁니까’라는 말로 정신을 쏙 빼놓는다”고 전했다. 정치인 출신 장관들도 예외는 아니다. 김현미 국토교통부 장관과 김영주 고용노동부 장관은 부동산 대책, 최저임금과 일자리안정자금 대응 논란 과정에서 총리한테 혼쭐이 난 적이 있다.  이 때문에 장관들은 총리 주재 회의 때가 되면 꼼꼼히 자료를 챙기고 숙지하느라 전날 밤을 새우다시피 한다는 후문이다. 총리실 관계자는 “장관들이 워낙 준비를 철저히 해서 그런지 회의 때 장관들마다 책상 옆에 보고서류를 30㎝ 이상 수북이 쌓아놓고 있다”고 말했다.  고경봉 기자 kgb@hankyung.com  [, 무단전재 및 재배포 금지"
"【서울=뉴시스】배훈식 기자 = 제99주년 대한민국임시정부수립 기념식이 열린 13일 오전 서울 용산구 효창공원 내 삼의사 묘역에 이낙연 국무총리가 참배하고 있다. 2018.04.13.  dahora83@newsis.com  [사진 영상 제보받습니다] 공감언론 뉴시스가 독자 여러분의 소중한 제보를 기다립니다. 뉴스 가치나 화제성이 있다고 판단되는 사진 또는 영상을 뉴시스 사진영상부(n-photo@newsis.com, 02-721-7470)로 보내주시면 적극 반영하겠습니다."
