"앞으로 대학교 등 학교 기숙사의 용적률이 최대 250%까지 허용돼 증·개축이 가능해집니다.  또 개발제한구역 내 노인요양원의 증축과 신혼부부·다자녀가구 등에 대한 아파트 특별공급 인터넷청약, 청소년수련원의 일반인 개별숙박도 허용됩니다.  국무조정실은 이러한 내용을 포함해 '국민불편 영업·입지규제 정비방안'을 발표했습니다.  이낙연 국무총리는 앞서 지난해 12월 26일 국무회의에서 ""영업장 이용 등 국민이 일상생활에서 느끼는 불편사항 개선을 위한 규제 정비를 하라""고 지시한 바 있습니다.  이에 국무조정실은 관계부처와 합동으로 주민·이용자 편의 개선 24건, 생활편의업종 창업·영업 활성화 14건 등 총 38건의 규제정비 방안을 내놓았습니다.  대통령령 이하 규정 정비는 상반기 중에, 법률정비는 하반기까지 각각 완료할 예정입니다.  [저작권자(c) YTN &amp; YTN PLUS 무단전재 및 재배포 금지]"
"각당 관심 법안, 협상 테이블에 올려놓고 처리하자  ""4월20일까지 국민투표법 처리해야""  (서울=뉴스1) 박기호 기자,정상훈 기자 = 우원식 더불어민주당 원내대표는 8일 개헌의 데드라인으로 4월20일을 설정하면서 야권의 태도 변화를 촉구했다.  또한 4월 임시국회 공방전의 핵심인 방송법 개정안과 관련 ""방송의 공정성을 확보할 확실한 방안을 즉각 논의하자""고 제안했다.  우 원내대표는 이날 오전 국회에서 기자간담회를 열고 개헌과 국민투표법, 4월 임시국회 파행 등과 관련 이렇게 밝혔다.  우 원내대표는 먼저 ""새로운 대한민국의 청사진이 될 국민개헌 성사에 정치권 모두 힘을 모아도 시간이 부족한데 자유한국당의 온갖 훼방과 몽니, 바른미래당의 암묵적 공조에 국민 개헌의 시간이 헛되어 흘러가 안타깝다""고 개탄했다.  이어 국민투표법 개정안 처리에 대해 ""야당은 4월20일 국회 본회의에서 통과가 되도록 협조해야 한다""며 ""개헌과 6월 지방선거와의 동시 투표를 위해선 적어도 지방선거 50일 전에는 국민투표법이 반드시 개정돼야 한다""고 주장했다.  우 원내대표는 ""20일 본회의가 국민 개헌의 성사를 가늠할 데드라인""이라며 ""만약 야당이 20일 본회의에서 국민투표법 개정안 처리에 협조하지 않으면 이는 개헌과 지방선거의 동시투표를 무시하겠다는 속셈을 드러내는 것으로 (개헌 무산에 대해선) 한국당과 바른미래당이 책임져야 한다""고 말했다.  야권이 개헌과 관련, 국무총리에 대한 국회 추천권 도입을 요구하는데 대해선 ""받을 수 없다""며 ""이것(권력구조, 개헌 투표 시기)만 협의되면 다른 부분은 좀 더 유연성을 갖고 논의가 가능하다""고 했다.  우 원내대표는 4월 임시국회가 방송법 개정안 처리 문제로 파행을 빚고 있는 것과 관련해선 ""민주당은 언제든 타협하고 협의할 준비가 돼 있다""며 ""정치권이 방송에 영향을 미칠 통로를 원천적으로 차단하고 국민의 방송을 국민 품으로 돌려드릴 확실한 안을 만들자""고 말했다.  그는 ""정치권의 (방송에 대한) 외풍을 차단하고 방송의 공정성을 확보할 확실한 방안을 즉각 국회에서 논의해야 한다""며 ""고위공직자비리수사처(공수처) 설치 등 각 당의 모든 관심법안을 협상 테이블에 올려놓고 속도감 있게 처리하자""고 강조했다.  9일 예정된 이낙연 국무총리의 추가경정예산 시정연설 등의 국회 일정과 관련해선 ""내일 (여야 원내지도부) 정례회동에서 본회의 개회를 강력히 요구할 것""이라며 ""야당도 입으로만 개헌과 민생을 찾지 말고 행동으로 임해야 하고 내일 회동이 국회 정상화의 계기가 되길 바란다""고 덧붙였다.  우 원내대표와 함께 기자간담회에 참석한 박홍근 원내수석부대표는 ""내일 의사일정은 예정대로 두 당(한국당·바른미래당)이 들어오지 않더라도 국회의장은 의사일정을 진행해야 한다""고 했으며 방송법 개정안에 대해선 ""(민주당은) 처리를 하자는 것이다. 조속히 과학기술정보방송통신위원회를 열어 관련 심사에 착수하자""고 말했다.  goodday@news1.kr  ), 무단 전재 및 재배포 금지]"
"김성태 ""국회 의사일정 합의 안 돼""…대정부질문은 예외  ""與의 방송법 논의 제안은 시간 끌기…꼼수 부리지 말라""  【서울=뉴시스】김난영 기자 = 여야의 강대강 대치로 4월 임시국회가 파행을 빚고 있는 가운데 김성태 자유한국당 원내대표는 오는 9일로 예정된 이낙연 국무총리의 추가경정예산안 국회 시정연설에도 불참 의사를 확고히 했다.  김 원내대표는 8일 국회에서 기자간담회를 열어 시정연설 참여 여부를 묻는 질문에 ""국회 의사일정은 교섭단체 간 합의가 이뤄져야만 수립되는 것이다. 그런데 4월 국회 의사일정이 지금까지 합의되지 못했다""고 일축했다.  그는 특히 ""(추경 시정연설은) 원래는 대통령이 와야 한다""고 지적했다. 그는 ""(이 총리가 대통령 대신 추경 시정연설에 나선 것은) 다음에 국민 여론을 보고 개헌 연설을 하려고 자꾸 속도조절을 하는 것""이라고 주장했다.  그는 또 우원식 더불어민주당 원내대표가 ""정치권이 방송에 영향을 미칠 수 있는 통로를 원천적으로 차단하고 공영방송을 국민 품으로 돌려드릴 수 있도록 완전하고 확실한 안을 만들자""며 방송법 논의를 제안한 데 대해서는 ""분명히 시간 끌기""라고 거절 의사를 명백히 했다.  김 원내대표는 ""국회 과학기술정보방송통신위원회에 박홍근 민주당 의원이 제출한 법안을 자유한국당과 바른미래당이 토씨하나 손대지 않고 방송의 독립성과 정치권의 정치적 개입을 원천적으로 줄여나가자는 의지를 가졌다""고 강조했다.  그는 이어 ""가장 빠르게 처리할 수 있는 내용이 있음에도 불구하고 다시 원점에서 논의를 하자는 것은 과방위에서 그 법안 처리는 하지 않겠다는 입장으로밖에 받아들일 수 없다""며 ""그런 꼼수는 부리지 말아야 할 것""이라고 목소리를 높였다.  자유한국당은 다만 오는 10일부터 3일 간 예정된 대정부질문에는 참석할 것으로 보인다. 김 원내대표는 ""대정부질문을 통해 김기식 금융감독원장 사태는 물론이고 그동안 문재인 정권에서 누적돼온 정책적 과오와 포퓰리즘의 실체를 분명히 드러낼 것""이라고 했다.  imzero@newsis.com"
"4월 임시국회가 파행 일주일 만에 정상화 기로에 섰지만 전망은 여전히 안갯속입니다.  여야는 방송법 개정을 비롯한 쟁점법안 처리와 최대 현안인 헌법 개정을 놓고 대립을 이어갔습니다.  여당인 더불어민주당은 방송법 개정에 대한 즉각적 논의 착수를 일단 제안했지만 보수야당에서는 이를 시간끌기용 '꼼수'라고 일축했습니다.  다만 정치권에서는 당장 내일부터 이낙연 국무총리의 추가경정예산 시정연설이 예정된 데다 이어 모레부터 대정부 질문 일정도 줄줄이 잡혀 있어 여야 모두 파행 장기화를 마냥 방치할 수만은 없을 것이란 관측도 나옵니다.  이 때문에 여야 원내대표들이 내일 정세균 국회의장과 정례회동에 앞서 별도로 조찬을 겸한 접촉을 하는 만큼 이 자리에서 교착 국면을 타개할 절충점을 모색할 가능성이 거론됩니다.  민주당은 일단 방송법 개정과 관련해 고위공직자비리수사처법 처리와 연계해온 기존 입장을 부분적으로 완화하며 개헌과 국민투표법 개정, 추경처리 등 당면 현안에 대한 야당의 전향적 태도 변화를 촉구했습니다.  우원식 원내대표는 오늘(8일) 국회에서 기자 간담회를 열고 국회 공전의 표면적 계기를 제공한 방송법 개정과 관련, 방송의 공정성을 담보하는 차원의 방안을 마련하자며 즉각적인 논의를 제안했습니다.  우 원내대표는 회견에서 ""야당이 요구하는 방송법과 관련해 민주당은 언제든 협의할 준비가 돼 있다""며 ""정치권이 방송에 영향을 미칠 수 있는 통로를 원천적으로 차단하고 공영방송을 국민의 품에 돌려드릴 수 있는 완전하고 확실한 안을 만들자""고 밝혔습니다.  방송법 개정에 대한 '맞대응' 성격으로 내놓은 공수처법 처리에 대해서도 반드시 일괄 처리해야 하는 것은 아니라며 한 발 뒤로 물러섰습니다.  개헌 협상에 대해서도 투표시기와 권력구조를 제외한 나머지 부분에 대해 유연성을 발휘할 수 있다고 강조하며 내용상으로 이견이 없는 부분부터 합의를 도출할 가능성을 사실상 열어 놓았습니다.  그러나 보수야당은 방송 정상화 논의 제안을 '시간끌기용 말장난'이라고 비판하며, 단계적 개헌론에 대해서도 반대 입장을 분명히 했습니다.  자유한국당 김성태 원내대표는 기자간담회에서 우 원내대표의 방송법 관련 제안에 대해 민주당이 야당 시절 만든 개정안을 그대로 처리할 것을 거듭 압박하며 ""분명한 시간 끌기이고, 그런 꼼수는 부리지 말아야 한다""고 목소리를 높였습니다.  우 원내대표가 개헌투표 시기와 권력구조에 대한 야당입장 수용 불가 방침을 재확인한 것에 대해서도 ""국민 개헌을 걷어차 버리겠다는 입장을 천명한 것""이라며 ""문재인 대통령과 국회 교섭단체 원내대표들이 모여서 국민 개헌안을 합의할 수 있는 자리를 하루 속히 만들어달라""고 문 대통령과의 직접 개헌협상을 압박했습니다.  바른미래당도, 민주당이 과거 야당시절 내 놓은 방송법 개정안을 처리하지도 않으면서 구체적인 안도 없이 방송정상화 방안을 논의하자는 것은 시간 끌기에 불과다하고 주장했습니다.  또 민주당 우 원내대표가 개헌 시기와 권력구조 문제를 제외하면 개헌 협상에서 유연성을 발휘할 수 있다는 입장을 밝힌 데 대해서는 민주당이 권력기관 개편과 선거제도 개혁과 관련한 대안을 우선 제시해야 한다고 강조했습니다.  신승이 기자(seungyee@sbs.co.kr)  ※ ⓒ SBS &amp; SBS Digital News Lab. : 무단복제 및 재배포 금지"
"- 與 '개헌 6월 데드라인' 압박  - 우원식 ""20일까지 협조 안하면  - 한국당과 논의조차 하지 않겠다""  - 野 '김기식 사퇴하라' 집중공세  - 김성태 ""갑질 외유 진상조사  - 검토 후 추가 폭로 하겠다""  더불어민주당 우원식 원내대표가 8일 국회에서 기자회견을 열고 “국회가 아닌 국민을 위한 개헌을 해야 한다”고 주장하고 있다. (사진=연합뉴스)[이데일리 이승현 기자] 파행을 거듭하고 있는 국회 정상화의 해법을 놓고 여야가 엇갈린 해법을 내놨다. 게다가 기존의 쟁점인 방송법과 개헌, 추가경정예산에 김기식 금융감독원장 논란까지 더해지면서 가뜩이나 꼬인 정국이 더욱 어려워졌다. 내일(9일) 이낙연 국무총리의 시정연설과 모레(10일)부터 대정부질의 일정이 잡혀 있지만 정상적으로 진행되기 쉽지 않다는 관측이 우세하다.  우원식 더불어민주당 원내대표와 김성태 자유한국당 원내대표는 9일 오전과 오후 각각 기자간담회를 열고 국회 정상화 방안을 밝혔다.  우선 우 원내대표는 4월 임시국회 파행의 원인이 되고 있는 방송법 개정안 처리에 대해 “방송법 개정에 대해 민주당은 야당의 의견대로 논의하자는데 이견이 없다”며 “다만 아예 정치권이 방송에 영향을 미칠 수 없도록 확실한 방송 정상화 논의를 시작하자는 게 우리 당의 주장”이라고 말했다.  또 개헌 논의에 대해선 보다 강한 어조로 야당을 압박했다. 그는 “개헌의 시기와 권력구조가 쟁점인데 우리 당은 (한국당이 주장하는) 시기를 6월 이후로 미루는 것과 내각제는 절대 동의할 수 없다”며 “이를 제외하고 모든 사항에 대해 야당과 의견을 조율할 수 있다”고 말했다.  특히 개헌 국민투표를 위해 전제되야 하는 국민투표법 개정안 처리에 대해서 강조했다. 그는 “이달 20일까지 국민투표법 처리에 한국당이 협조하지 않는다면 한국당은 개헌을 하지 않겠다는 것으로, 이후에는 한국당과 개헌 논의를 하지 않겠다”고 밝혔다.  추경에 대해서도 “청년일자리와 군산·통영 지역경제를 위한 추경안도 국회에서 조속히 처리될 수 있도록 협조해 달라”고 주문했다. 최근 야당이 문제를 삼고 있는 김 금감원장의 의혹에 대해선 “국회의 관행으로 일어난 일가지고 임명하지 말라고 하는 건 말이 안된다”고 반박했다.  자유한국당 김성태 원내대표가 8일 국회에서 김기식 금감원장의 ‘피감기관 돈 외유’를 ‘황제외유’라고 비판하고 있다. (사진=연합뉴스)반면 김 원내대표는 이날 간담회에서 “함진규 의원을 ‘김기식 갑질 외유 진상조사단’ 반장으로 진상 조사에 나설 것”이라며 “관련 제보가 계속 들어오고 있는데 이를 면밀히 검토한 후 추가 폭로하겠다”고 엄포를 놨다.  또 우 원내대표가 한국당이 제시한 개헌 시기, 권력구조를 절대 수용할 수 없다는 입장을 밝힌 것에 대해서도 “문 대통령이 지난해 5월 청와대 초청 5당 원내대표 회동때 선거구제 개편이 이뤄진다면 대통령제 아닌 권력구조도 수용할 수 있다고 했는데 1년도 안 돼 여당 원내대표가 이를 뒤집은 것”이라고 비판했다.  이어 “국민투표법은 개헌 부수법안인데 청와대 비서실장까지 나서 처리를 종용하고 있다”며 “개헌이 우선이지, 국민투표법이 우선이 아니다. 이 정권은 선거에 혈안이 돼 국정 시간표 자체를 정략적 목적에 따라 가져가려는 작태를 보이고 있다”고 꼬집었다. 개헌안이 합의되기까지 국민투표법 처리에 협조할 수 없음을 분명히 한 것이다.  여당의 방송법 처리에 대한 입장에 대해서도 “시간끌기다. 박홍근 민주당 의원이 제출한 법안에 대해 한국당과 바른미래가 토씨하나 손대지 않고 처리하자고 하는데 다시 원점에서 논의하자는 것”이라며 “방송법을 처리하지 않겠다는 것으로 받아들일 수밖에 없다”고 강조했다.  4월 임시국회 일정에 대해서도 여야는 전혀 다른 입장을 고수하고 있다. 박홍근 민주당 원내수석부대표는 “만약 내일 국무총리 시정연설에 한국당과 바른미래가 불참할 경우 대정부질의 일정도 진행할 수 없다”고 했고 김 원내대표는 “4월 국회 의사일정 합의가 이뤄지지 않아 (사실상 참여가 어렵다)”며 “다만 대정부질의는 국민들의 알권리 차원에서 문 정권의 인사정책 난맥상을 밝힐 것”이라고 말했다.  한편, 여야 교섭단체 4당 원내대표는 내일 아침 회동을 갖고 4월 임시국회 의사 일정에 대해 협의할 계획이다.  이승현 (eyes@edaily.co.kr)  ＜ⓒ종합 경제정보 미디어 이데일리 - 무단전재 &amp; 재배포 금지＞"
"동영상 뉴스  꽉 막힌 4월 국회…극적타협 가능할까  [뉴스리뷰]  [앵커]  4월 임시국회가 시작된 지 일주일이 지났지만 여야 간 대치로 개점휴업 상태가 이어지고 있습니다.  당장 내일(9일)로 예정된 본회의가 열릴 수 있을지 불투명한 상황입니다.  정영빈 기자가 보도합니다.  [기자]  4월 임시국회는 첫날부터 파행을 빚었습니다.  공수처 신설법안과 방송법 개정안 처리를 놓고 여야 간 힘겨루기 속에 첫날 본회의조차 열리지 못했기 때문입니다.  이후 일주일이 지났지만 아직도 여야는 한발짝도 물러서지 않고 있습니다.  내일(9일)로 예정된 본회의가 정상적으로 열릴 수 있을지도 불투명합니다.  당초 여야 합의에 따라 이번 본회의에는 이낙연 국무총리의 추경 관련 연설이 예정돼 있습니다.  일단 민주당은 본회의에 한국당과 바른미래당이 불참하더라도 이 총리의 추경 연설을 추진한다는 방침입니다.  국회 연설은 의사정족수와 관계가 없기 때문에 얼마든지 진행할 수 있다는 것입니다.  ""국무총리의 시정연설이 예정돼 있고 이번 주에는 대정부 질의도 예정돼 있어 더이상 국회 파행을 방치해서는 안됩니다.""  반면 한국당과 바른미래당은 방송법 처리가 담보되지 않으면 국회 일정에 협조할 수 없다고 맞서고 있습니다.  ""국회 의사일정은 교섭단체간 합의가 이루어져야만 의사일정이 수립되는 것이죠. 그런데 지금까지 합의되지 못했습니다.""  다만 일각에서는 여야가 극적으로 국회 정상화에 합의할 수 있다는 관측도 내놓고 있습니다.  지난 6일 국회로 넘어온 추경안 처리를 마냥 미룰 수 없는데다 야당이 대여 공세의 무대인 대정부질문을 포기하지 않을 것이라는 현실적 판단 때문입니다.  이에 따라 내일 오전 예정된 여야 4개 원내교섭 단체 회동 결과에 관심이 집중되고 있습니다.  연합뉴스TV 정영빈입니다.  연합뉴스TV : 02-398-4441(기사문의·제보) 카톡/라인 jebo23"
"야, 김기식 사퇴 이어 靑 책임론 제기…대여 공세 수위 높일 듯  (서울=뉴스1) 박기호 기자 = 방송법 개정안과 고위공직자비리수사처(공수처) 법안에 대한 여야의 이견으로 4월 임시국회가 파행을 빚고 있는데 김기식 금융감독원장의 국회의원 시절 외유 의혹이 불거지면서 정치권의 대치 전선 확장이 불가피해 보인다.  또한 김 원장이 이날 자신의 의혹에 대해 직적 해명할 것으로 알려지면서 김 원장 문제를 두고 여야의 충돌은 더욱 거칠어질 것으로 예상된다.  여야는 4월 임시국회를 두고 대치 전선을 형성하고 있다.  개헌, 추가경정예산안(추경) 등 여야 모두 한치도 양보할 수 없는 대형 이슈들이 산적해 있어 협상 자체가 쉽지 않다. 여기에 당장 방송법 개정안 처리 문제가 4월 국회의 발목을 잡고 있다.  결국 4월 임시국회를 열기 위한 첫 본회의가 무산된데 이어 9일 예정된 이낙연 국무총리의 추경 관련 연설 일정 역시 불투명해졌다.  이처럼 4월 국회 대치 전선이 형성되면서 여야 사이에 형성된 감정의 골은 어느 때보다 깊어진 상황이다. 이들은 서로를 향해 '보이콧 정당' '청와대 국회 출장소'라고 지칭하면서 책임공방을 이어가고 있다.  여야가 4월 국회를 두고 팽팽한 대치전선을 이어가던 중 김기식 원장의 외유 논란이 터져 나왔다.  그러자 문재인 정부의 빈틈을 노리던 야권은 당장 대여 공세 수위를 한층 끌어올리고 있다.  자유한국당은 연일 김 원장의 사퇴를 촉구한데 이어 청와대까지 직접 정조준하고 나섰다.  한국당은 8일 청와대를 향해 김 원장에 대한 파면과 인사 검증 책임이 있는 조국 민정수석 비서관의 해명과 사죄를 촉구했다.  반면, 민주당은 김 원장의 의혹에 대해선 별다른 입장을 내놓지는 않으면서 추이를 지켜보고 있다. 민주당은 김 원장의 이날 해명을 일단 지켜보자는 방침이다.  민주당 관계자는 이날 ""김 원장이 이날 해명을 한다고 하니 일단 내용을 들어봐야 한다""고 전했다.  김 원장이 이날 자신의 의혹에 대해 해명을 할 예정이지만 야권은 공세를 더욱 강화할 것으로 보인다.  당장 김성태 한국당 원내대표는 이날 일정에 없던 기자회견을 열고 김 원장에 대한 의혹을 집중적으로 제기할 예정이다.  반면 여권 역시 야권의 공세를 더 이상 지켜볼 수가 없는 만큼 야권의 공세에 대한 방어에 나서면서 여야의 충돌이 이뤄질 수밖에 없게 됐다.  게다가 여야 대치 전선은 어느 때보다 가파르게 형성될 것으로 보인다. 여야 모두 4월 임시국회에서 정국의 주도권을 잡아야 한다는 절박감을 안고 있는 탓이다.  그 뿐만 아니라 여야는 공전을 거듭하고 있는 4월 임시국회 파행을 풀기 위한 해법 마련에 나섰지만 김 원장 의혹으로 대치전선 해빙 방안은 더욱 찾기 힘들어지고 있다.  당장 9일 정세균 국회의장과 여야 4당 원내대표 회동이 예정됐지만 해법 도출이 만만치 않을 것이라는 우려가 벌써부터 나온다.  goodday@news1.kr  ), 무단 전재 및 재배포 금지]"
"중기연구원 보고서…45% ""최근 3년간 필요 R&amp;D 인력 채용못해""  (서울=뉴스1) 이승환 기자 = 부설연구소를 보유한 중소기업 10곳 중 6곳이 연구개발(R&amp;D) 인력이 부족한 것으로 조사됐다.  노민선 중소기업연구원 연구위원이 8일 발표한 '중소기업 R&amp;D인력 현황 및 시사점' 보고서에 따르면 조사 대상 기업 중 59.3%가 '적정 수준보다 R&amp;D 인력이 부족하다'고 답했다.  이 조사는 부설연구소를 둔 중소기업 400개사를 대상으로 이뤄졌다. 이들 기업 가운데 '적정 수준'이라는 응답한 기업 비중은 35.3%다. '충분하다'는 답은 5.5%에 그쳤다.  벤처기업 같은 혁신형 중소기업(61.1%)의 부족률이 일반 중소기업(53.9%)보다 다소 높았다. 업력 기준으로는 7년 미만 창업기업 66.7%가 '부족하다'고 답해 어려움이 두드러졌다.  이처럼 인력 부족에 시달리는 것은 채용 자체를 못 하고 있기 때문으로 풀이된다. 절반에 가까운 45.0%가 '최근 3년간 필요 R&amp;D인력을 채용하지 못한 경험이 있다'고 답했다. 혁신형 중소기업(47.3%)의 미채용 경험이 일반 중소기업(38.2%)보다 높은 것으로 나타났다.  R&amp;D인력 확보 전망에 대해선 44.5%가 향후 5년간(2018∼2022년) R&amp;D인력 수급 상황이 '악화할 것'이라고 예상했다.  '현재 수준과 동일'할 것이라는 응답 비중은 33.0%였다. '현재 수준보다 개선'될 것이란 답은 22.5%에 불과했다.  노민선 연구위원은 ""중소기업의 R&amp;D인력난 완화를 위해선 중소기업과 근로자 모두에게 도움이 되는 근본적인 해결방안이 마련돼야 한다""며 ""특히 청년 인력과 이공계 석·박사급 고급 인력를 중소기업으로 유입하는 방안이 필요하다""고 강조했다.  mrlee@news1.kr  ), 무단 전재 및 재배포 금지]"
