"[신동아]  “수사권 조정은 그간의 검찰권력 파행 때문”  ● 두 대통령 구속, 사람 아닌 제도 문제  ● 수사종결권 경찰 안 주면 의미 없어  ● 진보 정권 20년? 그런 교만한 소리 하면 안 돼  ● 수능 연기 건의하고 일주일 잠 못 이뤄  ● 인권보호 차원에서 수사권 조정 중  ● 한국 전자정부, 국제사회 신뢰 얻어  행안부가 전자정부 실천에 앞장서는 것 같더군요.  “전자정부와 관련된 사업들이 상당 부분 내용을 잘 갖춰가고 있어요. (장관실 벽에 걸려 있는 ‘전자정부 해외진출 현황’ 지도를 가리키며) 이 때문에 우리와 협력하자는 나라가 많아요. 지금 50~60개국은 되잖아요? 우리에게 전자정부와 관련해 도움을 달라, 협약을 하자, 공무원 훈련해 달라 그런 요청이 많죠. 그만큼 전자정부에 대해선 한국이 자부심을 가져도 좋아요. 여기다 투명성, 이런 부분들만 첨가된다면 국제사회에서 한국 정부의 신뢰도가 확 높아질 것 같아요.”  박근혜 전 대통령에 이어 이명박 전 대통령까지 구속된 상황은 사람의 문제입니까, 시스템의 문제입니까.  “논쟁이 되겠지만 저는 기본적으로 제도 자체에 문제가 있다고 봅니다. 국민이 선택한 대통령이 임기가 끝나고 난 뒤에 감옥을 가고 기소를 당하고, 이게 정상적인 상황은 아니죠. 그래서 개헌을 하면 권한도 있지만 책임을 명확히 묻는 방법, 그다음에 책임을 묻더라도 투명성을 획기적으로 높일 수 있는 방법을 시스템으로 만들어야 해요. 결국은 제도 설계를 제대로 해서 비극적인 대통령이 안 나오게 해야죠.”  야당에선 두 전직 대통령 구속을 정치보복이라고 주장합니다만.  “이명박 전 대통령 구속에 대해 국민 상당수가 찬성한다는 여론조사 결과가 있더군요. 정치 노선을 떠나 이는 국민 눈높이에서 봐야 할 사안이라고 생각합니다.”  여권 일각에서 진보 정권 20년 장기 집권론을 얘기하는데요.  “그런 교만한 소리 하면 안 됩니다. 기본적으로 문재인 정부가 내거는 미래 비전이 공동체를 제대로 뒷받침하느냐, 그 비전에 따라서 4차 산업혁명이라는 세계사적인 흐름을 놓치지 않을 것이냐를 봐야 해요. 이 분위기면 우리가 20년 가네, 그런 소리가 어디 있어요. 그거는 국민들한테 크게 혼날 이야기예요. 정치권엔 부침이 항상 있는 겁니다.”  “딸 셋 둔 아버지로서…”  여당 정치인도 많이 연루된 미투운동은 어떻게 봅니까.  “과거 산업화 시대는 남성이 가지는 권력, 그 권력에 뒷받침되는 노동력이 확실히 여성보다 우위에 있었죠. 그러니까 남성이 상황을 지배하는 게 가능했다고 봅니다. 그러나 인공지능이 나오고 전부 디지털화되면서 이 권력이란 건 아무 의미가 없어졌어요. 남성보다 여성이  더 섬세하고, 상대편을 이해하는 능력이 더 뛰어나고, 상황에 더 빨리 적응하죠. 이미 문명 전환이 온 겁니다. 이것을 옛날 방식으로 뭉갠다든지, 무시한다든지 혹은 대상화한다든지, 펜스 룰에 따라서 배제한다든지 하는 것은 안 되죠.”  미투 운동에 공감하는 입장이군요.  “딸 셋을 둔 아버지로서 여성이 당하는 피해에 대해 늘 불안한 마음을 가지고 있다 보니 자연스럽게 여성의 입장에서 미투운동을 보며 많이 공감하고 있어요. 그동안 우리 사회는 성장 위주의 급속한 경제 발전을 이뤘죠. 그 과정에서 성적 차별, 여성 인권 존중과 같은 사회적 가치가 제대로 정착되지 못했어요. 미투운동은 남성 중심의 권위적 사회에서 남녀가 동등하게 대우받는 사회로 전환하는 계기가 될 것입니다.”  장관의 목표는 대통령인가요?  “정치를 하는 사람이 어떤 꿈을 갖는 것을 뭐라 할 수 없지만, 현실에서는 주어진 역할을 잘 수행하기 위해 혼신의 힘을 다할 수밖에 없어요. 그게 쌓이고 쌓이다 보면 국민 눈에 띄는 리더가 될 수도 있고, 또 눈에 안 띄면 거기까지 하는 거고요. 저는 막 계산해 ‘다음에 뭐, 그다음에 뭐’ 하는 정치인을 믿지 않아요. 그런 정치를 하려면 제가 대구에 왜 갔겠습니까. 노무현이란 사람이 부산에 왜 갔겠습니까. 지금 제겐 문재인 정부가 국민 속에 안착하는 것이 제일 중요해요. 행정안전부 장관의 소임을 다하는 것을 목표로 삼고 있습니다.”  | 허만섭 기자 mshue@donga.com  송국건 영남일보 서울취재본부장 song@yeongnam.com"
"동영상 뉴스  이낙연 국무총리가 세월호 사고원인은 '한점 의혹없이 조사할 것'이라고 강조했습니다.  이 총리는 어제(21일) 진도 팽목항과 '기억의 숲', 목포 신항을 둘러보고 유족들을 만나 이렇게 말했습니다.  2기 특별조사위원회에 참여한 일부 인사를 배제해달라는 유족들의 요구에 대해서는 정부가 간섭하는 것은 법 취지에 맞지 않는다면서, 특조위원들도 각오를 단단히 하고 있을 것이라고 덧붙였습니다.  진도와 목포, 안산이 거론되고 있는 세월호 선체 보존 장소에 대해서는 세월호는 ""기억될 만한 곳에 거치돼야 한다""며 자치단체와 유가족들의 의견을 존중하겠다고 말했습니다.  이 총리는 이어 다음 달 세월호 직립작업이 끝난 뒤에는 ""미수습자 가족들이 이제 됐다고 할 때까지 선체 수색을 철저히 해 달라고 선체조사위원회 관계자들에게 당부했습니다.  [저작권자(c) YTN &amp; YTN PLUS 무단전재 및 재배포 금지]"
"과학정보통신의 날 기념식서  이낙연 총리 정부 계획 강조  ""과학기술이 혁신성장을 이끌고, 국민의 삶을 개선하는 데 더 많이 기여하도록 국가 R&amp;D행정을 혁신하고 기초연구에 더 투자할 것입니다.""  지난 20일 대전 유성구 국립중앙과학관 사이언스홀에서 열린 '2018년 과학·정보통신의 날 기념식'에서 이낙연 국무총리는 과학기술에 대한 정부의 지원 계획에 대해 이 같이 강조했다.  이 총리는 이날 축사를 통해 ""과학기술과 ICT 융합, 신산업 성장을 가로막는 규제를 과감히 혁파하고, 과학기술이 미세먼지 같은 환경문제와 지진 등 안전문제 해결에 더 잘 공헌하도록 R&amp;D사업 쇄신과 R&amp;D 비용 적기 투입, 연구몰입 환경 조성을 추진하겠다""고 강조했다.  앞서 김명자 한국과학기술단체총연합회 회장은 기념사에서 ""R&amp;D 성과 확산은 단순히 신성장동력 창출이 아니라 안전과 안보, 복지, 삶의 질 향상에 기여해야 한다""며 ""과학기술계가 사회적 가치 공유와 창출에 힘써 혁신성장을 이끌고 국민에게 더 다가가야 할 것""이라고 밝혔다.  '국민의 삶과 안전 지킴이, 과학기술·ICT'를 주제로 열린 기념식에는 이 총리를 비롯해 유영민 과학기술정보통신부 장관, 김명자 한국과총 회장, 이계철 한국정보방송통신대연합회장 등 과학기술·정보통신 분야 주요 인사, 과학기술 유공자, 정부포상 수상자 등 1000여 명이 참석했다.  특히 처음으로 과학기술 발전에 공헌이 큰 권이혁 서울대 명예교수 등 32명을 '과학기술 유공자'로 지정, 시상했다. 과학기술 진흥과 정보통신 발전 유공자 120명에 대한 훈·포장, 대통령, 국무총리 표창도 수여됐다.  과학기술 진흥 부문에서는 컴퓨터지원설계(CAD) 분야의 세계적 권위자로, 우리나라 공학교육 혁신을 선도한 이건우 서울대 교수가 창조장(1등급)을 수상했따. 정보통신발전 부문에서 동탑산업훈장(3등급)은 컴퓨터 시뮬레이션 SW를 개발해 해외 110개국에 수출하고, 구조해석 SW시장 세계 1위를 달성한 이형우 마이다스아이티 대표, 홍조근정훈장(3등급)은 이철희 전 분당서울대병원장이 수상했다. 이와 함께 우수과학 어린이(5691명), 우수과학교사(225명), 과학기술 유공자(175명) 등 모두 6091명에게 과기정통부장관 표창이 수여됐다.  한편, 과기정통부는 과학·정보통신의 날을 기념해 이날부터 22일까지 사흘간 대전 국립중앙과학관에서 '국가 연구개발 우수성과 특별전'을 열었다. 특별전에는 무인자동 미니트램, 휴대용 초음파 영상진료 시스템, 스마트 펜 등 최근 3년간(2015∼2017년)의 연구성과 중 상위 0.02%에 속하는 우수 연구성과물 16건이 전시됐다.  대전= 이준기기자 bongchu@dt.co.kr  이준기"
"(서울=연합뉴스) 왕길환 기자 = 세계 30여 개국에서 우리말 매체를 운영하는 한인언론인들의 모임인 세계한인언론인협회(공동회장 전용창·김소영)는 한인사회와 고국이 소통하는 채널인 잡지 '세계한인'(Global Korean)을 오는 5월 창간한다고 22일 밝혔다.  112쪽 분량의 창간호는 커버스토리, 포커스, 글로벌 한상, 글로벌 코리안, 전 세계 한인 소식을 다룬 '인사이다 OK', 협회 회원 동정인 '브라보 마이라이프', 글로벌 칼럼, 지난 9∼13일 서울과 인천, 전주 등지에서 열린 제17회 세계한인언론인대회 관련 소식 등으로 구성됐다.  특히 커버스토리는 이낙연 국무총리 주최 오찬 간담회 내용을 사진과 함께 상세히 실었다.  창간호는 3천 부를 발행해 정부와 관련 기관, 국회, 재외동포 언론과 한글 관련 단체, 한인회 등에 무료로 배포하기로 했다.  앞으로 애플리케이션(앱)을 통해서도 확인할 수 있도록 할 계획이다.  전용창 회장은 ""올해는 계간지로 출발하지만, 내년부터는 월간지로 발행할 예정""이라며 ""잡지는 한인과 한인, 한인과 한인사회, 한인사회와 국민간 소통 채널 역할을 할 것""이라고 밝혔다.  ghwang@yna.co.kr"
"(서울=연합뉴스) 김승두 기자 = 이낙연 국무총리가 23일 오후 서울 강남구 코엑스 그랜드볼룸에서 열린 2018 평창 동계올림픽 및 동계패럴림픽 대회의 성공적인 개최에 큰 힘을 보탠 자원봉사자 해단식에 참석, 국기에 경례하고 있다. 오른쪽은 도종환 문화체육관광부 장관. 2018.4.23  kimsdoo@yna.co.kr"
"[이데일리 김영환 기자] 오는 27일 열리는 남북 정상회담을 앞두고 청와대는 첫번째 리허설에 돌입한다. 남북 정상회담 전까지 우리측과 북측은 모두 3번의 리허설을 갖는다. 우리측이 2번, 북한 인사가 참여한 리허설이 1번으로 오늘(24일) 열리는 리허설은 우리측 인원으로만 진행된다.  문재인 대통령은 또 청와대에서 국무회의를 주재한다. 국무회의에는 이낙연 국무총리를 포함한 장관들이 참석할 예정이다. 문 대통령은 이 자리에서 내각에 국내 이슈 점검을 당부할 것으로 점쳐진다.  다음은 24일 주요 경제일정이다.  ◇경제·금융  10:00 김동연 부총리, 국무회의(청와대)  10:00 김상조 위원장, 국무회의(세종청사 영상회의실)  15:00 김동연 부총리, 우크라이나 부총리 면담 KSP MOU 체결 및 양국 경제협력방안 논의(비공개)  10:00 특별회계·기금 국유재산 관리상황 점검 추진  소비자기본법 시행령 개정안 국무회의 통과(참고)  하도급법 시행령 개정안 국무회의 통과(참고)  10:00 유영민 장관, 본부장 국무회의(청와대)  14:00 유영민 장관, 스마트미디어 X 캠프(상암 누리꿈스퀘어)  미래소재 원천기술 확보전략 수립(25일 조간)  2018 상반기 연구산업 시장 설명회 개최(25일 조간)  미디어 업계 협업의 장, 2018 스마트미디어X 캠프 개최(25일 조간)  ◇정치·사회  청와대, 남북 정상회담 리허설(판문점 평화의집)  ◇산업·증권  10:00 통상교섭본부장 차관 국무회의(청와대)  산업부, 5대 신산업 프로젝트의 가시적 성과창출에 박차(25일 석간)  김영환 (kyh1030@edaily.co.kr)  ＜ⓒ종합 경제정보 미디어 이데일리 - 무단전재 &amp; 재배포 금지＞"
"평창자원봉사단 해단식…""여러분의 공헌, 역사에 남을 것""  (서울=연합뉴스) 성혜미 기자 = 이낙연 국무총리는 23일 ""평창의 겨울이 한반도의 봄을 가져왔다""며 ""한반도의 이 봄이 평화의 꽃을 피우고 번영의 열매를 맺도록 마음을 모아달라""고 말했다.  이 총리는 이날 오후 서울 코엑스에서 열린 '2018 평창동계올림픽 자원봉사단 해단식'에서 격려사를 통해 이같이 밝혔다.  noanoa@yna.co.kr"
"【서울=뉴시스】고범준 기자 = 이낙연(가운데) 국무총리, 도종환(오른쪽) 문화체육관광부 장관, 최문순 강원도지사를 비롯한 참석 내빈들이 23일 오후 서울 강남구 코엑스 그랜드볼룸에서 열린 '2018평창동계올림픽대회 및 동계패럴림픽대회 자원봉사자 해단식'에서 국민의례를 하고 있다. 2018.04.23.  bjko@newsis.com  [사진 영상 제보받습니다] 공감언론 뉴시스가 독자 여러분의 소중한 제보를 기다립니다. 뉴스 가치나 화제성이 있다고 판단되는 사진 또는 영상을 뉴시스 사진영상부(n-photo@newsis.com, 02-721-7470)로 보내주시면 적극 반영하겠습니다."
"남북, 오늘 3차 경호·의전·보도분야 실무회담 개최  (서울=뉴스1) 박승주 기자 = 문재인 대통령은 남북정상회담을 나흘 앞두고 열리는 수석·보좌관회의에서 청와대 차원의 정상회담 준비 상황을 다시 한번 점검한다.  문 대통령은 23일 오후 2시 청와대에서 수보회의를 주재하고 정상회담 관련 사항을 재확인하는 한편, 회담의 성공적인 개최를 위한 노력을 당부할 예정이다.  문 대통령은 전날(22일) 오후 청와대에서 남북정상회담 의제 최종점검회의를 소집하고 남북공동선언 합의문 수준과 북한의 변화된 상황 등을 논의했다.  회의에는 임종석 대통령비서실장, 정의용 국가안보실장, 장하성 정책실장, 서훈 국가정보원장, 조명균 통일부 장관 등이 참석했다.  이 회의에서는 김정은 북한 국무위원장이 20일 노동당 중앙위원회 전원회의를 통해 21일부터 핵실험·대륙간탄도미사일(ICBM) 시험발사를 중지하고 북부 핵실험장을 폐기한다는 내용의 결정서를 채택한 것과 관련한 정세분석과 남북정상회담에 미칠 영향에 대해 심도있는 토론을 진행했다.  전날 정상회담과 관련된 청와대 실무자들 또한 출근해 지난 21일 판문점 회담 현장에서 이뤄진 경호와 안전 관련 관계기관 대책회의 결과를 바탕으로 점검사항들을 체크했다.  문 대통령은 다음날(24일) 청와대에서 열리는 국무회의를 주재한다. 이 자리에서는 이낙연 국무총리를 포함한 내각들에 국내 이슈 점검을 당부할 것으로 예상된다.  이번주 문 대통령은 수보회의와 국무회의를 제외한 일정을 따로 잡지 않고 정상회담 전략수립에 총력을 기울인다는 방침인 것으로 전해졌다.  23일에는 판문점 북측 통일각에서 남북 제3차 경호·의전·보도 분야 실무회담도 열린다.  회담에선 김정은 북한 국무위원장이 군사분계선(MDL)을 어떤 방식으로 넘을지, 회담에 남북 퍼스트레이디가 참석할지, 고위급회담이 한번 더 열릴지 등 다양한 문제가 최종 조율될 것으로 예상된다.  앞서 남북은 지난 18일 2차 의전·경호·보도 분야 실무회담을 하고 정상회담 당일 문 대통령과 김 위원장의 첫 만남을 생방송으로 전세계에 알리기로 합의했다.  24일에는 정상회담을 위한 우리 정부의 첫 리허설도 예정돼 있다. 리허설은 24일과 26일 두 차례에 걸쳐 진행될 예정이다.  24일에는 판문점 종합상황실이 개소되고 남북정상회담 준비위원회 분과장단 전원이 참석해 행사 당일 전체 일정을 재연할 예정이다. 남북정상회담 직전일인 26일에는 24일보다 좀 더 세밀한 시간 계획하에 리허설이 진행될 계획이다.  북측도 선발대가 이르면 24일 남쪽으로 내려와 우리측과 같은 방식으로 리허설을 준비한다. 경우에 따라서는 남북의 실무진이 함께하는 공동 리허설도 이뤄질 수도 있을 것으로 보인다.  parksj@news1.kr  ), 무단 전재 및 재배포 금지]"
"【서울=뉴시스】고범준 기자 = 이낙연 국무총리가 23일 오후 서울 강남구 코엑스 그랜드볼룸에서 열린 '2018평창동계올림픽대회 및 동계패럴림픽대회 자원봉사자 해단식'에 참석, 치사에 앞서 인사를 하고 있다. 2018.04.23.  bjko@newsis.com  [사진 영상 제보받습니다] 공감언론 뉴시스가 독자 여러분의 소중한 제보를 기다립니다. 뉴스 가치나 화제성이 있다고 판단되는 사진 또는 영상을 뉴시스 사진영상부(n-photo@newsis.com, 02-721-7470)로 보내주시면 적극 반영하겠습니다."
"【서울=뉴시스】고승민 기자 = 이낙연 국무총리가 23일 오후 정부서울청사 접견실에서 케마이스 지나우이 튀니지 외교장관을 접견하고 있다. 2018.04.23.  kkssmm99@newsis.com  [사진 영상 제보받습니다] 공감언론 뉴시스가 독자 여러분의 소중한 제보를 기다립니다. 뉴스 가치나 화제성이 있다고 판단되는 사진 또는 영상을 뉴시스 사진영상부(n-photo@newsis.com, 02-721-7470)로 보내주시면 적극 반영하겠습니다."
"평창 동계올림픽 자원봉사단 해단식  (서울=뉴스1) 박승주 기자 = 이낙연 국무총리는 23일 평창 동계올림픽의 성공 개최를 위해 애썼던 자원봉사자들을 만나 이들의 노고를 격려했다.  이 총리는 이날 오후 서울 강남구 코엑스에서 열린 '평창 동계올림픽 자원봉사단 해단식' 격려사에서 ""재작년 7월 올림픽 자원봉사단 모집으로 시작된 긴 여정이 오늘 마침내 마침표를 찍게 된다""며 ""자원봉사자 여러분이 참 많이 고생했다""고 밝혔다.  이날 해단식에는 850여명의 자원봉사자를 비롯해 도종환 문화체육관광부 장관, 심보균 행정안전부 차관, 이희범 평창올림픽 조직위원회 위원장, 최문순 강원지사 등이 참석했다. '영미팀'으로 유명한 여자 컬링 국가대표 선수들도 자리했다.  이 총리는 올림픽 당시 일부 자원봉사자가 노로바이러스에 감염돼 격리되거나 중도에 귀가한 점, 야외 봉사자들이 추위에 시달린 점 등을 언급하면서 ""여러분의 고통에 저는 지금도 미안한 마음을 누르지 못하겠다""고 말했다.  평창 올림픽과 패럴림픽을 위해 일한 자원봉사자는 연인원 1만7712명이며 두 대회에 모두 참여한 사람은 3367명이다. 이들은 안내, 경기진행, 방송, 의료, 통역 등 17개 분야에서 활약했다.  이어 이 총리는 ""평창 동계올림픽과 패럴림픽은 그 자체로도 성공했지만, 한반도의 해빙에 결정적으로 기여했다. 남북정상회담, 북미정상회담 등 일련의 정상회담이 어떤 놀라운 합의를 내놓을지 세계가 주목하고 있다""며 ""기적과도 같은 이 모든 전개는 여러분이 봉사했던 올림픽에서 시작됐다""고 말했다.  이 총리는 또 ""한반도에 봄이 오게 하는 데 여러분도 기여했다는 사실에 자부심을 느껴도 좋다고 생각한다""며 ""한반도의 이 봄이 평화의 꽃을 피우고 번영의 열매를 맺도록 앞으로도 마음을 모아 주리라 믿는다""고 밝혔다.  이 총리는 ""정부가 자원봉사자에게 인증서를 준 데서 그치지 않고 여러분의 노력을 데이터베이스화해서 또 하나의 올림픽 유산으로 만들기로 했다""며 ""여러분의 공헌은 평창의 또 다른 성공으로 역사에 길이길이 남을 것""이라고 강조했다.  parksj@news1.kr  ), 무단 전재 및 재배포 금지]"
"대한민국 과학기술 유공자 지정서 전달···IBS 본원 개원식 개최 등4월20일 정부는 제51회 과학의 날 및 제63회 정보통신의 날을 맞아 이낙연 국무총리, 유영민 과학기술정보통신부 장관, 김명자 한국과학기술단체총연합회 회장 등이 참석한 가운데 대전 국립중앙과학관에서 기념식을 개최했다.  이날 행사에는 ‘과학기술 진흥 및 정보통신 발전 유공자’들이 지정서를 받았다. 이번 지정은 한국 과학발전을 이끌어 온 원로 과학인들을 예우하기 위해 마련됐다. 이날 시상한 유공자는 총 120명으로 훈장 및 포장, 대통령 표창, 국무총리 표창으로 나뉘었다. 그 중 지난해 첫 선정한 ‘대한민국 과학기술 유공자’ 32명 중 8명이 행사에 직접 참석해 과학기술 유공자 지정 증서를 받아 의미를 더했다.  행사에서 이낙연 국무총리는 “이제 우리는 국가 경제의 지속적인 발전 동력을 새로 찾으면서 우리 국민은 물론 세계 인류의 번영과 행복에 기여해야 한다”라며 “문재인 정부는 이 벅찬 과업을 과학기술 정보 방송 통신으로 헤쳐나가고자 한다”라고 밝혔다. 올해 정부가 지정한 R&amp;D 예산은 19조7000억원으로 역대 최대다.  행정중심복합도시건설청이 ‘조치원우회 도로공사’ 및 ‘회덕나들목(IC)연결 도로공사’의 기본 및 실시설계용역을 본격적으로 추진한다.  ‘조치원우회도로’는 총 사업비 1327억원을 투입해 총 연장 7.99km(4차로 신설)를 2023년까지 시행하는 사업이다. 또한, ‘회덕나들목(IC)연결도로’ 사업은 총 사업비 721억원을 행복청과 대전시가 매칭으로 각각 50%씩 분담해 총 연장 0.8km(IC신설)를 2023년까지 시행하는 사업이다.  행복청은 ‘조치원우회도로’가 개통되면 행복도시 개발에 따라 증가하는 조치원 시가지 교통지체 등이 완화돼 세종시 북부지역으로부터 천안 및 화성, 평택까지 이어지는 국도1호선의 기능 향상이 기대된다고 밝혔다. ‘회덕나들목(IC)’의 경우 영남권으로부터 행복도시까지의 거리가 약 7km 단축되고, 조성 중인 국제과학비지니스밸트 거점(신동.둔곡) 지구의 접근성 향상을 기대한다.  ◇ 금산군, 지방세 체납액 강제징수 돌입  금산군이 40억2400만원에 달하는 지방세 체납액 강제징수에 돌입했다. 군은 그동안 독촉장과 문자발송, 전화 등 다양한 방법으로 체납액을 자진납부해 줄 것을 독려했다. 하지만 체납액이 계속 늘어남에 따라 오는 6월 말까지 ‘상반기 체납액 일제정리 기간’으로 정했다.  체납액 일제정리 기간에는 군·읍·​면 합동 징수반을 구성 징수활동을 강화하는 한편 예금·​급여·​부동산 및 차량 압류 등 체납처분을 할뿐 만 아니라 관허사업 제한, 신용정보 등록, 명단공개 등 행정제재도 병행한다.  특히, 전체 체납액의 35%이상 차지하는 자동차세 체납에 대해서는 ‘체납차량 번호판 영치팀’을 주 2회 상시 운영해 2회 이상 체납차량은 번호판을 영치하고 1건 체납차량은 영치예고를 실시 자진납부를 유도하기로 했다.  ◇ 태안군, 에너지 효율화 사업 진행  태안군은 올해 △경로당 LED 조명 교체 △LPG 소형저장탱크 농어촌 마을 보급 △취약계층 가스시설 개선 △태안읍 도시가스 공급배관 설치 △신재생에너지보급 주택지원 ‘그린홈’ 사업 등을 중점 추진한다.  도시가스가 공급되지 않는 농어촌 지역에 LPG 소형저장탱크를 보급키로 하고 4억5000만원을 들여 고남5리 70가구에 오는 하반기까지 소형저장탱크 보급을 마무리할 계획이다. 또한, LPG 가스시설의 고무배관을 금속배관으로 교체키로 하고 올해 5800만원을 투입해 오는 10월까지 기초생활수급자와 차상위계층 등 243가구를 대상으로 사업을 추진한다. 한국가스안전공사와의 협약을 통해 오는 2020년까지 2000여 가구에 금속배관 교체 사업을 추진한다.  태안읍 도시가스 미 공급지역에 대한 공급배관 설치 사업도 지속 추진된다. 도시가스 공급배관 확충을 위해 충남도 및 미래엔서해에너지 간 협약을 맺고 올해 5억1000만원을 들여 남문1·2리 일원에 총 2200m의 배관망을 설치, 353가구에 도시가스를 공급할 예정이다.  군은 이밖에도 신재생에너지보급 주택지원 사업인 ‘그린홈’ 사업에도 1억5900만원을 지원하는 등 다양한 에너지 사업을 적극 발굴해 추진하겠다는 방침이다.​  대전 = 김상현 기자 sisa411@sisajournal.com"
