"ㆍ암석 30톤 덮쳐…매몰자 6명 중 3명은 중경상  국내 유일의 철광산인 강원 정선군 한덕철광에서 매몰사고가 일어나 3명이 숨지고 3명이 중경상을 입는 등 6명의 사상자가 발생했다.  26일 오후 3시56분쯤 강원 정선군 신동읍 조동리 한덕철광 신예미광업소 제2수직갱도에서 발파작업 중 갱도가 무너져내리면서 6명이 돌무더기에 매몰됐다.  이 사고로 서모씨(63·대구 중구)와 진모씨(64·정선군 사북읍), 심모씨(69·정선군 사북읍) 등 3명이 숨졌다. 또 김모씨(54·정선군 사북읍), 이모씨(53·정선군 사북읍), 김모씨(43·정선군 신동읍) 등 3명이 중경상을 입어 충북 제천지역 병원으로 이송돼 치료를 받고 있다.  이날 사고는 갱구에서 5㎞가량 떨어져 있는 제2수직갱도 지하 약 500m 지점에서 수평갱도 굴진을 위한 발파작업 도중 발생했다. 발파와 동시에 돌덩이가 한꺼번에 쏟아져내리면서 갱도 안은 삽시간에 아수라장으로 변해버렸다.  당시 갱도 안에는 14명이 있었으나 사고 지점에서 멀리 떨어져 있던 8명은 암석이 무너지는 소리를 듣고 자력으로 무사히 탈출했다. 사고 직후부터 한덕철광 내 자체 구조대와 동부광산안전사무소, 119구조대 등 100여명이 투입돼 매몰자 구조작업에 나섰다.  하지만 사고 지점이 갱 입구에서 5㎞가량 떨어져 있어 차량으로 이동하는 데 30분가량 소요되는 데다 중장비의 교행이 어려울 정도로 갱도가 비좁아 구조작업에 큰 어려움을 겪었다.  강원도소방본부 관계자는 “119 특수구조단을 현장에 급파하고 구조견까지 투입해 구조작업에 안간힘을 썼으나 갱도 붕괴로 떨어진 암석이 30여t에 달해 매몰자를 찾는 데 많은 시간이 걸렸다”고 말했다. 이어 “사고 발생 5시간여 만인 이날 오후 8시23분쯤 구조작업이 모두 완료됐다”고 덧붙였다.  한덕철광 신예미광업소는 국내에서 유일하게 철광석을 생산하고 있는 곳이다. 2001년 설립된 한덕철광은 매년 60만t 이상의 철광석을 생산해 포스코 등에 납품하고 있는 것으로 알려졌다.  이낙연 국무총리는 “소방청 등 관계부처는 가용한 모든 장비와 인력을 동원해 매몰자 구조에 최선을 다하라”고 긴급 지시하기도 했다.  백운규 산업통상자원부 장관은 이날 저녁 사고현장을 방문했다.  ▶ 경향신문 SNS ), 무단전재 및 재배포 금지"
"이낙연 국무총리. 뉴시스 제공[세종=이데일리 이진철 기자] 이낙연 국무총리는 26일 오후 4시께 강원도 정선군 신동읍 조동리 소재 철광석 광산에서 발생한 갱도사고와 관련해 “소방청장은 관계부처와 함께 가용한 모든 장비와 인력을 동원하여 고립자 구조에 최선을 다하고, 부상자 이송·치료에도 만전을 기할 것”을 긴급 지시했다고 총리실이 밝혔다.  이 총리는 또 “산업통상자원부 등 관계부처 장관은 사고자 가족에 대한 지원과 이후 사고 수습에 소홀함이 없도록 대응해 줄 것”을 당부했다.  이진철 (cheol@edaily.co.kr)  ＜ⓒ종합 경제정보 미디어 이데일리 - 무단전재 &amp; 재배포 금지＞"
"AI 22건·구제역 2건…발생건수 10분의 1로 줄어  AI·구제역 위기경보 단계 ‘심각’→‘주의’로 낮춰  이낙연 ""잘한 건 유지하고 미진한 부분 보완해야""이재욱 농림축산식품부 식품산업정책실장이 26일 오전 정부세종청사에서 26일부로 고병원성 조류 인플루엔자(AI)와 구제역 관련 위기경보 단계 하향 조정을 발표하고 있다. (사진=뉴시스)  [세종=이데일리 김형욱 기자] 겨울철 기승을 부린 고병원성 조류 인플루엔자(AI)와 구제역 확산 위험이 한풀 꺾였다. 이대로면 올해 가축전염병 피해가 예년의 10분의 1 수준으로 막게 된다.  농림축산식품부는 지난 24일 가축방역심의회를 열고 26일부로 닭, 오리 등 가금류 전염병인 AI 위기경보 단계를 ‘심각’에서 ‘주의’로 하향 조정한다고 밝혔다. 전국 방역지역에 대한 이동제한도 모두 해제했다. 소, 돼지 등 우제류(발굽이 둘로 갈라진 동물)에 전염되는 구제역도 30일까지 상황을 지켜본 후 이상이 없을 땐 역시 위기단계를 낮추고 이동금지 제한을 풀기로 했다.  고병원성 AI는 지난해 11월17일 전북 고창 오리농장에서 발생한 이후 올 3월17일 충남 아산 산란계 농가까지 총 22건이 발생했다. 방역 당국은 그러나 이를 마지막으로 40일 동안 AI 추가 발생이 없었고 추가 발생 위험도 낮다는 판단에 이번에 이동제한을 해제했다. 구제역 역시 지난달 26일 김포 돼지농가에서 14개월만에 발생했으나 4월1일 두 번째 감염 이후 추가 발생이 없고 전국 400만여 돼지에 백신 1차 예방접종을 마친 만큼 확산 우려가 낮아졌다는 판단이다.  방역 당국은 가축전염병이 마지막으로 발생한지 30일이 넘고 발생농장 반경 10㎞ 내에 이상 징후가 없을 때 이동제한을 해제한다.  올겨울 가축전염병 피해는 예년보다 훨씬 낮았다. AI 발생 건수는 1년 전 겨울(2016년 11월~2017년 4월) 383건이었으나 올겨울엔 22건에 머물렀다. 구제역 발생 건수도 2016년 21건, 지난해 9건에서 올해는 2건에 그쳤다.  (그래픽=농림축산식품부)  방역 당국은 재작년 가축전염병이 기승을 부리자 발생 축산 농가 인근 500m에서 3㎞까지 예방적 살처분을 시행하는 등 방역 대책을 강화했다. 이 결과 올겨울 고병원성 AI 발생건수는 1년 전의 17분의 1 수준에 그쳤으나 살처분 마릿수는 3787만수에서 654만수로 5분의 1 줄어드는 데 그쳤다. 그만큼 예방적 살처분을 강화한 것이다.  이재욱 농식품부 식품산업정책실장은 “지나치게 많이 살처분한 것 아니냐는 불만도 있을 수 있으나 결과적으론 이번에 피해를 줄이는데 큰 역할을 했다”며 “현장·전문가 의견을 종합적으로 고려하되 현 살처분 기조는 유지할 계획”이라고 말했다.  위기 단계는 하향 조정하지만 5월 말까지 특별방역기간은 유지한다. AI에 대비해 전국 4000여 오리·가금 농가에 대한 AI 일제검사를 실시한다. 5월 말까지 돼지에 대한 2차 구제역 백신 보강접종도 실시한다.  또 6월까지 현장에서 제기된 방역 개선방안을 정리해 이후 방역 정책에 적용키로 했다. AI 관련 3㎞ 내 예방적 살처분 일부 거부·지연 사례가 발생한 만큼 일괄 적용 원칙을 정하고 제재를 강화하는 방안을 검토한다. 3년 전부터 중단했던 돼지에 대한 A형 구제역 백신(O+A형) 접종을 재개키로 했다. 6월 열리는 한중일 방역 협의체에서 철새 이동 등 관련 정보도 공유한다. 특히 농가의 자체적인 방역과 빠른 의심신고가 전염병 확산을 막는 핵심이라고 보고 관련 교육을 강화하고 제도도 개선한다.  이낙연 총리는 이날 정부세종청사에서 열린 제35회 국정현안점검조정회의에서 “잘한 건 잘한 대로 살려 나가고 미진한 부분은 보완해 나가야 할 것”고 말했다. 또 “축산농가 주민 불편을 덜어준다는 점에서 AI·구제역 주의 단계를 조정하지만 5월 말 특별방역기간까지는 신중함을 유지해야 한다”고 강조했다.  지난달 29일 오전 경기도 용인시 돼지 사육 농가 주변에서 용인축산농협 방역차가 구제역 예방을 위한 방역활동을 하고 있다. 연합뉴스  김형욱 (nero@edaily.co.kr)  ＜ⓒ종합 경제정보 미디어 이데일리 - 무단전재 &amp; 재배포 금지＞"
"국정현안점검조정회의 주재  ""AI 주의단계 조정.. 5월말까지 특별방역기간""이낙연 국무총리가 26일 오전 정부세종청사에서 열린 국정현안 점검 조정회의에서 모두발언을 하고 있다. 뉴시스 제공[세종=이데일리 이진철 기자] 이낙연 국무총리는 26일  “4차 산업혁명의 성공과 활성화를 위해 정부가 할 수 있고, 해야 하는 가장 중요한 일은 공공데이터의 공유”라며 “그런데 현실은 기대만큼 진전되고 있지 않다”고 지적했다.  이 총리는 이날 정부세종청사에서 열린 국정현안점검조정회의에서 ‘공공데이터 표준화 및 활용확대 방안’에 대해 “정부는 나름대로 수년 동안 노력했다고 하는데 민간에서는 그렇게 체감을 하지 못하고 있다”면서 이같이 말했다.  이 총리는 “민간위원회를 하다 보면 공공데이터를 왜 공개하지 않느냐, 공유하지 않느냐 하는 얘기를 매번 듣는다”면서 “그런데 정부부처들한테 물어보면 그렇지 않다고 말한다”고 밝혔다. 그는 “이 괴리에 무슨 이유가 있을 것”이라며 “공공데이터 공유의 실천방식이 뭔가 부실했거나 또는 법령에 제약이 있었거나 등의 이유가 있었을 것”이라고 말했다.  이 총리는 “많은 사람들이 알고 싶어 하는 것처럼 원스톱으로 필요한 데이터를 공유할 수 있게 하는 그런 체제가 아직 충분히 갖춰져 있지 않다”면서 “개인정보의 보호처럼 법률상의 제약이 있는 것은 정부마음대로 할 수 없다손 치더라도 그렇지 않는 것은 활발하게 진척을 했으면 좋겠다”고 주문했다.  이 총리는 ‘조류인플루엔자(AI)와 구제역 방역평가 및 개선방향’에 대해선 “AI의 마지막 발생, 구제역의 마지막 발생으로부터 일정한 시간이 흘렀기 때문에 주의단계를 조정하는 시기가 됐다”고 말했다.  그는 “축산농가들 또 주민들의 불편을 덜어드린다는 점에서는 주의단계의 하향 조정이 필요하다”면서도 “5월 말까지는 특별방역기간으로 돼있기 때문에 신중하게 조정이 돼야 할 것”이라고 덧붙였다.  한편 이 총리는 “목요일 현안조정회의는 세종에서 여는 걸 원칙으로 하고, 화요일 국무회의는 절반쯤은 청와대에서 열기 때문에 서울 개최를 원칙으로 운영하겠다”고 밝혔다.  이진철 (cheol@edaily.co.kr)  ＜ⓒ종합 경제정보 미디어 이데일리 - 무단전재 &amp; 재배포 금지＞"
"【서울=뉴시스】임종명 기자 = 더불어민주당이 남북 정상회담 개최를 하루 앞두고 ""2000년과 2007년에 이어 11년만에 열리는 정상회담은 한반도의 휴전상태를 종식하고 새 시대를 열 역사적인 날로 기록될 것""이라며 기대감을 드러냈다.  제윤경 원내대변인은 26일 오전 현안 브리핑을 통해 ""남북 화해와 번영의 새 시대를 열 남북정상회담이 하루 앞으로 다가왔다. 4·27 3차 정상회담에서는 6·15, 10·4 남북공동선언에 이은 새로운 평화의 메시지가 기대되고 있다""고 전했다.  제 원내대변인은 ""문재인 정부 들어 급물살을 탄 평화무드는 정권 교체 1년만에 남북 정상회담이라는 소중한 결실을 맺게 됐다. 내일을 기점으로 비핵화를 통한 남북 적대 관계 해소, 나아가 정전선언으로 한반도의 두 국가가 평화를 준비하는 체제로 전환해야 한다""고 강조했다.  그는 ""한반도의 분단의 아픈 역사를 함께했던 미·중·일·러 주변 강대국들도 남북 정상회담을 일제히 지지하고 있다. 곧 이어질 북미 정상회담의 안내자로서도 내일 열릴 남북 정상회담이 무엇보다 중요한 마중물이자 이정표가 될 것""이라고 밝혔다.  제 원내대변인은 ""내일은 한반도의 항구적 평화정착, 평화와 공존으로 가는 한반도의 운명의 날이다. 국민들께서도 한반도 비핵화와 평화의 대장정에 오른 문재인 대통령을 한 마음으로 응원하고 있다""며 ""민주당은 남북 정상회담이 끝이 아니라 시작이라는 생각으로 정상회담의 결과를 한반도의 새 시대로 이어지도록 최선을 다할 것""이라고 덧붙였다.  jmstal01@newsis.com"
"[머니투데이 세종=양영권 기자] ['2018 청소년 통계' 발표 … 청소년 인구는 올해 처음으로 900만명선 깨져 ]  저출산 현상이 계속돼 올해 청소년(9∼24세) 인구가 900만 명 선 아래로 내려간 것으로 나타났다. 초등학교부터 대학교까지 다닐 나이(6∼21세)를 뜻하는 학령인구는 향후 10년간 130만여 명 감소해 2028 년엔 700만 명도 채 되지 못할 것으로 전망됐다.  여성가족부와 통계청이 26일 발표한 '2018 청소년통계'에 따르면 올해 청소년 인구는 899 만 명으로 지난해 924만9000 명보다 2.8% 감소했다. 청소년 인구는 1982년 1420만9000 명으로 정점을 찍은 뒤 계속 감소하고 있다.  올해 청소년 인구가 전체 인구(5163만5000 명)에서 차지하는 비중은 17.4%다. 1982년의 36.1%와 비교하면 절반도 안된다. 청소년 인구는 지속 감소해 2030년엔 698만9000명에 머물 것으로 전망됐다. 비중은 13.2%로 하락한다.  학령인구는 올해 824만2000 명으로 지난해보다 21만9000 명, 2.5% 감소했다. 10년 뒤인 2018년엔 693만3000 명으로 130만900명, 15.8% 감소할 것으로 보인다. 학령인구도 1980년 1440만1000 명으로 정점을 찍은 뒤 계속 감소하고 있다.  학령인구는 현재 총인구에서 16.0%를 차지하고 있는데 10년 뒤엔 비중이 13.1%로 내려가게 된다.  이같은 학령인구 감소는 당장 교원 수급과 학원, 학습지 등 관련 산업에 영향을 미칠 것으로 보인다. 최근 이낙연 국무총리는 학생수의 감소 추세에 맞게 교원 수급정책을 정교하게 마련할 것을 지시하기도 했다.  국제결혼이 늘면서 다문화 가정 학생은 처음으로 10만명 선을 돌파했다. 지난해 초·중·고 다문화 가정 학생은 10만9000 명으로 전년보다 10.3% 증가했다. 전체 초·중·고 학생 572만5000 명에서 차지하는 비중은 1.9%였다.  비만 학생의 비중은 계속 높아지고 있다. 지난해 학생들의 비만율은 17.3%로 전년보다 0.8%포인트 상승했다. 학생 6명 중 1 명은 비만이라는 얘기다.  전체학생에서 고도 비만은 2.0%, 중등도 비만은 7.0%인 것으로 나타났다.  통계청 관계자는 ""학생들이 신체활동은 줄이고 패스트푸드 섭취는 늘려 비만율이 높아졌다""고 설명했다.  주 3일 이상 격렬한 신체활동을 하는 학생은 37.3%에 불과해 전년도보다 비중이 0.4%포인트 낮아졌다. 반면 주3일 이상 패스트푸드를 섭취하는학생은 20.5%로 3.8%포인트 높아졌다. 또 9∼24세 청소년 가운데 아침식사를 전혀 하지 않거나 먹지 않는 편이라고 응답한 경우가 28.9%로 전년보다 5.2%포인트 증가했다.  세종=양영권 기자 indepen@mt.co.kr"
"국정현안조정회의…""가축전염병 제어, 현저하게 좋아져""  (서울=연합뉴스) 성혜미 기자 = 이낙연 국무총리는 26일 ""정부는 공공데이터 공유를 위해 나름대로 수년간 노력했다고 하는데, 민간에서는 그렇게 체감을 못 하고 있다""고 지적했다.  이 총리는 이날 오전 정부세종청사에서 주재한 제35회 국정현안점검조정회의에서 '공공데이터 표준화 및 활용확대 방안'과 관련해 이같이 밝혔다.  noanoa@yna.co.kr"
"지방선거 앞두고 '추경 무산' 영향에 촉각  (서울=뉴스1) 정상훈 기자 = 청년일자리 및 구조조정 위기지역 대책을 위한 정부의 추가경정예산(추경)안의 4월 임시국회 처리가 여야 공전으로 국회 파행이 이어지며 사실상 무산됐다.  정부는 지난 6일 국회에 3조9000억원 규모의 추경안을 국회에 제출했지만, 이낙연 국무총리의 시정연설조차 열리지 못한 채 국회에 계류 중이다.  정부와 여당인 더불어민주당은 추경은 '타이밍'이 중요하다면서 김동연 경제부총리 및 기획재정부 장관이 국회를 두 번이나 방문하며 야당 설득에 나섰지만, 자유한국당을 비롯한 야당은 정부 추경이 지방선거를 앞둔 선심성 추경이라며 반대 입장을 고수해 왔다.  여기에 방송법 개정안을 둘러싼 여야 공방부터 김기식 전 금융감독원장 사퇴, 그리고 '드루킹 사건' 등이 이어지면서 당초 여야가 합의한 4월 국회 일정 상 마지막 본회의날인 26일까지 추경은 빛조차 보지 못했다.  4월 국회에서의 추경안 처리가 무산되자 민주당은 야당을 향해 청년과 지역 주민들의 고통은 외면한 채 정쟁에만 몰두했다며 강하게 비판했다.  우원식 원내대표는 이날 정책조정회의에서 ""국민의 삶을 책임진 국회가 청년들 일자리와 고용위기 지역의 고통을 해결하자는 것을 놓고 길거리 좌판에서 물건 흥정하듯 대할 일이냐""며 강도 높은 비판을 쏟아냈다.  김태년 정책위의장도 ""한국당이 한가롭게 천막쇼나 하고 봄 소풍 다니듯 국회 밖을 돌아다니는 동안, 고용위기를 겪고 있는 청년과 지역의 고통은 하루하루 더 커지고 있다""며 ""한국당이 찾아가야 할 현장은 거재와 통영, 울산 등 지역 현장""이라고 지적했다.  정부의 추경안을 심사·검토해야 하는 국회 예산결산특별위원회의 민주당 간사인 윤후덕 의원은 지난 24일 원내대책회의에서 고용위기 지역의 상황을 전하면서 ""지역의 고통을 야당이 조금만이라도 공감한다면 이러한 일은 벌어지지 않을 것""이라고 비판했다.  하지만 한편에서는 야당의 추경 발목잡기가 결국은 오는 지방선거에서 야당의 발목을 잡을 것이라는 관측도 나온다.  정부가 추경을 통해 지원하려 했던 고용위기지역은 전북 군산과 경남 거제·통영·고성·창원 진해, 울산 동구 등 6곳으로 울산 동구를 제외하면 한국당과 바른미래당 등 야당 소속 의원들의 지역구다.  특히 오는 6·13 지방선거에서 최대 격전지로 꼽히는 PK(부산·울산·경남) 지역에서만 5곳이 고용위기지역으로 지정돼 있다.  민주당 입장에서는 야당이 선거를 앞두고 지역 민생은 외면한 채 정쟁에만 몰두했다고 공세를 이어갈 명분이 충분해졌다는 분석이 나온다.  민주당 한 관계자는 ""(지역에서는) 야당이 추경만이라도 했어야 했는데 라는 얘기가 나온다""며 ""그 지역에서는 (야당이) 역풍을 맞을 수 있을 것""이라고 말했다.  sesang222@news1.kr  ), 무단 전재 및 재배포 금지]"
"조배숙 민주평화당 대표가 재활용 쓰레기 대란 사태와 관련해 ""그 중심에는 수개월 동안 사태를 방관한 무능력한 환경부 장관이 있다""며 김은경 환경부 장관을 겨냥했다.  조 대표는 6일(오늘) 국회에서 열린 최고위원·국회의원 연석회의에서 ""이낙연 총리는 최근 사태와 관련해 장관을 질타한 데 이어 어제 국정현안점검조정회의에 쓰레기 문제 상정도 막았다고 한다""며 ""김 장관은 정부에서도 신뢰를 잃은 것으로 보인다""고 말했다.  조 대표는 ""재활용 쓰레기 대란과 미세먼지를 수수방관한 환경장관, 국민은 이제 환경장관이라고 쓰고 '환경방관'이라고 읽는다""고 비판했다.  장병완 원내대표는 국방부 서주석 차관에 대해 ""5·18 왜곡을 위해 만든 511 위원회의 실무위원이었다""며 ""무고한 민간인 학살을 정상적인 군 작전으로 허가하며 5월의 진실이 오랜 시간 규명되지 못하게 했다""고 지적했다.  장 원내대표는 ""5·18 정신을 헌법 전문에 넣겠다는 문재인 대통령은 서 차관을 즉시 해임하라""며 ""서 차관이 자리를 지키고 있는 한 정부의 5·18 진상규명 의지는 의심받을 것""이라고 말했다.  이어 4월 국회의 파행 상황과 관련해 ""양당 힘겨루기 때문에 민생과 개헌 골든타임을 놓쳐서는 안 된다""며 ""방송법과 고위공직자비리수사처법 처리가 국회 정상화의 연계조건이 돼선 안 된다. 두 법 통과를 위해 소관 상임위를 열어 논의하면 된다""며 더불어민주당과 자유한국당을 향해 국회 정상화를 촉구했다.  [사진출처 : 연합뉴스]  정유진  [저작권자ⓒ KBS 무단복제-재배포 금지]"
