"집권초 추진됐던 '노동존중사회'…2년새 '말짱 도루묵' 위기  ""정권내 노동정책 의지 실종…체계적인 정책 패키지 추진해야""[CBS노컷뉴스 김민재 기자]9일이면 문재인 정부 출범 반환점을 맞이한다. 헌정 사상 첫 대통령 탄핵을 이끈 '평범한' 촛불 시민들의 한 표 한 표로 탄생한 문재인 정부는 집권 초반 박근혜 정부의 캐비닛 문건 수사와 적폐청산, 세월호 진상규명, 대통령 개헌안 발표, 권력기관 개편 등 각종 개혁 정책을 이끌며 순항했다. 세 차례 남북정상회담과 판문점 남북미 정상 만남 등도 성사시키며 국정지지율이 80%를 육박하기도 했다.  하지만 '국민이 주인인 나라', '나라다운 나라 건설'을 기치로 첫발을 내딛었던 문재인 정부는 이제 집권 반환점을 돌며 냉혹한 칼날 위에 섰다. 소득주도성장으로 대표되는 경제운용정책은 글로벌 경기 하강과 보호무역주의 강화 등으로 국민 체감과 괴리되면서 '경제정책 실정' 논란으로 비화됐다. '공정의 가치'는 조국 전 법무장관 가족에 대한 검찰 수사로 빛을 바랬고 대통령마저 ""깊이 성찰하겠다""며 유감을 표했다. 당장이라도 손에 잡힐 듯했던 한반도 비핵화 역시 하노이 북미정상회담과 스톡홀름 실무회담에서 별 성과를 내지 못하며 공전 중이다. 문재인 정부는 남은 집권 2년 6개월에 어떤 성과를 더 낼 수 있을까? CBS노컷뉴스는 과거 정부와 달랐던 남북관계 개선 의지와 한계, J노믹스로 대표되는 경제정책, 야당과의 협치 실종 등 문재인 정부의 지난 2년6개월을 6부작으로 되돌아본다. [편집자 주]  글 싣는 순서 ① '공기처럼 다가온 남북 평화'…진전이냐 퇴보냐 최대 분수령  ② 실현되지 않는 '협치…여야정 상설협의체 1년째 '표류  ③ 공정이라는 국민 기준에 '화들짝'…공정개혁 통한 민심회복에 '올인'  ④ 사라진 소주성…J노믹스 '절반의 성공'  ⑤ 공수처·수사권 조정 검찰 개혁 정면돌파 승부수 통할까?  ⑥ '우향우' 선택한 문재인표 '노동자정부'  ◇""정부·여권, 노동감수성 부족해…체계적인 정책 접근과 동력 부활 필요""  이처럼 정부 노동정책이 우경화된 배경에 대해 '노동존중사회'라는 목표가 정부와 여권에 제대로 공유되지 않았다는 지적이 나온다.  권 변호사는 ""지난해 대법원에서 특수고용노동자의 노조할 권리에 대해 굉장히 전향적인 판결이 잇따라 내려졌는데, 정작 정부 태도에는 진전이 없다""며 ""정부가 법 개정 등을 시도했지만 보수야당의 반대로 실패했다면 이해하겠는데, 정부 스스로 할 수 있는 부분에서도 최소한의 진전조차 사라졌다""고 비판했다.  한국노동사회연구소 김유선 이사장은 ""집권 초기 청와대에서 노동정책을 가장 잘 아는 인물은 문 대통령 혼자라는 얘기가 많았다""며 ""정부, 여권 안에서 노동 정책을 제대로 이해하고 반드시 추진하겠다는 확고한 의지를 가진 인물이 없었다""고 꼬집었다.  노동 정책에 대한 큰 그림을 공유하지 못한 채로 무리하게 '위로부터의 변화'를 추진한 바람에 정책 간의 연계성을 고려하지 않아 정책 수용성을 정부 스스로 낮췄다는 비판도 나온다.  최저임금은 급격히 올렸지만 중소기업 자생력을 키울 수 있는 '공정사회' 개편 작업이 동반되지 못하면서 '을 대 을' 상황을 부른 것이 대표적인 예다.  부경대 황선웅 경제학과 교수는 ""저소득계층을 위해 ILO 핵심협약 비준을 통해 노동기본권을 보장해서 스스로 노동조건을 바꿔야 했는데, 최저임금을 한번에 일거에 올렸다""고 설명했다.  이어 ""집권 초기 변화를 보면 근본적인 법 제도 변화보다 특정 위원회의 결정이나 대통령의 지시로 갑작스레 추진된 사례가 많다""며 ""근본적인 법, 제도의 변화를 통한 점진적이되 지속적인 개혁을 추진해야 했는데, 한번에 바꾸려다 경기 침체 등 역풍을 맞자 곧바로 관리 미숙 사례들이 나타나고 있다""고 비판했다.  이 교수도 ""예컨대 근로시간을 줄이겠다면 관련 보완책까지 패키지로 접근해야 했는데, 이슈에 휘둘려 접근했다""며 ""탄력근로제와 근로시간 단축, 노동3군 핵심협약 등을 한번에 다뤘다면 노사 간의 균형이 맞았을텐데, 분리해서 다루니까 노사 양측에서 반대를 받고 있다""고 비판했다.  이어 ""하반기에는 개별적 이슈파이팅이 아닌 정책 패키지를 꾸려 종합적, 체계적으로 진행해야 한다""며 ""대외환경의 변화에 따라 유연하게 대처하는 것 자체는 문제가 아니지만, 노동존중사회라는 지향점을 잃지 않아야 한다""고 강조했다.  남은 임기 하반기 동안 '초심'을 회복하고 '노동존중사회'를 실현하기 위해서는 우선 문 대통령의 적극적인 역할이 필요하다는 주문도 나왔다.  이 교수는 ""필요하다면 대통령이 직접 청와대로 양대노총 위원장과 경영계 대표를 불러 직접 노사정 대화를 주재하는 것도 방법""이라며 ""결국 사회적 대화는 국민의 공감대를 넓히는 작업인데, 이를 청와대가 좀 더 주도하는 노력을 기울일 필요가 있다""고 조언했다.  하 교수는 ""열쇠는 대통령이 갖고 있다. 대통령이 강한 의지를 갖고 있다면 아직 바꿀 것이 많다""며 ""일부 시민들은 왜 노동자들은 비판만 하느냐고 하지만, 대통령이 노동자, 서민의 비판을 동력으로 끌어안고 반발을 돌파해야 한다""고 촉구했다.  한편 여권과 정부에만 책임을 넘기기 전에 노동계가 적극 나서야 한다고 주장도 나온다.  김 이사장은 ""선거 국면은 노동 이슈가 의제로 정리되고 심도 있게 논의되는 기회""라며 ""내년 총선을 앞두고 노동계가 핵심 노동 의제를 재점검하고, 새롭게 이슈화해야 한다""고 강조했다.  ten@cbs.co.kr  저작권자 © CBS 노컷뉴스 무단전재 및 재배포 금지"
"[앵커]  독도 헬기 추락 사고가 난지  오늘로 열흘째입니다.  실종자 4명에 대한  수색 작업은 계속되고 있지만  새로운 소식은 들리지 않고 있는데요.  울릉도에 나가 있는  취재기자 연결해  자세한 내용 들어보겠습니다.  윤지연 기자, 어제 수색 작업에서도  새로운 소식은 나오지 않았다고요?  [리포트]  네, 어제는  기상 여건이 나아지면서 실종자 수색 작업이  대부분 순조롭게 진행됐습니다.  어제 주간 수색작업에는 함선 15척과 항공기 5대, 드론과 소형 구조보트 등이 투입됐는데요.  청해진함과 광양함은  수중 수색을 재개했습니다.  37명의 잠수사들도 독도 연안 수색을 벌였지만 아직까지 실종자가  추가로 발견됐다는 소식은  들리지 않고 있습니다.  문제는 날씬데요.  오늘 오후부터 다시  사고 해역 부근에 2에서 3미터의 높은 파도가 예상돼, 수색 작업에 차질을 줄 가능성이 있습니다.  수색 작업이 길어지면서 가족들은  해류 때문에 실종자들이  수색 구역을 벗어나 이동한 것은 아닌지 우려하고 있는데요.  이 때문에 해외 전문 인력과 민간 수색 인력을 수색작업에 투입할 수 있는 방법을 찾아달라고 요청했습니다.  이어 정부가 책임있는 자세를 보여달라며 이낙연 국무총리의 방문을  거듭 요청하기도 했는데, 이 총리는 오늘 오전 실종자 가족들이  있는 대구를 방문할 것으로 알려졌습니다.  지금까지 울릉도 저동항에서 KBS 뉴스 윤지연입니다.  윤지연 기자 (aeon@kbs.co.kr)"
"이 날 이 총리는 실종자 가족들에게 “당장 오늘 상황을 점검하고 다시 오겠다”고 약속한 뒤 실종자 가족 한 명 한 명 손을 붙잡으며 1시간 동안 열린 면담을 마쳤다.  한편 지난달 31일 오후 11시26분께 응급환자와 보호자, 소방대원 5명 등 7명이 탄 중앙119구조본부 소속 EC225 헬기 한 대가 독도에서 이륙한 직후 바다로 떨어졌다.  소방 헬기가 추락한 지 열흘이 된 지금까지 당시 헬기에 탑승했던 7명 중 4명은 여전히 실종 상태다  이종후(39) 부기장과 서 정비실장, 조업 중 손가락이 절단돼 이송되던 선원 A(50)씨 등 3명의 시신이 수습됐다. 수색당국은 이날 헬기 조종석의 계기판 차양막과 분리형 들것을 발견했다고 밝혔으며, 실종자 수색을 이어가고 있다.  저작권자 ⓒ 서울경제, 무단 전재 및 재배포 금지"
"독도 헬기 추락사고 발생 열흘…가족 요청 면담  탑승자 총 7명 중 현재까지 4명 실종 상태  독도 헬기 추락사고가 발생 열흘을 맞이한 가운데 이낙연 국무총리가 실종자 가족들을 만난다. 이번 이 총리의 방문은 실종자 가족들의 요청에 의해 이뤄진 것으로 알려졌다.  9일 총리실 등에 따르면 이 총리는 이날 오전 9시 20분 독도 헬기 추락사고 실종자 가족들이 모여있는 대구 강서소방서에 도착했다.  지난달 31일 응급환자와 보호자, 소방대원 5명 등 총 7명이 탑승한 소방헬기가 독도에서 이륙 직후 바다로 추락하는 사고가 발생했다.  현재까지 탑승자 7명 가운데 3명의 시신은 수습됐고 4명은 실종상태다.  조준혁 한경닷컴 기자 presscho@hankyung.com  기사제보 및 보도자료 newsinfo@hankyung.com  ▶ , 무단전재 및 재배포 금지"
"독도 헬기 추락사고 열흘째인 오늘 실종자 가족들은 이낙연 국무총리와의 면담자리에서 눈물로써 철저한 수색을 호소했습니다.  가족들은 안타까운 현 상황을 얘기하며 빠른 시일 안에 실종자들이 돌아오도록 최선을 다해 달라고 말했습니다.  이낙연 국무총리는 ""가족 여러분의 비탄 앞에서 무슨 말씀을 드리겠습니까""라면서 정부가 최선을 다하겠다""고 약속했습니다.  오늘 면담은 범정부현장수습지원단이 있는 대구 강서소방서에서 1시간 동안 진행됐습니다.  심병철 기자  [저작권자(c) MBC (www.imnews.com) 무단복제-재배포 금지]  All rights reserved."
"[머니투데이 안재용 기자] [이 총리, 군산 무녀도 양식장 관리선 사고 실종자 수색 긴급지시]  이낙연 국무총리는 25일 군산 무녀도 인근 해상에서 작업중이던 양식장 관리선 미입항 사고에 대해 ""해양수산부장관과 해양경찰청장, 국방부장관은 어선, 상선, 관공선 등 사고주변 해역을 운항중인 모든 선박과 가용한 함정, 항공기 등 모든 자원을 총동원해 실종자 수색에 최선을 다할 것""이라고 긴급 지시했다.  안재용 기자 poong@mt.co.kr"
"한일·일한 협력위 총회 축사…축사,남관표 주일대사 대독  “내달 중국 청두서 한일정상회담서 새로운 토대 마련 기대”  [헤럴드경제=배문숙 기자] 이낙연 국무총리는 25일 “올해 일본은 레이와 신시대를 열었다”면서 “한일 양국이 레이와의 뜻 그대로 ‘아름다운 조화’를 이루며 공동번영을 향해 협력해가기를 소망한다”고 강조했다.  이 총리는 이날 일본 도쿄 뉴오타니 호텔에서 열린 '제55회 한일·일한 협력위원회 합동총회' 축사에서 “지난 10월 22일 나루히토 천황 즉위식에 대한민국 축하사절로 참석, 그런 기원을 천황께 말씀드렸다”며 이같이 밝혔다. 축사는 남관표 주일대사가 대독했다.  이 총리는 “그(천황 즉위식) 이틀 후에 열린 아베 신조 총리와 회담에서 아베 총리와 양국 관계의 엄중한 상황을 방치하지 않도록, 당국 간 협의를 지속하자는 데 뜻을 같이했다”고 전했다.  앞서 이 총리는 지난달 24일 일본 도쿄(東京) 총리관저에서 아베 총리와 회담을 갖고 양국은 중요한 이웃국가로서 한일 관계의 어려운 상태를 이대로 방치할 수 없다는데 인식을 같이한 바 있다. 지난해 10월 대법원의 강제징용 배상 판결 이후 한일 관계가 갈등을 거듭했지만 이 총리가 지난달 일본 방문한 계기로 양국이 관계 개선의 분기점을 마련했다는 평을 받았다.  이 총리는 또 “이달 4일 문재인 대통령과 아베 총리께서 태국 방콕에서 만나 양국 당국 간 대화에 힘을 실어 주셨다”면서 “그 후에 이어진 당국 간 협의의 결과로 양국 관계의 몇 가지 현안이 해결의 입구를 찾았다”고 설명했다.  특히 이 총리는 “이제부터 양국 정부는 현안의 본격적인 해결을 향해 더욱 진지한 협의를 농밀하게 진행해야한다”면서 “그런 당국 간 대화의 축적과 12월 말 중국 청두에서 열릴 한일 정상회담을 통해 양국이 새로운 미래로 가는 확고한 토대를 마련하기를 기대한다”고 말했다.  앞서 정부는 일본의 수출규제 문제 해소를 위해 조건부로 한일군사정보보호협정(GSOMIA·지소미아) 종료를 연기한다고 지난 22일 발표했다. 당시 발표 내용 등을 놓고 양국 정부 간 신경전이 이어지는 가운데 양국이 내달 정상회담 개최를 위해 조율에 나서면서 일본의 수출규제 문제, 강제징용 배상 해법 등에 대한 논의가 탄력을 받을 것으로 보인다.  이 총리는 ""지금 세계 질서는 세기적 전환기를 통과하고 있다""며 ""한일 지도자들은 양국이 세기적 전환기를 어떻게 수용하고 그 전환기 뒤에 기다리는 미래를 어떻게 준비할 것인지를 현명하게 판단해야 한다""고 강조했다. 이어 ""양국 지도자들이 그렇게 넓고 먼 시야로 오늘의 양국 관계를 재정립하자""고 제안했다.  그러면서 ""양국 관계가 '김대중-오부치 시대'처럼 균형과 배려의 바탕 위에서 원활하게 전개되도록, 양국 협력위원회가 '나카소네-남덕우 시대'처럼 활발히 지도해주기를 기대한다""고 덧붙였다.  남덕우 전 국무총리와 나카소네 야스히로(中曾根康弘) 전 일본 총리는 한일·일한 협력위원회의 공동 회장을 맡은 바 있다.  oskymoon@heraldcorp.com  - Copyrights ⓒ 헤럴드경제 &amp; heraldbiz.com, 무단 전재 및 재배포 금지 -"
"이낙연 국무총리는 전북 군산 무녀도 인근 해상에서 작업 중이던 양식장 관리선의 미입항 사고와 관련해 실종자 수색에 최선을 다하라고 긴급 지시했습니다.  이 총리는 해양수산부 장관과 해양경찰청장, 국방부 장관은 사고 주변 해역을 운항 중인 모든 선박과 가용한 함정, 항공기 등 모든 자원을 총동원해 실종자 수색에 최선을 다하라고 지시했습니다.  어젯밤 11시쯤 군산시 옥도면 무녀도 인근 해상으로 작업을 나간 양식장 관리선이 입항하지 않았다는 신고가 군산해양경찰서에 접수됐는데 실종된 양식장 관리선에는 선장과 선원 4명이 함께 타고 있는 것으로 전해졌습니다.  ※ '당신의 제보가 뉴스가 됩니다' YTN은 여러분의 소중한 제보를 기다립니다.  [카카오톡] YTN을 검색해 채널 추가 [전화] 02-398-8585 [메일] social@ytn.co.kr [온라인 제보] www.ytn.co.kr  [저작권자(c) YTN &amp; YTN PLUS 무단전재 및 재배포 금지]"
"이제는 기다려야지…검증동의서 제출여부는 얘기하기 좀 그렇다  (서울=뉴스1) 장은지 기자 = 이낙연 국무총리 후임으로 유력한 것으로 알려진 김진표 더불어민주당 의원이 검증동의서 제출 여부에 대해 부인하지 않았다.  김 의원은 25일 국회 의원회관에서 기자들과 만나 총리 후보로 검증동의서를 제출했느냐는 질문에 ""그건 뭐라고 얘기하기가 좀 그렇다""며 부인하지 않았다.  다만 김 의원은 ""공직생활에 있어 앞으로 더 크게 기여하고 헌신할 수 있도록 해야겠죠""라고 에둘러 답했다.  김 의원은 ""저는 문재인 정부가 출범할 때 국정기획을 만든 사람으로서 문재인 정부가 성공할 수 있도록, 그것이 우리 경제가 더 발전하고 민생경제를 개선할 수 있는 길이기도 하다""라고 했다.  김 의원은 차기 총리로 유력하다는 질문에 대해 ""후보자로 거론되고 있는데 제가 뭐라고 얘기하기는 좀 그렇고, 이제는 아무 말도 안하고 조용히 기다리는 수 밖에 없으니 좀 이해해달라""고 말을 아꼈다. 이어 ""후보의 한 사람으로 언론에 거명될 때는 본래가 노코멘트""라고 거듭 신중한 태도를 보였다.  현재 이낙연 총리 후임에는 4선의 김진표 의원과 진영 행정안전부 장관, 5선의 원혜영 민주당 의원이 거론되고 있다. 경제 전문가로 노무현 정부 때 경제부총리와 사회부총리를 지낸 김진표 의원이 유력한 후보로 급부상했다. 국회의원 기용 가능성이 높은 이유는 인사청문회 부담 때문이다. 선거를 통해 이미 검증된 국회의원의 청문회 통과 가능성이 높다는 점이 관록의 현역 의원의 총리실행 가능성을 높이고 있다.  여권 관계자는 ""개각을 앞둔 청와대가 김진표 의원과 진영 장관을 두고 여론을 면밀히 살피는 것으로 들었다""며 ""진영 장관의 경우 총리로 가면 후임 행정안전부 장관을 다시 임명해야 하는 부담이 있는 것으로 안다""고 말했다.  seeit@news1.kr  ), 무단 전재 및 재배포 금지]"
"(서울=뉴스1) 유승관 기자 = 이낙연 국무총리가 25일 서울 종로구 정부서울청사에서 열린 차관급 임명장 수여식에서 대상자들과 기념촬영을 하고 있다. 왼쪽부터 김창룡 방통위 상임위원, 유희상 감사원 감사위원, 도덕희 한국해양대 총장, 이동훈 서울과기대 총장, 이 총리, 박춘란 국가공무원인재개발원장, 이호영 창원대 총장, 임채성 서울교대 총장, 이상철 인권위 상임위원. 2019.11.25/뉴스1  fotogyoo@news1.kr  ), 무단 전재 및 재배포 금지]"
"정부·여당 개각 이슈로 뒤숭숭  정세균·원혜영에 박용만도 물망  법무장관엔 추미애·전해철 거명  청와대는 공식 언급한 적 없어정부와 여당이 개각 이슈로 뒤숭숭하다. 총리를 비롯한 국무위원 인선, 즉 개각은 보통 연초 분위기 쇄신 명목으로 등장한다. 하지만 내년 4월 총선 때 ‘인사청문회 정국’이란 변수를 만들지 않아야 할 필요성 때문에, 가급적 연내 개각이 이뤄져야 하는 상황이 됐다.  장관까지 확장하면 경우의 수가 너무 많다. 공석인 법무부 장관 후보만 따져봐도 민주당 추미애·전해철 의원이 거론된다. 여기에 ‘총선 차출’ 얘기가 나오는 홍남기 경제부총리, 강경화 외교부 장관, 정경두 국방부 장관 등이 실제 징발되면 빈자리는 확 늘어난다.  ②청와대 ‘공식입장’은  =과거부터 청와대 인사라인 당사자가 개각 관련 입장을 공식적으로 밝히는 예는 거의 없다. 이번에도 청와대는 쏟아지는 각종 설과 하마평에 대응하지 않았다.  이번 개각 국면에서 인사권자인 문 대통령은 한 달 전쯤 “법무부 장관 외에는 달리 개각을 예정하고 있지 않다”고 말했다. 지난달 25일 청와대 출입기자단 초청행사에서 한 말이다.  노영민 대통령 비서실장도 개각과 관련해 딱 한번 얘기했다. 지난 10일 문재인 정부 임기 반환점을 맞아 기자들과 만난 자리에서 “당에서 요구하고 본인이 동의한 분들에 대해서는 놓아드려야 한다”는 언급이었다. 총선과 연계된 개각 수요엔 응하겠다는 의미다. 노 실장의 이 발언으로 공석인 법무부 장관 자리 외 추가 개각이 있을 것이란 관측이 우세해졌다.  하지만 노 실장의 발언 이후에도 청와대는 “법무부 장관 후보자에 대한 검증을 착수했다는 것 외에는 더 드릴 말씀이 없다. 여당에서도 장관 차출 요구 등 청와대에 공식적으로 의견을 전해온 것은 없다”(청와대 참모)는 정도만 얘기하고 있다.  ③그런데 왜 중구난방 거론되나  =총리 후보자의 경우 특정인이 부각됐다 가라앉기도 하고, 난데없이 새 인물이 등장하기도 하는 건 여권 내 제 세력 간의 경쟁과 후보자 검증의 특수성, 언론의 취재 경쟁 등이 맞물려 있어서다.  여권 안에는 다양한 그룹이 다양한 이해관계로 얽혀있다. 문 대통령의 측근 그룹을 통칭하는 ‘친문’ 또한 마찬가지다. 각 그룹이나 힘 있는 개인이 후보자를 띄우기도, 깎아내리기도 하는 과정에서 이름이 중구난방 나오는 경향이 있다.  경우에 따라선 이름을 언론에 흘려 ‘세평’을 탐색하기도 한다. 이는 오래된 통치술의 하나다. 고(故) 김영삼(YS) 전 대통령은 집권 5년간 24차례 개각하면서 총리 6명, 장관 114명을 임명했는데, 언론에 후보 이름을 슬쩍 알린 뒤 여론 평가를 반영하곤 했다고 한다.  ④총리는 교체하나? 하면 언제쯤 하나  =일단 총리 교체는 기정사실에 가깝다고 한다. 이낙연 총리가 최장수 총리로 취임(2017년 5월 31일) 900일(24일 현재 908일)을 넘긴 데다 차기 대선주자 여론조사에서 1위를 유지하고 있고, 중도적 이미지로 내년 총선 때 민주당의 간판으로 나서야 한다는 요구가 많기 때문이다.  관건은 후임인데, “시장에 안정적 신호를 낼 수 있어야 한다”는 중론 속에 진영 장관과 김진표 의원이 유력하다는 여권 인사들이 많다. 그중에서도 진영 장관을 꼽는 이들이 최근 늘고 있다. 차기 총리로 ‘탕평 컨셉트’가 부각되면서다. 그는 박근혜 정부 초대 보건복지부 장관을 지냈다. 문 대통령도 진 장관을 높게 평가한다고 한다.  진 장관은 이날 한-브루나이 양해각서 서명식 때 취재기자와 이런 문답을 주고받았다.  Q : 장관님, 자리 옮기시는지.  A : “(손사래 하며)아니에요.”  Q : 동의서 쓰셨다는데?  A : “(대답 없이 손사래)”  Q : 믿어도 되나?  A : “(고개 끄덕이며)동의서에 ‘동’ 자도 안 썼어요.”  Q : 이미 한 번 하셨으니 동의서 안 써도 되는 것 아닌가?  A : “(답변 없음)”  어떤 후보자도 대통령 지명 전 언론에 “동의서를 냈다”라거나 “청와대 연락을 받았다”고 하는 경우는 없다. 하지만 민주당 수도권의 한 초선 의원은 “장관 임명 땐 ‘그 중 한명’이었지만, (총리 후보일 땐)야당의 집중 공세를 받을 가능성이 크다. 용산 지역 부동산 보유 문제 등 혹독한 검증을 버틸 지 모르겠다”고 말했다.  노무현 정부 때 경제부총리와 교육부총리를 지낸 김진표 의원은 경제 총리 카드다. 김 의원의 한 측근은 “본인이나 청와대나 고민이 많은 것 같다”고 했지만, 전략에 밝은 한 의원은 “부총리를 지낸 게 언제냐. 올드한 느낌이 강하다”고 말해 ‘제3의 카드’ 가능성도 거론되고 있다.  인사청문회만을 생각한다면 원혜영 카드도 꼽히지만, 문 대통령과 당내에서 다른 길(중립)을 걸었다는 점이 변수다.  권호·하준호 기자 gnomon@joongang.co.kr  ▶  ⓒ중앙일보(https://joongang.co.kr), 무단 전재 및 재배포 금지"
