"경제부총리 지낸 현역 4선 의원… 이르면 내달 중순 총리 포함 개각  이낙연 국무총리의 후임으로 더불어민주당 김진표 의원이 유력하게 부상하고 있는 것으로 알려졌다. 문재인 대통령은 국무총리를 포함한 개각을 빠르면 다음 달 중순경 단행할 예정이다.  21일 복수의 청와대 및 여권 관계자들에 따르면 청와대는 김 의원을 유력한 차기 총리 후보로 보고 막바지 검증을 진행 중이다. 여권 핵심 관계자는 “여러 후보군 중 김 의원이 최종 후보로 부상하고 있다. 가장 유력하다”고 전했다.  김 의원은 행정고시 출신으로 노무현 정부에서 경제부총리, 사회부총리를 지낸 4선 의원이다. 노무현 전 대통령은 김 의원을 대통령직인수위원회 부위원장으로 임명하며 “내가 아는 가장 유능한 관료”라고 표현했고, 정권 내내 중용했다.  문 대통령은 내년 총선을 앞두고 임기 후반기 핵심 과제를 경제 활성화로 정하고 여권의 대표적인 경제통인 김 의원을 차기 총리 후보로 꼽은 것으로 전해졌다. 청와대 관계자는 “문 대통령도 노무현 정부 청와대에서 일하며 김 의원의 업무 처리 능력을 직접 지켜본 바 있다”며 “인사청문회 통과 가능성도 중요한 고려 요인이었다”고 전했다. 현 정부 들어 현역 의원 출신 국무위원은 청문 과정에서 한 명도 낙마하지 않았다.  청와대는 총리와 함께 다른 장관들도 교체할 예정이다. 공석인 법무부 장관은 물론 강경화 외교부 장관, 정경두 국방부 장관도 교체 대상으로 꼽힌다. 두 장관은 민주당의 요청에 따라 차기 총선 출마가 유력하다. 민주당의 한 의원은 “김진표 의원이 총리로 입각하면 홍남기 경제부총리 겸 기획재정부 장관도 총선 출마를 위해 교체될 가능성이 있다”고 전했다.  박효목 tree624@donga.com·황형준 기자  ⓒ 동아일보 &amp; donga.com, 무단 전재 및 재배포 금지"
"동영상 뉴스  이낙연 총리 동생, SM삼환 건설 사장으로 재직  곽상도 의원 ""취업 신고 않아 과태료 처분 받아""  與 ""공직자 가족 삶마저 파괴하는 폭력적 행위""[앵커]  이낙연 국무총리의 동생이 사장으로 있었던 건설사가 재임 기간 관급 공사를 대거 따낸 것으로 확인돼 논란이 일고 있습니다.  여당은 흠집 내기에 불과하다며 반발했습니다.  한연희 기자가 보도합니다.  [기자]  자유한국당이 이낙연 국무총리의 동생과 관련된 논란에 다시 불을 지폈습니다.  이 총리의 동생은 지난 2018년 6월부터 1년 반 동안 건설사 'SM 삼환' 사장으로 재임했습니다.  그런데 한국당 김성원 의원이 확보한 자료를 보면 이 회사가 이 기간 수주한 관급 공사가 모두 4천5백억 원에 달하는 것으로 확인됐습니다.  이 회사는 지난 2017년 민간 수주액을 포함해서도 연 매출이 2,660억 원에 불과했습니다.  이 씨 취업 전보다 무려 두 배에 가까운 매출을 공공 수주로만 올린 건데, 그 과정이 석연찮다는 평갑니다.  김 의원은 이 총리 동생의 경력은 보험 분야에 집중돼 있는데 이런 성과를 올린 것은 우연으로 보이지 않는다고 말했습니다.  이와 함께 곽상도 의원이 입수한 법원결정문을 보면 이 씨는 회사를 옮기면서 공직자윤리위원회에 신고를 하지 않아 과태료 처분을 받은 것으로 나타났습니다.  이 씨가 공무원 신분인 전남신용보증재단에서 일하다가 퇴직한 뒤 2년 만에 재취업을 하면서 신고 의무를 어긴 겁니다.  여당은 즉각 반발하고 나섰습니다.  본인도 송달받기 전에 곽 의원이 법원 결정서를 입수하게 된 경위를 밝히라고 촉구했습니다.  [박주민 / 더불어민주당 의원 : 이 처분의 결정서가 이 총리 동생의 주민 번호 등 개인정보가 적혀있는 상태로 당사자가 받기도 전에 자유한국당 곽상도 의원에게 제공됐다고 합니다. 이후 이 결정서는 여러 언론뿐 아니라 SNS상에서도 유출되고 유통되고 있습니다.]  민주당은 또 알려진 관급 공사 수주액 가운데 2018년에 따낸 724억 원은 이 총리의 동생이 재직하기도 전에 진행된 사업이라며 한국당의 의혹 제기는 공직자 가족의 삶마저 파괴하는 폭력적인 행위라고 비판했습니다.  YTN 한연희입니다.  [저작권자(c) YTN &amp; YTN PLUS 무단전재 및 재배포 금지]"
"[머니투데이 안재용 기자] [이 총리, 김영삼 전 대통령 추모식 참석 ""통합과 화합의 길 찾아야""]  이낙연 국무총리가 22일 김영삼 전 대통령 4주기 추모식에서 ""김 전 대통령은 신념, 용기, 결단, 배려의 지도자였다""며 ""정치가 분열과 갈등을 키우지 말고 통합과 화합의 길을 찾아야 한다는 것을 다짐하자""고 말했다.  이 총리는 이날 서울 동작구 국립현충원에서 열린 김 전 대통령 4주기 추모식에서 이같이 밝혔다.  이 총리는 ""민주주의에 대한 대통령의 신념은 민주화의 꺼지지 않는 불씨로 작용했고 끝내 군정종식을 이루게 했다""며 ""'닭의 목을 비틀어도 새벽은 온다'는 말은 국민 가슴에 민주화의 희망을 심었다""고 말했다.  이 총리는 ""김 전 대통령은 대통령 가운데 처음으로 4.19 묘소에 참배했고 5.18을 민주화운동으로 처음 인정했다""며 ""살해위협과 가택연금을 겪으며 민주화 세력을 하나로 묶었다""고 말했다.  이 총리는 ""역사의 매듭을 결단으로 풀어냈다""며 ""하나회 해체와 금융실명제 실시는 대통령의 결단이 있었기에 가능했다""고 했다. 이어 ""대통령은 공직자 재산공개를 도입했고 청와대 안가를 없앴으며, 조선총독부 청사를 전격적으로 철거했다""고 덧붙였다.  또 이 총리는 ""누구에게도 약속시간을 잘 지켰고 야당 지도자 시절에는 불쑥 찾아온 손님에게 포도주를 직접 따라주곤 했다""며 ""재임 중에도 단골집을 찾아 칼국수나 설렁탕을 즐겨 먹었다""고 했다.  이 총리는 ""대통령이 병상에서 남겨준 통합과 화합 당부를 기억한다""며 ""화합의 길을 찾는 것이 대통령에 대한 진정한 존경과 추모라고 생각한다""고 말했다.  안재용 기자 poong@mt.co.kr"
"한국당 ""이게 과연 우연인가""  SM삼환 ""입찰 조작은 불가능""  SM그룹에 문 대통령 동생도 근무  이낙연 국무총리 동생인 이계연 씨가 건설사 SM삼환 대표로 재직한 18개월 동안 4570억 원대의 관급공사를 따낸 것으로 확인됐다. 이 총리 동생은 지난해 자신의 경력과 무관한 SM삼환 대표로 취임했다.  22일 조선일보 보도에 따르면 SM삼환의 관급공사 수주액은 이 씨 재직 이후인 2018년 6~12월 3495억 원, 올해 1~9월 1075억 원 등 최소 4570억 원으로 나타났다. 이 회사의 공공 수주액은 2016년 1041억 원, 2017년 1475억 원이었으며, 연간 매출액(민간 수주액 포함)은 2017년 기준으로 2660억 원 정도였다.  자료를 제공한 김성원 자유한국당 의원은 ""이 씨의 평생 경력은 보험 쪽에 몰려 있는데도 이런 성과를 올린 게 과연 우연이겠느냐""고 했다. SM삼환 측은 ""(공공 수주) 입찰 시스템상 결과의 인위적 변경이 불가능하다""고 해명했다.  SM그룹 우오현 회장은 지난해 3월 이 총리 모친 상가에서 이계연 씨를 만나 채용을 제안한 것으로 알려졌다.  SM그룹에는 공교롭게도 대한민국 권력 서열 1·2위 동생들이 같이 일하고 있어 그동안 논란이 돼왔다.  문재인 대통령 동생 재익 씨는 SM그룹 계열사인 케이엘씨SM 선장이다. 두 사람은 모두 문재인 정부 출범 후인 지난해 SM그룹에 채용됐다.  우 회장은 문재인 정부 들어 대통령 해외 순방과 각종 청와대 행사에 수차례 초청됐다. 지난 9월에는 SM그룹 계열사가 해수부 산하 공기업에서 1360억 원을 지원받았다는 사실이 알려져 논란이 됐다.  논란이 이어지자 이 총리 동생은 지난달 18일 SM삼환 대표직에서 물러났다.  김명일 한경닷컴 기자 mi737@hankyung.com  기사제보 및 보도자료 newsinfo@hankyung.com  ▶ , 무단전재 및 재배포 금지"
"동영상 뉴스  최장수 총리를 기록하고 있는 이낙연 국무총리의 후임으로 김진표 더불어민주당 의원과 진영 행정안전부 장관이 유력하게 검토되고 있습니다.  먼저 최장수 재임을 기록한 이낙연 총리의 말입니다.  [이낙연 / 국무총리 : 당연히 저의 거취는 저 혼자 할 수 있는 게 아니지요. 조화롭게 하겠습니다.]  이낙연 총리, 거취는 혼자 결정할 수 없다고 밝혔지만, 내년 총선을 앞두고 당으로 복귀할 가능성이 높은데요.  이 총리의 후임으로 검토되고 있는 김진표 의원은 노무현 정부 시절 경제, 교육부총리를 지낸 경제 전문갑니다.  지난해 당 대표 선거에서는 '경제 당 대표'를 슬로건으로 내세우기도 했습니다.  [김진표 / 더불어민주당 당 대표 후보 : 문재인 경제와 김진표 경제는 하나입니다. 침체된 우리 경제 반드시 살려내겠습니다, 여러분.]  청와대가 김 의원을 총리 후보로 꼽은 건 어려운 경제 상황에서 임기 후반기 내각을 경제 중심으로 재편하겠다는 의미로 풀이됩니다.  진영 행정안전부 장관은 박근혜 정부 초대 보건복지부 장관을 지냈습니다.  하지만 기초연금 대선공약 수정 문제를 두고 박근혜 전 대통령과 갈등을 빚다가 장관직을 사퇴했고,  2016년엔 새누리당 공천 과정에서 배제된 데에 반발해 탈당하고 더불어민주당에 입당했습니다.  이 같은 이력으로 대표적 탕평인사로 정치권의 주목을 받아왔는데요.  두 사람 모두 정치인 출신인 데다 이미 청문회를 통과한 경험이 있기 때문에 '청문회 리스크'가 높지 않다는 점도 유력 후보로 검토되고 있는 이유 가운데 하나입니다.  [저작권자(c) YTN &amp; YTN PLUS 무단전재 및 재배포 금지]"
"총선 승리땐 '조기 레임덕' 우려  교체 시 후임은 김진표·진영 거론[서울경제] 이르면 다음달 중순, 늦어도 내년 1월 중순에는 단행될 것으로 관측되는 개각을 앞두고 교체 대상에 이낙연 국무총리가 포함되느냐, 되지 않느냐를 놓고 전망이 엇갈리고 있다. 문재인 대통령이 교체를 택하면 후임으로는 김진표 더불어민주당 의원 또는 진영 행정안전부 장관이 유력하게 거론된다. 총리 교체 여부의 최대 변수는 이 총리를 ‘총선 간판’으로 내세우는 것에 대한 여권, 특히 친문(친문재인) 인사들의 부담감이 될 것으로 분석된다. 친문 인사들은 민주당의 4·15 총선 전망이 어둡지 않은 상황에서 이 총리를 내세워 총선에서 승리할 경우 문 대통령의 ‘정국 주도권’이 차기 유력 대선 주자인 이 총리에게로 급격히 넘어갈 것을 우려하고 있다. 쉽게 말해 조기 레임덕 현상이 나타날 수 있다는 얘기다.  22일 여권의 한 핵심관계자는 “한·아세안 특별정상회의가 끝나면 청와대가 개각 명단을 최종적으로 조율할 것으로 본다”며 “패스트트랙으로 지정된 법안과 예산안 처리, 국회 청문회 일정을 감안하면 오는 12월 중순에 개각이 단행될 가능성이 가장 높다. 시점을 내년 1월 중순까지 늦출 수는 있겠지만 그렇게 되면 총선을 코앞에 두고 열리게 될 국회 청문회가 부담이 될 수밖에 없다”고 분위기를 전했다.  실제 연동형 비례대표제 도입이 골자인 공직선거법 개정안은 이달 27일, ‘고위공직자범죄수사처 설치법’은 12월3일 각각 본회의에 부의된다. 2020년도 예산안 법정처리기한은 12월2일이다. 민주당은 12월 초·중순 공수처법과 예산안의 패키지 처리를, 문희상 국회의장은 같은 시기 공직선거법 개정안, 공수처법, 예산안 일괄 처리를 염두에 두고 있다. 이 일정을 감안할 때 12월 중순이 정치적으로 최적의 개각 타이밍이 아니겠느냐는 게 여권의 판단이다. 현행 공직선거법에 따르면 현직 총리와 장관들이 내년 총선에 출마하려면 내년 1월16일까지는 자리에서 물러나야 한다. 개각 시점을 그때까지 늦출 수는 있지만 그 경우 청문회 날짜가 총선일과 가까워지게 된다는 점도 12월 중순 개각 가능성을 높이고 있다.  정치권에서는 개각 시 교체 대상 명단에 이 총리가 이름을 올릴지 여부에 촉각을 곤두세우고 있는 모습이다. 당 일각에서 이 총리의 빠른 복귀를 원하는 목소리가 나오고 있는 가운데 친문 의원들 사이에서는 이 총리의 복귀에 대한 경계론도 제기된다. 한 비문 중진 의원은 “이 총리가 공동선대위원장을 맡아야 한다”며 “야당이 동의해주지 않으면 후임 총리가 서리로라도 하면 되는 것 아니냐”고 말했다. 반면 한 친문 의원은 “이 총리는 무난한 스타일로 페이스메이커 역할을 하는 게 맞다고 본다”며 “총선에서 이 총리가 부각되는 게 좋은 일인지 잘 모르겠다”고 토로했다.  민주당 지도부가 이 총리의 거취와 관련해 결정을 못하는 상황에서 청와대는 현재 김 의원과 진 장관에 대한 검증 작업에 돌입한 것으로 알려졌다. 이들은 정치인 출신 전현직 장관으로서 이미 청문회를 통과한 경험이 있다. 김 의원은 참여정부 시절 부총리 겸 재정경제부 장관, 부총리 겸 교육인적자원부 장관을 역임했다. 당내 대표적인 경제통으로 꼽히는 만큼 김 의원을 총리로 박탈할 경우 ‘경제활력 제고’를 문재인 정부의 후반기 중점 정책과제로 밀고 나간다는 메시지를 줄 수 있다. 진 장관은 과거 박근혜 정부에서 보건복지부 장관을 맡은 이력이 있어 보수 정당도 무조건 반대하기는 어려울 것이라는 관측이 나온다. /임지훈·김인엽기자 jhlim@sedaily.com  저작권자 ⓒ 서울경제, 무단 전재 및 재배포 금지"
"23일은 북한에 의한 서해 연평도 포격 9주년이 되는 날이다. 2010년 11월23일 북한이 기습적으로 연평도에 170여발의 포탄을 발사해 민간인 2명과 해병대 2명 등 4명이 사망하고 26명이 중경상을 입었다. 휴전 협정 이후 민간을 대상으로 한 군사 공격으로는 첫 사례다.  연평도 포격 사건 9주년을 맞아 연평도 주민들이 이낙연 국무총리에게 탄원서를 보냈다. 연평도 신항 건설 약속을 지키라는 내용이다.  박태원 서해5도 평화수역 운동본부 상임대표 등 연평도 주민 414명은 22일 ""정부는 포격 사건 이후 긴급상황 시 주민 대피를 위해 5000톤 급 선박을 정박할 수 있도록 연평도를 국가관리 연안항으로 지정했지만 9년간 아무런 진척이 없었다""며 ""연평도 주민들은 국가로부터 버림받았나?""라고 따졌다.  주민들은 ""현재 연평도는 전국 국가관리 연안항 가운데 접안시설과 항만 기능이 가장 열악한 곳이다. 유일한 교통수단인 여객선은 물때를 맞추지 못하면 접안할 수 없고 불법 중국어선을 단속할 해경의 중형 경비정조차 정박하지 못한다""고 주장했다. 연평항은 1000톤 급 이하 여객선만 정박이 가능해 위급 상황이 발생해도 대처가 불가능하다는 얘기다.  연평도 신항 사업은 3740억원을 들여 2022년 착공해 2027년 준공을 목표로 460 길이의 접안서실과 방파제, 부잔교 등을 건설하는 내용이다. 2017년 예비타당성 조사 대상으로 선정됐지만 기재부가 해수부와 국방부간 사업비 협상 결렬을 이유로 예타 사업에서 제외시켰다.  [고석태 기자]  - Copyrights ⓒ 조선일보 &amp; chosun.com, 무단 전재 및 재배포 금지 -  []"
"이낙연 국무총리 동생이 SM삼환 대표로 재직한 18개월 동안 4천5백억 원대 관급 공사를 따낸 것으로 확인됐습니다.  자유한국당 김성원 의원실에 따르면 이낙연 총리의 동생인 이계연 대표가 재직한 2018년 6월부터 올해 9월까지 SM삼환의 공공건설 공사 수주액은 4천570억 원으로 이전 연간 매출액의 두 배에 달했습니다.  곽상도 의원 역시 이 대표 취임 뒤 3개월 동안 수주액이 3배 정도 늘었다며 부당이익을 취했을 가능성이 있다고 주장했습니다.  곽 의원은 또 서울중앙지방법원 결정문 확인 결과, 이 대표가 SM삼환 대표로 갈 당시 공직자윤리위원회에 신고하지 않아 과태료 30만 원을 부과받았다고 밝혔습니다.  [저작권자(c) YTN &amp; YTN PLUS 무단전재 및 재배포 금지]"
"이낙연 국무총리가 부산지역의 도시재생사업장을 방문하고 적극적인 지원을 약속했다.  이 총리는 지난 21일 오후 1시부터 사상구 우리동네살리기 사업현장과 영도구 경제기반형 뉴딜사업 현장을 방문해 직접 현장을 둘러보고, 사업 현황을 청취했다.  이날 현장방문에는 오거돈 부산시장을 비롯해 박선호 국토교통부 1차관, 김대근 사상구청장, 김철훈 영도구청장 등 관계기관장과 도시재생사업 관계자 등이 참석했다.  먼저 사상구 괘내마을을 방문한 이낙연 총리는 사업현장에 대한 설명을 경청했다. 정부의 하반기 도시재생 뉴딜사업 공모에 선정된 사상구 괘내생태문화마을은 순환형 공공임대주택과 노후주택 정비사업 등을 통해 주거복지를 실현하고, 경부선 경관개선사업 등을 추진해 마을의 기반을 구축할 예정이다.  또한 마을협동조합을 통해 공방 운영 등의 수익금을 마을에 재투자하는 지역경제 선순환구조로 공동체 회복을 꾀한다.  오 시장은 “이곳은 주민들과 마을활동가들이 근 10여 년 동안 마을 만들기 사업을 해왔을 만큼, 주민들의 마을 만들기 역량이 매우 뛰어난 곳”이라며 도시재생에 대한 기대감을 드러냈다.  이어 “사상구는 지난 2월, 부산을 통째로 바꾸는 부산대개조 비전을 발표했던 곳”이라고 소개한 뒤 “경부선 철로 지하화와 스마트시티 사업 등이 본격 추진되면 괘법동 일원과 사상구가 상전벽해로 변할 것”이라며 서부산 발전을 위한 지원을 당부했다.  설명을 들은 이 총리는 “뉴딜사업의 목적에 맞게 사업대상지가 잘 선정되었다”며 “취지를 잘 살려서 뉴딜사업을 성공적으로 추진해주길 바라고, 도울 일이 있으면 적극적으로 지원하겠다”고 전했다.  자리를 옮겨 근대 수리 조선산업의 발상지인 영도구 대평동 일대를 방문한 이낙연 총리는 사업현장을 둘러보고, 근무 중인 근로자들을 격려했다.  오 시장은 “영도구는 근대 조선산업 발생지로서 장소적 상징성과 가치가 높은 곳”이라며 “산업유산과 문화, 새로운 해양산업이 공존하는 대한민국 신(新) 조선산업의 1번지로 거듭나도록 할 것”이라고 강조했다.  이 총리도 “최근 국제해사기구(IMO)의 환경규제가 강화되는 등 새로운 해양 환경에서 조선 혁신센터와 수리센터가 혁신적인 기술가치로 발전할 수 있도록 노력해달라”며 “적극적인 지원을 아끼지 않겠다”고 의지를 드러냈다.  부산시는 영도구 대평동 일대에서 추진되는 도시재생 뉴딜사업을 통해 수리조선 혁신센터와 기술센터 조성해 산업 고도화를 꾀하고, 선박개조·재제조 등 고부가가치 신산업을 육성해 대평동을 해양산업의 혁신기지로 전환한다는 계획이다.  부산=김동기 기자 moneys3927@mt.co.kr"
"4주기 추모식 참석…""신념·용기·결단·배려의 지도자""  ""햇병아리 기자시절 아침밥·포도주 얻어먹어…그시절 아련""  [헤럴드경제=배문숙 기자] 이낙연 국무총리는 22일 ""정치가 분열과 갈등을 키우지 말고 통합과 화합을 키워야 한다는 것을 다짐했으면 한다""며 ""그것이 김영삼(YS) 전 대통령에 대한 진정한 존경과 추모""라고 강조했다.  이 총리는 이날 오후 서울 동작구 국립서울현충원에서 열린 고(故) 김영삼 전 대통령 4주기 추모식에서 ""김 전 대통령이 문민정부 시대를 연 지 27년이 흘렀다""며 이같이 언급했다.  이 총리는 ""김 전 대통령이 그토록 사랑했던 대한민국은 그동안 민주주의를 발전시키며 국력을 키웠고 국가 위상을 높였다""면서 ""적지 않은 발전이 김 전 대통령이 만든 토대 위에서 이뤄졌다""고 말했다. 이 총리는 이어 ""김 전 대통령은 특유의 덕목으로 여러 발전의 기초를 쌓았고, 시대를 뛰어넘는 지도자의 덕목을 보여줬다""고 평가했다.  이 총리는 김 전 대통령의 덕목으로 민주주의에 대한 신념, 용기, 결단력, 배려·친화 등을 꼽았다. 특히 김 전 대통령의 어록 '닭의 목을 비틀어도 새벽은 온다'를 언급하며 ""민주주의에 대한 김 전 대통령의 신념은 민주화의 꺼지지 않는 불씨로 작용했고 끝내 군정 종식을 이루게 했다""고 말했다.  이 총리는 또 ""야당 지도자로서도, 대통령으로서도 역사의 매듭을 결단으로 풀어냈다""며 하나회 해체, 금융·부동산 실명제 도입, 공직자 재산공개 도입 등을 그 사례로 들었다.  이 총리는 동아일보 기자 시절 김 전 대통령을 취재한 일화도 거론했다. 이 총리는 ""(김 전 대통령은) 야당 지도자 시절에 아침마다 수십명에게 밥을 주셨고 저녁엔 불쑥 찾아온 손님에게 포도주를 직접 따라줬다""며 ""저도 햇병아리 기자 시절에 상도동 아침밥을 먹고 저녁엔 포도주를 얻어 마시며 조국의 민주화를 꿈꾸던 시절이 아련하게 기억된다""고 말했다.  oskymoon@heraldcorp.com  - Copyrights ⓒ 헤럴드경제 &amp; heraldbiz.com, 무단 전재 및 재배포 금지 -"
"김영삼 전 대통령 4주기 추모식  ""정치가 분열·갈등 키우지 말고 통합·화합 길 찾아야""이낙연 국무총리가 22일 오전 서울 동작구 국립현충원 현충관에서 열린 ‘김영삼 전 대통령 4주기 추모식’에서 추모사를 하고 있다. 연합뉴스 제공[이데일리 이진철 기자] 이낙연 국무총리는 22일 “김영삼 전 대통령님을 흠모하지만, 대통령님을 닮을 수는 없다는 것을 잘 안다”면서 “그래도 저희는 대통령께서 병상에서 후배들에게 남겨주신 ‘통합과 화합’의 당부를 기억한다”고 말했다.  이 총리는 이날 국립서울현충원에서 열린 김영삼(YS) 전 대통령 4주기 추모식에 참석해 “정치가 분열과 갈등을 키우지 말고, 통합과 화합의 길을 찾아야 한다는 것을 대통령님의 영전에 모인 저희부터 다짐했으면 한다. 그것이 대통령님에 대한 진정한 존경과 추모라고 저는 생각한다”면서 이같이 밝혔다.  이 총리는 “대통령님이 31년을 넘은 군부정권을 끝내고 문민정부 시대를 여신지 27년이 흘렀다”면서 “대통령님이 그토록 사랑하셨던 대한민국은 그동안 민주주의를 발전시키며 국력을 키웠고 국가 위상을 높였다”고 말했다. 이어 “시대는 변했지만, 대통령님은 시대를 뛰어넘는 지도자의 덕목을 보여주셨다”고 덧붙였다.  이 총리는 “대통령님은 신념의 지도자셨다”면서 “역대 대통령 가운데 처음으로 4·19 묘소에 참배하셨다. 5·18을 민주화운동으로 처음 인정하셨다”고 밝혔다. 또한 “당대 권력의 어떤 위협도 대통령님의 용기를 꺾지는 못했다”면서 “대통령님의 잇따른 개혁은 마치 불꽃처럼 선명하고 치열했다”고 말했다.  이 총리는 “대통령님은 독재세력과 그들의 적폐에는 단호하셨지만, 국민과 이웃에게는 온화하셨다”는 언급도 했다.  그는 “야당 지도자 시절에는 아침마다 수십 명씩에게 밥을 주셨다”면서 “저녁이면 불쑥 찾아온 손님에게 포도주를 직접 따라주시곤 했다”고 회고했다. 이어 “저도 햇병아리 기자 시절에 상도동의 아침밥을 먹고, 저녁의 포도주를 얻어 마시며, 조국의 민주주의를 꿈꾸던 시절이 아련하게 기억된다”고 말했다.  이진철 (cheol@edaily.co.kr)  네이버 홈에서 ‘이데일리’ 뉴스  ＜ⓒ종합 경제정보 미디어 이데일리 - 무단전재 &amp; 재배포 금지＞"
