"동영상 뉴스  만약 간첩이 의심된다면 113, 경찰이나 111, 국정원에 신고해야합니다.  그런데 두 기관이 간첩 잡는 대공수사 분야의 내년 예산을 스스로 깎아서 국회에 제출했습니다.  남북관계를 우선시하는 문재인 정부의 눈치를 본 것 아니냐 분석도 나오고, 간첩은 누가 잡느냐 걱정도 나옵니다.  강병규 기자의 단독 보도입니다.  [리포트]  국정원은 내년도 예산을 올해 예산 5446억 원보다 14.1%를 늘려달라고 국회에 요구했습니다.  하지만 대공수사 정보 수집 예산은 16% 가량을 감액하겠다고 국회 정보위원회에 밝혔습니다.  대공 수사가 더 이상 본인들의 업무가 아니라는 이유에섭니다.  문재인 정부는 국정원의 대공수사권을 폐지하고, 경찰에 이관하는 것을 추진하겠다고 밝힌 바 있습니다.  하지만 정작 경찰청도 내년도 대공수사예산을 줄이겠다고 국회에 밝힌 것으로 전해졌습니다.  대공 첩보 내사, 안보 위해세력 수사 예산을 각각 30% 가량 감액하겠다는 의견을 제출한 겁니다.  경찰청은 ""전년도 실적을 기준삼아 부진한 부분은 줄였다""고 밝혔습니다.  지난 6월 북한에서 직접 남파한 간첩이 검거되는 등 북한의 대남공작은 계속되는 상황이라 우려의 목소리도 나옵니다.  [심재철 / 자유한국당 의원(지난 9월)]  ""북한이 네팔 국적으로 세탁한 정찰총국 직파 간첩 40대 박 모 씨를 보냈고, 파견했고 검거됐습니다. 알고 계시지요?""  [이낙연 / 국무총리(지난 9월)]  ""그 검거 활동을 했다면 정상적인 활동을 하고 있는 것입니다.""  하지만 이번 정부 들어서 간첩을 포함한 국가보안법 위반 사범 적발 건수는 크게 줄었습니다.  정부가 북한의 눈치를 보며 대공 수사 예산을 알아서 줄이려는 것 아니냐는 지적이 나옵니다.  이에 대해 국정원은 “수사 환경 변화에 따라 일부 항목을 조정했을 뿐 대공수사 관련 예산 총액은 늘었다”면서 “국정원 업무가 아니라는 이유로 감액 했다는 주장은 사실이 아니다”라고 알려왔습니다.  채널A 뉴스 강병규입니다.  ben@donga.com  영상편집:박형기  꿈을 담는 캔버스 채널A  ⓒCHANNEL A(www.ichannela.com), 무단 전재 및 재배포 금지"
"환경부, ‘미세먼지 계절관리제 시행 준비상황’ 발표  내년 2월부터 수도권 배출가스 5등급차 운행 제한  정부가 매년 12월부터 3월까지를 ‘미세먼지 고농도 시기’로 규정해 미세먼지를 집중 관리하는 ‘미세먼지 계절관리제’를 처음으로 도입해 내달 1일부터 시행한다. 이에 따라 내년 2~3월 서울·경기·인천 등 수도권에서 배출가스 5등급차의 운행이 제한되고, 공공부문의 차량 2부제가 12~3월 동안 유지된다.  조명래 환경부 장관은 26일 정부세종청사에서 이같은 내용을 담은 ‘미세먼지 계절관리제 시행 준비상황’을 발표했다. 미세먼지 계절관리제는 이달 초 이낙연 국무총리 주재로 열린 제3차 미세먼지 특별대책 위원회에서 결정됐다.  현재 전국 유치원·초·중·고교의 공기정화장치(공기청정기)의 설치율은 88%로, 환경부는 이를 연말까지 100%로 끌어올린다는 계획이다. 또 저소득층과 옥외 근로자 등 총 253만명에게 미세먼지 차단 마스크도 제공한다.  미세먼지 예보는 더욱 촘촘해진다. 오는 27일부터 매일 오후 5시 30분에 실시되는 3일 단기예보에 초미세먼지(PM2.5) 주간 예보 시범 서비스를 제공한다. ‘높음’과 낮음’ 등 2단계로 예보한다.  사업장 미세먼지 배출을 관리·감독하기 위해 감시 인력을 현재 470여 명에서 700명으로 늘리고, 드론 2대 등 장비를 투입해 내년 5월까지 특별 점검에 나설 계획이다. 또 제철·제강·발전·석유화학 공장의 굴뚝에서 나오는 미세먼지 배출 정보를 공개하고, 전력 수급 상황을 실시간으로 살펴보면서 석탄발전소 가동 상황도 살필 예정이다.  [박진우 기자 nicholas@chosunbiz.com]  - Copyrights ⓒ 조선일보 &amp; chosun.com, 무단 전재 및 재배포 금지 -  []"
"[YTN 라디오 이동형의 뉴스 정면승부]  ■ 방송 : FM 94.5 (18:10~20:00)  ■ 방송일 : 2019년 11월 26일 (화요일)  ■ 대담 : 김영춘 더불어민주당 의원  * 아래 텍스트는 실제 방송 내용과 차이가 있을 수 있으니 보다 정확한 내용은 방송으로 확인하시기 바랍니다.  [이동형의뉴스정면승부] 김영춘, 대권? ""3선 이상 누구나 꿈, 지명도 3년 뒤 달라지지 않을까""  [저작권자(c) YTN &amp; YTN PLUS 무단전재 및 재배포 금지]"
"동영상 뉴스  ■ 용감한 토크쇼 '직설'  - 진행 : 임종윤  - 출연 : 김수민 시사평론가  Q. 구속영장 청구된 유재수…수상한 '영전'?  - 유재수 '뇌물수수·수뢰 후 부정처사' 혐의  - 김태우, 지난 2월 유재수 비위 무마 의혹 제기  - 檢, 유재수 구속영장…'靑 감찰 무마' 향하는 길목  - 檢, ""감찰 도중 중단지시 내려왔다"" 진술 확보  - ""금융위, 與 요청으로 유재수 국회 영전 추천""  - 檢, '유재수 의혹' 최종구·김용범 곧 소환  Q. 조사 앞둔 조국…유재수 수사까지 '산 넘어 산'?  - 유재수 '감찰무마 의혹'…'조국 수사' 새 변수로  - 檢, 유재수 '감찰무마 의혹' 조국 수사 불가피  - 보고라인…특감반원→이인걸→박형철→조국  - 檢, '유재수 의혹' 이인걸·백원우도 소환 예고  Q. 보수 대통합, '패트 정국'에 밀리나?  - 보수 대통합, '패스트트랙 정국'에 밀리나?  - 한국당 ""패트 마무리 뒤, 통합 논의""  - 변혁 ""내달 8일 발기인대회, 연내 창당""  - 변혁, 창당 일정 발표…바른미래 분당 본격화  - 변혁, 신당 창당 속도…평행선 달리는 보수통합  - 한국 ""공화당도"" vs 변혁 ""공화당은 안돼""  Q. '보수통합' 외친지 20일 만에 '각자도생'?  - 변혁은 연내…이언주·이정현도 각자 신당 구상  - 보수통합 흐림…선거 다가오자 거세진 창당 바람  - 선거법 개정 반사이익·통합시 지분 확보 해석도  - 이언주 ""한국당이 주도? 헤쳐모여식 통합해야""  - 이언주 ""유승민도 쇄신 대상이다""  Q. '86그룹 용퇴론'에 불 끄는 우상호?  - 우상호 ""임종석, 종로 안 비켜주는데…""  - 우상호 ""임종석 왜 형한테 불똥 튀느냐 당혹""  - 우상호 ""임종석, 386들 다죽자 한적 없다""  - 임종석, 종로 출마 막히자 불출마 선언한 듯  - 임종석 불출마…'불똥' 튄 정세균-386 그룹  - 임종석 빠진 종로…정세균? 이낙연? 관측 무성  Q4. 하마평 무성한 차기 국무총리…김진표에 무게?  - 김진표, 총리 유력설에 ""기다려보는 수밖에…""  - 김진표 ""총리 지명 시 文정부 성공에 헌신""  - 김진표, 盧정부 때 경제부총리·교육부총리 지내  - 새 총리 김진표 급부상…靑, 막바지 검증  - 김진표 차기총리설…임명땐 '경제' 의지 표명  - 총선 출마 공직자 사퇴 시한 1월 16일  (자세한 내용은 동영상을 시청하시기 바랍니다.)  ☞ 의견 있는 경제채널 SBSCNBC  저작권자 SBS미디어넷 &amp; SBS I&amp;M 무단전재-재배포 금지"
"[커버스토리]  “뇌전증 신약 ‘엑스코프리’(성분명 세노바메이트)를 개발한 회사는 SK바이오랜드가 아니라 SK바이오팜 아닌가요?” “그런 거 따질 시간에도 주식은 계속 오르니 일단 사고 봅시다.”  SK그룹 자회사 SK바이오팜의 독자 개발 신약이 미국 식품의약국(FDA)의 공식 판매 허가를 받았다는 발표가 났던 22일. SK바이오팜과 사명(社名)이 비슷한 코스닥 상장사 SK바이오랜드의 주가가 가격제한폭(30%)까지 오르자 주식투자 관련 인터넷 카페에는 혼란스러워하는 투자자들의 질문이 이어졌다. SK바이오랜드의 주가는 다음 거래일인 25일에도 투자자들의 ‘묻지마 투자’ 행진이 이어지며 2거래일 연속 상한가를 기록했다.  ○ 회사 이름 비슷하다고 엉뚱한 회사에 투자자 몰려  SK바이오팜은 SK바이오랜드와 이름만 비슷할 뿐 연관성이 거의 없는 회사다. 아직 증시에 상장되지 않은 SK바이오팜은 SK㈜가 지분 100%를 갖고 있는 제약사다. 반면 SK바이오랜드는 SKC가 지분 32.4%를 보유해 최대주주로 있는 화장품 재료 생산업체다.  SK그룹 관계자는 “SK바이오랜드는 뇌전증 신약과 어떤 관계도 없다. SK바이오랜드가 SK바이오팜의 신약 개발과 관련해 앞으로 협력할 가능성을 현 시점에서 예측하기는 어렵다”고 밝혔다.  그럼에도 개인투자자들은 ‘SK’와 ‘바이오’라는 이름만 보고 SK바이오랜드 주식을 사들였다. 22일과 25일 이틀 동안 개인투자자들은 SK바이오랜드 주식을 약 63억 원어치 순매수했다. 반면 기관과 외국인은 각각 약 16억 원, 40억 원어치를 순매도했다. 한 증권사 애널리스트는 “정확하지 않은 정보에 개미(개인투자자)들이 엉뚱한 종목에 몰리고, 주가가 오르니 또 몰려드는 전형적인 테마주 현상”이라고 말했다. 한국거래소는 SK바이오랜드 주가가 과도하게 오르자 26일 하루 동안 투자 경고종목으로 지정한다고 공시했다.  ○ 넘쳐나는 테마주들에 결국 투자자 손해  기업 가치와 관련 없는 소식에 과잉 반응하는 개인투자자들의 테마주 투자 행태는 이뿐만이 아니다. 개인투자자 비중이 85% 안팎을 차지하는 코스닥시장에는 수많은 테마주가 넘쳐나고 있다.  대표적인 건 정치인 테마주다. ‘이낙연 테마주’, ‘황교안 테마주’ 등 차기 대선 출마가 거론되는 유력 정치인들의 지지율에 따라 주가가 오르내리는 종목이 적지 않다. 이 회사들은 대부분 회사 임직원이 특정 후보의 친인척 또는 학교 동문이라는 이유만으로 투자자들 사이에서 ‘테마주’로 분류되고 있다. 조국 전 법무부 장관 가족이 투자했다는 의혹을 받고 있는 코스닥 상장사 WFM도 ‘조국 테마주’로 분류돼 개인투자자의 돈을 빨아들이기도 했다. 이 회사 주가는 ‘조국 사태’가 확산되며 크게 떨어졌고 현재는 거래정지 상태다.  국내에 아프리카돼지열병(ASF)이 발병했을 때도 개인투자자들은 ‘ASF 테마주’ 목록을 만들어 공유했다. 이 목록에는 방역과 무관한 고려시멘트 같은 회사도 이름이 올라가 주가가 큰 폭으로 오르내리기도 했다.  특히 최근에는 개인 방송, 텔레그램이나 카카오톡 등 소셜네트워크서비스(SNS)의 오픈 채팅방 등을 통해 투자 정보가 오가면서 개인투자자들의 테마주 쏠림 현상도 심해지고 있다. 본보 기자가 들어가 본 투자 관련 채팅방에는 “A사 ‘미중 무역협상 테마주’로 상승 예고” “B사 ‘방사능 테마주’로 신규 편입” 같은 글이 수시로 올라왔다.  전문가들은 테마주는 기업가치와 무관하게 주가가 움직이기 때문에 결과적으로 투자자들이 손해를 볼 수밖에 없다고 지적했다. 남길남 자본시장연구원 동향분석실장은 “개인투자자들은 단기 차익을 노리는 성향이 짙다 보니 주가 움직임이 큰 테마주로 쏠리는 모습을 보인다”며 “테마주로 잘못 분류된 기업들도 오해를 막기 위해 정보를 보다 투명하게 공개할 필요가 있다”고 말했다.  이건혁 기자 gun@donga.com  ⓒ 동아일보 &amp; donga.com, 무단 전재 및 재배포 금지"
"스가 “한국에 사죄한 사실 없다” 거듭 해명 불구  일본대사관 통해 사과 전달한 듯  위안부 합의 이후 왜곡된 언론 플레이로 한국 자극 ‘악순환’  이러한 과정은 2015년 12월 28일 한일 위안부 합의 직후 벌어진 상황과 포개어진다. 기시다 후미오(岸田文雄) 당시 일본 외무장관은 협상 타결 후 자국 취재진에게 화해ㆍ치유재단 설립에 투입되는 10억엔의 성격에 대해 “배상금이 아니다”고 못박았다. 합의문에 없는 주한 일본대사관 앞 소녀상 이전에 대해서도 “적절히 이전되는 것으로 알고 있다”고 했다. 이후 일본 언론들은 일본 정부가 소녀상 이전이 정부가 10억엔을 내는 전제라는 사실을 한국으로부터 확인 받았다고 보도했다. 또 한국이 위안부 기록물의 유네스코 세계기록 유산 등재 신청을 보류하기로 합의했다고도 보도했다. 합의문의 잉크가 마르기도 전에 일본 언론이 정부 관계자를 인용해 자국에 유리한 보도를 쏟아내자, 한국 내 비판 여론이 비등했고 합의의 진정성에 대한 의구심이 커졌다.  지난해 10월 대법원 강제동원 배상 판결과 11월 한국 정부의 화해ㆍ치유재단 해산 이후 양국 간 이슈가 있을 때마다 일본 측의 언론플레이는 더욱 노골화했다. 지난해 말 일본 해상자위대 초계기의 위협비행과 한국 해군 구축함의 레이더 조사(照射ㆍ비추어 쏨) 갈등 4개월 뒤인 올 4월 양국 국방 당국 간 비공개 협의에서 오간 ‘초계기가 3해리 이내 근접 시 레이더 조사’ 방침이 일본 언론을 통해 공개됐다. 지난 10월엔 이낙연 국무총리가 아베 총리와의 회담에서 문 대통령의 친서를 전달했으나, 아베 총리가 눈길도 주지 않은 채 국제법 위반 시정을 재차 요구했다는 보도가 나오기도 했다. 한국 측의 대화 노력을 일본 정부 관계자들의 전언을 통해 평가절하한 것이다. 언론이라는 ‘칼’을 빌려 목적을 달성하려는 일본 정부의 전형화된 수법이다.  살얼음에 놓인 한일관계를 더 궁지로 몰아넣을 수 있는 지소미아 종료 유예 결정 후 갈등에 대해 조진구 경남대 극동문제연구소 교수는 “누가 더 양보했느냐는 평가를 하다 보니 일본이 한국을 자극한 측면이 있다”고 말했다. 김숙현 국가안보전략연구원 대외전략연구실장은 “아베 총리가 ‘벚꽃을 보는 모임’ 사유화 비판 등으로 지지율 하락을 겪고 있기 때문에 한국에 양보하지 않았다는 모습으로 리더십을 평가 받으려 한 것 같다”고 했다. 아베 장기집권으로 사회 전반에 만연한 손타쿠(忖度ㆍ윗 사람의 의중을 헤아려 행동함) 측면이 없지 않다는 지적이다.  그러나 일본이 빌미를 제공했지만 “일본의 지도자로서 과연 양심을 갖고 할 수 있는 말인지 되묻지 않을 수 없다”는 청와대 고위 관계자의 발언도 감정적이었다는 지적이 나온다. 다음달 강제동원 해법 등을 논의할 한일 정상회담 개최를 앞둔 상황에서 상대국 정상을 거론하는 것은 지나쳤다는 말이다.  다만 일본 정부와 언론의 획책에 일희일비할 이유가 없다는 의견이 나온다. 청와대 고위 관계자도 지소미아 조건부 종료 유예 발표 직후 “일본은 표면적으로 다른 얘기를 할 가능성이 있다”고 말했을 만큼 국내 여론을 의식한 예상 가능한 반응이었기 때문이다. 양기호 성공회대 일본학과 교수는 “일본 정부도 한국에 대한 불신과 불만이 쌓여 있기 때문에 언론을 통해 ‘한국 때리기’에 나선 측면이 있다”면서 “강제동원 배상문제 해결을 위한 시간이 얼마 남지 않은 만큼 양국이 논란을 확대하기 보다는 해법 모색에 진력해야 한다”고 말했다.  도쿄=김회경 특파원"
"연말까지 결정해야  내년 총선 정국으로 장기 지연 우려  [김해=뉴시스]김상우 기자 = 김해신공항 건설을 반대하는 시민단체들이 26일 김해시청 프레스센터에서 ""국무총리실이 신공항 건설을 재검증하고 있지만 장기 지연되고 있다""며 ""대통령이 직접 나서서 연말까지 해결하라""고 촉구했다.  김해신공항대책 민관정협의회 등 시민단체들은 ""지난 6월21일 김해신공항 재검증이 국무총리실에서 시작됐지만 아직 결론을 내지 못하고 장기 지연되고 있다""고 지적했다.  이어 ""그동안 5개월간 총리실이 한 일은 몇 번의 실속 없는 회의일뿐 검증단 구성도 못하고 있다. 포괄적이고 정책적인 검토를 전면 거부하는 것은 소음, 환경 등의 기술적인 부분만 검증하겠다는 것""이라고 주장했다.  또 ""지난 11월18일 부산 경남 울산 지역의 민주당 소속 국회의원 8명이 이낙연 국무총리를 만나 조속한 검증을 촉구해도 연내 마무리는 어렵다는 답변을 했다""고 전했다.  이들은 ""금년 내 검증을 하지 못하면 내년엔 총선이라는 선거 국면에서 이런 민감한 검증문제는 미뤄 놓을 것이 뻔히 예상된다""고 우려했다.  따라서 ""총리는 정부의 명예를 걸고 금년 안에 검증을 완료할 수 없다면 신공항문제에서 손을 떼고, 2017년 대통령 선거 공약인 동남권 관문공항 문제를 신속히 해결하라""고 압박했다.  이날 참여한 시민단체는 김해신공항대책 민관정협의회, 김해신공항 건설반대대책위원회, 김해신공항백지화 대책위원회 등이다.  ◎공감언론 뉴시스 woo@newsis.com"
"26일 황교안 자유한국당 대표의 청와대 앞 단식농성이 7일째에 접어들면서, 주요 정치인들이 황 대표를 찾고 있다. 홍준표 전 대표는 물론이고 여권의 이낙연 국무총리와 이해찬 더불어민주당 대표도 ‘방명록’에 이름을 올렸다.  바른미래당의 비당권파 모임인 변혁(변화와 혁신을 위한 비상행동)의 유승민 의원은 아직 아니다. 같은 당은 아니지만 보수 통합 논의의 파트너란 점에서 주목받고 있다. 유 의원도 최근 황 대표를 방문할지를 놓고 고심을 거듭했다고 한다. 한 변혁 의원은 25일 중앙일보와 통화에서 “‘황 대표에게 찾아가 봐야 하지 않겠느냐’고 말했더니 유 대표도 ‘생각해보겠다’고 했다”고 전했다. 유 의원도 위로 및 격려 차원의 농성장 방문에 대한 필요성에는 공감하고 있다는 게 그의 설명이다. 단식 기간과 국회 일정 등을 감안해, 유 의원이 이르면 26일 황 대표의 단식 현장을 방문할 가능성이 높다는 관측이 나온다.  다만 유 의원이 황 대표의 농성장을 찾더라도 덜 주목받는 이른 아침이나 늦은 저녁 시간대가 될 것이라는 전망이다. 변혁 측은 한국당과의 보수통합 논의가 정체된 상태에서, 유 의원이 농성장을 방문하면 확대해석이 나올 것을 우려하고 있다. 둘 사이는 최근 껄끄러운 편인데, 황 대표가 원유철 의원을 통합추진단장으로 내정한 걸 두고 유 의원 측은 “원 의원을 원한 적 없다”며 비판적 입장을 내놓은 일이 있다. 또 황 대표와 유 의원이 한 차례 통화한 사실이 언론에 알려진 데 대해 변혁 측에선 “황 대표 측을 신뢰하기 어렵다”고 했었다. 이런 가운데 변혁은 연내 신당 창당을 목표로 다음 달 8일 중앙당 발기인 대회를 열 예정이다.  유 의원이 황 대표의 농성장을 찾으면 당권파와 비당권파를 통틀어 바른미래당에서는 첫 방문이 된다. 앞서 황 대표의 단식 농성장에는 청와대와 여‧야 주요 인사들이 잇따라 모습을 보였다. 20일과 22일에는 강기정 청와대 정무수석이 황 대표를 찾아 “단식을 풀어달라”고 청했다. 24일에는 이낙연 총리가 “충정을 잘 이해한다”며 단식 만류의 뜻을 전했고, 25일에는 이해찬 민주당 대표가 농성장을 방문했다. 정홍원·이완구 전 총리, 김병준 전 한국당 비상대책위원장, 오세훈 전 서울시장 등도 현장을 찾았다. 22일에는 정동영 민주평화당 대표도 황 대표와 만났다.  성지원 기자 sung.jiwon@joongang.com.  ▶  ⓒ중앙일보(https://joongang.co.kr), 무단 전재 및 재배포 금지"
"단식 일주일… 정국 중대변수로  황교안, 누운상태로 고개만 돌려 인사  이해찬 “이러다 병 나시면 어쩌려고… 단식 중단하고 저와 협상합시다”  황교안 “잎 떨어뜨려도 나무는 못꺾어”  자유한국당 황교안 대표의 단식이 26일로 일주일을 맞는다. 단식이 장기화하면서 황 대표는 옆에 있는 사람과 대화하기 힘들 정도로 건강이 급격히 악화됐다. 단식 엿새째인 25일 더불어민주당 이해찬 대표가 황 대표를 찾아 단식을 만류하는 등 황 대표의 단식 문제가 여야 ‘패스트트랙 협상’ 등 정국의 주요 변수가 돼 가는 기류다.  황 대표는 이날 오전 페이스북에 “간밤 성난 비바람이 차가운 어둠을 두드린다. 이 추위도 언젠가는 끝이 나겠지요”라며 “잎은 떨어뜨려도 나무 둥지(둥치)를 꺾을 수는 없다”고 했다. 이어 “고통은 고마운 동반자다. 육신의 고통을 통해 나라의 고통을 떠올린다”면서 “자유와 민주와 정의가 비로소 살아 숨 쉴 미래를 포기할 수 없다”고 썼다. 황 대표는 심한 탈수 증상에 시달리고 있고, 혈압도 정상 수치가 잘 나오지 않는 상태인 것으로 전해졌다. 대표 비서실장인 김도읍 의원은 “저녁부터는 콧물이 갑자기 많이 나오면서 더욱 몸이 안 좋아졌다”고 전했다. 농성장 주변에서 지지자들이 찬송가를 부르며 ‘황교안’을 연호하자 황 대표는 부축을 받으며 텐트 밖으로 나왔다가 3분간 인사한 뒤 다시 들어가기도 했다. 황 대표는 기력이 없어 손도 위로 올리지 못했고 양쪽에서 부축하지 않으면 걸음도 잘 내딛지 못했다.  이날 오전 민주당 이해찬 대표가 농성장을 찾았을 때도 황 대표는 누운 상태로 고개만 일으킨 채 손을 내밀어 악수했다. 이 대표는 김도읍 대표 비서실장에게 “이러다 병 나시면 어떻게 하려고… (황 대표를) 강제로 병원으로 옮기세요”라고 말했다. 이 대표는 만남 직후 기자들에게 “(황 대표가) 기력이 빠져서 거의 말을 못 했다”면서 “빨리 단식을 중단하고 저와 대화를 하자고, 협상을 하자고 이야기했는데 목소리가 작아서 황 대표의 답은 안 들렸다”고 말했다.  전날 이낙연 국무총리에 이어 이 대표까지 황 대표를 찾았고, 이날 민주당 회의에서도 황 대표의 단식이 화두가 됐다. 이인영 원내대표는 “황 대표의 단식이 남은 (선거법과 고위공직자범죄수사처 설치법 등 패스트트랙 지정 법안) 협상의 최대 난관이 될 것 같아 걱정”이라며 “합의 시도 여지를 황 대표가 원천 봉쇄했다는 점은 매우 유감스럽다”고 말했다.  황 대표가 20일 단식을 시작했을 땐 당내에서도 “명분도 약하고 타이밍도 맞지 않는 단식”이라는 비판이 나왔다. 하지만 황 대표가 단식 해제의 조건으로 연일 “선거법과 공수처법 포기”를 주장하고 건강 상태가 급속히 악화되자 청와대와 여당 모두 신경을 곤두세우기 시작했다. 한국당 관계자는 “김세연 의원의 당 지도부 사퇴와 당 해체 요구에 맞대응한 ‘위기 타개용 임시방편’으로 여겨지기도 했지만 지금은 단식 중단이 여야 협상의 핵심 카드가 됐다”고 평가했다. 이날 황 대표를 찾은 한국당 홍준표 전 대표는 “민주당이 원하는 것은 공수처법과 검경 수사권 조정 법안”이라며 “우리 당도 하나(검찰개혁 법안)는 내주고, 선거법은 정상적으로 돌아가는 것이 맞다”고 제안하기도 했다.  최우열 dnsp@donga.com·조동주 기자  ⓒ 동아일보 &amp; donga.com, 무단 전재 및 재배포 금지"
